Nome Attività,Categoria,Sito Web,Telefono,Indirizzo,Comune,Provincia,Email,Protocollo,Tecnologia,Cookie Banner,Hosting Provider,Mobile Performance,Desktop Performance,Punteggio SEO,Disponibilità Sito,Stato Manutenzione
Cursano Impianti,Elettricista,http://www.cursanoimpianti.it/,349 452 4362,"Via Brindisi, 38/A",San Pietro Vernotico,,cursanoimpianti@gmail.com,http,WordPress,No,Hostinger International Limited,63,87,100.00,Sì,No
IDROTERM FASANO,Idraulico,,347 619 6411,"Via Mascagni, 71/A",San Vito dei Normanni,,,,,,,,,,,
Vero Comfort Clima Di Vero Paolo,Idraulico,,080 626334,"Corso Garibaldi, 84",Palo del Colle,,,,,,,,,,,
Botrugno,Idraulico,,0836 483718,"Via G. Mangionello, 49",Maglie,,,,,,,,,,,
La Termosanitaria srl,Negozio di forniture idrauliche,,0831 982395,Viale Lussemburgo,Zona Industriale,,,,,,,,,,,
Golia Pietro,Negozio di forniture elettriche,,0831 620767,"Via Giacomo Leopardi, 74",Torchiarolo,,,,,,,,,,,
Idrotermoelettrica di Schiavone Angelo-Termoidraulica e materiale elettrico,Negozio di forniture idrauliche,,333 241 2198,"Via Bellini angolo, Via Petrarca",San Michele Salentino,,,,,,,,,,,
Termoidraulica Ianniello,Idraulico,,340 502 9309,"Via Sardegna, 9",Trepuzzi,,,,,,,,,,,
IDROTERMICA.SERVICE di Scategna Fabio,Idraulico,,392 223 8420,"Via della Pace, 152",Carmiano,,,,,,,,,,,
Miglietta Cosimo,Idraulico,,0832 760164,"Via Sant`Angelo, 28",Trepuzzi,,,,,,,,,,,
MP impianti snc di Monte e Perrone,Idraulico,,346 418 9297,"Via Giuseppe Parini, 11",Trepuzzi,,,,,,,,,,,
Idrotermicaeco Sas,Idraulico,,0832 523001,"Via Brindisi, 1",Squinzano,,,,,,,,,,,
Macelletti Rappresentanze Di Macelletti Vito,Negozio di forniture idrauliche,http://www.macellettirappresentanze.it/,371 382 8173,"Via Leopardi, 24",San Michele Salentino,,agenzia@macellettirappresentanze.it,http,React,Sì,Google LLC,56,97,100.00,Sì,No
Capodieci Alessandro,Idraulico,,0832 756487,"Via Guglielmo Pepe, 38",Trepuzzi,,,,,,,,,,,
Greco Impianti dì Greco Francesco,Idraulico,,327 842 7801,Via Armando Diaz,Campi Salentina,,,,,,,,,,,
Tiemme Impianti Srl-Impianti Termoidraulici a Galatina | in Provincia di Lecce,Idraulico,,0836 567679,"Viale Jonio, 45",Galatina,,,,,,,,,,,
Greco Arredobagno,Arredo bagno,,340 571 0104,"Via Kennedy, 144",Torchiarolo,,,,,,,,,,,
Idrodinamica Spurgo Velox Di Petrelli Franco E C. Snc,Idraulico,,0832 606172,"Via Santa Giovanna d’Arco, 11",Carmiano,,,,,,,,,,,
Impianti Idraulici-Elettrici Brindisi Impianti Elettrici Idraulici Lecce DITTA EDILE MARTINA MARCO,Impresa edile,,327 577 8978,"Via Pietro Mascagni, 17",Cellino San Marco,,,,,,,,,,,
Idrotermica Tundo,Negozio di forniture idrauliche,,0836 563127,"Via Val d'Aosta, 37",Galatina,,,,,,,,,,,
Tecnoimpianti Carlucci Cosimo,Idraulico,http://www.tecnoimpianti-br.it/,0831 981496,"Via Franklin Nardelli, 8",San Vito dei Normanni,,,http,React,No,Aruba S.p.A.,37,63,92.00,Sì,No
Garofoli S.p.A. - Termoidraulica,Negozio di forniture idrauliche,https://www.garofolispa.eu/,080 991 1795,Strada Provinciale Palo-Bitetto Z.A,Palo del Colle,,,https,React,Sì,Server Plan S.r.l.,55,65,92.00,Sì,No
D'Errico Impianti di Giuseppe D'Errico,Idraulico,,349 008 6140,"Via S. Stefano, 6",Galatina,,,,,,,,,,,
HYDROTECH IMPIANTI IDRAULICI,Idraulico,,329 291 7228,"Via Gioacchino Toma, 44",Galatina,,,,,,,,,,,
T & C Sas Di Coroneo Salvatore E C.,Idraulico,,338 841 7341,"Via Arezzo, 7",Galatina,,,,,,,,,,,
Eclisse Impianti Srl - Centro Assistenza Palazzetti,Elettricista,,0836 528618,"Via della Ceramica, 32/36",Galatina,,,,,,,,,,,
Termo Erre Bierre Di Basile Salvatore,Idraulico,,0836 561413,"Viale Santa Caterina Novella, 65",Galatina,,,,,,,,,,,
Energialternativa Di Bardi Giovanni,Idraulico,,0831 655329,"Via S. Pietro, 28",San Pietro Vernotico,,,,,,,,,,,
Idelgas - Paiano Piero,Impianto di raffreddamento,http://www.idelgas.it/,0831 606160,"Via Lo Marchese, 42",Torchiarolo,,info@idelgas.it,http,Angular,No,Aruba S.p.A,56,61,69.00,Sì,No
"Galizia Assistenza caldaie: montaggio, manutenzione, revisione, controllo e certificazione Brindisi",Ditta specializzata in impianti di riscaldamento,https://www.galiziassistenza.it/,0831 961574,"Via Alcide De Gasperi, 4",San Michele Salentino,,galiziassistenza@gmail.com,https,React,Sì,Server Plan S.r.l.,25,33,85.00,Sì,No
Vantaggiato Antonio,Idraulico,,0836 568567,"Via Giuseppe Parini, 42",Galatina,,,,,,,,,,,
Giordano Gaetano S.r.l.,Impresa di scavi e demolizioni,,0831 740466,"Via Mesagne, 48",Torre Santa Susanna,,,,,,,,,,,
Ser Clima S.r.l.,Appaltatore,,0836 561603,"Via di Gallipoli, 226",Galatina,,,,,,,,,,,
F.A.T.I.C.,Ditta specializzata in piscine,,0836 564153,"Corso Armando Diaz, 79",Galatina,,,,,,,,,,,
De Pascalis Impianti Srl,Idraulico,http://www.depascalisimpianti.com/,0836 563141,"Via Metauro, 101",Galatina,,info@depascalisimpianti.it,http,ASP.NET,No,Aruba S.p.A. Network,100,90,82.00,Sì,No
Maiorano Impianti,Idraulico,,333 799 8852,"Via Cesira Pozzolini, 70",Galatina,,,,,,,,,,,
Termomeccanica di Spano Sergio,Installatore di impianti di condizionamento,,389 969 8838,"Via Castel del Monte, 67",Galatina,,,,,,,,,,,
Diviggiano Daniele,Negozio di forniture elettriche,,0831 746339,"Via Latiano, 21",Torre Santa Susanna,,,,,,,,,,,
Conserva Rocco,Idraulico,,099 561 1373,"Via Abruzzi, 62",Grottaglie,,,,,,,,,,,
D'Amicis Anthony,Idraulico,,099 563 8644,"Viale Ariosto, 42",Grottaglie,,,,,,,,,,,
Global Service Assistance,Idraulico,,0831 844091,"Via Occhi Bianchi, 23",Francavilla Fontana,,,,,,,,,,,
AUTOSPURGO METAL EDIL Srl,Idraulico,,389 829 8267,"Via V. Calò, 32/b",Grottaglie,,,,,,,,,,,
Lupo Cosimo,Idraulico,,099 566 1404,"Via Vittorio Emanuele II, 38",Grottaglie,,,,,,,,,,,
Ro.ma.ri srl,Idraulico,,099 561 1802,"Via Ennio, 107",Grottaglie,,,,,,,,,,,
Balestra Francesco,Idraulico,,0831 844929,"Via Rosario Ribezzi, 32",Francavilla Fontana,,,,,,,,,,,
TERMOCOB SOC. COOP. A.R.L.,Idraulico,,333 734 4907,"Via Epitaffio, 90",Oria,,,,,,,,,,,
TermoidraulicaSANTORO,Installatore di impianti di condizionamento,,333 444 1195,"Via Urbino, 20c",Grottaglie,,,,,,,,,,,
ACQUAPOOL,Negozio,,0832 304105,"Via Taranto, 174",Lecce,,,,,,,,,,,
Torsello Energy di Torsello Alfredo,Elettricista,,340 768 0462,Via,Presicce-Acquarica,,,,,,,,,,,
Sud Impianti Snc,Idraulico,,0831 811962,"Via S. Giovanni, 54",Francavilla Fontana,,,,,,,,,,,
IDROCLIMA di Cosimo Bellanova,Idraulico,https://idroclimaostuni.com/,320 724 6882,Via Bari,Ostuni,,info@idroclimaostuni.com,https,Joomla,Sì,HOSTINGER DE,67,100,100.00,Sì,No
Caprioli Giulio,Idraulico,,0836 569604,"Via Giuseppe Parini, 54",Galatina,,,,,,,,,,,
D.E.A. srl - Torre S. Susanna (BR),Negozio di forniture idrauliche,https://www.deatermoidraulica.it/,0831 746638,"Via Marzabotto, 9",Torre Santa Susanna,,info@deasite.it,https,Angular,No,Aruba S.p.A.,56,83,92.00,Sì,No
TERMOIDRAULICA GALIANO DANIELE,Idraulico,,328 869 0650,C.da san Giovanni lo parete Snc,Oria,,,,,,,,,,,
Technical Impianti Idrotermici,Idraulico,,349 064 4427,"Via Gorizia, 6",Racale,,,,,,,,,,,
Edilimpianti s.a.s. di Faggiano Cosimo & C,Idraulico,http://www.edilimpianti.net/,368 345 4384,"Via Rocco Gioia, 36",Ceglie Messapica,,info@edilimpianti.net,http,ASP.NET,Sì,Aruba S.p.A. Network,42,68,82.00,Sì,No
Tecnokalor Group Srl,Idraulico,http://www.tecnokalorgroup.it/,080 485 7395,"Via Mulino S. Martino, 19",Martina Franca,,,http,WordPress,No,Aruba S.p.A. Network,44,59,85.00,Sì,No
All'impianti,Complesso sportivo,,327 200 8031,Via John Kennedy,Presicce-Acquarica,,,,,,,,,,,
M Industry Gruppo Muscogiuri,Fornitore di finestre,http://www.mindustrygroup.com/,0831 746055,"Via Oria, Km 1",Torre Santa Susanna,,,http,WordPress,No,Aruba S.p.A.,32,55,92.00,Sì,No
TOP CLIMA,Negozio di forniture idrauliche,,0833 293069,"Via Lecce, n° 115",Gallipoli,,,,,,,,,,,
Idraulica Spagna Sergio,Negozio di forniture idrauliche,,327 216 6642,"Via Trento, 16",Gallipoli,,,,,,,,,,,
Francesco Perrone Impianti,Ditta specializzata in impianti di riscaldamento,,360 832 520,"Via S. Lazzaro, 28",Gallipoli,,,,,,,,,,,
Idro Termo Clima - Sperti,Idraulico,,338 426 7542,"Via Giuseppe Cesare Abba, 17",Tricase,,,,,,,,,,,
R.L.D. di Romano Daniele,Idraulico,,0833 503862,"Via Padova, 6",Matino,,,,,,,,,,,
Sandro Negro - Impianti idraulici e termoidraulici,Idraulico,,388 891 9756,"Via C. A. Lionetto, 24",Salve,,,,,,,,,,,
Balducci Roberto & C.Sas,Idraulico,http://www.balducciservice.it/,0833 561444,"Via Gallipoli, 56",Nardò,,,http,Wix,No,Aruba S.p.A. Network,74,96,36.00,Sì,No
I. G. srl,Idraulico,,0833 791017,"Via Don Tonino Bello, 2",Gagliano del Capo,,,,,,,,,,,
Ciardo Saverio Impianti,Idraulico,,388 589 1340,"Via Enrico de Nicola, 8",Gagliano del Capo,,,,,,,,,,,
Sergimpianti Di Sergi Angelo,Ditta specializzata in impianti di riscaldamento,,0833 261769,"Via Bonaventura Tricarico, 67",Gallipoli,,,,,,,,,,,
Mazzotta Antonio,Idraulico,,347 975 7496,"Via Ventuno Aprile, 114",Soleto,,,,,,,,,,,
Tecno Impianti S.R.L.,Idraulico,,0833 772273,"Via Filippo Bottazzi, 5",Tricase,,,,,,,,,,,
Essedi Impianti S.N.C. Di De Cicco Giuseppe E Siciliano Roberto,Elettricista,,0836 813499,"Via Roma, 117",Giurdignano,,,,,,,,,,,
TERMOTECNICA TRAZZA,Idraulico,,347 690 4140,"Via S. Francesco D'Assisi, 60",Muro Leccese,,,,,,,,,,,
Euro Impianti Di De Bene Andrea,Idraulico,,0836 818620,"Via Vittorio Emanuele II, 48",Minervino di Lecce,,,,,,,,,,,
Hydro System Srl,Consulente per impianti di produzione di energia,http://www.hydrosystem.it/,0833 522158,"Via Bari, 2",Alessano,,info@hydrosystem.it,http,Shopify,No,Host SpA,34,52,92.00,Sì,No
Salento Impianti di Giorgio Ianni,Idraulico,,347 912 9778,Via SS. Medici,Depressa,,,,,,,,,,,
Rc Di Rocco Cardigliano E F.lli Snc,Idraulico,,0833 539559,"Via Campo Sportivo, 12",Specchia,,,,,,,,,,,
C & D SRL,Arredo bagno,https://www.cdsrlshop.com/,392 072 3626,"Via Marina Serra, 45",Tricase,,,https,Shopify,No,"Cloudflare, Inc.",76,84,92.00,Sì,No
F.lli Pizzileo S.A.S. Di Pizzileo Daniele & C.,Negozio di tende avvolgibili,,0833 781326,Via Gonfalone,Alessano,,,,,,,,,,,
Felline Energie di Sergio Felline & C. snc,Elettricista,,0836 315688,"Via Menhir, 36",Giurdignano,,,,,,,,,,,
F-TeC Tecnologie Elettriche Connesse di Felline Danilo Fiore,Elettricista,http://f-tec.it/,329 665 2403,Via Giuseppe Mazzini,Giurdignano,,felline.tec@gmail.com,http,WordPress,No,Aruba S.p.A. Network,63,88,85.00,Sì,No
MP IDROTERMO di Muscatello Pasquale,Idraulico,,320 752 5398,"Via Giovan Battista Vico, 32",Soleto,,,,,,,,,,,
Idrotermica Di Calo' Concetto,Idraulico,,329 819 7759,"23, Via Antonio, Via A. Pellegrino",Zollino,,,,,,,,,,,
Hydrotherm Di Emanuele Giudice,Idraulico,,0833 690046,"Via Luigi Cadorna, 23",Ruffano,,,,,,,,,,,
idrostrutture,Idraulico,,080 891 8050,"Via Stefano da Putignano, 10",Sammichele di Bari,,,,,,,,,,,
Persano Luigi,Idraulico,,0836 958389,"Via Giuseppe Verdi, 35",Vitigliano,,,,,,,,,,,
Marrocco My Service,Idraulico,,339 175 5333,"Via Giuseppe Mazzini, 36",Maglie,,,,,,,,,,,
Autospurgo Rubrichi,Servizio di smaltimento delle acque reflue,http://www.autospurgorubrichi.com/,338 708 0158,VIA CASE SPARSE,Casamassella,,rubrichiautospurgo@gmail.com,http,WordPress,No,Aruba S.p.A.,55,59,85.00,Sì,No
Autofficina E. P. Motors di Roberto Presicce,Officina autoriparazioni,,320 933 6688,Via Sulicare,Giuggianello,,,,,,,,,,,
Puce Impianti Di Sandro Puce,Idraulico,,338 758 7703,"Via XXI Aprile, 51",Maglie,,,,,,,,,,,
Urso Cosimo Damiano,Idraulico,,0836 901898,"Viale Giovanni Capreoli, 220",Poggiardo,,,,,,,,,,,
TC IMPIANTI di Toma Cosimo,Idraulico,,347 736 9209,Via C.da Varna,Ruffano,,,,,,,,,,,
Calò Giuseppe Luigi,Idraulico,https://calogiuseppeluigi.altervista.org/,333 528 7332,"Via Pasubio, 11",Carpignano Salentino,,calogimpianti@gmail.com,https,WordPress,Sì,Hetzner Online GmbH,67,96,92.00,Sì,No
IDRO SERVICE 2020,Negozio di forniture idrauliche,,389 458 6788,"Via Alliste, 81",Racale,,,,,,,,,,,
Centro Clima,Idraulico,,0833 583640,"Via Makallè, 33",Racale,,,,,,,,,,,
Margarito Renato,Idraulico,,0833 584455,"Via Gallipoli, 99",Racale,,,,,,,,,,,
Casto Carmelo,Officina autoriparazioni,,0833 551313,"Via Como, 18",Racale,,,,,,,,,,,
Salento Idraulica Di Milelli Sebastiano,Idraulico,,339 448 1696,"Via Francesco Crispi, 10",Galatone,,,,,,,,,,,
ZUCCALA GIACOMO S.R.L.,Impresa edile,https://www.zuccalagiacomo.com/web/,339 701 8052,"Via Fra Silvestro Calia, 6",Copertino,,info@zuccalagiacomo.com,https,React,No,Aruba S.p.A.,55,41,75.00,Sì,No
Filoni Donato,Idraulico,,0833 867291,"Via XX Settembre, 110",Galatone,,,,,,,,,,,
Tutto Professionale - TuttoProfessionale.it,Negozio di forniture idrauliche,https://www.tuttoprofessionale.it/,0833 730267,"Corso Giacomo Matteotti, 78",acquarica del capo,,,https,WordPress,No,"Cloudflare, Inc.",28,28,77.00,Sì,No
Impianti Papa Di Papa Francesco,Idraulico,,328 652 3960,Contrada Orelle,Galatone,,,,,,,,,,,
Impianti di GUIDO Danilo,Idraulico,,339 292 6469,"Via Monte S. Michele, 62",Galatone,,,,,,,,,,,
Meccanica Impianti S.A.S.,Negozio di forniture idrauliche,,0833 901107,SP67,Alliste,,,,,,,,,,,
Termoidraulica Rolli,Ditta specializzata in impianti di riscaldamento,https://bit.ly/3QmFVUL,339 730 7717,"Via Achille palma, 9",Galatone,,info@rollisrl.com,https,Shopify,No,Google LLC,87,97,92.00,Sì,No
Francesco Resta Impianti,Fornitore di impianti di riscaldamento,,328 725 6900,Via Martin Luther King,Galatone,,,,,,,,,,,
FASANO IDRO SYSTEM di Fasano Fausto,Idraulico,,349 818 5287,Via Camillo Benso Conte di Cavour,Melissano,,,,,,,,,,,
Acquafuoco,Idraulico,http://www.acquafuoco.com/,366 369 7301,"Via Felline, 114",Alliste,,,http,WordPress,Sì,Hetzner Online GmbH,78,97,92.00,Sì,No
A.N. Impianti Elettrici,Elettricista,,340 645 3669,Contrada Medichicchio,Poggiorsini,,,,,,,,,,,
Abbinante Damiano,Idraulico,,080 535 6392,"118, Contrada Spignardi, Modugno, BA 70026",Modugno,,,,,,,,,,,
De Marco Impianti,Idraulico,,347 849 4388,Bernardino Telesio,Taviano,,,,,,,,,,,
TIS s.r.l.,Negozio di forniture idrauliche,https://fornituretis.com/,0833 162 3989,"Via Matino, 22",Taviano,,info@fornituretis.com,https,WordPress,Sì,Netsons Network,59,67,92.00,Sì,No
Rci Climasistemi srl,Ditta specializzata in impianti di condizionamento,,0833 583316,"Via Enrico Mattei, 19",Racale,,,,,,,,,,,
G.C. Assistenza,Idraulico,,099 474 4131,"Via Rossano, 46",Statte,,,,,,,,,,,
Idrotech srls,Fornitore di attrezzature per l'energia solare,https://www.idrotechonline.it/,0833 583905,"Via Roma, 66",Racale,,,https,Joomla,Sì,Host SpA,60,69,92.00,Sì,No
Euroimpianti Di Gorgoni Cosimo,Ditta specializzata in impianti di riscaldamento,,340 297 3324,"Via Sicilia, 41",Brindisi,,,,,,,,,,,
Autospurgo Pronto Intervento Brindisi (24H),Servizio per fosse biologiche,,347 687 3735,Via Gerolamo Aleandro,Brindisi,,,,,,,,,,,
T.S. Termotecnica Di Stabile E Tundo Snc,Idraulico,,0831 516792,"Via Monte Nero, 29",Brindisi,,,,,,,,,,,
L'impiantista della tua città,Idraulico,,0831 529966,"Via Giulio Cesare, 98",Brindisi,,,,,,,,,,,
Gravili s.r.l. - Noleggio Piattaforme Aeree,Agenzia di noleggio gru,https://www.gravili.com/,0833 564081,"Z.I. Ss 101, Km 19",Galatone,,segreteria@gravili.com,https,Drupal,No,Aruba S.p.A.,47,39,92.00,Sì,No
Clima System,Ditta specializzata in impianti di riscaldamento,,0831 515529,"Via Cappuccini, 188",Brindisi,,,,,,,,,,,
T.e.c. S.r.l.,Impresa di costruzioni,,0831 525484,"Via Provinciale S. Vito, 67",Brindisi,,,,,,,,,,,
Gaetani Alvaro Ceramiche,Arredo bagno,,0833 552599,"Via Marina, 59",Alliste,,,,,,,,,,,
Conte Michele,Idraulico,,099 474 1841,"Via Madonna del Rosario, 33",Statte,,,,,,,,,,,
Technos ' Di Di Totero Domenico & C. S.A.S.,Idraulico,,0831 550245,"Via Aosta, 13",Brindisi,,,,,,,,,,,
Camassa Impianti Srl,Idraulico,,0831 518671,"Via Aprilia, 44",Brindisi,,,,,,,,,,,
Brindisi Energia S.P.A.,Idraulico,,0831 525423,"Via Filomeno Consiglio, 4",Brindisi,,,,,,,,,,,
Marraffa Angelo,Idraulico,,0831 995235,"Via Alessandro Manzoni, 2",Carovigno,,,,,,,,,,,
Control Calor Center S.R.L.S.,Idraulico,http://www.controlcalorcenter.cloud/,0831 430079,"Via Fulvia, 147",Brindisi,,info@controlcalorcenter.cloud,http,Basekit,No,Aruba S.p.A.,71,70,100.00,Sì,No
Unitermica di Franco Martucci,Idraulico,,338 914 1775,"Via Carbina, 49",Carovigno,,,,,,,,,,,
Scanderebech Ferramenta Edilizia Colorificio Idraulica,Ferramenta,https://scandecasa.it/,348 895 2892,"Via Melissano, n 43",Felline,,,https,Shopify,Sì,Infomaniak Network Management,56,63,100.00,Sì,No
Technos S.r.l.,Idraulico,,0831 508437,"Viale Commenda, 85",Brindisi,,,,,,,,,,,
Tecnomat,Negozio di materiali da costruzione,,02 8390 5463,"Via Vecchia S. Donato, snc",Cavallino,,,,,,,,,,,
Edil Ma.Co.Cer. S.R.L. F.lli Miglietta,Fornitore di materiali da costruzione,,0831 617145,"Via Bari, 69",Cellino San Marco,,,,,,,,,,,
Climar,Ditta specializzata in impianti di condizionamento,,099 474 2364,"Corso Vittorio Emanuele III, 165/A",Statte,,,,,,,,,,,
IDROTERMICA di Maggiulli Francesco,Idraulico,,329 545 0922,"Via Cimarosa Domenico, 13",Lecce,,,,,,,,,,,
Conte Group Srl,Idraulico,,0832 352687,"Via Oronzo Cosi, 7",Lecce,,,,,,,,,,,
'Forniture Termoelettriche ' Di Paolo D'Elia,Negozio di forniture idrauliche,http://deliapaolo.it/,0831 523862,"Via Bastioni S. Giacomo, 50",Brindisi,,info@deliapaolo.it,http,Angular,No,Host SpA,23,48,75.00,Sì,No
Montefusco Andrea,Idraulico,,0832 300525,"Viale Giovanni Paolo II, 38/B",Lecce,,,,,,,,,,,
S.O.G.A.S. di Massimo Carella,Ditta specializzata in impianti di condizionamento,,0832 359782,"Via Vecchia S. Pietro in Lama, 73",Lecce,,,,,,,,,,,
Falco Gaetano,Ditta specializzata in impianti di riscaldamento,https://www.falcogaetano.it/,0831 517715,"Via Cappuccini, 185",Brindisi,,falcogaetanosrl@gmail.com,https,WordPress,No,WIIT AG,62,86,83.00,Sì,No
Aquaman Impianti di Cirillo Sacha,Idraulico,,347 768 6116,"Piazzetta Arturo Toscanini, 5",Lecce,,,,,,,,,,,
D' Amico Francosimo,Elettricista,,080 444 4225,"Via Domenico Cirillo, 97",Cisternino,,,,,,,,,,,
Termoforniture,Idraulico,,0832 455398,"Viale G. Leopardi, 149",Lecce,,,,,,,,,,,
Tecnoimpianti di Albanese Angelo,Negozio di allarmi e sistemi di sicurezza,,080 444 9240,"Via Mulini Vecchi, 21",Cisternino,,,,,,,,,,,
Siram Spa,Idraulico,,0832 350521,Via Giuseppe Moscati,Lecce,,,,,,,,,,,
Zaccaria Emanuele,Servizio di distribuzione,http://www.zaccariathermo.it/,080 444 8246,"Via Eroi del Mare P. Zaccaria, 30",Cisternino,,info@zaccariathermo.it,http,ASP.NET,No,Aruba S.p.A. Network,100,100,82.00,Sì,No
Domotec di Zaccaria Vito,Elettricista,,080 444 6914,"Via Domenico Cirillo, 17",Cisternino,,,,,,,,,,,
La Idrotermica di A. Santamaria,Idraulico,,335 140 4847,"Via Indipendenza, 29/A",Noicattaro,,,,,,,,,,,
Nuova Termogas Impianti di Proscia Antonio,Installatore di impianti di condizionamento,http://www.nuovatermogasimpianti.it/,393 055 7822,"Via Logroscino, 1C",Noicattaro,,info@nuovatermogasimpianti.it,http,Shopify,Sì,OVH SAS,70,86,92.00,Sì,No
Centro Sportivo li Diavulicchi,Complesso sportivo,,340 543 8639,Via Olimpica,Morciano di Leuca,,,,,,,,,,,
Perrone Impianti,Appaltatore,,0833 741139,"Via Roma, 339",Salve,,,,,,,,,,,
SOGIM IMPIANTI | COSTRUZIONI| RISTRUTTRAZIONI,Elettricista,,345 606 4320,Via Capitano Congedi,Ugento,,,,,,,,,,,
Salentosole,Idraulico,,340 470 8630,"Via Armando Diaz, 24",Salve,,,,,,,,,,,
Savemac,Ferramenta,https://www.savemac.it/,0833 726350,"Viale Stazione, 60",Presicce-Acquarica,,,https,React,No,Aruba S.p.A. Network,47,66,92.00,Sì,No
Idropoint Morciano,Fornitore di impianti di riscaldamento,,0833 744029,"Via F.lli Bandiera, 4",Morciano di Leuca,,,,,,,,,,,
Idrosanitaria - Termoidraulica Di Ruffo Vito,Arredo bagno,,0836 571489,"Via Castrignano, 118",Martano,,,,,,,,,,,
De Iacob Vincenzo,Idraulico,,0836 589257,"Via Vittorio Emanuele, 38",Castrignano De' Greci,,,,,,,,,,,
SPIRITO CLIMA SERVICE- GIOVANNI SPIRITO,Ditta specializzata in impianti di riscaldamento,,0836 428221,"Via Cesare Battisti, 49",Maglie,,,,,,,,,,,
Agenzia Colizzi Di Colizzi Stefano Cosimo,Agenzia pratiche automobilistiche e nautiche,,0836 343585,"Via Malta, 164",Muro Leccese,,,,,,,,,,,
Termoimpianti,Ditta specializzata in impianti di riscaldamento,,333 401 1361,Piazza SS. Medici,Maglie,,,,,,,,,,,
CF Elettro Impianti a Presicce Acquarica di Cazzato Andrea,Elettricista,http://www.cfelettroimpianti.it/,388 890 7630,"Via Sicilia, 2",Presicce-Acquarica,,info@cfelettroimpianti.it,http,WordPress,No,Aruba S.p.A.,60,87,92.00,Sì,No
Basso S.A.S. Di Morganti Dario & C.,Ditta specializzata in impianti di riscaldamento,,0836 484108,"Via Vittorio Emanuele, 143",Maglie,,,,,,,,,,,
Eco Ambiente,Servizio di gestione dei rifiuti,http://www.ecoambientesrlpresicce.it/,0833 623088,"Zona Industriale Presicce, Snc",Presicce-Acquarica,,info@ecoambientesrlpresicce.it,http,WordPress,No,OVH SAS,55,75,61.00,Sì,No
Branca Srl - Termoidraulica e Irrigazione,Negozio di forniture idrauliche,https://brancatermoidraulica.it/,0833 762024,"Via Giuseppe Pisanelli, 16",Montesano Salentino,,info@brancatermoidraulica.it,https,WordPress,No,Server Plan S.r.l.,56,84,85.00,Sì,No
F.d.b. Impianti Srl,Idraulico,http://www.fdbimpianti.it/,0833 873086,Via Malpighi,Nardò,,info@fdbimpianti.it,http,ASP.NET,No,Aruba S.p.A. Network,100,100,82.00,Sì,No
Sud Comfort Srl,Arredo bagno,,0833 572606,"Via Incoronata, 15",Nardò,,,,,,,,,,,
L'Idraulica Srl,Fornitore di materiali da costruzione,,0833 873317,"Viale Medaglie d'Oro, 22",Nardò,,,,,,,,,,,
Idrotermoimpianti Rizzo Michele,Idraulico,,349 499 0887,"Via Pantalei Tagliate, 19",Nardò,,,,,,,,,,,
GINO BALDUCCI,Servizio di riparazione di guasti idraulici,,337 233 252,"Via Gallipoli, 16",Nardò,,,,,,,,,,,
Itic di Damiano trotta,Idraulico,,392 646 1445,"Via Trentino, 23",Nardò,,,,,,,,,,,
Autospurgo Ivano Falangone,Appaltatore,,380 752 2040,"Via Silvio Pellico, 1",Nardò,,,,,,,,,,,
Tecno Impianti MG di Gerardo Manca,Idraulico,,360 741 467,"Via Conte di Torino, 5",Nardò,,,,,,,,,,,
Mangia Impianti Di Mangia Salvatore,Idraulico,https://www.mangiaimpianti.it/,347 642 4795,"Via Tagliamento, 6",Nardò,,mangiaimpianti@libero.it,https,Joomla,Sì,Aruba S.p.A.,45,70,83.00,Sì,No
De Marco Luigi,Idraulico,,347 629 0693,"Via Masserei, 18",Nardò,,,,,,,,,,,
MyHome Impiantistica e Tecnologia,Elettricista,,335 821 3394,"Via Vincenzo Gioberti, 30",Neviano,,,,,,,,,,,
San Marco colori Pierino Chiri di Daniele Chiri & C. SNC,Ferramenta,http://www.pierinochiri.com/,0836 342154,"Via Corsica, 168",Muro Leccese,,,http,React,No,Server Plan S.r.l.,65,72,100.00,Sì,No
Tecnoimpianti S.n.c.,Fornitore di impianti di riscaldamento,,0833 564508,"Via S. Francesco D'Assisi, 8",Nardò,,,,,,,,,,,
BRAMATO - Soluzioni per il comfort abitativo,Negozio di forniture idrauliche,https://www.bramato.energy/,393 550 1312,"Via Giuseppe Pisanelli, 61",Montesano Salentino,,bramatosrl@pec.it,https,React,Sì,Aruba S.p.A. Network,56,72,92.00,Sì,No
IdroClima Global Service di Ivano Calabrese,Servizio di riparazioni idrauliche,https://www.idroclima-global-service.it/,320 230 7047,"Strada Tagliate, 82",Nardò,,idroclima.service.coop@gmail.com,https,Wix,No,Google LLC,46,72,100.00,Sì,No
Gt Impianti Idrotermici,Idraulico,,329 546 3361,"Via Arturo Graf, 1",Nardò,,,,,,,,,,,
Class Tecnologie,Ditta specializzata in impianti di condizionamento,,0832 458858,"Viale della Cavalleria, 19",Lecce,,,,,,,,,,,
Idrotecnica Di Grieco Antonio,Elettricista,,348 652 3638,"Via Gorizia, 30",Nociglia,,,,,,,,,,,
Legittimo Srl,Negozio di piastrelle ceramiche,http://www.legittimosrl.it/,0833 631174,"Via Nociglia, 34",Supersano,,info@legittimosrl.it,http,React,No,Seeweb srl,84,94,100.00,Sì,No
Termoidraulica Visconti Srls,Idraulico,,333 202 8051,"Via Galileo Ferraris, 15",Novoli,,,,,,,,,,,
Hidro Green Service,Ditta specializzata in piscine,https://www.hidrogreen.it/,377 351 3375,Via Beata Madre Teresa di Calcutta,Seclì,,info@hidrogreen.it,https,React,Sì,Aruba S.p.A.,57,80,92.00,Sì,No
Global Impianti Di Gianluca Verrienti,Elettricista,,328 316 0669,"Via Po, 17",Novoli,,,,,,,,,,,
Leone Impianti,Idraulico,,324 627 1124,"Via Saverio Mercadante, 1",Lecce,,,,,,,,,,,
TERMOGAS TECNOLOGIE ENERGETICHE s.r.l.,Ditta specializzata in impianti di riscaldamento,http://www.termogaspiccinno.com/,0832 711786,"Via Stefano Costa, 2",Novoli,,info@termogaspiccinno.com,http,WordPress,No,Aruba S.p.A.,60,78,92.00,Sì,No
La Nuova Ferramenta di Stifani Giovanni,Ferramenta,,0832 245812,"Viale Otranto, 21/25",Lecce,,,,,,,,,,,
Rosato Alfredo,Idraulico,,0832 823408,"Viale Risorgimento, 13",Castri di Lecce,,,,,,,,,,,
S.I.T. Sistemi Innovativi Tecnologici Srl,Idraulico,,0832 169 0523,"Via Basilicata, 19",Lecce,,,,,,,,,,,
Idraulico Elettricista,Consulente ingegneristico,http://idraulicoelettricista.com/,338 100 3568,"Via Japigia, 45",Corigliano d'Otranto,,,http,ASP.NET,No,Aruba S.p.A. Network,84,99,82.00,Sì,No
Impianti Elettrici E Termoidraulici Di Casciaro Luigi,Ditta specializzata in impianti di riscaldamento,,328 655 8865,"Via Risorgimento, 24",Vignacastrisi,,,,,,,,,,,
Nuzzo Giacomo Filippo,Idraulico,,0836 920376,"Via Filippo Bottazzi, 54",Diso,,,,,,,,,,,
RUCCO IMPIANTI ELETTRICI & SERVIZI,Elettricista,https://goo.gl/V7Z14N,328 341 8010,"Via Eugenio Montale, 10",Novoli,,,https,Shopify,No,Google LLC,71,78,100.00,Sì,No
Ducta Srl Showroom,Negozio di forniture idrauliche,https://www.ducta.it/,0832 520975,"Viale Otranto, 24",Lecce,,info@ducta.it,https,Shopify,Sì,Aruba S.p.A. Network,56,88,85.00,Sì,No
Doria Vito,Idraulico,,0832 826587,"Piazza Municipio, 6",Castri di Lecce,,,,,,,,,,,
Bray Fabio e Marco Assistenza Caldaie,Idraulico,,0832 801101,"Via Cesare Battisti, 12",Martignano,,,,,,,,,,,
T.I.M. Impianti Idraulici,Idraulico,https://www.timimpiantilecce.com/,347 242 8229,"Via Panaro, 9",Lecce,,tim.impianti_latino@libero.it,https,Joomla,No,Netsons s.r.l.,56,85,92.00,Sì,No
SOS SERVICE ITALIA Ristrutturazione - Servizi Edili,Servizi di ristrutturazione,http://www.sosserviceitalia.it/,366 711 7875,"Viale Giovanni Paolo II, 11",Lecce,,,http,WordPress,No,OVH SAS,56,12,85.00,Sì,No
