Nome Attività,Categoria,Sito Web,Telefono,Indirizzo,Comune,Provincia,Email,Protocollo,Tecnologia,Cookie Banner,Hosting Provider,Mobile Performance,Desktop Performance,Punteggio SEO,Disponibilità Sito,Stato Manutenzione
TERMICA DEMAR CENTRO ASSISTENZA AUTORIZZATO VAILLANT & THERMOROSSI,Fornitore di attrezzature per l'energia solare,http://www.termicademar.it/,335 126 2597,Contrada Piano Dei Masi,Foiano di Val Fortore,,info@termicademar.it,http,ASP.NET,No,Aruba S.p.A. Network,100,100,73.00,Sì,No
Paolo Ingrosso - Assistenza Caldaie Beretta,Idraulico,https://www.paoloingrossosrl.it/,0832 348801,"Via Giosuè Carducci, 2",Cavallino,,info@paoloingrossosrl.it,https,WordPress,No,Aruba S.p.A.,63,65,85.00,Sì,No
Centro Impianti Ignomeriello Cosma Damiano,Idraulico,,080 374 4563,"Via Giuseppe Comez, 91",Bitonto,,,,,,,,,,,
Gruppo Etis Tecnologie Srl,Idraulico,,080 371 7455,"Traversa IV Molfetta, Bitonto, BA 70032",Bitonto,,,,,,,,,,,
Impiantistica termoidraulica Spini Giuseppe,Idraulico,,327 573 1419,"Via L. da Vinci, 39",Lequile,,,,,,,,,,,
Pezzuto - Idro Termo Clima,Negozio di forniture idrauliche,http://www.pezzuto.it/,0832 240041,"Viale della Repubblica, 43",Lecce,,,http,React,Sì,Passepartout s.a.,59,66,73.00,Sì,No
Autospurgo Di Daniele Rizzi,Idraulico,,333 612 9969,Via Vitale Giordano,Bitonto,,,,,,,,,,,
Termoimpianti di Altamura Gianfranco,Idraulico,,339 751 0463,"Via Vito Giuseppe Millico, 22",Terlizzi,,,,,,,,,,,
FC Termoidraulica di Formiglio Cosimo,Ditta specializzata in impianti di riscaldamento,,338 646 8104,"Via Francesco Cervelli, 2/d",Bitonto,,,,,,,,,,,
Garofalo Antonio,Idraulico,,080 371 7264,"26/1 Traversa II D'angio' Lodovico, Bitonto, BA 70032",Bitonto,,,,,,,,,,,
Max Clima Di Massimo Pennacchio,Idraulico,,080 371 5403,"Via Pasquale Berardi, 10",Bitonto,,,,,,,,,,,
DITTA Lattanza Giuseppe Autospurgo Pozzi Neri Sturamenti Allagamenti Servizo Idraulico,Servizio per fosse biologiche,,368 366 8794,"Via Vito Siragusa, 23",Bitonto,,,,,,,,,,,
Termoidraulica Terlizzi S. R. L.,Idraulico,http://www.terlizzisrl.com/,039 284 2942,"Via Walter Fontana, 40",Monza,,,http,WordPress,No,Blacknight Internet Solutions Limited,53,68,92.00,Sì,No
Mirgaldi Vitantonio,Idraulico,,080 638241,"Via Immacolata, 3",Grumo Appula,,,,,,,,,,,
Polidrotermica Pugliese Srl,Negozio di forniture idrauliche,,080 783 5858,"Via D'Ecclesis Giovanni, 22",Grumo Appula,,,,,,,,,,,
Bellomo Snc di Bellomo Vincenzo e Lidia,Idraulico,,080 371 7635,"Via Nicola Garofalo, 48",Bitonto,,,,,,,,,,,
Idracol Srl,Fornitore di impianti di riscaldamento,http://www.idracol.it/,080 374 0793,"Strada Privata Luigi Perrini, Vico Modugno, snc",Bitonto,,segreteria@idracol.it,http,WordPress,Sì,OVH SAS,54,92,92.00,Sì,No
Palladino Giuseppe,Idraulico,,0882 451424,"Via Arc. Pasquale Cirpoli, 15",San Giovanni Rotondo,,,,,,,,,,,
IDRO CENTER,Negozio di forniture idrauliche,,0882 452157,"Via Foggia, 191",San Giovanni Rotondo,,,,,,,,,,,
Rovea Giorgio,Idraulico,,368 337 8686,"Via S. Giovanni Battista, 9",San Giovanni Rotondo,,,,,,,,,,,
Termoidraulica Conveniente,Idraulico,https://termoidraulicaconveniente.com/,340 840 5150,"Via Giuseppe Mazzini, 126",Terlizzi,,info@termoidraulicaconveniente.com,https,React,Sì,Combell NV,34,82,92.00,Sì,No
M.G. Impianti di Mongiello Giuseppe,Idraulico,https://mgimpiantibitonto.it/,080 321 4935,"Via Borgo San Francesco, 57",Bitonto,,mgimpiantibitonto@libero.it,https,Joomla,No,OVH SAS,70,86,100.00,Sì,No
Termoidraulica Acqua e Fuoco di Giorgio Antonio,Idraulico,http://www.acquaefuocobitonto.it/,080 964 9072,"Via Giuseppe Mazzini, 116",Bitonto,,,http,React,Sì,OVH SAS,56,69,85.00,Sì,No
Termoidraulica Torelli Di Torelli Giuseppe,Negozio di forniture idrauliche,,080 623109,"Via Beato Giacomo da Bitetto, 4",Grumo Appula,,,,,,,,,,,
Clima Assistance - Installazione Assistenza Caldaie Riello - Assistenza idraulica - Installazione e assistenza Condizionatori,Fornitore di impianti di riscaldamento,https://www.climaassistance.it/,333 167 0485,"Via Aspromonte, 55",Palombaio,,info@climaassistance.it,https,WordPress,No,Aruba S.p.A.,57,90,100.00,Sì,No
Gentile Termoidraulica,Ditta specializzata in impianti di condizionamento,http://www.dittagentile.net/,328 651 5866,"Via Pietro Giannone, 25",San Giovanni Rotondo,,info@dittagentile.net,http,WordPress,No,Aruba S.p.A.,64,81,77.00,Sì,No
Lattonerie De Bonis di De Bonis Luigi affiliato Metal Theory srls,Servizi di canna fumaria,http://metaltheorysrls.it/,0882 411095,Viale della Gioventù,San Giovanni Rotondo,,assistenza@webador.it,http,React,No,Google LLC,69,95,100.00,Sì,No
Ferramenta da Pierino di De Benedictis Luigi,Ferramenta,,080 455 9176,"Via Francesco Lattanzio, 38",Capurso,,,,,,,,,,,
CALDOROSSO BITONTO,Negozio di forniture idrauliche,http://www.caldorosso.it/,080 964 9177,"Via Ludovico I D'Angiò, 76",Bitonto,,info@caldorosso.it,http,WordPress,Sì,OVH SAS,78,96,67.00,Sì,No
"De Bonis Group | Vendita, Consulenza e Manutenzione Caldaie, Pompe di Calore e Impianti Fotovoltaici",Ditta specializzata in impianti di riscaldamento,http://www.debonisgroup.it/,0882 452510,Via Pasquale Turbacci,San Giovanni Rotondo,,,http,ASP.NET,No,Aruba S.p.A. Network,100,100,73.00,Sì,No
De Bonis Arredo Bagno,Arredo bagno,,0882 453997,Via Antonio Canova,San Giovanni Rotondo,,,,,,,,,,,
IdrauliGò,Idraulico,http://www.idrauligo.it/,327 194 8409,"Via Crocifisso, 44",Bitonto,,info@idrauligo.it,http,React,Sì,"Cloudflare, Inc.",82,99,100.00,Sì,No
G.E.T. Srls,Servizi di ristrutturazione,,392 140 5825,"Via Valenzano, 9",Capurso,,,,,,,,,,,
Tecnoimpianti Di Pacucci G. & C. Srl,Ditta specializzata in impianti di condizionamento,,080 455 9463,"Via Vicinale La Lenza, 23",Capurso,,,,,,,,,,,
Rovea Impianti,Elettricista,https://impiantirovea.it/,380 444 0022,"Via S. Giovanni Battista, 9",San Giovanni Rotondo,,saveriorovea@gmail.com,https,WordPress,Sì,Signet B.V.,56,80,85.00,Sì,No
Termoidraulica Esposito Giuseppe,Idraulico,,338 274 9945,"Via Leonardo da Vinci, 2",Bitritto,,,,,,,,,,,
P.F.T. di Palladino Fabrizio,Idraulico,http://www.pfttecnologie.it/,0882 459593,"Contrada Piano, Snc",San Giovanni Rotondo,,info@pfttermoidraulica.it,http,Basekit,No,Aruba S.p.A.,55,76,92.00,Sì,No
"Clima Futura Di Inviti Angelo, Inviti Lorenzo E Scardicchio Raffaello Snc",Idraulico,,080 631054,"Via Alessandro Manzoni, 5",Bitritto,,,,,,,,,,,
Vico Termica Di Ruo Francesco,Negozio di forniture idrauliche,,339 237 6240,"Via della Resistenza, 5",Vico del Gargano,,,,,,,,,,,
Iervolino Francesco,Fornitore di attrezzature per l'edilizia,,0884 993595,"Via Vadotiglia, Vico Del Gargano, FG 71018",Vico del Gargano,,,,,,,,,,,
F.lli Massa Centro Ceramiche,Arredo bagno,http://www.massafratelli.com/,0882 453552,"Via Tratturo, Via Piano del Marchese Strada 3",San Giovanni Rotondo,,info@massafratelli.com,http,WordPress,Sì,Aruba S.p.A.,59,74,92.00,Sì,No
Gargano Plus Services,Centro per la revisione tecnica delle auto,,329 725 4837,"Via del Risorgimento, 28",Vico del Gargano,,,,,,,,,,,
DUE N impianti,Fornitore di impianti industriali,http://www.duenimpianti.com/,080 558 1537,"Vico Privato Capurso, 16/B",Bari,,nardulliservizio@libero.it,http,WordPress,Sì,Aruba S.p.A. Network,35,70,85.00,Sì,No
So.C.A.B. Gargano F.Lli Paolino Michele & Giovanni B. S.N.C.,Negozio,,0884 993220,"Corso Carmine, 29",Vico del Gargano,,,,,,,,,,,
New Edil Garden Di Perniola Adele,Idraulico,,080 332 3614,"Via Altamura, 18",Santeramo In Colle,,,,,,,,,,,
Staffieri Elettronica Di Staffieri Fabio,Negozio,,0884 991784,"Via Palmiro Togliatti, 10",Vico del Gargano,,,,,,,,,,,
3d Caldaie Sicure,Idraulico,,080 321 8499,"Via Pietro Mascagni, 39",Santeramo In Colle,,,,,,,,,,,
Artigiani srl,Impresa edile,,392 281 1515,"Via Laterza, 104",Santeramo in Colle,,,,,,,,,,,
Porfido Impianti S.R.L.,Elettricista,,080 302 6384,"Largo Convento, 12",Santeramo In Colle,,,,,,,,,,,
Palasciano Antonio,Idraulico,,080 314 2554,"Via Santeramo in Colle, 85",Altamura,,,,,,,,,,,
Lella Pietro,Idraulico,,080 302 3286,"7 Via Contrada Petrilli, Santeramo In Colle, BA 70029",Santeramo In Colle,,,,,,,,,,,
B&B Vico Vacanze,Bed & Breakfast,http://www.bebvicovacanze.it/,329 704 4831,"Via G. di Vagno, 15",Vico del Gargano,,prenotazione@bebvicovacanze.it,http,ASP.NET,No,Aruba S.p.A. Network,80,97,75.00,Sì,No
Metalgum Srl,Servizio di impermeabilizzazione,,080 303 6443,SP236 per Cassano km 39.850,Santeramo In Colle,,,,,,,,,,,
Ciccarello S Di Tozzi Gianluca,Tabaccheria,,0884 991417,"Corso Re Umberto, 80",Vico del Gargano,,,,,,,,,,,
Idraulico Di Bari Donato,Idraulico,,080 557 3316,"Via Montello, 7",Bari,,,,,,,,,,,
Ferramenta Laganella,Ferramenta,https://ferramentalaganella.it/,0884 991041,"Via Papa Giovanni XXIII, 35/37",Vico del Gargano,,info@ferramentalaganella.it,https,Joomla,Sì,Aruba S.p.A,62,78,92.00,Sì,No
Giampetruzzi Vincenzo Srl,Arredo bagno,https://www.giampetruzzi.it/,080 302 3500,"Via Acquaviva, 44",Santeramo in Colle,,,https,ASP.NET,Sì,"Cloudflare, Inc.",55,79,82.00,Sì,No
"Facility Management Bari / DS General | servizi per le aziende, impresa pulizie, security, facchianaggio, lavori edili 3-6-9",Servizi per le imprese,,02 4070 2224,Via Gioacchino Rossini,Santeramo in Colle,,,,,,,,,,,
Assistenza Termoidraulica GSM,Ditta specializzata in impianti di riscaldamento,http://gsmscotto.altervista.org/blog/,348 383 8817,"Via Giovanni Modugno, 27",Bari,,,http,WordPress,Sì,"Cloudflare, Inc.",66,97,75.00,Sì,No
Nicola di Bari e Figli,Appaltatore,,080 574 0872,"Via Principe Amedeo, 402",Bari,,,,,,,,,,,
Ferramenta Veneziani | Pitture e Termo Idraulica / Nautica,Ferramenta,,0884 965328,"Via de Grazia, 28",Rodi Garganico,,,,,,,,,,,
Idraulico Vel Di Zullo Carlo Idraulico Vel Di Zullo Carlo,Idraulico,,080 225 6398,"Viale delle Regioni, 21",Bari,,,,,,,,,,,
DE TOMMASO SRL,Idraulico,,099 736 1660,"Via Puglia, 134",Taranto,,,,,,,,,,,
Mi.fra,Arredo bagno,https://www.mifrasrl.com/,080 841 1693,"Via Giuseppe Bottalico, 78/80",Bari,,info@termoway.com,https,Shopify,No,Aruba S.p.A.,56,63,77.00,Sì,No
"Imit - Impianti, Caldaie, Climatizzatori e Solare Taranto",Ditta specializzata in impianti di riscaldamento,,099 738 3315,"Via Solito, 6",Taranto,,,,,,,,,,,
Ficarella Idrotermica Sud Snc,Idraulico,,080 553 7236,"Via Francesco Lattanzio, 82",Bari,,,,,,,,,,,
Idraulico,Idraulico,http://www.idraulicobari.net/,080 987 7480,"Via Gaetano Salvemini, 91",Bari,,info@idraulicobari.net,http,WordPress,No,Aruba S.p.A.,41,76,100.00,Sì,No
Ferrara,Negozio di forniture idrauliche,http://www.ferrarasrl.it/,080 561 7548,"Via Antonio de Ferrariis, 38",Bari,,fergiov@libero.it,http,React,Sì,Aruba S.p.A.,47,80,83.00,Sì,No
Mongelli Giuseppe,Idraulico,,338 814 4918,"Via Pietro Ravanas, 334",Bari,,,,,,,,,,,
Vi.gi. srl,Idraulico,,099 452 1078,"Via G. Oberdan, 70",Taranto,,,,,,,,,,,
Impianti Idraulici Taranto - De Pace Impianti Srl A S.U.,Idraulico,https://depaceimpianti.com/,099 779 4954,"Via Capitano Andrea Capozzi, 20",Taranto,,info.depace@virgilio.it,https,Shopify,No,Hetzner Online GmbH,92,100,100.00,Sì,No
Il Lattoniere Di Montanaro Giovanni,Idraulico,,099 779 5601,"Via Cesare Battisti, 5190",Taranto,,,,,,,,,,,
IDROTERMICA SCAPATI,Ditta specializzata in impianti di riscaldamento,,329 372 2154,Via g.Montefusco,Taranto,,,,,,,,,,,
Ciemme Lavori Srl,Ditta specializzata in impianti di condizionamento,,099 477 7773,"Via Emilia, 81",Taranto,,,,,,,,,,,
Idraulico Antonio Magrone,Idraulico,,335 653 9617,"Via Francesco Lattanzio, 46/A",Bari,,,,,,,,,,,
Tuttidrica Di Cardellicchio Vincenzo,Negozio di forniture idrauliche,,099 452 5559,"54/A, Via Oberdan Guglielmo, Taranto, TA 74123",Taranto,,,,,,,,,,,
Convertini Martino,Idraulico,,099 777 0690,"Via Sciabelle, 13",Taranto,,,,,,,,,,,
TERMOIDRAULICA F. LLI ADDANTE,Idraulico,,080 468 7580,"Via John Fitzgerald Kennedy, 102",Triggiano,,,,,,,,,,,
BARBERINO IMPIANTI DI GIUSEPPE BARBERINO,Idraulico,,348 100 3674,"Via Virgilio, 170",Triggiano,,,,,,,,,,,
Chiochia Impianti Snc,Idraulico,http://www.chiochiaimpianti.com/,099 736 8161,"Via Campania, 205",Taranto,,,http,WordPress,No,Aruba S.p.A.,68,76,92.00,Sì,No
Colonna - Banco Termoidraulica | Showroom Arredo Bagno,Negozio di forniture idrauliche,http://www.colonnasaverio.com/,080 504 6562,"Via Generale Nicola Bellomo, 93ter",Bari,,tecnico@colonnasaverio.com,http,React,No,Telecom Italia S.p.A.,49,63,83.00,Sì,No
Italclima 2000 S.R.L.,Ditta specializzata in impianti di condizionamento,,080 602779,"Via Favaro, 27",Toritto,,,,,,,,,,,
Emporio Idraulico di Marcello Nobile,Negozio di forniture idrauliche,https://www.emporioidraulico.it/,320 806 9927,"Via G. Oberdan, 126",Taranto,,,https,Shopify,No,Aruba S.p.A.,74,97,100.00,Sì,No
D.R. Termoidraulica Edile,Arredo bagno,http://www.dierreshop.it/,080 562 1674,"Via Bruno Buozzi, 60/A",Bari,,,http,WordPress,No,OVH SAS,61,26,92.00,Sì,No
Impresa Carbonara,Impresa edile,,346 133 3727,"Via Giuseppe Colucci, 25",Triggiano,,,,,,,,,,,
Eliteclima Di Michele Lagioia,Idraulico,,080 468 5521,"Via Roma, 22",Triggiano,,,,,,,,,,,
Metanoservice Di Carrozzo Cosimo,Idraulico,,099 339032,"Via Lombardia, 14",Taranto,,,,,,,,,,,
L'IDRAULICA S.R.L.,Servizio di contabilità,https://www.idraulicataranto.it/,099 452 6592,"Via Vincenzo Pupino, 79/A",Taranto,,idraulicataranto@gmail.com,https,WordPress,No,Aruba S.p.A.,34,64,92.00,Sì,No
EDIL GLOBAL SRL,Negozio di materiali da costruzione,,339 350 5359,"Via Giovanni Battista Pirelli, 4b",Triggiano,,,,,,,,,,,
Dechi Sas Di Chiarolli Giovanni & C.,Idraulico,https://www.dechi.it/,099 736 9749,"Corso Italia, 205",Taranto,,info@dechi.it,https,WordPress,No,Aruba S.p.A.,65,76,85.00,Sì,No
Futurclima Di Giampaolo Gaetano,Idraulico,,080 462 2308,Via Francesca Fallacara,Triggiano,,,,,,,,,,,
Ripetta Ilario,Ditta specializzata in impianti di riscaldamento,,328 154 1227,"Via Monte Grappa, 86",Monteroni di Lecce,,,,,,,,,,,
D.S.I. DI SPEDICATO DIEGO,Idraulico,,349 159 7528,"Via Monte Sabotino, 68",Monteroni di Lecce,,,,,,,,,,,
CAT SERVICE S.R.L.,Ditta specializzata in impianti di riscaldamento,,080 343 3076,"Via delle Fosse Ardeatine, 18",Gioia del Colle,,,,,,,,,,,
Focus Center Srl,Idraulico,,080 349 1073,"Via Dante Alighieri, 80",Gioia del Colle,,,,,,,,,,,
Termas Assistenza Caldaie,Ditta specializzata in impianti di riscaldamento,,080 403 4316,"Via Di Vittorio Giuseppe, 57",Gioia del Colle,,,,,,,,,,,
Coscia Nicola,Idraulico,https://www.nicolacoscia.com/,080 603774,"Via Favaro, 27",Toritto,,,https,Angular,No,"Cloudflare, Inc.",40,59,92.00,Sì,No
La Termoidraulica di Maurizio Martulli,Ditta specializzata in impianti di riscaldamento,,320 452 5218,"Via Giovanni Falcone, 4g",Triggiano,,,,,,,,,,,
climagas,Idraulico,,080 467 3833,"Via Capurso, 108",Valenzano,,,,,,,,,,,
Giancane S.R.L.,Fornitore di materiali da costruzione,,0832 324669,"Corso Umberto I, 217",Monteroni di Lecce,,,,,,,,,,,
Lefemine Giovanni Raffaele,Idraulico,,080 891 3084,"Via Camillo Benso Conte di Cavour, 47",Turi,,,,,,,,,,,
Idrotecnica,Idraulico,https://www.nuovaidrotecnica.it/,080 344 1357,"Via dei Peuceti, 64",Gioia del Colle,,,https,Joomla,No,Seeweb srl,68,96,92.00,Sì,No
IDROTERMICA LG DI LINZALONE G. E RONCO D. S.A.S.,Idraulico,,080 343 1223,"Via delle Fosse Ardeatine, 23",Gioia del Colle,,,,,,,,,,,
Tecno A.Z. S.N.C. Di Ayroldi Salvatore Giuseppe E Zaza Luigi,Idraulico,,080 467 3840,"Via Leonardo da Vinci, 20",Valenzano,,,,,,,,,,,
A.D.Emme System snc,Idraulico,,392 741 2217,"Via Giancane, 15",Manduria,,,,,,,,,,,
Termoidroclima Srl,Idraulico,https://termoidroclima.com/,080 343 3194,"Via Carlo Poerio, 38",Gioia del Colle,,,https,React,Sì,WIIT AG,79,94,85.00,Sì,No
Trasporti Ecologica Service Di Arcangelo Rossetti,Idraulico,,099 973 7029,Via Cosimo Palumbo,Manduria,,,,,,,,,,,
Climacenter S.n.c.,Idraulico,http://www.clima-center.com/,080 344 1368,"Via dei Peuceti, 43",Gioia del Colle,,,http,WordPress,No,Aruba S.p.A.,60,84,0.00,Sì,No
Impianti Termoidraulici Stefano Allegrini - Lattarulo Impianti Srl,Idraulico,,333 540 4764,"Via Michele Iacovazzi, 4",Turi,,,,,,,,,,,
Franco Simone SRL - Idraulica & Materiale Edile - Turi,Impresa edile,https://www.francosimonesrl.it/,080 967 8422,Via Casamassima s/n,Turi,,info@francosimonesrl.it,https,WordPress,No,Aruba S.p.A.,61,90,92.00,Sì,No
Cimino Service Impianti e servizi S. R. L. S.,Idraulico,,338 358 0819,"VIA DON MINZONI, n. 69",Manduria,,,,,,,,,,,
Tecnoclima Snc,Idraulico,,0831 667585,"Via Bruno Giordano, 25/b",San Pancrazio Salentino,,,,,,,,,,,
Tecnologia dell'acqua di A. Melle,Idraulico,,340 283 5775,"Viale Piceno, 13",Manduria,,,,,,,,,,,
Tecnico Termo di Antonio Di Ciolla,Geometra,,080 891 6015,"Via Vittorio Veneto, 65",Turi,,,,,,,,,,,
ELETTRO SYSTEM Impianti & Sistemi Tecnologici di d'Amuri Vincenzo,Elettricista,,380 354 4805,"Via Attilio Regolo, 7",Erchie,,,,,,,,,,,
Fo.Im.,Installatore di impianti di condizionamento,,099 972 1393,"Via L. da Vinci, 47",Sava,,,,,,,,,,,
IDROTERMOCLIMA s.r.l.s.,Idraulico,,329 278 7354,"Via Gastone Valente, 15A",Salice Salentino,,,,,,,,,,,
D'Oria Raffaele,Idraulico,,099 974 6091,"Via L. da Vinci, 81",Sava,,,,,,,,,,,
Fusaro Vincenzo,Idraulico,,080 872 4510,"Via Don David Albertario, 52",Corato,,,,,,,,,,,
Tecno Clima Snc Di Capogna Francesco E Vangi Michele,Idraulico,,080 872 7078,"Via Umberto I', 48",Corato,,,,,,,,,,,
Idroland S.R.L.,Ditta specializzata nella realizzazione di sistemi di irrigazione per prato,http://www.idroland.com/,080 459 4819,Strada Provinciale Adelfia Valenzano,Adelfi,,info@idroland.com,http,WordPress,No,Hetzner Online GmbH,56,64,100.00,Sì,No
Edil Fa.,Impresa edile,,393 059 8454,"Via Piave, 66",Valenzano,,,,,,,,,,,
Capodiferro Angelo,Idraulico,,080 343 3556,"Arco Cimone, 14",Gioia del Colle,,,,,,,,,,,
Iti Sud Srl,Arredo bagno,,080 898 2564,"Via Teano, 8",Corato,,,,,,,,,,,
Di Bisceglie Antonio,Idraulico,,080 872 3611,"Via Duca di Genova, 32",Corato,,,,,,,,,,,
D'Elia Roberto,Idraulico,,099 971 2796,"Via Regina Giovanna II, 42",Manduria,,,,,,,,,,,
Iannone Giuseppe,Idraulico,,080 872 7418,"Via Virgilio, 12",Corato,,,,,,,,,,,
Infissi Ingrosso di Ingrosso Oronzo C. S. A. S.,Fornitore di finestre,http://www.infissiingrosso.it/,099 970 7345,"Z.I. Lotto n, 3",Avetrana,,,http,React,No,Aruba S.p.A.,73,95,100.00,Sì,No
GUERRIERIMPIANTI,Idraulico,http://www.guerrierimpianti.com/,0831 635881,"Via Mesagne, 44",San Donaci,,info@freehtml5.co,http,ASP.NET,No,Armada WAN,67,89,100.00,Sì,No
Mg Impianti Giordano Michele,Idraulico,,347 502 2071,"Via Colella Giovanni, 4",Bitetto,,,,,,,,,,,
Ditta Tinelli Domenico,Idraulico,,339 825 5385,"Via Cesare Battisti, 55",Noci,,,,,,,,,,,
Schiralli Giuseppe,Idraulico,,080 992 4713,"Via Gaetano Incovelli, 6",Bitetto,,,,,,,,,,,
Quarato Giuseppe,Idraulico,,080 497 0564,"Via Don Emanuele Caronti, 2",Noci,,,,,,,,,,,
Perservice di Ferrante Domenico- Assistenza caldaie Ariston,Ditta specializzata in impianti di riscaldamento,,080 358 8065,"Via G. Leopardi, 48",Corato,,,,,,,,,,,
D'Oria srl,Negozio di forniture idrauliche,https://www.doriasrl.com/,080 898 7588,"Via Andria, 96",Corato,,info@doriasrl.com,https,WordPress,No,Aruba S.p.A. Network,87,95,85.00,Sì,No
Adriatica Impianti Di Cannillo E C.,Idraulico,,080 898 7047,"Via Veronica Gambara, 16",Corato,,,,,,,,,,,
Galli Investments,Fornitore di attrezzature per l'energia solare,,800 660 562,"Via XX Settembre, 7",Noci,,,,,,,,,,,
Mekagri Di Plantone Francesco E Losavio Vito S.n.c.,Meccanico,,080 497 9872,"Strada Statale Per Mottola Km.1, Zona F N, 30",Noci,,,,,,,,,,,
T.I.C.A. Impianti sas di Dongiovanni G.&Co.,Ditta specializzata in impianti di riscaldamento,,351 629 8805,"Via Palmiro Togliatti, 35",Noci,,,,,,,,,,,
Luigi Perrone Srl - Impianti Tecnologici,Fornitore di impianti industriali,,080 872 4159,"V.le Luigi Cadorna, 1",Corato,,,,,,,,,,,
Termoidraulica di Diaferia Giuseppe,Ditta specializzata in impianti di condizionamento,https://www.diaferiatermoidraulica.it/,080 898 5251,"Viale V. Veneto, 79",Corato,,termoidraulicadiaferia@gmail.com,https,React,Sì,Server Plan S.r.l.,66,82,85.00,Sì,No
AUTOSPURGO CORATO ECOPUGLIA,Servizio per fosse biologiche,http://www.ecopuglia.it/,368 648 331,"km 35,500, SP231",Corato,,ecopuglia@ecopuglia.it,http,Joomla,Sì,Netsons s.r.l.,35,65,75.00,Sì,No
Termoidraulica Di Longo Maria Grazia,Idraulico,,095 769 8907,"Via Noce, sn",Adrano,,,,,,,,,,,
Security Gas Di Luigi De Mattia,Idraulico,,0865 911046,"Via dietro le Noci, 4",Santa Maria Oliveto,,,,,,,,,,,
Termo Idraulica Tarantini,Idraulico,http://www.termoidraulicatarantini.com/,080 898 4300,"Via Belvedere, 41",Corato,,termoidraulicatarantini@hotmail.it,http,Wix,No,Google LLC,62,93,61.00,Sì,No
HYDROTECH di Diaferia Mauro,Servizio di riparazioni idrauliche,,393 618 3571,"Via Guerrazzi, 40",Corato,,,,,,,,,,,
Azzilonna Domenico,Idraulico,,080 311 7034,"Via Pompei, 81",Altamura,,,,,,,,,,,
I.F.I.R. Di Cutecchia A.& C. Snc,Idraulico,,080 311 8614,"Via Eugenio Montale, 10",Altamura,,,,,,,,,,,
C.I.S. Centro Idro-Sanitario Di Pucci Angelo,Idraulico,,080 314 2120,"Via Fezzan, 7",Altamura,,,,,,,,,,,
Carucci Giuseppe,Fornitore di materiali da costruzione,,080 497 7136,"Via Vittorio Emanuele, 57",Noci,,,,,,,,,,,
Cappiello Idro Termo Sanitaria,Negozio di forniture idrauliche,,080 222 3303,"Via Gravina, 205",Altamura,,,,,,,,,,,
I Te Co Di Corradino Rocco,Idraulico,,080 310 1399,"Via Abbazia, 46",Altamura,,,,,,,,,,,
Monitillo Giovanni,Idraulico,,080 310 5024,"Via Ugo Foscolo, 41",Altamura,,,,,,,,,,,
Bruno Vito,Idraulico,,080 497 8336,"Zona G, 6/n. 10",Noci,,,,,,,,,,,
Forte Michele,Idraulico,,080 310 1143,"Via Niccolò Piccinni, 56",Altamura,,,,,,,,,,,
Ediltermoidraulica Di Cutrone Vito,Idraulico,,080 225 4142,"Via Piemonte, 8",Palo del Colle,,,,,,,,,,,
Fiorino Impianti Di Fiorino Francesco,Idraulico,,080 310 2593,"Via Istria, 9",Altamura,,,,,,,,,,,
SINERGY di Paolo Miccolis Elettrodomestici,Negozio di elettrodomestici,https://www.sinergy-store.com/store-locator/miccolis-paolo?utm_source=GBP&utm_medium=ORGANIC&utm_campaign=MICCOLIS,080 497 8521,"Via Galileo Galilei, 4/6",Noci,,miccolispaolo@alice.it,https,React,Sì,Stack Emea - Italy S.P.A.,33,60,54.00,Sì,No
Acogei Srl,Idraulico,https://www.acogei.it/contatti/,080 314 6330,"Via Conservatorio Carmine, 3/5",Altamura,,info@acogei.it,https,WordPress,Sì,Aruba S.p.A. Network,73,92,100.00,Sì,No
Si.Ti Impianti Snc,Idraulico,,080 314 8769,"Via S. Luigi, 18",Altamura,,,,,,,,,,,
De Santis Orazio,Idraulico,http://www.gruppodesantis.it/service/de-santis-orazio/,080 311 2049,Via Foresta Mercadante,Altamura,,info@gruppodesantis.it,http,WordPress,No,OVH SAS,67,99,92.00,Sì,No
Cutrone Giuseppe,Idraulico,,080 626620,"Viale Adriatico, 17",Palo del Colle,,,,,,,,,,,
I L V I Impianti Di Alberto Ilenia,Elettricista,,080 968 4703,"Via Piscinelle, 34",Binetto,,,,,,,,,,,
Tecnoservice2000 - Italiangas Point di Lacalamita,Idraulico,,080 625764,"Via Alcide De Gasperi, 25",Palo del Colle,,,,,,,,,,,
Vr gruop,Idraulico,,080 352 6462,Corso Vittorio Emanuele,Palo del Colle,,,,,,,,,,,
Maiullari Impianti,Fornitore di impianti di riscaldamento,,327 023 3288,"Via Monte Rosa, 20",Altamura,,,,,,,,,,,
Termoclima Sud S.R.L.,Idraulico,,080 624585,"Via Giuseppe Perrone, 1/A",Palo del Colle,,,,,,,,,,,
Lm Impianti srl,Ditta specializzata in impianti di riscaldamento,http://www.lm-impianti.com/,080 310 3736,Via Martin Luther King,Altamura,,info@lm-impianti.com,http,Joomla,No,Aruba S.p.A.,53,82,92.00,Sì,No
Pietro Caserta,Idraulico,,333 871 9505,"Via E. Fermi, 15",Trinitapoli,,,,,,,,,,,
Edilimpianti srls,Impresa edile,,342 072 2033,Via Caporale Cosimo D'Armiento,Grumo Appula,,,,,,,,,,,
SG SERVICE DI SANTORO GIOVANNI,Servizio di riparazione di climatizzatori,,333 865 2059,"Via Francesco Montuori, 33",Trinitapoli,,,,,,,,,,,
ELE.MAC. | Impianti Elettrici e Fotovoltaici,Elettricista,,338 497 3406,"Via Don Luigi Sturzo, 2",Trinitapoli,,,,,,,,,,,
Termoidraulica di Chiarini Gabriele,Idraulico,,329 425 4234,Villa Tofo 19,Torricella Sicura,,,,,,,,,,,
RTF IMPIANTI S.R.L.,Idraulico,https://rtfimpianti.com/,080 314 1889,"Via del Tabacco, 13/15",Altamura,,info@rtfimpianti.com,https,WordPress,Sì,Armada WAN,59,66,92.00,Sì,No
EDIL RISTRUTTURAZIONI DI CALÒ COSIMO,Servizi di ristrutturazione,,338 868 8236,"Via C. Colombo, 36",Torricella,,,,,,,,,,,
Idro Service Termoidraulica di Alessi,Idraulico,,0541 920625,Via Torricella 216,Novafeltria,,,,,,,,,,,
Riccardo Baldi Termoidraulica,Idraulico,,0383 83634,"Via Roma, 81",Torricella Verzate,,,,,,,,,,,
Orsini Impianti Srl,Idraulico,,0831 667137,"Via Vittorio Emanuele III, 80",San Pancrazio Salentino,,,,,,,,,,,
Tecno Impianti Di Caputo Enzo,Idraulico,,0831 162 2203,"Via E. Battisti, 31",San Pietro Vernotico,,,,,,,,,,,
Fobra Di Fontana Amleto,Idraulico,,0831 653400,"Via S. Pietro, 80",San Pietro Vernotico,,,,,,,,,,,
Mc Tecnotermica Di Manfreda G. & C. S.A.S.,Impianto di raffreddamento,,0831 654209,"Via Mare, 151",San Pietro Vernotico,,,,,,,,,,,
Tecnocaldo Di Parisi Francesco & C. S.N.C.,Idraulico,,0831 961569,"Via Ettore Tagliaferro, 75",San Michele Salentino,,,,,,,,,,,
De Benedittis Nunzia Srl Termoidraulica-Ceramiche-Arredo bagno,Negozio di materiali da costruzione,http://www.dbnsrl.com/,0883 633538,"Via Barletta, 63",Trinitapoli,,info@dbnsrl.com,http,React,No,Keliweb S.R.L,63,86,83.00,Sì,No
Conte Linda Idrotermoceramiche,Arredo bagno,http://www.idrotermoceramiche.it/,0831 667138,"Viale dell'Industria, Snc",San Pancrazio Salentino,,,http,WordPress,No,Aruba S.p.A.,83,95,100.00,Sì,No
ELIA IMPIANTI,Idraulico,,338 362 2104,"Via Boemondo Normanno, 58",San Vito dei Normanni,,,,,,,,,,,
LDS INGEGNERIA,Ingegnere civile,https://www.ldsingegneria.it/,349 290 2318,"Via Armando Diaz, 6",Torricella,,ldsingegneria@libero.it,https,WordPress,Sì,Aruba S.p.A.,49,72,100.00,Sì,No
Domus Clima srl Di Maurizio Citiolo Brindisi,Negozio di forniture idrauliche,,0831 608843,"Via Arrigo Boito, 47",San Vito dei Normanni,,,,,,,,,,,
