Nome Attività,Categoria,Sito Web,Telefono,Indirizzo,Comune,Provincia,Email,Protocollo,Tecnologia,Cookie Banner,Hosting Provider,Mobile Performance,Desktop Performance,Punteggio SEO,Disponibilità Sito,Stato Manutenzione
DITTA MINELLI GIUSEPPE,Servizio di riparazione di climatizzatori,,348 766 5217,"Via Santa Caterina da Siena, 3",Biccari,,,,,,,,,,,
IDROSERVICE Andrea Creta,Idraulico,,329 109 0544,"Via Raffaele de Peppo, 21",Lucera,,,,,,,,,,,
Idrotermo Di Forte Eugenio,Idraulico,,0881 555089,"Via Papa Giovanni XXIII, 1",Pietramontecorvino,,,,,,,,,,,
C.s. Impianti Di Candela Salvatore,Ditta specializzata in impianti di riscaldamento,,320 346 3172,"Via Badisco, 1",Uggiano la Chiesa,,,,,,,,,,,
IDROCALOR di Caccavelli Leonardo - Idraulico - Termoidraulico - Foggia - Termoli,Idraulico,,333 732 0619,"Via Brescia, 56",San Severo,,,,,,,,,,,
Castelnuovo Impianto Termoidraulici Sas Di Alessandra Comini,Idraulico,,0341 735176,"Via Statale, 95",Mandello del Lario,,,,,,,,,,,
Termoidraulica D'Ariano Srl,Idraulico,,0881 665518,"Viale Francia, 40",Foggia,,,,,,,,,,,
D'Auria & Talia Idraulica,Idraulico,,0875 689175,"Via Goito, 88",Guglionesi,,,,,,,,,,,
Candela Massimiliano Termoidraulica,Idraulico,,333 995 1564,"Via Giudicato di Torres, 6",Budoni,,,,,,,,,,,
Barletta Juan Carlos,Idraulico,,347 620 4196,"Viale Kennedy, 53",Troia,,,,,,,,,,,
Dlp impianti di Delli Carri Domenico,Idraulico,,331 473 3627,"Via Pio La Torre, 8",Foggia,,,,,,,,,,,
Maddalena Michele,Idraulico,,0881 523591,"Via Famiglia d'Auria, 49",Lucera,,,,,,,,,,,
Idrothermogas Di Caccavelli Leonardo & Mastrangelo Riccardo N. Snc,Idraulico,,0882 240898,"Via Brescia, 56",San Severo,,,,,,,,,,,
Giancarlo Laronga,Idraulico,,328 134 9405,"Via Enrico de Nicola, 107",Torremaggiore,,,,,,,,,,,
Pannichella Franco Manutenzione Impianti Termici,Idraulico,,335 532 8595,Corso Udha Giorgio Castriota Skanderbeg,Casalvecchio di Puglia,,,,,,,,,,,
Ieva M Impianti s.r.l.,Idraulico,,339 448 1406,"Via Vittime Civili, 4",Carapelle,,,,,,,,,,,
Tcr Di Carlo Troilo,Idraulico,,0882 374506,"Corso Giuseppe Di Vittorio, 6",San Severo,,,,,,,,,,,
Maddalena Alberto & C. S.N.C.,Idraulico,,0444 673652,"Via Nicola patrimonio lotob n11 Via Nicola patierno lottob, n11",Foggia,,,,,,,,,,,
IDRAULICA DELL'ANNA RAFFAELE,Idraulico,,347 000 1753,"Via Archita da Taranto, N° 38",Lecce,,,,,,,,,,,
Idraulica Service srl - Concessionaria Ufficiale Assistenza Caldaie Unical,Ditta specializzata in impianti di riscaldamento,http://concessionari.unicalag.it/foggia/idraulica-service-srl-di-marino-martella,339 404 4260,"Largo Podgora, 11",Pietramontecorvino,,,http,React,Sì,Server Plan S.r.l.,63,97,82.00,Sì,No
Termotec Impianti di Rollo Paolo,Idraulico,,340 679 1642,"Via Marchese de Rosa, 5",Foggia,,,,,,,,,,,
Sergio Antonelli,Idraulico,,334 818 8579,"Via Calabria, 3",San Severo,,,,,,,,,,,
Idraulica Patete,Idraulico,,0882 331257,"Via Torquato Tasso, 13",San Severo,,,,,,,,,,,
2C S.r.l.,Idraulico,,0824 963627,Via var,San Bartolomeo in Galdo,,,,,,,,,,,
Termoidraulica La Cava,Idraulico,http://www.termoidraulicalacava.it/,349 857 8625,"Via Alberico Marrone, 125",Lucera,,info@termoidraulicalacava.it,http,React,No,Aruba S.p.A. Network,52,75,75.00,Sì,No
Idrotermica Salnitro,Fornitore di materiali da costruzione,http://www.idrotermicasalnitro2003.com/,0881 778985,"Via di Salsola, 42",Foggia,,info@idrotermicasalnitro2003.com,http,WordPress,No,Aruba S.p.A. Network,40,65,85.00,Sì,No
Teknoclima System Srl,Idraulico,,0882 335355,"Viale due Giugno, 44",San Severo,,,,,,,,,,,
Drv Impianti Idraulici e Termoidraulici,Idraulico,,0874 484535,"Via Monte Grappa, 25",Campobasso,,,,,,,,,,,
Minchillo Srl,Impresa di costruzioni,,0881 558201,"Via Rossetti, 18",Casalnuovo Monterotaro,,,,,,,,,,,
D.F. Impianti Di D Alfonso Flaviano,Idraulico,,0874 728658,"27 Via Aste E Mestieri, Santa Croce Di Magliano, CB 86047",Santa Croce di Magliano,,,,,,,,,,,
Thermo Solar Tech di Princigallo Antonio,Idraulico,,0882 218354,"Via Petrarca, 5",San Severo,,,,,,,,,,,
Tecnotherm Impianti • Gargano,Idraulico,,350 073 5493,Via Europa,Vico del Gargano,,,,,,,,,,,
Termico 89 di Milione Amedeo,Idraulico,,389 092 7576,"Via Carlo Pisacane, 29",San Severo,,,,,,,,,,,
Iafelice Sandro Pasquale,Idraulico,,338 759 9541,"Via Uranio, 12",San Severo,,,,,,,,,,,
CHIODO FISSO FERRAMENTA,Ferramenta,,0884 8194,"Via A. Moro, 6/C",Cagnano Varano,,,,,,,,,,,
PrimoClima di Fiano Antonio Assistenza Caldaie Beretta,Idraulico,,0882 422563,"Via Teano Appulo, 41",San Severo,,,,,,,,,,,
Mondotermica,Idraulico,,328 963 3378,"Corso Matteotti, 74",Carapelle,,,,,,,,,,,
Ruggiero Giovanni,Fornitore di materiali da costruzione,,0881 554184,"Via Cairoli, 211",Celenza Valfortore,,,,,,,,,,,
Fomas Srl,Ferramenta,,0881 554182,"Via Giardino, 2A",Celenza Valfortore,,,,,,,,,,,
D'Agostino F.lli Claudio & Davide s.n.c.,Fornitore di materiali da costruzione,,0881 554584,"Sp.1, Contrada Fornaci",Celenza Valfortore,,,,,,,,,,,
Co.Ma.Co,Fornitore di materiali da costruzione,,0881 554255,"Contrada Fornaci, Snc",Celenza Valfortore,,,,,,,,,,,
Macelleria Fascia,Macelleria,,393 995 7990,"Via Cairoli, 1",Celenza Valfortore,,,,,,,,,,,
Cinalli Vincenzo,Idraulico,,0875 539806,"Via Don L. Sturzo, 55",Campomarino Lido,,,,,,,,,,,
Ziccardi Termoidraulica,Idraulico,,346 827 3753,"Via Aldo Moro, 28",Larino,,,,,,,,,,,
Vellonio Aldo,Idraulico,,0881 525048,"Via Enrico Toti, 14",Lucera,,,,,,,,,,,
ML IMPIANTI DI MANUEL LONGO,Idraulico,,347 989 1132,"Via Vigne Nuove, 44/A",Campomarino,,,,,,,,,,,
Thermotech Di D'Anzeo Maurizio,Idraulico,https://www.danzeoservizi.it/,0882 337339,"Via Soccorso, 266",San Severo,,info@danzeoservizi.it,https,React,Sì,Aruba S.p.A.,56,75,92.00,Sì,No
Gruppo Real | Realwood - Edilcolor - Realkasa,Fornitore di porte,http://www.realwoodporte.it/,0884 80924,"Contrada Coppa Sant'Agata, Snc",Cagnano Varano,,,http,WordPress,No,Netsons s.r.l.,72,99,100.00,Sì,No
Impianti Idraulici Antonio Ondesca,Idraulico,,338 721 8390,"Via Roma, 118",Montecilfone,,,,,,,,,,,
Elettrotermoimpianti Snc,Idraulico,,328 974 6033,"Via Enrico Pestalozzi, 29/E",Foggia,,,,,,,,,,,
Nuova Impiantistica s.a.s,Idraulico,,331 423 2393,"Via India, 21",Termoli,,,,,,,,,,,
Termoidraulica DE5 - di De Cinque Giorgio,Idraulico,https://termoidraulicade5.weebly.com/,347 844 5095,Via Udine,Termoli,,,https,Weebly,Sì,"Weebly, Inc.",60,81,83.00,Sì,No
Tartaglia Pietro,Idraulico,,0882 646105,"Via Pier delle Vigne, 35",Apricena,,,,,,,,,,,
Climatek 2000 di Sergio D'Alessandro,Idraulico,https://climatek2000.it/,328 376 9516,"Contrada Feudo, 42",Campobasso,,,https,WordPress,No,Hetzner Online GmbH,43,91,92.00,Sì,No
Lannutti Antonio,Idraulico,,0875 538240,"Via G. Di Vittorio, 24",Campomarino,,,,,,,,,,,
Idrotermica di Ruggiero Giuseppe,Ditta specializzata in impianti di condizionamento,http://idrotermicaruggierogiuseppe.myadj.it/v/idrotermicaruggierogiuseppe,347 062 2112,Via San Nazario Zona Artigianale Lotto 46,Apricena,,,http,Shopify,No,"Cloudflare, Inc.",78,97,92.00,Sì,No
Agricola 2000 Di Mitrione Nicola - Prodotti per l'edilizia,Fornitore di fertilizzante,,0884 997500,"Via Europa, 58",Carpino,,,,,,,,,,,
Giambattista Francesco,Ferramenta,,0884 997432,"Via Roma, 171",Carpino,,,,,,,,,,,
ITALEDIL SRLS,Ferramenta,,0881 553454,"2, Viale degli Albanesi D'italia, 71030",Casalvecchio di Puglia,,,,,,,,,,,
Termo System,Idraulico,,393 083 3046,"Via Francesco Ferrucci, 37",Apricena,,,,,,,,,,,
MEIS del Geom. Luigi Maddaloni,Idraulico,,339 683 9776,"Via Ottaviano Augusto, 97",Nola,,,,,,,,,,,
Cellamare Vito Impianti Idraulici,Idraulico,,080 527 7060,"Corso Giuseppe Mazzini, 166",Bari,,,,,,,,,,,
Impianti Idrici Termici Condizionamenti Gas di Donato della Santa,Idraulico,,340 779 3613,"Via Porta del Pozzo, 81",Castelluccio Valmaggiore,,,,,,,,,,,
Termoidraulica Di Disposto Vito,Idraulico,,080 553 4012,"Via Valona, 59",Bari,,,,,,,,,,,
Epifani Impianti Termoidraulici,Idraulico,,360 830 923,"Via Pirandello, 7",San Vito dei Normanni,,,,,,,,,,,
Termoidraulico Attorre Gianvito,Idraulico,,349 500 3232,"Via Massimo D'Azeglio, 30",San Vito dei Normanni,,,,,,,,,,,
Lazazzera Giacomo Vito,Idraulico,,080 303 2221,"Via Salvatore Cognetti, 6",Santeramo In Colle,,,,,,,,,,,
Termoidraulica Sud Di Leone Biagio,Idraulico,,333 956 3537,"Via Camillo Cavour, 12",Ascoli Satriano,,,,,,,,,,,
STEFANINI CARLO TERMOIDRAULICA,Idraulico,,340 297 5024,"Via Zelano, 36",Accadia,,,,,,,,,,,
TERMOIDRAULICA SIMONETTI ANTONIO DEI F.LLI SIMONETTI NICOLA & GIUSEPPE S.n.c.,Idraulico,,329 874 5628,Via Papa Giovanni XXIII,Lucera,,,,,,,,,,,
Del. Ve Impianti di Della Vella Leonardo | Idraulico Vico del Gargano,Idraulico,,349 076 6076,"Via Alcide de Gasperi, 17",Vico del Gargano,,,,,,,,,,,
Turchiarelli Luigi Impiantistica,Idraulico,,0881 963867,"Via S. Cristoforo, 19",Deliceto,,,,,,,,,,,
Isothermo Di Antenozio Alessandro,Idraulico,,330 867 937,"Via Don Giovanni Minzoni, 95",Lucera,,,,,,,,,,,
Frigogen Condizionamento Refrigerazione Di Gennarino Antonio,Idraulico,,0881 522625,"Via Pasquale Follieri, 61",Lucera,,,,,,,,,,,
Fusillo Raffaella,Idraulico,,0885 427882,"Via Don Minzoni, 70",Cerignola,,,,,,,,,,,
E.co.tec. srl,Idraulico,,0885 411755,"132 Via Pedone Antonio, Cerignola, FG 71042",Cerignola,,,,,,,,,,,
Imbrice,Idraulico,,0885 423513,"Viale di Ponente, 20",Cerignola,,,,,,,,,,,
Cm Impianti Di Mauro Chieti,Idraulico,,0885 421166,"Via D. Cirillo, 13",Cerignola,,,,,,,,,,,
"Ferramenta, colori e idraulica di Anna Carpino",Ferramenta,http://www.carpinoanna.it/,340 277 7159,"Via Stazione, 18/C",Santo Stefano di Rogliano,,,http,React,No,Aruba S.p.A.,63,51,100.00,Sì,No
Sciusco Giuliano & C.,Negozio di forniture idrauliche,,0885 424523,"Via Sestriere, 40",Cerignola,,,,,,,,,,,
IDROTECH IMPIANTI E MANUTENZIONI,Ufficio aziendale,,348 408 9770,"Via Tivoli, 2",Cerignola,,,,,,,,,,,
Idrosanitari M.I.C. Sas,Arredo bagno,,0881 635512,"Via Angelo Fraccacreta, 104",Foggia,,,,,,,,,,,
termoidraulica De Maso Angelo,Idraulico,,380 467 2126,"Via Alberico Marrone, 125",Lucera,,,,,,,,,,,
"ColucciCalorClima Assistenza caldaie Vaillant,Lamborghini,Ferroli,Chaffoteaux,Italtherm,Sime,Intergas VenditaRicambi",Ditta specializzata in impianti di riscaldamento,,0885 415919,"Via Assisi, 6B",Cerignola,,,,,,,,,,,
L'Equilibrio Climatico - Porzio Giovanni,Idraulico,,0881 707517,"Via S. Antonio, 84",Foggia,,,,,,,,,,,
Punto A.F.A. S.N.C. Di Padalino Slvatore E Fracasso Luigi,Idraulico,,0881 611841,"Via Marchese de Rosa, 11",Foggia,,,,,,,,,,,
Termo Commerciale,Fornitore di impianti di riscaldamento,,0881 611510,"Piazza Domenico Scaramella, 23",Foggia,,,,,,,,,,,
Termoidraulica Cota,Idraulico,,388 956 0768,"Viale dell'Emigrante, 2",Mattinata,,,,,,,,,,,
Tekno Elettrodomest. Di Tricarico P,Negozio di elettrodomestici,,199 580 480,"via Giacomo Matteotti, 3",Ischitella,,,,,,,,,,,
Verdeclima,Idraulico,,0881 709049,"Via Antonio Ciano, 44",Foggia,,,,,,,,,,,
Idroservice di Francesco Esposito,Idraulico,,340 521 4758,"Via dei Martiri delle Fosse Ardeatine, 26",Mattinata,,,,,,,,,,,
Antonacci Termoidraulica Srl,Idraulico,http://www.antonaccisrl.it/,0881 707522,"Via S. Severo, Km. 2",Foggia,,,http,WordPress,No,Aruba S.p.A. Network,100,0,0.00,Sì,No
Gatta Matteo,Idraulico,,0884 551406,"Via Delegazione Municipale, 148",Mattinata,,,,,,,,,,,
EdilTriggiani dei F.lli Ciardone S.r.l. ~ Ischitella (FG),Fornitore di materiali da costruzione,,0884 995214,via Valloncello,Ischitella,,,,,,,,,,,
Berthoud Sas Ischitella • Edilizia & Riscaldamento,Fornitore di attrezzature per l'edilizia,,0884 195 0834,"via Giacomo Matteotti, snc",Ischitella,,,,,,,,,,,
Triggiani & Miucci S.D.F.,Fornitore di finestre,,0884 996755,Viadotto Romondato,Ischitella,,,,,,,,,,,
PRONTORAPIDO,Ditta specializzata in impianti di riscaldamento,http://www.prontorapido.it/,800 114 424,"Corso Scuola Agraria, 51C",Cerignola,,info@prontorapido.it,http,Basekit,No,Aruba S.p.A.,60,74,100.00,Sì,No
Berthoud L. Dei F.lli Berthoud Veronica E Figli,Fornitore di materiali da costruzione,,0884 996074,"via Giacomo Matteotti, Snc",Ischitella,,,,,,,,,,,
A.C.T.I.,Idraulico,http://www.actisrls.it/,348 229 0096,"Via Tratturo Castiglione, 26",Foggia,,info@actisrls.it,http,WordPress,No,Aruba S.p.A.,41,62,85.00,Sì,No
Delle Donne Giuseppe,Idraulico,,348 857 2300,"Via Giuseppe Mandara, 79",Foggia,,,,,,,,,,,
Volpe Stefano Costruzioni,Fabbro,,368 786 7711,"Contrada Cupazzo, 71020",Monteleone di Puglia,,,,,,,,,,,
Futura shop,Negozio di climatizzatori,,0882 304217,"Via Colonnella, 21",Lesina,,,,,,,,,,,
Ferramenta E Materiali Edili Carmelo Volpe,Ferramenta,,0881 983246,"Via Mancini, 119",Monteleone di Puglia,,,,,,,,,,,
Termoidraulica Mancini Adelchi,Ditta specializzata in impianti di riscaldamento,https://sites.google.com/view/termoidraulica-mancini-adelchi?usp=sharing,389 133 5745,"Viale Cristoforo Colombo, 10",Foggia,,,https,React,No,Google LLC,57,94,75.00,Sì,No
Comune di Orsara di Puglia,Municipio,,0881 964013,"Via XX Settembre, 1",Orsara di Puglia,,,,,,,,,,,
ELETTROIMPIANTI di LUIGI MURGANO,Servizio di installazione elettrica,http://www.elettroimpiantimurgano.it/,328 908 9509,Corso Vittorio Emanuele,Lesina,,elettroimpiantimurgano@gmail.com,http,Joomla,No,Netsons s.r.l.,66,93,83.00,Sì,No
Termosud Impianti S.r.l.,Idraulico,,0825 891052,"Via Angelica Fontana, 1",Ariano Irpino,,,,,,,,,,,
CSI - Centro Sud Idrotermico s.r.l,Idraulico,,0825 872024,"Via Bosco, Ariano Irpino, AV 83031",Frolice,,,,,,,,,,,
Kalor Klima Di Vellonio A.E Del Grosso L.Snc,Idraulico,,0881 530421,"Via Napoleone Battaglia, 40",Lucera,,,,,,,,,,,
Building Energy Group s.r.l.,Impresa di costruzioni,http://www.buildingenergygroup.com/,0881 964962,"Via Cesare Battisti, 29",Orsara di Puglia,,info@buildingenergygroup.it,http,WordPress,No,Hetzner Online GmbH,68,95,85.00,Sì,No
Porcelli Angela Maria Rosaria,Idraulico,,0885 782100,"Via Giuseppe Ungaretti, 32",Orta Nova,,,,,,,,,,,
La Termoimpianti Srl,Ditta specializzata in impianti di riscaldamento,,0825 828623,Contrada Accoli,Ariano Irpino,,,,,,,,,,,
Lo Drago Termoclima Di Franco Lo Drago,Idraulico,,0885 783032,"Corso Umberto I, 28",Orta Nova,,,,,,,,,,,
Porcelli Michele,Ditta specializzata in impianti di condizionamento,,0885 783334,"Corso Vito Vittorio Lenoci, 33",Orta Nova,,,,,,,,,,,
Cala' Giuseppe & C. Snc,Negozio di elettrodomestici,,0882 991075,"Via Lorizio, 11",Lesina,,,,,,,,,,,
CIR impianti di Nicola Cocca,Idraulico,https://www.cirimpianti.com/,334 924 0654,Vico III M. Passeri,Ariano Irpino,,cirimpianti.info@gmail.com,https,WordPress,Sì,TransIP BV,75,96,92.00,Sì,No
Idroelettra,Negozio di forniture idrauliche,,0885 792021,"Viale Ferrovia, Snc",Orta Nova,,,,,,,,,,,
Tutto Gas Di Menduno Mario,Servizio di riparazione di climatizzatori,,339 184 1143,"Corso Bixio, 37",Orta Nova,,,,,,,,,,,
Assistec,Idraulico,,059 340287,"Str. Panni, 25",Modena,,,,,,,,,,,
Termoidraulica Antonio Graziano,Negozio di forniture idrauliche,,0881 545327,"Viale Avv. Vincenzo Scarano, 43",Lucera,,,,,,,,,,,
Punto Edison Lucera (FG) - BOSCO IMPIANTI - Business Partner,Azienda fornitrice di energia elettrica,,349 061 4056,"Via Napoleone Battaglia, 104",Lucera,,,,,,,,,,,
Termosud Service Di Lucio Bosco,Idraulico,,348 660 1152,"Via Cesare Battisti, 4",Lucera,,,,,,,,,,,
Comune di Isole Tremiti,Municipio,,0882 463063,"Piazza del Castello, 4",San Nicola di Tremiti,,,,,,,,,,,
Lenoci,Idraulico,,0884 994279,"Via G. di Vagno, 22",Vico del Gargano,,,,,,,,,,,
Lattoniere Vico Di Dattoli Alberto,Lavorazione metalli,,0884 272862,"Via dei Caduti, 24",Vico del Gargano,,,,,,,,,,,
Marlintremiti,Negozio di attrezzature per immersioni,https://www.marlintremiti.com/,336 829 746,"Viale Amerigo Vespucci, snc",Isole Tremiti,,info@marlintremiti.com,https,WordPress,Sì,Google LLC,66,54,100.00,Sì,No
Novatek Impiantistica,Servizio di installazione elettrica,,348 034 5365,"Via Michelangelo Manicone, 12",Vico del Gargano,,,,,,,,,,,
Maar Impianti Di Serafino Mario,Idraulico,,349 422 0571,"Via A. Manzoni, 63 B",Tiggiano,,,,,,,,,,,
L' Idraulico Di Elia Antonio,Idraulico,,335 751 5891,"Via Vincenzo Monti, 66",Tricase,,,,,,,,,,,
Brikiamo,Commerciante di ferramenta,https://www.brikiamo.it/,350 091 2797,"Via Ripalta, 38",Lesina,,info@brikiamo.it,https,WordPress,Sì,Server Plan S.r.l.,59,62,92.00,Sì,No
I. G.,Idraulico,,0833 743529,Via Luigi Credaro,Tricase,,,,,,,,,,,
Prioletti Srl,Arredo bagno,https://priolettisrl.it/,0881 201433,"Viale dell'Artigianato, 3",Lucera,,info@priolettisrl.it,https,WordPress,No,Keliweb S.R.L,39,64,85.00,Sì,No
Speed Casa - Rodi Garganico,Servizi di ristrutturazione,,0884 966629,"Corso Ruggero Bonghi, 14",Rodi Garganico,,,,,,,,,,,
Ds Idraulica,Negozio di forniture idrauliche,,0884 198 0057,"Via Scaloria, 196",Manfredonia,,,,,,,,,,,
Tecnocalor Srl,Idraulico,,0884 582466,Località Conte di Troia,Manfredonia,,,,,,,,,,,
C.R.G. Di Matteo D'Achille E C.,Idraulico,,0884 583406,"Corso Manfredi, 192",Manfredonia,,,,,,,,,,,
Pagano Carlo S.r.l.,Idraulico,,0884 708700,"Via Venezia, 12",Vieste,,,,,,,,,,,
Idroclima Di Michele De Cristofaro,Idraulico,,0884 273552,"Via Cimarrusti, 23",Manfredonia,,,,,,,,,,,
Tecnoimpianti Di Rinaldi Leonardo,Idraulico,,0884 536672,"Via Tribuna, 88",Manfredonia,,,,,,,,,,,
DUEF di Ferragonio Giuseppe | Vendita Assistenza Caldaie Climatizzatori | Termoidraulica Ceramica Rubinetteria | Orta Nova FG,Ditta specializzata in impianti di riscaldamento,,333 850 1591,"Via F. Turati, 13",Orta Nova,,,,,,,,,,,
Ideal Calor,Ditta specializzata in impianti di riscaldamento,,0884 534383,"Via Giuseppe Mazzini, 41",Manfredonia,,,,,,,,,,,
N.T. Idraulica Riscaldamento Di Novelli Angela,Negozio di forniture idrauliche,https://www.idroclimasolution.com/,0885 784213,Via Giovanni Amendola,Orta Nova,,info@idroclimasolution.com,https,WordPress,Sì,IONOS SE,35,24,100.00,Sì,No
Mangano Impianti,Idraulico,http://manganoimpianti.it/,340 761 9990,"Vicolo Gorizia, 9",Manfredonia,,benedettomangano@gmail.com,http,WordPress,No,Netsons s.r.l.,64,74,83.00,Sì,No
Idraulica Trotta Di Trotta Giuseppe,Idraulico,,0884 532788,"Via Giacomo Leopardi, 6",Manfredonia,,,,,,,,,,,
New Calor di Gelsomino Annalisa,Installatore di impianti di condizionamento,,366 387 4271,"Via Scaloria, 23/A",Manfredonia,,,,,,,,,,,
Belcastro Impianti,Servizio di riparazioni idrauliche,,0884 965439,"via Palestro, 18",Rodi Garganico,,,,,,,,,,,
Vaillant Service Assistenza Caldaie,Fornitore di impianti di riscaldamento,,333 633 8076,"Vicolo Carradori, 9",Manfredonia,,,,,,,,,,,
P.A.M.M. Srl Materiali Termo-Idrici-Sanitari,Idraulico,,0884 538851,"Via Gaetano Palatella, 94 - 94/A",Manfredonia,,,,,,,,,,,
D'Alessandris TermoIdraulica Elettricità Ferramenta - Sede Centrale,Negozio di forniture idrauliche,http://www.dalessandris.it/,0833 722265,"Corso Giacomo Matteotti, 78",Presicce-Acquarica,,info@dalessandris.it,http,Shopify,No,Serverplan S.r.l.,30,49,92.00,Sì,No
Gargano Pierangelo,Idraulico,,335 743 5015,"Via Spallanzani, 18",San Pietro Vernotico,,,,,,,,,,,
Valerio Termo Service,Idraulico,,389 997 8615,"Via Cozzolete, 9",Manfredonia,,,,,,,,,,,
Idroservice di Di Iasio Adriano,Idraulico,,0884 593752,"Via Pulsano, 66",Manfredonia,,,,,,,,,,,
DB. R. Service,Ditta specializzata in impianti di riscaldamento,https://www.dbrassistenza.it/,334 362 4079,"Via IV Novembre, 54",Manfredonia,,dbrassistenza@gmail.com,https,Shopify,Sì,Aruba S.p.A.,44,57,100.00,Sì,No
Riserva naturale marina Isole Tremiti,Attrazione turistica,https://www.riservamarinaisoletremiti.it/,0884 568911,"Isole Tremiti, Puglia",Monte Sant'Angelo,,info@riservamarinaisoletremiti.it,https,React,No,Aruba S.p.A.,31,35,85.00,Sì,No
Granatiero Impianti,Azienda fornitrice di energia elettrica,https://www.granatieroimpianti.it/,347 988 4619,"Via Gargano, 224",Manfredonia,,granatieroimpianti@gmail.com,https,React,Sì,Aruba S.p.A. Network,10,13,100.00,Sì,No
Rubino Giulio,Idraulico,,0882 644395,"Via Milano, 83",Apricena,,,,,,,,,,,
Clima Service - Basile Antonio,Idraulico,,346 285 1207,"Via Lido, 29",Rocca Imperiale,,,,,,,,,,,
Lattonerie Cassano Di Cassano Andrea Leonardo,Idraulico,,348 523 8665,"Via S. Nazario, 17",Apricena,,,,,,,,,,,
Lombardi Vincenzo,Idraulico,,0882 646450,"Via A. de Gasperi, 1",Apricena,,,,,,,,,,,
STE.PA TERMOTECNICA S.n.c.,Idraulico,,349 131 7707,"Via Inverse, 21",Castelluccio dei Sauri,,,,,,,,,,,
D.R.L. snc di D'Avena Michele & C.,Installatore di impianti di condizionamento,https://drl-davena.webnode.it/,0882 644170,"Viale Aldo Moro, 133",Apricena,,,https,Webnode,No,Amazon Technologies Inc.,73,98,92.00,Sì,No
Termoidraulica Guglielmo,Idraulico,,340 356 9941,"Str. Vittorio Emanuele, 58",Melfi,,,,,,,,,,,
F.Lli Argentino S.R.L.,Idraulico,,0972 238044,"Via Araneo, 4",Melfi,,,,,,,,,,,
D'Errico Impianti,Idraulico,,388 616 8275,"cappella 4, Contrada Campo",Bisaccia,,,,,,,,,,,
Termoidraulica Curlo Michele,Idraulico,,080 634676,"Via Carlo Alberto, 35",Bitritto,,,,,,,,,,,
Simeone S.p.a.,Pianta di depurazione acque reflue,http://www.simeonespa.com/,0882 996260,"Piazza Principe Imperiale, 25",Poggio Imperiale,,info@simeonespa.com,http,React,No,Aruba S.p.A. Network,55,71,100.00,Sì,No
'La Stella Srl,Idraulico,http://www.lastellasrl.it/,080 632344,"56 Via Mauro Pontrelli, Sannicandro Di Bari, BA 70028",Sannicandro di Bari,,,http,WordPress,No,Aruba S.p.A. Network,63,98,67.00,Sì,No
Indipedente - San Marco la Catola,Benzinaio,,368 352 7260,Via Aldo Moro,San Marco La Catola,,,,,,,,,,,
Ites S.r.l. di Lasaracina,Cooperativa edilizia,http://www.itesimpianti.com/,347 729 8806,"Via Ponticello, n.03",Sannicandro di Bari,,info@itesimpianti.com,http,Joomla,No,Netsons s.r.l.,56,75,92.00,Sì,No
Tedeschi Srl,Idraulico,,080 473 2358,"Viale Giacomo Matteotti, 52",Mola di Bari,,,,,,,,,,,
Teknoterm Impianti,Ditta specializzata in impianti di condizionamento,https://www.teknotermimpianti.com/,328 736 3716,"Zona PIP lotto, 8",Sannicandro di Bari,,info@teknotermimpianti.com,https,WordPress,No,Seeweb srl,56,89,85.00,Sì,No
IDROTERMOVELOX,Ditta specializzata in impianti di riscaldamento,,328 532 3491,"Via John Fitzgerald Kennedy, 10",Sannicandro di Bari,,,,,,,,,,,
Ro.Mo.Va. S.A.S. Di Rondanini Gennaro,Idraulico,,080 214 6372,"Via Eugenio Montale, 16",Mola di Bari,,,,,,,,,,,
Idro Fire S.R.L. Sannicandro di Bari,Ditta specializzata in impianti di condizionamento,https://www.idrofire.it/?utm_source=google&utm_medium=wix_google_business_profile&utm_campaign=13181650891629361151,080 632535,"Via Nicola Sacchetti, 5",Sannicandro di Bari,,info@idrofire.it,https,Wix,No,Google LLC,63,91,100.00,Sì,No
Clima Di A. Deperte,Ditta specializzata in impianti di riscaldamento,,080 473 3529,"Via Giuseppe Garibaldi, 94",Mola di Bari,,,,,,,,,,,
EDISAL,Negozio di forniture idrauliche,,347 471 1583,Contrada Scannacinque lotto 20 - Z.I,Mola di Bari,,,,,,,,,,,
Buonsanto Giuseppe,Idraulico,,0881 618656,"Via de Viti de Marco, 51",Foggia,,,,,,,,,,,
Di Bari Giovanni,Idraulico,,080 537 4758,"Via Lombardia, 39",Modugno,,,,,,,,,,,
IdroRM Termoidraulica di Saverio MARZULLI,Idraulico,,338 914 1797,"Via Cosenza, 22",Modugno,,,,,,,,,,,
Centro Impianti Tecnologici Srl,Idraulico,,080 537 5511,"Via delle Ortensie, 10",Modugno,,,,,,,,,,,
Termoidraulica 3D & C. s.r.l.,Idraulico,,080 536 7020,"Viale dell'Artigianato II Traversa, 4",Modugno,,,,,,,,,,,
Termoidraulica 3d & C. S.R.L.,Idraulico,,080 532 4555,"Via Alexander Fleming, 16",Modugno,,,,,,,,,,,
Tedeschi Luigi,Idraulico,,080 476 2761,"Corso Giuseppe Garibaldi, 21",Rutigliano,,,,,,,,,,,
Carelli Tecno Solutions di Carelli Pasquale,Idraulico,,080 535 2447,"Via Kennedy, 17",Modugno,,,,,,,,,,,
Main Tech Srl,Idraulico,,080 531 5358,"Via delle Ortensie, 10",Modugno,,,,,,,,,,,
Losito impianti Idrici,Idraulico,,333 316 7641,Strada Provinciale Modugno-Bari,Modugno,,,,,,,,,,,
Termotec di D'Angelo Giovanni,Negozio di forniture idrauliche,,0882 475612,"Viale Vittorio Veneto, 151",San Nicandro Garganico,,,,,,,,,,,
Corriero Nicola,Idraulico,,080 532 0572,"Via Giuseppe Monaco, 13",Modugno,,,,,,,,,,,
Ditta Mulas Aldo & Figli Snc Impianti Ind. Aspirazione,Idraulico,,080 220 5901,"Via Santa Lucia, 9",Modugno,,,,,,,,,,,
Tecnoterm,Fornitore di impianti di riscaldamento,,080 335 2600,"Piazza Aldo Moro, 4/5",Molfetta,,,,,,,,,,,
Ma. Pi. Sistemi Energetici,Servizio di riparazioni idrauliche,,320 083 1317,"Via della Repubblica, 6",Molfetta,,,,,,,,,,,
I.e.s S.r.l,Idraulico,,080 536 7416,"Piazza Capitaneo, 24",Modugno,,,,,,,,,,,
Ricerca Perdite Brandi,Idraulico,http://www.ricercaperditebrandi.it/,328 875 8095,"Via Ada Cudazzo, 35",Lecce,,info@ricercaperditebrandi.it,http,Angular,Sì,Aruba S.p.A. Network,49,79,100.00,Sì,No
ITM Idrotermica,Negozio di forniture idrauliche,,080 338 7530,"Via Paolo Poli, 56",Molfetta,,,,,,,,,,,
Termoidraulica Spaspe di Altomare nicoló,Idraulico,,348 470 7882,"Vico 12° Madonna dei Martiri, 20",Molfetta,,,,,,,,,,,
Termoidraulica MA.DEC.,Ditta specializzata in impianti di riscaldamento,https://www.madecsnc.it/,392 887 6829,"Via Magenta, 12/14",Molfetta,,ma.dec.snc@gmail.com,https,React,Sì,OVH SAS,62,75,100.00,Sì,No
Idro Sistem Societa Srl Semplificata,Idraulico,,080 532 3496,"Piazza Giuseppe Garibaldi, 9",Modugno,,,,,,,,,,,
LA IDRICA - Impianti idrici e di riscaldamento - Molfetta,Ditta specializzata in impianti di condizionamento,http://www.laidrica.it/,080 334 0387,"Via Paolo Borsellino, 13",Molfetta,,info@laidrica.it,http,React,No,Netsons s.r.l.,68,82,83.00,Sì,No
Idrotermogas Di Giovanni Bufi,Idraulico,,080 338 1735,"C.so Vito Fornari, 105",Molfetta,,,,,,,,,,,
Idrotermosanitaria Lacedonia S.r.l.,Arredo bagno,,080 338 1190,"Via S. Francesco D'Assisi, 20",Molfetta,,,,,,,,,,,
S.I.Te Impianti Di De Ceglia Francesco & Mezzina D,Idraulico,,080 397 3522,"Via Tenente Mauro Marzocca, 43",Molfetta,,,,,,,,,,,
' Clima Service ' Di Marino Giuseppe & C. Snc,Idraulico,,080 338 2092,"Zona Industriale, Molfetta, BA 70056",Zona Artigianale E P.i.p.,,,,,,,,,,,
