Nome Attività,Categoria,Sito Web,Telefono,Indirizzo,Comune,Provincia,Email,Protocollo,Tecnologia,Cookie Banner,Hosting Provider,Mobile Performance,Desktop Performance,Punteggio SEO,Disponibilità Sito,Stato Manutenzione
IDROTERM di Mingiano Stefano (idrotermstore),Negozio di forniture idrauliche,https://www.idrotermstore.it/,0832 654056,"Via Caserta, 8",Lizzanello,,,https,Joomla,Sì,Hetzner Online GmbH,55,66,85.00,Sì,No
Energyca Termoforniture,Negozio di forniture idrauliche,,0832 263090,"Via S. Cesario, 90",Lequile,,,,,,,,,,,
ELLE ESSE IMPIANTI,Idraulico,,0832 631617,"Via G. Parini, 10",Lequile,,,,,,,,,,,
Sergimpianti. Di sergi Rocco,Installatore di impianti a gas,,328 822 5777,"Via Vecchia per Tricase, 13",Andrano,,,,,,,,,,,
R.F. IMPIANTI DI RIZZO FEDERICO,Fornitore di impianti di riscaldamento,,380 382 9166,"Via Calabria, 32",Lequile,,,,,,,,,,,
Giuseppe Tornese - impianti idrici termici gas antincendio,Idraulico,,0832 631000,"Piazzale Croce Rossa, 9",Lequile,,,,,,,,,,,
Luperto Giuliano Termoidraulica,Idraulico,,347 658 2171,"VIa Lazio, 40",San Cesario di Lecce,,,,,,,,,,,
Sorge Impianti srl,Ditta specializzata in impianti di riscaldamento,,0832 634037,"Via Guglielmo Marconi, nr. 92",Lequile,,,,,,,,,,,
Ditta Climatech Di Capone Marcello,Idraulico,,0832 634574,"13 Vicinale Tramacere Dragoni, Lequile, Le 73010",Lequile,,,,,,,,,,,
Castrí Impianti Di Castrí Claudio,Idraulico,https://www.castriimpianti.it/,320 687 5711,"Via Edmondo de Amicis, 5",Matino,,info@castriimpianti.it,https,WordPress,No,Hetzner Online GmbH,74,96,100.00,Sì,No
Santoro Termoidraulica,Fornitore di attrezzatura idraulica,,0832 654088,"Via Milano, 6",Lizzanello,,,,,,,,,,,
Global FCM,Negozio di forniture idrauliche,,328 975 7624,"Via gramsci, Via Giacomo Puccini, 6",Lizzanello,,,,,,,,,,,
I.t.i.s.,Idraulico,,0832 922836,"Via Lazio, 16",Leverano,,,,,,,,,,,
Tecknoimpianti di Grandioso Gianluca,Ditta specializzata in impianti di riscaldamento,,339 261 4574,"Via G.Giusti, 29",Leverano,,,,,,,,,,,
CGMIMPIANTI,Idraulico,,351 621 9918,"Via Bari, 9",Sternatia,,,,,,,,,,,
Foredil - Specchia,Ferramenta,,0833 535042,Strada Comunale Matine Prima,Specchia,,,,,,,,,,,
Luce E Calore-Piccola Soc. Cop. A Rl,Idraulico,,0836 427496,"Via A. De Ferraris, 48",Maglie,,,,,,,,,,,
Paladini Raffaele,Idraulico,,0832 606216,"Via Veglie, 19",Carmiano,,,,,,,,,,,
Piccinno Mario,Idraulico,,0836 551455,"Via XXIV Maggio, 43",Aradeo,,,,,,,,,,,
Clima Service Srl,Idraulico,,348 400 3601,"Via Ettore Pasanisi, 24",Ruffano,,,,,,,,,,,
Impianti Termoidrici Montanaro,Idraulico,,099 562 8587,"Via Vittorio Veneto, 24",Carosino,,,,,,,,,,,
Cr Termoidraulica Di Carichino Giovanni Roberto,Idraulico,,345 350 8202,"Via Savoia, 12",Matino,,,,,,,,,,,
Neon Toma Termoidraulica,Negozio di forniture idrauliche,http://www.neontoma.it/,0836 194 6462,"Via Nicola Ferramosca, 96",Maglie,,info@neontoma.it,http,WordPress,Sì,Aruba S.p.A.,70,96,85.00,Sì,No
PDD | Sistemi Idrotermici e Arredo Bagno,Negozio di forniture idrauliche,http://www.arredobagnopdd.com/,0836 427846,"Via Lecce, 56",Maglie,,info@pddmaglie.it,http,Angular,Sì,IP VDF,50,53,92.00,Sì,No
G.S.G. Impianti & Servizi di Cuscito Sonia,Ditta specializzata in impianti di condizionamento,https://www.gsgimpiantieservizi.com/,099 450 4431,"Via Paolo Borsellino, 5",Carosino,,gsg_2007@libero.it,https,WordPress,Sì,Aruba S.p.A. Network,65,76,92.00,Sì,No
PM Arredobagni di Matichecchia Ivana,Arredo bagno,,328 920 6376,"Via N. Sauro, n° 16",Carosino,,,,,,,,,,,
Vitali Antonio,Idraulico,,0833 503286,"Via Garibaldi, 215",Matino,,,,,,,,,,,
Rihabitat Srl,Arredo bagno,https://www.rihabitat.it/wpnewsite/,0833 606585,Via Maestri del Lavoro,Zona Industriale,,,https,WordPress,Non trovato,Aruba S.p.A. Network,85,94,83.00,No - Pagina Non Trovata (404),No
Conte Impianti Srl,Idraulico,,0833 594283,"Via Provinciale Matino, 31",Parabita,,,,,,,,,,,
Acquater di Lucia Centonze,Ditta specializzata nella realizzazione di sistemi di irrigazione per prato,,0832 787320,"Via Campi, 92",Squinzano,,,,,,,,,,,
Eco Fire Di Moreno Avventuroso,Idraulico,,0832 072701,"Via Campi, 1",Squinzano,,,,,,,,,,,
Fano Luigi,Idraulico,,0832 785308,"Via Brindisi, 195",Squinzano,,,,,,,,,,,
C.r.e.i. S.r.l.,Negozio di forniture idrauliche,,099 844 2062,"Via S. Francesco, 125",Castellaneta,,,,,,,,,,,
Edilclima snc,Servizi di ristrutturazione,,320 457 4547,Via Alessandro Fleming,Castellaneta,,,,,,,,,,,
Di Liddo Gaetano,Idraulico,,099 844 1488,"Via Alessandro Fleming, 37",Castellaneta,,,,,,,,,,,
Olivares s.r.l.s.,Impresa di costruzioni,http://www.olivarescostruzioni.it/,346 374 5861,"Via Luciano Manara, 5",Matino,,olivarescostruzioni@hotmail.it,http,WordPress,Sì,Aruba S.p.A. Network,53,55,92.00,Sì,No
TERMOIDRAULICA DI MIGLIETTA LUCIO,Negozio di forniture idrauliche,https://www.termoidraulicamiglietta.it/commerce/it/,347 624 5980,"Via Raffaello Sanzio, 65B",Squinzano,,info@termoidraulicamiglietta.it,https,React,No,Aruba S.p.A.,69,77,100.00,Sì,No
Edilclima Impianti Di Ferro Andrea,Idraulico,,0833 186 2217,"Via Addis Abeba, 4",Taurisano,,,,,,,,,,,
Idrosolar Di Rosafio Gianfranco,Idraulico,,333 443 8555,"Corso Umberto I, 152",Taurisano,,,,,,,,,,,
GEG Srl,Ditta specializzata in impianti di riscaldamento,http://www.gegenergia.com/,0833 692883,"Strada Provinciale 362, 330-356",Ruffano,,,http,Joomla,No,SEEWEB s.r.l.,72,81,100.00,Sì,No
Ve. Ma. Te. Sa.,Fornitore di impianti di riscaldamento,,0833 624108,"Via Casarano, 38",Taurisano,,,,,,,,,,,
Puglia Clima & C. Snc,Appaltatore,,099 844 2562,"Via Vecchia Stazione, B/3",Castellaneta,,,,,,,,,,,
Clark,Negozio di forniture idrauliche,http://www.clarksrl.it/,0833 593059,"Lotto, Via dei Commercianti, 22/23, 16/17, Snc",Zona P.i.p.,,info@clarksrl.it,http,WordPress,No,Host SpA,53,56,85.00,Sì,No
R.g. Termoimpianti Di Russo Antonio,Idraulico,,0833 593123,"Via Impero, 71",Parabita,,,,,,,,,,,
Hydro-Cos. Srl,Impresa di costruzioni,http://www.hydrocos.com/,099 849 3855,Strada Statale 7 km 611,Castellaneta,,info@hydrocos.com,http,WordPress,No,Aruba S.p.A.,38,64,100.00,Sì,No
Catalano S.R.L.,Idraulico,,0832 205905,"Via Sardegna, 6",San Cesario di Lecce,,,,,,,,,,,
"Mf Mazzotta Srl - Sanitari, Rubinetteria, Climatizzatori, Pannelli Solari, Caldaie, Stufe a Pellet e Materiale Idrauliche",Negozio di elettrodomestici,,0836 667449,"Via Armando Diaz, 50",Soleto,,,,,,,,,,,
AD MARINE SERVICE di Davide Mele,Idraulico,,349 196 4124,"Via Sogliano, 160",Soleto,,,,,,,,,,,
Bg Impianti Di Guido Benigno,Idraulico,,0833 623552,"Via A. de Pace, 22",Taurisano,,,,,,,,,,,
De Marco Rocco Mario Impianti,Elettricista,,338 601 8398,Via S. M. di Leuca,Taurisano,,,,,,,,,,,
Effevi - Manuntenzione Impianti Termoidraulici,Idraulico,,340 777 8170,"Via Generale, Piazza Carlo Alberto Dalla Chiesa, 52",Surbo,,,,,,,,,,,
Carlino Giovanni,Idraulico,,0832 362626,"Via Volturno, 53",Surbo,,,,,,,,,,,
Ripetta Diego,Ditta specializzata nella trivellazione di pozzi,http://ripettaimpianti.it/,345 427 5550,Via Vecchia Carmiano,Arnesano,,,http,ASP.NET,No,Aruba S.p.A,57,94,91.00,Sì,No
Caretto Giovanni,Idraulico,,0832 363660,"Via Botero, 6",Surbo,,,,,,,,,,,
Marengo Snc,Negozio di articoli per il giardinaggio,,0832 363415,"Via Vincenzo Bellini, 62",Surbo,,,,,,,,,,,
G&P.Rappresentanze sas di Angelo Promutico,Agente di commercio,,347 316 3696,"Via G. Mameli, 33",Surbo,,,,,,,,,,,
Calema | Pompe di Calore Fotovoltaico Infissi,Idraulico,http://www.calemacasa.it/,0832 181 6081,"Via Giovanni Boccaccio, 2",Arnesano,,info@calemacasa.it,http,React,No,Server Plan S.r.l.,59,91,100.00,Sì,No
Carlà Lab Srl,Impianto solare fotovoltaico,http://www.carlalab.it/,0832 177 8264,"Via Olanda, 6",Zona Industriale,,info@carlalab.it,http,Basekit,No,Aruba S.p.A.,52,65,92.00,Sì,No
Termo Teknick Di Giorgio Portone,Idraulico,,339 321 5577,"Via Ignazio Silone, 1",Ruffano,,,,,,,,,,,
IA.ING s.r.l.,Ingegnere ambientale,https://www.iaing.it/,0832 242193,"Viale Marcello Chiatante, 60",Zona Industriale,,info@iaing.it,https,WordPress,No,Aruba S.p.A,45,87,85.00,Sì,No
Ferredil,Negozio di forniture elettriche,,0832 733273,"Via Stazione, 14",Salice Salentino,,,,,,,,,,,
Energy Clima,Fornitore di attrezzatura idraulica,,389 207 8080,"Via Senatore De Castris, 102",Salice Salentino,,,,,,,,,,,
La Nuova Idrotermotech,Idraulico,,349 125 2422,"Via Cavalieri di Vittorio Veneto, 12",Salice Salentino,,,,,,,,,,,
C.s. Tecnoservice Soc. Coop.,Idraulico,,380 474 4441,"Via Umberto I, 14",Salice Salentino,,,,,,,,,,,
Perrone Antonio,Ditta specializzata in impianti di riscaldamento,,347 176 7454,"Via Galileo Galilei, 4",San Donaci,,,,,,,,,,,
C.A.I.M di Bianco Melcarne Giovanni,Negozio di ceramiche,,0832 361312,"Via L. Trabucco, 92",Surbo,,,,,,,,,,,
Apruzzese Domenico,Idraulico,,0831 842831,"Via Immacolata, 13",Francavilla Fontana,,,,,,,,,,,
Co.m.ed. S.r.l.,Negozio di materiali da costruzione,,389 655 8619,"SP28, 125",Francavilla Fontana,,,,,,,,,,,
Itea s.a.s.,Negozio di forniture idrauliche,http://www.iteashop.it/,0833 622317,"Via Cicerone, 42",Taurisano,,,http,PrestaShop,Sì,Host SpA,53,45,83.00,Sì,No
Negozio ferramenta & idraulica,Ferramenta,,347 008 6088,"Via G. Marconi, 85",Salve,,,,,,,,,,,
Gran Bazar - Ferramenta Edilizia Colorificio Idraulica Bombole GPL,Ferramenta,https://www.granbazarferramenta.it/,388 241 1302,"Via per Brindisi, km. 1",Francavilla Fontana,,granbazarsrl73@libero.it,https,ASP.NET,No,Aruba S.p.A,56,73,91.00,Sì,No
Fontana Ascensori,Installazione e manutenzione ascensori,https://www.fontanascensori.it/,320 214 0079,"Via S. Francesco, 56",Francavilla Fontana,,fontanascensori@libero.it,https,ASP.NET,No,Aruba S.p.A,62,97,91.00,Sì,No
Idroelectrik S.M. - Impianti elettrici ed idraulici,Idraulico,http://www.idroelectrik.it/,328 849 3537,"Via Piave, 112",Fasano,,idroeletrik@gmail.com,http,React,Sì,OVH SAS,64,97,85.00,Sì,No
H2O FIRE,Idraulico,,320 827 5013,Via dell'Energia,Fasano,,,,,,,,,,,
GEA materiali per vivere,Arredo bagno,https://geasrl.com/,0831 841890,"Via Ceglie, km 0,800",Francavilla Fontana,,,https,WordPress,No,Server Plan S.r.l.,53,77,85.00,Sì,No
Sportillo Srl,Fornitore di materiali da costruzione,,0831 812198,Via Oria Km 0.800,Francavilla Fontana,,,,,,,,,,,
Ferramenta Loprete,Ferramenta,,080 809 4968,"II' Traversa dell' Industria, 15",Fasano,,,,,,,,,,,
Novimpianti - Installazione di impianti civili e industriali,Ditta specializzata in impianti di condizionamento,https://www.novimpianti.it/,0831 842630,Zona Industriale Di Francavilla Fontana,Francavilla Fontana,,info@novimpianti.it,https,Shopify,Sì,Serverplan s.r.l.,56,62,85.00,Sì,No
Forniture termoidrauliche Cannone,Negozio di forniture idrauliche,,080 441 4473,"Via Passiatore, 153",Fasano,,,,,,,,,,,
Ungaro Impianti Idrici & Termici di Domenico Ungaro,Idraulico,,379 256 0025,"Via Rodolfo Tanzarella, 4",Ostuni,,,,,,,,,,,
EdilTermoIdraulica,Fornitore di attrezzature per l'edilizia,https://www.ediltermoidraulica.com/,080 433 1262,"Viale del Bosco, 36",Selva di Fasano,,info@editermoidraulica.com,https,React,Sì,Host SpA,57,78,85.00,Sì,No
Idrotermica Mesagnese Di Lonoce Luigi & C. Snc,Idraulico,,0831 092661,"Piazza IV Novembre, 27",Mesagne,,,,,,,,,,,
Sinergreen Srl,Servizi di ristrutturazione,http://www.sinergreensrl.it/,080 441 3785,"Traversa di Via de Deo, 74",Fasano,,,http,ASP.NET,No,Aruba S.p.A. Network,65,96,91.00,Sì,No
L.M. Impianti Di Laera Mario,Idraulico,,329 961 2015,Via Capitan Pietro,Mesagne,,,,,,,,,,,
Cer.Mar.,Negozio di forniture idrauliche,,327 822 3355,"Via Brindisi, 117",Mesagne,,,,,,,,,,,
Idroklimatech - Stufe e camini,Ditta specializzata in impianti di riscaldamento,http://www.idroklimatech.it/,080 439 3036,"Via G. Colucci, 5",Fasano,,idroklimatechfasano@libero.it,http,React,Sì,SEEWEB s.r.l.,57,75,92.00,Sì,No
New South Europe Impianti - Laguardiaimpianti,Elettricista,http://www.laguardiaimpianti.it/,080 442 6736,Via Valletta,Fasano,,,http,WordPress,No,Netsons s.r.l.,83,90,83.00,Sì,No
Umberto Cupertino Srl,Idraulico,,080 441 4674,"Via de Deo, 63",Fasano,,,,,,,,,,,
Energy Gas Service Srl,Idraulico,,0831 772812,"Piazza Giuseppe Garibaldi, 30",Mesagne,,,,,,,,,,,
Ferrettitermotecnica Oria (BR),Fornitore di impianti di riscaldamento,,0831 170 6478,"Via Francavilla, 54",Oria,,,,,,,,,,,
Technoacque,Impianto chimico,https://www.technoacque.com/,080 439 1140,"Contrada Sant'Angelo, 1",Fasano,,info@technoacquesrl.it,https,WordPress,Sì,Server Plan S.r.l.,69,99,92.00,Sì,No
Ferretti Impianti,Fornitore di energia pulita,,347 434 8352,"Via F, Via Francavilla Ciriaco, 11",Oria,,,,,,,,,,,
Ditta Massimo Calò Commercio Materiale Edile,Fornitore di attrezzature per l'edilizia,,330 745 129,Contrada Santoro snc,Oria,,,,,,,,,,,
DE.COST. - GRUPPO DESTRADIS,Impresa di costruzioni,,0831 369190,"Via Mario Pagano, 56",Oria,,,,,,,,,,,
Idro Edil Multiservizi S.R.L.,Ditta specializzata in impianti di condizionamento,http://www.idroedilmultiservizi.com/,0831 198 5573,"Via Brindisi, 123",Mesagne,,amministrazione@idroedilmultiservizi.com,http,ASP.NET,Sì,Server Plan S.r.l.,50,90,75.00,Sì,No
Italclima Srl,Idraulico,,0831 302746,"Via Eugenio Trinchera, 7",Ostuni,,,,,,,,,,,
L'Idraulica,Ditta specializzata in impianti di condizionamento,http://lidraulica.com/,080 441 4691,"19, Via Morchiaturo, 17",Fasano,,,http,WordPress,No,Aruba S.p.A. Network,56,73,92.00,Sì,No
De Giorgi Global Service S.r.l.,Ristrutturatore di bagni,https://www.degiorgiglobalservice.com/lazienda,0832 200398,Via Sicilia,San Cesario di Lecce,,info@degiorgiglobalservice.it,https,React,No,"Amazon.com, Inc.",60,99,83.00,Sì,No
Puglimpianti Energia srl,Fornitore di impianti industriali,https://www.puglimpiantienergia.it/,080 442 7861,"Via dell'Industria, 84/A",Fasano,,pugenergia@libero.it,https,WordPress,No,Aruba S.p.A.,54,57,92.00,Sì,No
Fratelli Proto,Negozio di materiali da costruzione,,0831 301785,"Via Custoza, 36",Ostuni,,,,,,,,,,,
GE Impiantistica di Epifani Giuseppe,Idraulico,,338 881 6267,"Via Ferrara, 3",Ostuni,,,,,,,,,,,
Nuova Idrotecnica,Idraulico,,328 820 3934,"Via Eugenio Trinchera, 36",Ostuni,,,,,,,,,,,
Maldarella Vittorio Climatizzazione E Idrotermica,Idraulico,,0831 339680,"Via Don Luigi Sturzo, 82",Ostuni,,,,,,,,,,,
Tecnoclima S.R.L.,Idraulico,,0831 301304,"Via degli Emigranti, 37",Ostuni,,,,,,,,,,,
Idrotermica 2000 Di Melpignano G. & Caroli C. Snc,Idraulico,,0831 304367,"Via Nino Sansone, 66",Ostuni,,,,,,,,,,,
Savi Vincenzo Santoro,Idraulico,,0831 198 2747,"Via Antonio Specchia, 49",Ostuni,,,,,,,,,,,
Altavilla Caminetti e Stufe Oria,Negozio,http://www.altavillaoria.it/,320 499 9868,"Via Camillo Benso Conte di Cavour, 22",Oria,,,http,WordPress,Sì,Aruba S.p.A. Network,56,74,92.00,Sì,No
Iaia Pietro Antonio,Idraulico,,0831 304717,"Via Francesco de Sanctis, 19",Ostuni,,,,,,,,,,,
Ecoterm S.R.L.,Idraulico,,0831 304561,"Via Stazione, 57",Ostuni,,,,,,,,,,,
Caputo Impianti S.A.S. Di Caputo Carmine & C.,Idraulico,,333 458 8324,"Strada Provinciale Copertino, San Donato Di Lecce, Le 73010",San Donato di Lecce,,,,,,,,,,,
Toma Antonio,Idraulico,,0833 595698,"Via Milano, 36",Parabita,,,,,,,,,,,
DITTA ANTONIO LEOPIZZI TERMOIDRAULICO,Idraulico,,349 385 4453,"Via Ferrara, 43/A",Parabita,,,,,,,,,,,
Euroimpianti Srl,Idraulico,,0833 509925,Zona Industriale - Lotto 39,Parabita,,,,,,,,,,,
Palumbo Ivan,Idraulico,,320 889 5776,"Via Collina, 263",Sannicola,,,,,,,,,,,
Pellico Luigi Impianti Di Condizionamento E Riscaldamento,Idraulico,,348 081 5538,"Via Grazia Deledda, 5",Parabita,,,,,,,,,,,
Ponzetta Lorenzo,Fornitore di materiali da costruzione,,0833 594267,"Via Vittorio Emanuele II, 57",Parabita,,,,,,,,,,,
TERMOIDRAULICA M&A,Negozio,,348 545 4381,"Via Giuseppe Grassi, 95",Sannicola,,,,,,,,,,,
Termoidraulica Vasco Di Vigna Antonio,Negozio,http://www.termoidraulicavasco.com/,0833 232331,Via S. Simone,Sannicola,,,http,React,No,Server Plan S.r.l.,56,92,75.00,Sì,No
Clima Multi System - idraulico/elettricista,Idraulico,https://www.climamultisystem.it/,0831 303464,"Via dei Calzolai, 65",Ostuni,,info@climamultisystem.it,https,Joomla,No,Aruba S.p.A. Network,61,97,85.00,Sì,No
Grasso Vincenzo,Idraulico,,0833 593932,"Via Zona PIP Lotto 38, Parabita, Le 73052",Zona P.i.p.,,,,,,,,,,,
IMP.DE PANDIS ANTONIO,Idraulico,,339 271 0544,"V. Mentana, 54",Merine,,,,,,,,,,,
Idrotermica Salentina Due Srl,Idraulico,,0836 554691,"9 Via Pablo Neruda, Aradeo, Le 73040",Aradeo,,,,,,,,,,,
Guglielmo Costruzioni (S.R.L.),Impresa di costruzioni,,0836 318023,"Via Antonio Gramsci, 4",Cannole,,,,,,,,,,,
Chisena (S.R.L.),Ditta specializzata nella realizzazione di sistemi di irrigazione per prato,http://www.mondoirrigazione.net/,0831 777444,"Via Antonio Murri, 1/A",Mesagne,,ordini@centroirrigazione.it,http,React,Sì,Host SpA,10,23,83.00,Sì,No
ACG Di Poci Cosimo E C. S.n.c.,Idraulico,,0831 773075,"Via Tenente Roberto Antonucci, 78",Mesagne,,,,,,,,,,,
Carrozzo Impianti Di Marco Carrozzo,Idraulico,,328 765 6804,"Via S. Nicola, 32",Melendugno,,,,,,,,,,,
D.S.I. Impianti Srl,Elettricista,,0836 571536,"Via Persia, 74",Martano,,,,,,,,,,,
C.A. Impianti Tecnologici Srl,Elettricista,,0836 318978,"Via Alcide De Gasperi, 51",Cannole,,,,,,,,,,,
'Pulli Silvia' di Colonna Andrea,Fornitore di impianti di riscaldamento,http://www.pullisilvia.it/,0832 183 1343,"Via Pietragrossa, 2",Carmiano,,info@pullisilvia.it,http,PrestaShop,Sì,Host SpA,71,64,83.00,Sì,No
Impresa Alessandro Dell’Anna,Idraulico,,388 897 8213,"Via della Pace, 5",Lecce,,,,,,,,,,,
L'idraulica di Scorrano Luigi,Idraulico,,339 684 5788,"Via Adda, 7",Casarano,,,,,,,,,,,
Trane Giuseppe Snc di Trane Domenico & C.,Ferramenta,,0836 465108,"Via Gabriele D'Annunzio, 151",Scorrano,,,,,,,,,,,
Sm Impianti,Ditta specializzata in impianti di riscaldamento,,339 346 5115,"Via Leonardo Da Vinci, 38",Scorrano,,,,,,,,,,,
Negro Service - Punto Edison Maglie (LE),Azienda fornitrice di energia elettrica,https://www.negrogiancarlo.it/,0836 485883,"Via Scorrano, 5",Maglie,,info@negrogiancarlo.it,https,Laravel,No,Amazon Technologies Inc.,71,94,92.00,Sì,No
Secli' Fabio,Negozio di elettrodomestici,,0832 343635,"Via Luigi Corvaglia, 20",Lecce,,,,,,,,,,,
La Gidue Impianti,Ditta specializzata in impianti di condizionamento,http://www.lagidueimpianti.it/,368 715 7644,"Via Fontana, 67",Aradeo,,,http,WordPress,No,Server Plan S.r.l.,69,72,92.00,Sì,No
Secli' Srl,Negozio di elettrodomestici,,329 657 2100,Negozio Via Provinciale Matino 54 Deposito G.P.L Via provinciale parabita alezio,Parabita,,,,,,,,,,,
Spazzacamino Salento di Aluisi Nicola Antonio,Spazzacamino,,351 334 4006,"Via Isonzo, 65",Aradeo,,,,,,,,,,,
Ferramenta PRESICCE - PRO FISHING SCORRANO,Ferramenta,http://www.presiccestore.com/,331 260 3427,Via Tito Schipa,Scorrano,,,http,Shopify,No,Server Plan S.r.l.,48,56,83.00,Sì,No
Coluccia1964: Ferroli PREMIUM & Lamborghini Caloreclima - ASSISTENZA TECNICA AUTORIZZATA,Ditta specializzata in impianti di riscaldamento,https://www.coluccia1964.it/,0836 552585,"Via Salvatore Quasimodo, 3",Aradeo,,info@coluccia1964.it,https,Joomla,Sì,Serverplan S.r.l.,43,48,85.00,Sì,No
S.E.Edilizia e Termoidraulica S.r.l.,Impresa edile,http://seediliziaetermoidraulica.it/,320 534 9074,"Contrada Macchia, snc",Cutrofiano,,santoroemanuele443@gmail.com,http,WordPress,Sì,TransIP BV,51,85,85.00,Sì,No
Gem di Greco Enrico Martino,Servizi di ristrutturazione,,339 378 2163,"Via della Costituzione, 17",Seclì,,,,,,,,,,,
IDRALITE (Fapal s.r.l.),Arredo bagno,http://www.idralite.it/,0833 185 5602,"SP50 (Aradeo-Sannicola) KM 1.2, SNC",Seclì,,,http,WordPress,No,"Cloudflare, Inc.",45,83,85.00,Sì,No
GEP di Elia Emanuele,Idraulico,,335 183 8116,"Largo Sant'Antonio, 22",Melendugno,,,,,,,,,,,
Piscopo Egidio,Idraulico,,0836 452426,"Via Vittorio Emanuele III, 47",Cutrofiano,,,,,,,,,,,
Ceramiche e Idraulica Russo,Arredo bagno,,0836 544388,"Viale Italia, 1",Sogliano Cavour,,,,,,,,,,,
Procomfort Di Russo Antonio Fernando,Idraulico,,0836 543335,"Via Cutrofiano, 65",Sogliano Cavour,,,,,,,,,,,
Idro Term Clima Di Alemanni Enrico,Idraulico,,338 754 4016,"Via Chiusa, 115 A",Cutrofiano,,,,,,,,,,,
Caputo Rocco Impianti Idrotermici,Fornitore di impianti di riscaldamento,,0833 587627,"Via Felline, 130",Melissano,,,,,,,,,,,
Rsa don tonino bello 3,Assistenza agli anziani,http://rsamiggiano.com/,0833 761670,"Via A.Manzoni, n.107",Miggiano,,dontoninobello3.miggiano@gmail.com,http,Joomla,Sì,Netsons s.r.l.,51,64,92.00,Sì,No
Giuri Franco,Idraulico,,0836 554549,"Via P. Mascagni, 47",Aradeo,,,,,,,,,,,
C.M. Forniture Srl - Forniture Termoidrauliche,Negozio di radiatori,,0836 818392,"Via Podgora, 19/21",Minervino di Lecce,,,,,,,,,,,
Greco Vincenzo,Idraulico,,099 612243,"Via Vittorio Alfieri, 16",Crispiano,,,,,,,,,,,
La Termotecnica,Negozio di bricolage,,099 616209,"Via Gabriele d'Annunzio, 62",Crispiano,,,,,,,,,,,
F.Lli Vitantonio E Sebastiano Giuliani S.N.C.,Fornitore di materiali da costruzione,,099 616169,"Via F. Baracca, 8",Crispiano,,,,,,,,,,,
Hi-Tech Innovation,Negozio di elettronica,http://hitechinnovation.catonline.it/,0833 761992,"Via Specchia, 14",Miggiano,,mail@andreavettori.com,http,Angular,No,Telecom Italia S.p.A.,71,90,42.00,Sì,No
Edil Comm s. r. l.,Fornitore di materiali da costruzione,,099 811 0031,Via montemerlo s.n.c,Crispiano,,,,,,,,,,,
A.P. Impianti Srl,Fornitore di impianti industriali,,099 964 6371,"Via Tevere, 6",Crispiano,,,,,,,,,,,
Angelini srl,Ditta specializzata in impianti di riscaldamento,,327 215 2275,"Corso Umberto I, 189",Crispiano,,,,,,,,,,,
Bruno Impianti,Installatore di impianti di condizionamento,,328 748 2803,"Via 14 Novembre, 7",Crispiano,,,,,,,,,,,
Ferramenta Todaro,Ferramenta,,099 956 1815,"Via G. Leopardi, 2",Fragagnano,,,,,,,,,,,
Lonoce Cosimo,Idraulico,,099 957 4223,"Via Papa Giovanni XXIII, 1",San Marzano di San Giuseppe,,,,,,,,,,,
Gruppo Vincenti SRL,Fornitore di attrezzature per l'energia solare,http://www.gruppovincenti.it/,0836 543257,"Via dei Cavamonti, 10",Cutrofiano,,,http,WordPress,No,Aruba S.p.A.,73,95,85.00,Sì,No
Itat S.r.l.,Idraulico,,099 533 9611,"Via Chiesa, 6",Pulsano,,,,,,,,,,,
Hidra Impianti Srl,Idraulico,,099 531 6514,"Via Dante Alighieri, 14",Leporano,,,,,,,,,,,
Arcuri Impianti,Idraulico,,335 538 6650,"Via Giacomo Matteotti, 2/3",Pulsano,,,,,,,,,,,
IMPIANTILECCEPIETRO,Ditta specializzata in impianti di condizionamento,,099 955 2103,"Via Piersanti Mattarella, 16",Lizzano,,,,,,,,,,,
Forim,Idraulico,https://www.forim.it/,099 613224,"Corso Umberto I, 235",Crispiano,,info@forim.it,https,WordPress,Sì,Aruba S.p.A. Network,37,53,85.00,Sì,No
D'Amico Pietro,Idraulico,,099 611091,"Via Cordiglia, Crispiano, TA 74012",Crispiano,,,,,,,,,,,
Edil LUX Tamburrano,Fornitore di materiali da costruzione,,099 821 5169,"S.S. 580 km. 9,6",Ginosa,,,,,,,,,,,
Ml Termoidraulica Srl,Idraulico,,099 533 0190,"Via Dante Alighieri, 8",Pulsano,,,,,,,,,,,
D.G. System Snc di Di Giacomo Gabriele & C.,Fornitore di finestre,http://www.dgsystemsnc.it/,099 956 1965,Z.I. lotti 13/14,Fragagnano,,,http,ASP.NET,No,Aruba S.p.A,73,97,91.00,Sì,No
De Stefani Giovanni,Idraulico,,099 827 1060,Viale Italia,Ginosa,,,,,,,,,,,
Assistenza Caldaie A Gas Di Cosimo Martano,Ditta specializzata in impianti di riscaldamento,,099 563 9229,"Via Sicilia, 102/a",Grottaglie,,,,,,,,,,,
Franco Fernando,Idraulico,,099 974 6725,"Via Ponza, 4",Sava,,,,,,,,,,,
Drago S.r.l.,Negozio di forniture idrauliche,https://www.dragosrl.net/it/content/4-chi-siamo,099 590 0149,"SS. Appia - Contrada Baronia, Zona Industriale",San Giorgio Ionico,,info@dragosrl.net,https,Joomla,Sì,Server Plan S.r.l.,59,73,92.00,Sì,No
Chirico Francesco - Impianti elettrici - TermoIdrici - Gas - Solare Termico - EcoBonus - Sconto in Fattura,Fornitore di impianti industriali,,340 365 7649,"Via O. Flacco, sn",Grottaglie,,,,,,,,,,,
Clima Comfort di Madama Andrea,Ditta specializzata in impianti di riscaldamento,,099 591 9666,"Via Vittorio Alfieri, 19",Grottaglie,,,,,,,,,,,
Mancarella Pietro,Idraulico,http://www.mancarellaserviziecologici.com/,099 533 0743,"Via Toma, 135",Pulsano,,info@mancarellaserviziecologici.com,http,Joomla,Sì,Aruba S.p.A.,54,51,92.00,Sì,No
C.E.F.F. Impianti di Francesco Quaranta,Elettricista,,328 472 4214,"Via XXV Aprile, 31",Grottaglie,,,,,,,,,,,
Termoidrica,Idraulico,,080 556 1121,"Via Giovanni Laterza, 9",Bari,,,,,,,,,,,
Laterza Autogru Snc di Laterza Margherita,Idraulico,,0922 970243,"28, Contrada Imbriacola, Lampedusa, AG 92010",Lampedusa e Linosa,,,,,,,,,,,
CLIMA SERVICE di Loforese Vito,Installatore di impianti di condizionamento,,328 012 5804,"Via Matera, 71",Laterza,,,,,,,,,,,
Tecnoimpianti,Idraulico,https://tecnoimpiantiginosa.it/,347 658 2034,"Via Curtatone, 37",Ginosa,,,https,Shopify,No,"InMotion Hosting, Inc",46,47,85.00,Sì,No
Climatec Srl Assistenza Caldaie,Ditta specializzata in impianti di riscaldamento,https://www.climatec.info/,351 887 1379,"Corso Umberto I, 280",Crispiano,,amministrazione@climatec.info,https,React,No,Netsons Network,35,39,92.00,Sì,No
Electroedil di GIulio russo,Elettricista,,327 825 7684,"Via O. Flacco, n1",Lizzano,,,,,,,,,,,
Termoidrica Di Loforese Francesco,Idraulico,,347 711 9398,"Via Aborigeni, 67",Laterza,,,,,,,,,,,
Dell'Orco S.r.l.,Impresa di costruzioni,http://www.dellorcosrl.it/,339 874 1835,Via Giovanni Papini,Laterza,,,http,Joomla,No,Netsons s.r.l.,35,38,85.00,Sì,No
Barberio Vito,Idraulico,http://www.barberiovito.com/,339 395 2224,"Via Monte Grappa, 16",Ginosa,,info@barberiovito.com,http,ASP.NET,No,Aruba S.p.A. Network,69,78,100.00,Sì,No
IMET IMPIANTI E SERVICE DI RIBECCO,Idraulico,,338 787 3749,"Via Lucania, 96",Ginosa,,,,,,,,,,,
Fratelli Laterza,Arredo bagno,https://www.fratellilaterza.com/,099 880 6141,"Via Orto Della Corte, 7/9",Massafra,,shop@fratellilaterza.com,https,React,Sì,Server Plan S.r.l.,56,64,92.00,Sì,No
Termotecnica Di Bitella Nicolangelo,Ditta specializzata in impianti di riscaldamento,http://www.termotecnicabitella.it/,099 829 1212,"Via Giusti, 9",Ginosa,,termotecnicabitella@gmail.com,http,Shopify,Sì,OVH SAS,56,89,85.00,Sì,No
