Nome Attività,Categoria,Sito Web,Telefono,Indirizzo,Comune,Provincia,Email,Protocollo,Tecnologia,Cookie Banner,Hosting Provider,Mobile Performance,Desktop Performance,Punteggio SEO,Disponibilità Sito,Stato Manutenzione
Generali Impianti,Elettricista,,0883 622798,"Via Ruggiero R. Grieco, 48",San Ferdinando di Puglia,,,,,,,,,,,
Dragonetti Massimo,Elettricista,,0882 551699,"Via Giacomo Leopardi, 4",San Paolo di Civitate,,,,,,,,,,,
Arredamenti Locurcio,Negozio di mobili,http://www.locurcioarredamenti.com/,0881 984939,"Contrada Liscia, snc",Sant'Agata di Puglia,,,http,WordPress,No,Aruba S.p.A.,74,95,92.00,Sì,No
SPORT IMPIANTI - Costruzione Impianti Sportivi,Impresa di costruzioni,https://www.sportimpiantigicoma.it/,320 309 6400,"SP41, 168",San Nicandro Garganico,,commerciale@sportimpiantigicoma.it,https,Svelte,No,DIGITALOCEAN,52,65,92.00,Sì,No
Gdcimpianti,Elettricista,,392 140 7790,Corso Amedeo D'Aosta,San Severo,,,,,,,,,,,
Impianti Elettrici Scanzano Ciro,Fornitore di impianti di riscaldamento,,328 678 2167,"Via Carlo Goldoni, 11",San Nicandro Garganico,,,,,,,,,,,
Nardella Impianti Elettrici,Elettricista,,349 529 7987,"Via Celenza, 56",San Severo,,,,,,,,,,,
ELETTRO FORNITURE PENNACCHIA GIUSEPPE,Negozio di forniture elettriche,,0882 371096,"Corso Leone Mucci, 49A",San Severo,,,,,,,,,,,
S.C.Elettrocenter,Negozio di forniture elettriche,,0882 600547,"Via Marconi, 60",San Severo,,,,,,,,,,,
Elettrotech,Elettricista,http://www.elettrotechfg.it/,345 095 3344,"Via Simone Moffa, 50",San Severo,,info@elettrotechfg.it,http,Joomla,No,Aruba S.p.A. Network,57,87,92.00,Sì,No
Elettronic Store,Negozio di elettronica,https://www.elettronicstoreweb.it/,347 837 9373,"Via S. Francesco D'Assisi, 32",San Nicandro Garganico,,,https,React,Sì,Hetzner Online GmbH,40,54,85.00,Sì,No
D.l.g. S.a.s. Di De Lorenzo Giuseppe Antonio E C.,Elettricista,,0882 441936,"Via San Matteo, 28",San Severo,,,,,,,,,,,
Elettricista: Elettronica Impianti di Troia Cesario,Elettricista,,330 786 774,"Via Scevola Muzio, 28",Andria,,,,,,,,,,,
Ferrante Elettrodomestici,Negozio di elettronica,,0884 993621,"Via G. di Vagno, 9",Vico del Gargano,,,,,,,,,,,
Spazio Enel Partner Vico del Gargano,Azienda fornitrice di energia elettrica,,0884 994903,"Via del Risorgimento, 15",Vico del Gargano,,,,,,,,,,,
Tecnotherm Impianti • Gargano,Idraulico,,350 073 5493,Via Europa,Vico del Gargano,,,,,,,,,,,
Staffieri Elettronica Di Staffieri Fabio,Negozio,,0884 991784,"Via Palmiro Togliatti, 10",Vico del Gargano,,,,,,,,,,,
A.T.I.S. Srl,Fornitore di sistemi di sicurezza,https://www.atisimpianti.net/,0882 225316,"Via Don Minzoni, 70/D",San Severo,,,https,WordPress,No,OVH ISP,93,96,83.00,Sì,No
Impresa Edile Foggia Sicuro Costruzioni Srl,Impresa di costruzioni,,333 135 8948,"Via Milazzo, 3",Torremaggiore,,,,,,,,,,,
Del. Ve Impianti di Della Vella Leonardo | Idraulico Vico del Gargano,Idraulico,,349 076 6076,"Via Alcide de Gasperi, 17",Vico del Gargano,,,,,,,,,,,
G.&G. Service Srl,Ditta specializzata in telecomunicazioni,,080 565 4919,"Via degli Imbianchini, 8/10",Modugno,,,,,,,,,,,
For.M.El. Di M.La Porta & Grifa (S.N.C.),Negozio di forniture elettriche,https://www.formelmaterialielettrici.it/,0882 473469,Via Degli Ulivi,San Nicandro Garganico,,formelsnc1@virgilio.it,https,PrestaShop,No,Aruba S.p.A. Network,0,0,83.00,Sì,No
Elektrosaem Srl,Produttore di articoli elettronici,https://elektrosaem.com/,0884 995678,Contrada Mannarelle,Vico del Gargano,,,https,WordPress,No,Aruba S.p.A,62,90,92.00,Sì,No
Uemme Impianti Elettrici,Elettricista,https://uemmeimpianti.com/,377 555 9743,"V.le Antonio Meucci, 12",Bari,,info@uemmeimpianti.it,https,React,Sì,Aruba S.p.A.,66,88,85.00,Sì,Sì
Elettrolamp srl,Negozio di forniture elettriche,http://www.elettrolamp.com/,0882 371215,"Viale Checchia Rispoli, 156",San Severo,,info@elettrolamp.com,http,WordPress,No,Keliweb S.R.L,45,49,92.00,Sì,No
CODES S.r.l.,Impresa di costruzioni,http://www.codescostruzioni.it/,080 384 7327,"Via Brescia, 4/D",Modugno,,,http,ASP.NET,No,Aruba S.p.A. Network,99,100,80.00,Sì,No
FAS3 TECNOLOGY SRL,Elettricista,https://fas3tecnology.it/,080 972 2654,"Via Molfettesi del Venezuela, 23",Molfetta,,info@fas3tecnology.com,https,Shopify,Sì,Google LLC,59,88,92.00,Sì,No
G.D. Tech Di Spezzacatena Corrado,Elettricista,http://www.gdtechimpianti.it/,347 398 3499,"Via Massimiliano, Via Mayer, 34",Molfetta,,info@gdtechimpianti.it,http,ASP.NET,Sì,Aruba S.p.A. Network,89,82,100.00,Sì,Sì
Fiore Impianti,Elettricista,http://www.fioreimpianti.it/,338 900 8659,"Via Negrelli, 22",Corato,,fiore@fioreimpianti.it,http,WordPress,No,OVH ISP,60,76,92.00,Sì,Sì
Elettricisti San Giuseppe Società Cooperativa,Impresa edile,http://www.elettricistisangiuseppe.it/,080 476 1742,"Strada Provinciale 240, Km 13",Rutigliano,,,http,WordPress,No,Aruba S.p.A. Network,66,86,92.00,Sì,Sì
Sea S.r.l.,Elettricista,http://www.seasrlimpianti.it/contatti,080 237 3133,"Via A. Scarlatti, 6",Ruvo di Puglia,,info@seasrlimpianti.it,http,React,Sì,Aruba S.p.A. Network,74,97,92.00,Sì,No
Tommaso La Bottega Dell’Elettricista,Elettricista,,320 644 4435,"Via Municipio, 37",Bari,,,,,,,,,,,
Edil Valentino Costruzioni Ristrutturazioni Srls,Impresa edile,,391 366 5845,"Via Parco Padre Pio, 27",Zapponeta,,,,,,,,,,,
S.G.E. di Giuseppe Saulle,Elettricista,,339 395 6967,"Via Pisacane 58, Via Giuseppe Capaldi, 44",Bari,,,,,,,,,,,
SUD ELETTRICA,Servizio di installazione elettrica,http://sud-elettrica.net/,080 455 1431,"Via Casamassima, 90",Capurso,,info@sud-elettrica.com,http,ASP.NET,No,Aruba S.p.A. Network,96,100,91.00,Sì,Sì
Elettrica 2R di Romita Giuseppe,Elettricista,,338 333 9479,"Via Battisti, 33",Bitritto,,,,,,,,,,,
Elettrica Cicirelli Srl,Elettricista,http://www.elettricacicirelli.it/,080 310 5812,"Via dell’Ortica, 10",Altamura,,info@elettricacicirelli.it,http,WordPress,No,IT.Gate S.p.A.,71,81,92.00,Sì,No
Ar.Fa Tech Srl,Impresa di costruzioni,http://www.arfatech.it/,080 203 1023,"Viale Ottorino Respighi, 7",Bari,,,http,ASP.NET,No,Aruba S.p.A. Network,0,0,100.00,Sì,No
Caporusso Impianti S.r.l.s.,Elettricista,,338 471 1192,"Via Vincenzo Mastrorocco, 48",Acquaviva delle Fonti,,,,,,,,,,,
ROPER impianti,Elettricista,,338 112 1217,"Via Leonardo da Vinci, 5",Acquaviva delle Fonti,,,,,,,,,,,
DL SERVICE SRL LUCA DI RUGGIERO,Elettricista,,338 308 3830,"Via Giancarlo Barbieri, 27",Acquaviva delle Fonti,,,,,,,,,,,
GS ELETTRICA,Negozio di forniture elettriche,,080 759286,"Via Monsignor Laera, 108",Acquaviva delle Fonti,,,,,,,,,,,
M.G. Elettromeccanica Chimienti Di Chimienti Roberto,Negozio di elettronica,,080 758317,"Via Basilicata, 28",Acquaviva delle Fonti,,,,,,,,,,,
Leo Impianti srl,Ufficio aziendale,,080 769965,"Via Enrico Fermi, 2",Acquaviva delle Fonti,,,,,,,,,,,
Eletrix impianti Elettrici,Elettricista,,335 174 0331,"Via Caduti di Tutte le Guerre, 50/A",Acquaviva delle Fonti,,,,,,,,,,,
Elettr.Di Giovinazzo Rocco Via Vitt.Veneto 168 Adelfia,Elettricista,,080 459 4498,"Via Vittorio Veneto, 168",Adelfia,,,,,,,,,,,
Troilo Domenico,Elettricista,,080 757913,"Via Sacro Cuore, 21",Acquaviva delle Fonti,,,,,,,,,,,
DI.MA. Impianti & Costruzioni,Elettricista,,080 459 3084,"Via Vittorio Veneto, 92",Adelfia,,,,,,,,,,,
Elettrosud Impianti,Elettricista,,080 459 2113,"Via V. Alfieri, 28",Adelfia,,,,,,,,,,,
Sinenergy Srl,Fornitore di attrezzature per l'energia solare,,347 616 0064,"Via Palmerio de Rosa, 21",Acquaviva delle Fonti,,,,,,,,,,,
I.E.M. Di Cozzoli Simone,Elettricista,,080 310 6818,"Via Ricovero di Mendicita', 93",Altamura,,,,,,,,,,,
F.lli Cassano S.r.l.,Elettricista,,347 777 0649,"Via Conella, 27",Adelfia,,,,,,,,,,,
Elettrica Murgia di Terranova Michele,Elettricista,,389 115 0345,"Via Termoli, 84",Altamura,,,,,,,,,,,
AN IMPIANTI ELETTRICI di Antonio Natale,Elettricista,,328 824 5373,"Via Cremona, 34",Altamura,,,,,,,,,,,
Elettrica Leader S.R.L.,Elettricista,,080 314 1377,"Contrada, Via Bersaglio",Altamura,,,,,,,,,,,
Gallo Michele Michele,Elettricista,,338 197 6109,"Via Helsinki, 8",Altamura,,,,,,,,,,,
Elettrica Service,Impianto solare fotovoltaico,,080 967 2697,"Via Antonio Vivaldi, 7",Altamura,,,,,,,,,,,
TECHNITAI SRL,Elettricista,http://www.technitai.it/,080 311 6787,"STRADA COMUNALE ESTERNA 148, San Tommaso, 10",Altamura,,,http,WordPress,No,Server Plan S.r.l.,92,96,83.00,Sì,Sì
Impianti Elettrici di Chironna Tommaso,Elettricista,,360 371 884,"Via Tommaso Grossi, 45",Altamura,,,,,,,,,,,
Iurilli Impianti,Elettricista,,080 459 1826,"Via Vittorio Veneto, 82",Adelfia,,,,,,,,,,,
Electra Service Srl,Elettricista,http://logranoelectra.it/,080 310 1120,"Via del Leccio, 11",Altamura,,amministrazione@logranoelectra.it,http,WordPress,No,OVH ISP,79,77,82.00,Sì,No
Impianti elettrici Bari - Piepoli Impianti Elettrici - Elettricista Bari,Elettricista,,338 532 7891,"Via Marraffa, 16",Alberobello,,,,,,,,,,,
S & N Impiantistica Elettrica,Elettricista,,080 311 1132,Via S. Claudio,Altamura,,,,,,,,,,,
De Astis Diego,Elettricista,,080 503 3518,"Via Termopili, 10",Ceglie del Campo,,,,,,,,,,,
A E I Impianti Elettrici Alberobello Srl,Elettricista,,080 432 2896,"Via Domenico Aversa, 13",Alberobello,,,,,,,,,,,
Elettrolevante di Domenico Quarta,Fornitore di sistemi di sicurezza,http://www.elettrolevante.it/,335 774 2676,"Via G. Marconi, 17",Adelfia,,,http,Backbone.js,No,Aruba S.p.A. Network,59,82,92.00,Sì,No
Del.Ca. Elettrica sas,Servizio di installazione elettrica,,328 336 3322,"Via Carmelo Borg Pisani, 34-36",Bari,,,,,,,,,,,
Siemme Group S.R.L.,Elettricista,,080 467 3680,"Via Montrone, 33",Valenzano,,,,,,,,,,,
L. G. Impianti Elettrici Tecnologici Di Lalario Giovanni,Elettricista,,080 503 9696,"Via della Ferrovia, 4",Bari,,,,,,,,,,,
Electronic Solutions di Michele Pierri,Elettricista,,392 032 1879,"Via Valenzano, 4",Bari,,,,,,,,,,,
Impianti Alternativi 2007 S.R.L.,Elettricista,,340 105 4443,"1trav, Str. Madonna della Stella",Bari,,,,,,,,,,,
Maggi Michele,Elettricista,http://www.maggimichele.com/,080 310 5547,"Via Umberto Maddalena, Snc",Altamura,,info@maggimichele.com,http,Shopify,Sì,Aruba S.p.A. Network,51,86,77.00,Sì,Sì
Negozio di Miraglia Giandomenico,Negozio di forniture elettriche,,080 432 5892,"Via de Giosa, numero 17",Alberobello,,,,,,,,,,,
Elettrotel Di De Bellis Giuseppe,Elettricista,,080 503 1612,"Via de Angelis Francesco, 10",Bari,,,,,,,,,,,
Lopedote,Elettricista,,080 524 7481,"Via Nicola de Giosa, 105-105/A",Bari,,,,,,,,,,,
Co.mai S.r.l.,Elettricista,,080 314 6263,"Via Eritrea, 26",Altamura,,,,,,,,,,,
Biscardi Tommaso,Elettricista,,080 504 3655,"Via Grimoaldo degli Alfaraniti, 22",Bari,,,,,,,,,,,
Phoenix Elettronica s.a.s. di De Leonardis Emilio,Elettricista,http://www.phoenixelettronica.net/,335 634 9428,"Via Papa Innocenzo XII, 19",Bari,,info@phoenixelettronica.net,http,ASP.NET,No,Seeweb s.r.l,98,100,100.00,Sì,Sì
Sa.Vi. Impianti Soc. Coop.,Elettricista,https://www.saviimpianti.it/,080 967 5433,"Via Bezzecca, 54",Altamura,,info@saviimpianti.it,https,WordPress,No,SEEWEB s.r.l.,32,45,92.00,Sì,Sì
Elettroimpianti Di Ricco Luigi,Elettricista,,080 553 3167,"Via dei Mille, 48",Bari,,,,,,,,,,,
Electric House,Elettricista,,080 552 0576,"Via G. Petroni, 58",Bari,,,,,,,,,,,
"Studio Ispe. Certificati Verifiche Impianti Elettrici D.P.R.462/01,S.T.P./Perizie Attività Professionale",Perito misuratore,,379 184 260,Via Mendel,Alberobello,,,,,,,,,,,
R.C. Technology di Rollo Carlo Cristofaro,Elettricista,,335 413 319,"Via Monte Grappa, 179",Bari,,,,,,,,,,,
G V S Electronics,Elettricista,,080 556 9933,"Via Enrico Pessina, 32",Bari,,,,,,,,,,,
Elettrotecnica Italiana Smart,Elettricista,https://elettrotecnicasmart.it/,392 987 1327,"Via Gino Strada, 16",Bari,,eismart@pec.it,https,WordPress,Sì,Interoute Telecommunications (UK) Ltd,57,88,85.00,Sì,Sì
I L V I Impianti Di Alberto Ilenia,Elettricista,,080 968 4703,"Via Piscinelle, 34",Binetto,,,,,,,,,,,
Delta Elettronica,Elettricista,http://www.deltaelettronicabari.it/,080 556 2320,"Via Domenico Cirillo, 52",Bari,,info@deltaelettronicabari.it,http,Squarespace,Sì,Netsons s.r.l.,61,79,92.00,Sì,Sì
Dentico Maurizio,Elettricista,,339 285 0064,"Via Carlo Collodi, 19",Bari,,,,,,,,,,,
Comir,Servizio di installazione elettrica,,080 967 2287,"Via Anita Garibaldi, 18",Bari,,,,,,,,,,,
Fermes Impianti Srl,Elettricista,http://www.fermesimpianti.com/condizioni.php,080 557 6661,Via Scipione l'Africano,Bari,,info@fermesimpianti.com,http,Hugo,No,Telecom Italia S.p.A.,79,87,83.00,Sì,Sì
bp Elettrica,Elettricista,https://www.bpelettrica.com/,080 432 2878,"Viale Luigi Einaudi, 53",Alberobello,,,https,WordPress,Sì,Aruba S.p.A.,55,71,92.00,Sì,Sì
Elettro Security Clima di Basile Giovanni,Elettricista,,339 279 2017,"Via dei Mille, 20/a",Bari,,,,,,,,,,,
Elettricità Lamacchia,Elettricista,http://elettricitalamacchia.wix.com/elettricitalamacchia,080 523 2188,"Via Quintino Sella, 15",Bari,,,http,Wix,No,Google LLC,79,97,36.00,No - Pagina Non Trovata (404),No
Quattromini Impianti Srl,Elettricista,http://www.quattrominisrl.it/,327 228 1499,"Via Pompei, N. 18",Altamura,,,http,Wix,No,Google LLC,76,84,100.00,Sì,Sì
Ditta Schiralli Gregorio,Elettricista,,335 138 2020,"Via Montegrappa, 12",Bitetto,,,,,,,,,,,
Latocom S.r.l.,Impresa edile,http://www.latocom.it/,349 831 6501,"Via Surdi Tenente Carlo, 61",Binetto,,info@your-domain.com,http,ASP.NET,No,Google LLC,59,92,92.00,Sì,Sì
General Impianti Snc,Elettricista,,080 535 4755,"Via S. Biagio, 4",Bitetto,,,,,,,,,,,
Center Elettric Professional,Elettricista,,080 553 9438,"Via Enrico Nannei, 10",Bari,,,,,,,,,,,
Fino Impianti Com.,Appaltatore,,080 501 9188,"Via Guido Dorso, 3/A",Bari,,,,,,,,,,,
Lucarelli Vincenzo Forniture Elettriche,Negozio di forniture elettriche,,080 219 2092,"Via Crocifisso, 26",Bitonto,,,,,,,,,,,
Energeia di Alfonso Traetta,Elettricista,,080 321 7249,"Via Francia, 23",Bitonto,,,,,,,,,,,
Emmetiimpianti,Elettricista,https://emmetiimpianti.it/,377 972 0630,"Via Girolamo Savonarola, 18",Palo del Colle,,info@emmetiimpianti.it,https,Shopify,Sì,Google LLC,56,82,92.00,Sì,No
3c Impianti Societa' A Responsabilita' Limitata,Elettricista,http://www.3cimpianti.com/,348 351 1467,"Via della Roverella, 46",Altamura,,,http,WordPress,Sì,Aruba S.p.A. Network,46,46,77.00,Sì,Sì
TECHNOLOGY DI CAIATI GREGORIO,Elettricista,,338 962 7077,"Via Rodolfo Morandi, 12",Bitonto,,,,,,,,,,,
3E di Brattoli Pasquale Impianti Tecnologici,Appaltatore,http://www.treeimpianti.altervista.org/,333 920 7552,"Via Spagna, 18",Bitonto,,,http,WordPress,No,Hetzner Online GmbH,83,98,83.00,Sì,Sì
BF impianti di Cece Francesco,Elettricista,,347 284 8070,Via Pietro Nenni,Capurso,,,,,,,,,,,
SANNICANDRO NICOLA IMPIANTI ELETTRICI,Servizio di installazione elettrica,,338 749 0760,"Via Giovanna da Durazzo, 33",Bitonto,,,,,,,,,,,
Pirolo Vito,Elettricista,,080 671440,"Via Grazia Deledda, 17",Casamassima,,,,,,,,,,,
Patrono Giuseppe,Elettricista,,080 675391,"Via Turi, 85",Casamassima,,,,,,,,,,,
Quarto Impianti di Daniele Quarto,Elettricista,,393 066 5140,"Traverse II di Via Giacomo Matteotti, 23",Cassano delle Murge,,,,,,,,,,,
M.G. Impianti Di Monno Gennaro,Elettricista,,080 561 7087,"Via Martino Cassano, 21",Bari,,,,,,,,,,,
Ca. Vi. Elettric Elettricista Impianti Elettrici,Elettricista,,320 480 5377,"Via Antonio Segni, 18/a",Cassano delle Murge,,,,,,,,,,,
Elettra Impianti Lucana Di Caldararo Immacolata I.,Elettricista,,080 763655,"Via Pietrangelo Lascaro, 1",Cassano delle Murge,,,,,,,,,,,
"Clima Futura Di Inviti Angelo, Inviti Lorenzo E Scardicchio Raffaello Snc",Idraulico,,080 631054,"Via Alessandro Manzoni, 5",Bitritto,,,,,,,,,,,
Sma. Vir. S.N.C. Di Smaldino F. & Roberto,Elettricista,,080 775591,"Via Francesco Cilea, 14",Cassano delle Murge,,,,,,,,,,,
La Fluidotecnica Del Geom. Spinelli Pietro S.R.L,Elettricista,,080 775947,"Via Convento, 202",Cassano delle Murge,,,,,,,,,,,
Nuova Elettra,Negozio di forniture elettriche,http://www.nuovaelettra.com/,080 764973,"Via Dogana, 3",Cassano delle Murge,,,http,WordPress,No,Netsons Network,100,100,83.00,Sì,No
Duemme Forniture Elettriche Di Rubino Giuseppe,Negozio di forniture elettriche,,080 675492,"Via Stazione, 78",Casamassima,,,,,,,,,,,
Tricase Giovanni,Elettricista,,080 574 0540,"Corso Giuseppe Mazzini, 166",Bari,,,,,,,,,,,
Emme Bi Elettroclimax Di Bellincontro Maurizio,Elettricista,,080 465 7237,"Via Enrico Fermi, 28",Cellamare,,,,,,,,,,,
DITTA PRINCIPIO LEONARDO,Elettricista,,333 363 8118,"Via Luigi Digioia, 5",Cellamare,,,,,,,,,,,
Fluidotecnica Srl,Elettricista,http://fluidotecnicasrl.it/,080 763784,"VIA GRUMO, Via Della Scaletta Lotto n. 3 Z. I. , Cassano Delle Murge, BA, 70020",Cassano delle Murge,,,http,WordPress,No,Aruba S.p.A. Network,62,65,91.00,Sì,No
Elettrica Ed Elettronica Di Ferri Vincenzo,Elettricista,,080 467 5580,"Via Andrej Sacharov, 53",Valenzano,,,,,,,,,,,
Impianti Elettrici Elettronici De Tommaso Vincenzo Castellana Grotte,Elettricista,,349 456 5111,"Via Fratelli Bandiera, 34",Castellana Grotte,,,,,,,,,,,
Longo Vito | Impianti Elettrici e Automazioni,Elettricista,,080 698 2423,"Traversa IV Nicola Pinto, 2",Castellana Grotte,,,,,,,,,,,
Aelteci Impianti Di Genna Vito,Elettricista,,335 537 1234,Via Giambattista Vico,Castellana Grotte,,,,,,,,,,,
Gilli Impianti,Servizio di installazione elettrica,,349 154 1162,"Via Berardino Pepe, 7/C",Capurso,,,,,,,,,,,
DOM Impianti elettrici ed elettronici,Elettricista,,327 668 9903,"Via Salvatore Bini, 13",Castellana Grotte,,,,,,,,,,,
Antonio Campanella,Elettricista,,360 369 599,"Via Monopoli, 56",Castellana Grotte,,,,,,,,,,,
"""Elettricista Gioia del Colle"" Elettric Service di Rocco Antonicelli",Elettricista,,333 492 9380,"Via Monte Sannace, 6",Gioia del Colle,,,,,,,,,,,
Tecnoelettroclima,Elettricista,,080 344 1346,"Via Don Sante Milano, 41",Gioia del Colle,,,,,,,,,,,
Fc Impianti Srl,Servizio di installazione elettrica,http://www.fc-impianti.it/,080 914 4926,"Piazza Aldo Moro, 22",Cellamare,,info@fc-impianti.it,http,Shopify,Sì,Aruba S.p.A. Network,55,83,85.00,Sì,No
Mitola Impianti Termoidraulici,Idraulico,http://www.mitolaimpianti.it/,347 543 5656,"Via Umberto Giordano, 12",Cellamare,,mitolaimpianti@libero.it,http,React,Sì,OVH SAS,54,85,100.00,Sì,Sì
Pasquale PETRERA Installatore di impianti elettrici e di allarme,Elettricista,,338 321 8435,"Via Fratelli Cairoli, 66",Gioia del Colle,,,,,,,,,,,
Antonio Anicio,Elettricista,,338 577 7440,"Via Solferino, 17",Gioia del Colle,,,,,,,,,,,
Cuscito Leonardo,Negozio di forniture elettriche,,080 343 2505,"Via dei Peuceti, 96",Gioia del Colle,,,,,,,,,,,
Forelba Srl,Negozio di forniture elettriche,,080 495 0335,"Via Simplicio, 36",Conversano,,,,,,,,,,,
Signorile Impianti Srl,Elettricista,,080 477 1144,"1 Via Platone, Rutigliano, BA 70018",Rutigliano,,,,,,,,,,,
Lorusso Impianti S.R.L.,Fornitore di attrezzature per l'energia solare,,080 495 7091,Strada Vicinale Manorenna,Conversano,,,,,,,,,,,
Ideal Impianti Snc Dei Fratelli Troilo,Negozio di allarmi e sistemi di sicurezza,,080 495 8263,"Via Francesco De Sanctis, 13",Conversano,,,,,,,,,,,
G.D.F.Service di De Felice Gianni,Idraulico,,333 504 8435,"Strada com, Str. Vicinale Scamardella, 133",Castellana Grotte,,,,,,,,,,,
Futur Impianti,Elettricista,,368 762 5792,"Via Bettino Ricasoli, 4",Conversano,,,,,,,,,,,
ELETTROTECNICA VIGI S.R.L.,Elettricista,http://www.elettrotecnicavigi.it/,080 496 3307,"Via Angelo Viterbo, 26",Castellana Grotte,,info@elettrotecnicavigi.it,http,React,No,Server Plan S.r.l.,47,56,100.00,Sì,No
paganelli luigi,Elettricista,,392 697 0704,"Via Carlo Alberto, 13",Corato,,,,,,,,,,,
Teknology Impianti,Appaltatore,,360 260 590,"Via Mancini, 51",Conversano,,,,,,,,,,,
Elettro Romito,Elettricista,https://www.elettrodiromito.com/,347 809 6918,"Via Gaetano Donizetti, 32",Rutigliano,,info@elettrodiromito.com,https,Typo3,No,Aruba S.p.A.,63,72,100.00,Sì,Sì
Rizzi Francesco Elettrodomestici,Negozio di elettrodomestici,,080 496 5228,"Via Emanuele De Deo, 11",Castellana Grotte,,,,,,,,,,,
A&T Electric,Elettricista,,331 582 1626,"Via Albertone, 89",Corato,,,,,,,,,,,
N.G. Pitture e Legno,Servizi di ristrutturazione,,392 701 5544,"Via Camillo Cavour, 5",Castellana Grotte,,,,,,,,,,,
Campanella Impianti srl,Fornitore di sistemi di protezione antincendio,http://www.campanellaimpianti.it/,080 876 0704,"Via Turi, 16",Castellana Grotte,,info@campanellaimpianti.it,http,WordPress,No,Aruba S.p.A.,56,48,85.00,Sì,Sì
IntelliSun,Servizio di installazione elettrica,,080 495 2426,"Via Francesco Positano, 21",Conversano,,,,,,,,,,,
Elettronorba,Negozio di elettronica,http://www.elettronorba.it/,080 495 9213,"Via Simplicio, 34",Conversano,,assistenza@elettronorba.it,http,React,No,Aruba S.p.A.,57,83,77.00,Sì,No
Lumen Impianti,Elettricista,http://www.lumen-group.it/,080 237 8009,"Via Calatafimi, 13",Corato,,info@lumen-group.it,http,React,Sì,Netsons s.r.l.,66,90,100.00,Sì,No
Real Security Impianti,Elettricista,http://www.realsecurityimpianti.it/,080 897 9472,"Via Lago Baione, 9",Corato,,,http,React,Sì,Netsons s.r.l.,33,38,92.00,Sì,Sì
Amorese Serafino,Elettricista,,080 872 3144,"Viale V. Veneto, 92",Corato,,,,,,,,,,,
SAEL Technology di Aldo Mintrone,Elettricista,http://www.aldomintrone.it/,333 636 3201,"Via Carellario da Napoli, 116",Corato,,,http,Joomla,No,Aruba S.p.A.,82,99,83.00,Sì,No
ENERGY S.P. IMPIANTI SNC,Elettricista,,349 748 9541,"Via Cav. Domenico Maldarelli, 1",Giovinazzo,,,,,,,,,,,
Time di Quinto Cataldo,Servizio di installazione elettrica,http://timelectrical.it/,329 616 3950,"Via Aleardi, 7",Corato,,info@timelectrical.it,http,WordPress,No,Server Plan S.r.l.,73,87,92.00,Sì,No
Eleko s.r.l.s.,Impianto solare fotovoltaico,http://www.eleko.it/,342 020 4312,"Vico F. Nullo, 5",Corato,,,http,Angular,No,Aruba S.p.A. Network,34,46,92.00,Sì,No
Electric Center Di Armenise Michele & C. Snc,Negozio di forniture elettriche,,080 358 8602,"Via Carmine, 35",Corato,,,,,,,,,,,
Electric System di Tarantini Giuseppe,Negozio di allarmi e sistemi di sicurezza,,080 872 4330,"Via Guadagnoli, 1",Corato,,,,,,,,,,,
Elettro M.T.S. Srl,Elettricista,,080 990 0557,"Via Bitonto, 78",Giovinazzo,,,,,,,,,,,
E.S.A DI DIAFERIA FRANCESCO S.R.L.,Elettricista,http://esaimpiantielettrici.it/,080 898 4047,"Via Giuseppe Di Vittorio, 57",Corato,,info@esaimpiantielettrici.it,http,WordPress,No,Aruba S.p.A.,55,84,100.00,Sì,Sì
BAVARO PAOLO IMPIANTI ELETTRICI CIVILI E INDUSTRIALI,Elettricista,,335 658 4673,"Via S. Francesco D'Assisi, 5",Giovinazzo,,,,,,,,,,,
PUGLIA LUCE S.a.s.,Servizio di installazione elettrica,http://puglialuce.it/,339 883 3240,"Via Crocifisso, 29/A",Corato,,info@puglialuce.it,http,ASP.NET,No,Host SpA,57,74,85.00,Sì,Sì
Am Store,Negozio di forniture elettriche,,334 306 8838,Via Polvere delle Rose,Corato,,,,,,,,,,,
Sides Impianti Srl,Elettricista,,080 326 4768,"Via Giorgio Bizet, 26",Gravina in Puglia,,,,,,,,,,,
Elettrica Sistemi Di Capozzo Samuele,Elettricista,,080 326 2577,"Via Massimo d'Azeglio, 20",Gravina in Puglia,,,,,,,,,,,
ELETTROGEA,Negozio di forniture elettriche,http://www.elettrogea.com/,080 246 3540,"Via Don Giovanni Minzoni, 70",Corato,,info@elettrogea.com,http,Hugo,No,Hetzner Online GmbH,55,65,92.00,Sì,No
LD IMPIANTI - Civili e Industriali,Elettricista,,329 976 0701,"Via Ragusa, 58",Gravina in Puglia,,,,,,,,,,,
NIMA srls di Nicolardi Marco,Elettricista,,339 754 0322,"Via Fratelli Bandiera, 2",Gravina in Puglia,,,,,,,,,,,
Oprar Divisione Impianti S.R.L.,Elettricista,,080 326 6008,"31/LOTTO Via Zona Pip, Gravina In Puglia, BA 70024",Gravina in Puglia,,,,,,,,,,,
COMEL Di Tucci Francesco,Negozio di forniture elettriche,,080 326 7743,"Via Giardini, 71",Gravina in Puglia,,,,,,,,,,,
Elettricstar,Elettricista,,340 873 2980,"Via Antonio Cantore, 42",Martina Franca,,,,,,,,,,,
ElektroArt,Elettricista,https://impiantielettricielektroart.com/,327 435 2058,"Via Capitaneo, 36",Bari,,elektroartbari@gmail.com,https,WordPress,Sì,Signet B.V.,44,89,85.00,Sì,No
Liconso Electric S.R.L.,Società,,080 431 1211,"Via Vito Basile, 13",Locorotondo,,,,,,,,,,,
Dipe Srl,Elettricista,,080 321 0101,"Via Arezzo, 3",Gravina in Puglia,,,,,,,,,,,
Pinto impianti di Pinto Giandomenico,Elettricista,,333 330 5003,Contrada mancinella 16,Locorotondo,,,,,,,,,,,
S.P. Impianti di Palmisano Silvio,Negozio di allarmi e sistemi di sicurezza,,339 838 4458,"8, str. Comunale Casalini 44, Locorotondo, BA 70010",Locorotondo,,,,,,,,,,,
G.B. Impianti,Elettricista,,345 156 9983,"Via Annunziata, 71",Molfetta,,,,,,,,,,,
Centro Sicurezza srl,Elettricista,,080 524 3459,"Via Monsignor Giacinto Petronio, 12 / 12A 70056",Molfetta,,,,,,,,,,,
Sev Snc,Elettricista,,080 334 4986,"Via Bufi Tenente Sergio, 35",Molfetta,,,,,,,,,,,
Impiantistica Di Calella Tommaso,Elettricista,,080 431 6113,"Contrada Cinquenoci, 4",Locorotondo,,,,,,,,,,,
Energy3point snc,Elettricista,http://www.energy3point.it/,080 214 7330,"Via Lelio Fanelli, 83",Martina Franca,,info@energy3tore.it,http,Basekit,No,Aruba S.p.A.,80,70,100.00,Sì,No
Energetic Puglia srl,Servizio di installazione elettrica,,380 179 9863,"Via Don Giovanni Minzoni, 8",Molfetta,,,,,,,,,,,
Gierre Impianti Elettrici,Elettricista,,333 911 1047,"Via Baccarini, 38",Molfetta,,,,,,,,,,,
sciancalepore pantaleo,Riparazione antenne,,347 171 5961,"Via Amente, 14",Molfetta,,,,,,,,,,,
Tecnosistem s.a.s. di Lorenzo Magarelli & C.,Elettricista,http://www.tecnosistemsas.com/,080 397 5502,"Via Giovanni Spadolini, 88",Molfetta,,,http,ASP.NET,No,Aruba S.p.A. Network,0,0,90.00,Sì,No
Molseni Impianti S.R.L.,Elettricista,,080 397 1710,"Via Rosa Picca, 30G",Molfetta,,,,,,,,,,,
Carparelli Geoenergia di Carparelli Domenico,Fornitore di impianti industriali,https://www.carparelligeoenergia.it/,329 646 1918,"SS 172-2, C.da Casalini, 7",Locorotondo,,amministrazione@carparelligeoenergia.it,https,WordPress,Sì,Netsons s.r.l.,57,86,100.00,Sì,Sì
Tecno Energy S.R.L.,Consulente per impianti di produzione di energia,http://www.tecnoenergyweb.com/,080 431 3104,"Via Milazzo, 2",Locorotondo,,,http,Joomla,Sì,Aruba S.p.A.,69,97,92.00,Sì,No
D.IM.EL. IMPIANTI,Elettricista,http://dimelimpianti.blogspot.com/,349 427 7853,Via Monsignor Salvucci,Molfetta,,dimel.impianti@fastwebnet.it,http,Blogger,No,Google LLC,97,100,92.00,Sì,No
