Nome Attività,Categoria,Sito Web,Telefono,Indirizzo,Comune,Provincia,Email,Protocollo,Tecnologia,Cookie Banner,Hosting Provider,Mobile Performance,Desktop Performance,Punteggio SEO,Disponibilità Sito,Stato Manutenzione
Termoelettrica Di Ghionna Angela & C S.A.S.,Negozio di forniture elettriche,,099 880 0989,"Via del Santuario, 61",Massafra,,,,,,,,,,,
JE Impianti,Appaltatore,,099 450 7843,"Via Pier Paolo Pasolini, 22",Massafra,,,,,,,,,,,
Protek Di Maldarizzi Antonio,Elettricista,,099 886 2203,"Via Risorgimento, 91",Mottola,,,,,,,,,,,
Fedele Francesco,Elettricista,,099 849 5277,"Via Settembrini, 2",Palagianello,,,,,,,,,,,
Elettricista Mottola M.P. Impianti Di Mottola Pasquale...,Elettricista,,339 179 8475,"Via Enrico Fermi, 6",Trentola Ducenta,,,,,,,,,,,
Il Mio Tecnico Di Notaristefano Vincenzo,Idraulico,,099 886 1179,"Via Carlo Goldoni, 23",Mottola,,,,,,,,,,,
TECNODUE Impianti,Installatore di impianti di condizionamento,,099 599 3335,"Via S. Maria di Camera, 46/B",Monteparano,,,,,,,,,,,
G.e.i.t. S.r.l.,Elettricista,,099 880 2581,"Via Colonnello Scarano, 46",Massafra,,,,,,,,,,,
Rima Fluid Spa,Elettricista,http://www.rimafluid.it/,099 883 0811,"SS7, 22",Massafra,,info@rimafluid.it,http,WordPress,No,Serverplan S.r.l.,71,95,92.00,Sì,No
Mm Impianti,Appaltatore,,392 222 4856,"Via Giuseppe Libertini, 60",Massafra,,,,,,,,,,,
Erca Impianti Società Cooperativa Sociale,Impresa di costruzioni,http://www.ercaimpianti.it/,099 776 2055,"Viale Unità d'Italia, 159",Taranto,,info@ercaimpianti.it,http,WordPress,No,Aruba S.p.A.,80,91,92.00,Sì,No
Pirelli - Servizi Telelettrici,Elettricista,,099 731 1287,"Via Risorgimento, 37",Taranto,,,,,,,,,,,
Mek Impianti di Antonio De Crescenzo,Elettricista,,338 981 6994,"Via Salvatore Allende, 5a",Mottola,,,,,,,,,,,
Impiantistica dell'Acqua Carlo,Elettricista,https://www.impiantisticadellacquacarlo.eu/,349 637 9361,"Via Matera, 54",Palagiano,,impiasud@gmail.com,https,WordPress,Sì,Aruba S.p.A.,0,92,100.00,Sì,Sì
Giutech Impianti,Elettricista,,373 526 5878,via San Marco,Palagiano,,,,,,,,,,,
Allestimenti Elettrici Martucci Srl,Elettricista,,099 470 7707,"Via Di Giorgio Martini Francesco, Taranto, TA 74123",Taranto,,,,,,,,,,,
Termo Idroelettrica Di Mortato Martino,Idraulico,,099 888 9194,"Via F. Cavallotti, 36",Palagiano,,,,,,,,,,,
T&D S.r.l.,Servizio di installazione elettrica,http://impresated.it/,099 886 3964,"Via Scarlatti, 16",Palagiano,,info@impresated.it,http,WordPress,Sì,Server Plan S.r.l.,60,81,85.00,Sì,Sì
Gaballo Musica Elettronica,Negozio di elettrodomestici,,099 884 1344,"Via Dante, 80",Palagiano,,,,,,,,,,,
Illuminotecnica Di Liverano Pasquale,Negozio di forniture elettriche,,099 888 2998,"Via Benvenuto Cellini, 3",Palagiano,,,,,,,,,,,
Mandorino Group s.r.l.s.,Negozio di computer,http://www.mandorinogroup.com/,099 886 1671,"via della libertà, 22",Mottola,,,http,WordPress,No,Aruba S.p.A. Network,71,88,92.00,Sì,No
Eurox Srl 4/8 Elettronica,Negozio di elettronica,,347 467 0446,"Via Oronzo Massa, 4",Palagiano,,,,,,,,,,,
Varegliano Srl,Negozio di forniture elettriche,,099 888 5929,"Viale Chiatona, 73",Palagiano,,,,,,,,,,,
Semeraro Srl,Idraulico,,099 888 2510,"Via Parisi, 9",Palagiano,,,,,,,,,,,
Novatech Srls,Negozio di forniture elettriche,http://ntautomazione.it/,339 149 2526,"Via L da Vinci, 23",Palagiano,,,http,WordPress,No,Aruba S.p.A. Network,70,91,92.00,Sì,No
ELETTRODILAURO,Negozio di forniture elettriche,,099 533 7178,"Via Vincenzo Bellini, 39",Pulsano,,,,,,,,,,,
Elettrolux Di Angelo Conte,Negozio di forniture elettriche,,099 533 9011,"Via Umberto I, 92",Pulsano,,,,,,,,,,,
Dalena Service di Giacomo Dalena S.a.s.,Ditta specializzata in impianti di riscaldamento,http://www.dalenaservice.it/,099 662 0685,"Corso Gramsci, Via Regina Margherita, 61",Palagianello,,,http,Basekit,No,Aruba S.p.A.,45,71,92.00,Sì,Sì
Elettrica futura,Elettricista,,347 781 3461,"Via Giacomo Matteotti, 67",Palagianello,,,,,,,,,,,
A.t.s. srl,Elettricista,,099 972 7166,"Via B.Croce, 138",Sava,,,,,,,,,,,
"Rienergia srl - ENERGIA RINNOVABILE, SOLARE FOTOVOLTAICO TERMICO E EOLICO",Fornitore di attrezzature per l'energia solare,,099 567 1400,"Viale delle Imprese, 3",Montemesola,,,,,,,,,,,
De Sarlo Antonio,Elettricista,,099 972 2014,"SS7ter, 1",Sava,,,,,,,,,,,
Joniogas Di Giovanni D'Onghia & Figli,Officina autoriparazioni,http://www.joniogas.it/,099 566 0306,"Viale delle Industrie, 3",Montemesola,,,http,ASP.NET,No,Aruba S.p.A. Network,66,36,90.00,Sì,No
Smea Srl,Elettricista,,099 470 4156,"Km. 3.000, Strada Provinciale Taranto Statte, Taranto, TA 74100",Taranto,,,,,,,,,,,
Punto Elettrico di Soloperto Laura,Ferramenta,,099 974 6571,"Via Verona, 7/A",Sava,,,,,,,,,,,
"Elettromeccanica ""VOLTA"" Srl",Negozio di forniture elettriche,http://elettromeccanicavolta.it/,+39 399 9474 6216,"Via Leucaspide, 10240",Statte,,,http,ASP.NET,No,Aruba S.p.A. Network,99,100,82.00,Sì,No
Russano Impianti di Russano Saverio,Ufficio aziendale,,338 500 8671,"Via Aldo Moro, 11",San Giorgio Ionico,,,,,,,,,,,
GBS S.r.l.,Elettricista,,099 336703,"Via Colonnello Diego Peluso, 111",Taranto,,,,,,,,,,,
Security System di Cinieri Gianpiero,Elettricista,http://www.securitys.it/,379 189 2586,"Via Tito Speri, 35A",Sava,,,http,React,No,Aruba S.p.A. Network,56,62,85.00,Sì,No
Gi Effe Service S A S Di Francesco Gabriele,Elettricista,,099 477 5857,"Via Nettuno, 15",Taranto,,,,,,,,,,,
N. & D. Impianti Tecnologici Avanzati Srl,Elettricista,,0831 562811,"Via Silla Dittatore, 11",Brindisi,,,,,,,,,,,
Impresa Quaranta Srl,Impresa di costruzioni,https://www.eticasaquaranta.it/,335 743 4232,"Via fermi, 6",San Giorgio Ionico,,eticasa.fratelliquaranta@gmail.com,https,WordPress,No,SEEWEB s.r.l.,57,79,100.00,Sì,No
Tecnoemme Impianti Tecnologici,Negozio di articoli per l'illuminazione,https://www.tecnoemmeimpianti.com/,099 779 4062,"Via Pisa, 27",Taranto,,,https,ASP.NET,No,Aruba S.p.A,65,65,82.00,Sì,No
Loimar Materiale Elettrico Srl,Negozio di forniture elettriche,,0831 524039,"Via Indipendenza, 12",Brindisi,,,,,,,,,,,
Foel Group dal 1984 - Lucefutura - Materiale elettrico,Negozio di forniture elettriche,http://www.foel.it/,099 591 9126,"Via Amilcare Cipriani, Contrada Baronia, Zona Industriale",San Giorgio Ionico,,,http,WordPress,No,"Cloudflare, Inc.",65,88,100.00,Sì,No
L'impiantista della tua città,Idraulico,,0831 529966,"Via Giulio Cesare, 98",Brindisi,,,,,,,,,,,
De Florio Vito Impianti Elettrici Elettronici Fotovoltaici,Elettricista,,0831 517591,"Via Orazio Flacco, 71",Brindisi,,,,,,,,,,,
G.IM.E.S. Impianti di Scardino Graziano,Elettricista,https://www.gimesimpianti.it/,342 061 4742,"Via G. Mazzini, 97",Sava,,info@gimesimpianti.it,https,WordPress,Sì,OVH SAS,69,87,77.00,Sì,No
Ma.In Manutenzioni Industriali S.R.L.,Produttore,,0831 574223,"Via Alfred Nobel, 2/4",Brindisi,,,,,,,,,,,
Saif global,Elettricista,,347 192 2319,"Via de Ripa, 7",Brindisi,,,,,,,,,,,
Tina Impianti Elettrici,Elettricista,,328 681 6015,"Via Maria Montessori, 45",Carovigno,,,,,,,,,,,
Brio Impianti Di Greco Giuseppe Antonio,Elettricista,,0831 990430,"Via delle Donne, 10",Carovigno,,,,,,,,,,,
T.e.c. S.r.l.,Impresa di costruzioni,,0831 525484,"Via Provinciale S. Vito, 67",Brindisi,,,,,,,,,,,
Domoelettrica Di Franco Zizza,Elettricista,,333 528 8740,"Via P. Di Vagno, 54",Carovigno,,,,,,,,,,,
NT IMPIANTI di Nicola Tamborrino,Elettricista,,345 168 3741,"Via S. Martino, 4",Carovigno,,,,,,,,,,,
Cursano Impianti,Elettricista,http://www.cursanoimpianti.it/,349 452 4362,"Via Brindisi, 38/A",San Pietro Vernotico,,cursanoimpianti@gmail.com,http,WordPress,No,Hostinger International Limited,65,89,100.00,Sì,Sì
Elettrica Piccinno Di Piccinno Pietro,Elettricista,,349 259 2407,"Via Generale Tellini, 1",San Vito dei Normanni,,,,,,,,,,,
T S Impianti Srl,Automazione e robotica,http://www.tsimpianti.it/,0831 442611,"Via Galileo Ferraris, 1",Pedagne,,,http,WordPress,Sì,Aruba S.p.A. Network,56,55,77.00,Sì,Sì
Integra Nuove Tecnologie,Elettricista,https://www.int-srl.it/,327 219 1496,"Via Alessandro Artom, 13",Brindisi,,aAsset-3@4x-1.png,https,Shopify,Sì,Aruba S.p.A. Network,65,90,92.00,Sì,Sì
AB Multiservice,Azienda fornitrice di energia elettrica,,324 073 2310,"Via Vittorio Emanuele III, 135",San Marzano di San Giuseppe,,,,,,,,,,,
Elettrauto Delia Diego,Meccanico e assistenza automobili,,320 571 2497,"Via Dante angolo, Viale Europa",San Marzano di San Giuseppe,,,,,,,,,,,
Studio Demaio,Elettricista,,345 362 6574,"Via S. Vito, 1",Carovigno,,,,,,,,,,,
Eolotech srls,Servizio di installazione elettrica,,348 396 0732,"Via, Via Monte, 9",San Marzano di San Giuseppe,,,,,,,,,,,
Brandi Giosue',Elettricista,,0831 994277,"Via Claude Monet, 24",Carovigno,,,,,,,,,,,
Brio Impianti Di Greco Giuseppe,Elettricista,http://www.brioimpianti.it/,0831 990573,"Corso Umberto I, 114",Carovigno,,,http,Joomla,No,Host SpA,61,98,100.00,Sì,Sì
Emil Elettroimpianti,Elettricista,,349 852 8012,"Via Torricella, SNC",Ruffano,,,,,,,,,,,
Dp impianti,Fornitore di impianti di distribuzione acqua calda,,338 981 4129,"Via Magellano, 9",San Marzano di San Giuseppe,,,,,,,,,,,
Convertino s.r.l,Elettricista,http://www.convertinosrl.it/,0831 548111,"Via Galileo Ferraris, 27/29",Brindisi,,impresa@convertinosrl.it,http,React,No,Aruba S.p.A. Network,60,90,100.00,Sì,Sì
Camporeale Impianti srl - Antifurto Domotica Impianti elettrici,Elettricista,http://www.camporealeimpiantisrl.it/,345 164 8288,"Via Caduti in Guerra, 11",Carovigno,,info@camporealeimpiantisrl.it,http,ASP.NET,No,Aruba S.p.A,62,93,91.00,Sì,Sì
Tcp Elettric Societa' In Nome Collettivo Di Tondo S.Chirivi' C. E Pet,Elettricista,,0831 634057,"Via Lecce, 12",Cellino San Marco,,,,,,,,,,,
ES impianti elettrici e fotovoltaici,Elettricista,,392 909 5733,"Via G. Leopardi, 29",Cellino San Marco,,,,,,,,,,,
Elettrica Spedicati S.A.S. Di Spedicati Giuseppe E C.,Elettricista,,0831 618692,"Via Genova, 53",Cellino San Marco,,,,,,,,,,,
CS Vega srl,Elettricista,,335 108 3939,"Via Genova, 45",Cellino San Marco,,,,,,,,,,,
MiniIuci - Euronics,Negozio di elettrodomestici,https://www.euronics.it/store?storeId=3059,099 957 5616,"Via Cristoforo Colombo, 45/C",San Marzano di San Giuseppe,,,https,React,No,"Cloudflare, Inc.",42,50,75.00,No - Pagina Non Trovata (404),No
Punella Service di Leonardo Zaccaria,Ditta specializzata in impianti di riscaldamento,,349 116 3106,"Via XXVIII Ottobre, 8",San Marzano di San Giuseppe,,,,,,,,,,,
Impianti Idraulici-Elettrici Brindisi Impianti Elettrici Idraulici Lecce DITTA EDILE MARTINA MARCO,Impresa edile,,327 577 8978,"Via Pietro Mascagni, 17",Cellino San Marco,,,,,,,,,,,
D' Amico Francosimo,Elettricista,,080 444 4225,"Via Domenico Cirillo, 97",Cisternino,,,,,,,,,,,
EDIL RISTRUTTURAZIONI DI CALÒ COSIMO,Servizi di ristrutturazione,,338 868 8236,"Via C. Colombo, 36",Torricella,,,,,,,,,,,
Argentiero Angelo Raffaele,Elettricista,,0831 867552,Via Torino,Villa Castelli,,,,,,,,,,,
Elettricista Distante Snc,Negozio di forniture elettriche,,0831 812793,Via S. Vito,Francavilla Fontana,,,,,,,,,,,
Imiel A&G srl,Negozio di forniture elettriche,,0831 380579,"Via degli Emigranti, 20",Ceglie Messapica,,,,,,,,,,,
Vinci Giovanni,Elettricista,,080 442 5015,"Via dei Trasporti, 58",Fasano,,,,,,,,,,,
Vinci Production,Elettricista,,336 821 154,"Corso Garibaldi, 122",Fasano,,,,,,,,,,,
Elettro Impianti,Elettricista,,346 376 2558,"Via Giardinelli, 46/A",Fasano,,,,,,,,,,,
Puglimpianti Srl,Servizio di installazione elettrica,http://www.puglimpianti.it/,080 442 2582,"Via dell'Industria, 84/A",Fasano,,,http,WordPress,No,Aruba S.p.A.,61,85,92.00,Sì,No
Edilimpianti s.a.s. di Faggiano Cosimo & C,Idraulico,http://www.edilimpianti.net/,368 345 4384,"Via Rocco Gioia, 36",Ceglie Messapica,,info@edilimpianti.net,http,ASP.NET,Sì,Aruba S.p.A. Network,60,69,82.00,Sì,Sì
Enalt,Elettricista,,080 441 3785,"Via de Deo, 24",Fasano,,,,,,,,,,,
Legrottaglie - Forniture generali elettricità,Negozio di forniture elettriche,,080 441 3376,"Via de Giosa, 23",Fasano,,,,,,,,,,,
Simel Group,Azienda di energia solare,http://www.simelgroup.it/,0831 617494,111 SP75,Cellino San Marco,,commerciale@simelimpianti.eu,http,Sitefinity,No,Server Plan S.r.l.,56,68,92.00,Sì,Sì
Idroelectrik S.M. - Impianti elettrici ed idraulici,Idraulico,http://www.idroelectrik.it/,328 849 3537,"Via Piave, 112",Fasano,,idroeletrik@gmail.com,http,Shopify,Sì,OVH SAS,71,92,85.00,Sì,Sì
Palazzo Impianti di Palazzo Vito,Elettricista,,347 767 0208,Via Occhi Bianchi,Francavilla Fontana,,,,,,,,,,,
GM Electric,Elettricista,,080 441 4215,"Via Roma, 286",Fasano,,,,,,,,,,,
Elettric@ S.r.l.,Negozio di forniture elettriche,,0831 854228,"Via Spontini, 10",Francavilla Fontana,,,,,,,,,,,
Palumbo Impianti Di Palumbo Giovanni,Elettricista,,0831 815855,"Via Porta Roccella, 11",Francavilla Fontana,,,,,,,,,,,
Tecno Project Sas,Elettricista,http://tecnoprojectfasano.it/,338 919 5917,"Contrada Martucci, Traversa Via dell’Industria",Fasano,,,http,WordPress,Sì,Aruba S.p.A,55,74,77.00,Sì,Sì
Ditta Palazzo Alfredo,Elettricista,http://www.dittapa.it/,331 705 2445,"Via dei Trasporti, 66",Fasano,,info@dittapa.it,http,Mobirise,Sì,Aruba S.p.A. Network,66,95,92.00,Sì,No
Elettro Light srl - Impianti elettrici Sicurezza Automazione,Elettricista,http://www.elettrolightsrl.it/,349 423 9519,"Via Filippo d'Angiò, 29",Francavilla Fontana,,,http,ASP.NET,No,Aruba S.p.A,62,81,91.00,Sì,Sì
Puglimpianti Energia srl,Fornitore di impianti industriali,https://www.puglimpiantienergia.it/,080 442 7861,"Via dell'Industria, 84/A",Fasano,,pugenergia@libero.it,https,WordPress,No,Aruba S.p.A.,54,66,92.00,Sì,Sì
Forel - Paginediluce,Negozio di forniture elettriche,http://www.forelfasano.com/,080 439 1817,Contrada Sant'Angelo,Fasano,,info@forelfasano.com,http,WordPress,Sì,Aruba S.p.A.,59,70,92.00,Sì,No
di coste strade s.r.l,Impresa edile,,0831 162 0801,Via S. Francesco,Francavilla Fontana,,,,,,,,,,,
GIELLE SRL Impianti elettrici,Elettricista,http://www.gielleimpiantielettrici.it/,080 489 0255,"Via Lomartire, 48",Pozzo Faceto,,infogiovannilosavio@libero.it,http,Hugo,No,Aruba S.p.A. Network,64,83,64.00,Sì,Sì
Palumbo Istallazioni Reti Telefoniche Elettriche Srl,Elettricista,,0831 811882,"Viale Del Commercio, Francavilla Fontana, BR 72021",Francavilla Fontana,,,,,,,,,,,
TECDOMUS,Negozio di forniture elettriche,http://www.tecdomus.com/,351 530 3621,"Via Giuseppe di Vagno, 210",Francavilla Fontana,,tecdomussrls@gmail.com,http,Sitefinity,No,Keliweb S.R.L,71,90,83.00,Sì,No
Security Energy,Elettricista,http://www.securityenergy.it/,393 275 4960,"Via per Grottaglie, km 0, 300",Francavilla Fontana,,info@securityenergy.it,http,ASP.NET,No,Aruba S.p.A. Network,66,94,91.00,Sì,No
Dev. El. Di De Vanna Fabio Mario,Elettricista,,0831 767592,"Via Giuseppe Grassi, 44",Erchie,,,,,,,,,,,
Elettromarket,Negozio di forniture elettriche,,0831 768296,"Via Provinciale Per Torre S. Susanna, 109",Erchie,,,,,,,,,,,
New South Europe Impianti - Laguardiaimpianti,Elettricista,http://www.laguardiaimpianti.it/,080 442 6736,Via Valletta,Fasano,,,http,WordPress,No,Netsons s.r.l.,83,91,83.00,Sì,No
Impianti elettrici Distante,Servizio di installazione elettrica,,320 664 8749,"Via Palmiro Togliatti, 42",Francavilla Fontana,,,,,,,,,,,
Punto Elettronica di Capraro Giancarlo,Negozio di forniture elettriche,,0831 778719,"Via Udine, 12",Mesagne,,,,,,,,,,,
Consorzio Gamadi Engeneering & Lavori S.R.L.,Elettricista,,0831 730520,"Via Zona Industriale, Mesagne, BR 72023",Mesagne,,,,,,,,,,,
RIZZO ELETTROFORNITURE,Negozio di forniture elettriche,,0831 776984,"Via Caterina Storni, 56",Mesagne,,,,,,,,,,,
Mister Impianto,Elettricista,https://misterimpianto.it/,338 151 6908,"Via Savoia, 204",Francavilla Fontana,,,https,WordPress,Sì,Aruba S.p.A.,56,62,92.00,Sì,Sì
GLED Technology Innovation,Impianto solare fotovoltaico,http://www.gledimpianti.com/,333 114 1150,"Via Edmondo de Amicis, 28",Francavilla Fontana,,info@gledimpianti.com,http,WordPress,No,"New Dream Network, LLC",59,78,75.00,Sì,Sì
G M Impianti Di Moreno Massimiliano,Elettricista,,0831 198 5072,"Via Sannio, 35",Mesagne,,,,,,,,,,,
Electric System Di Laera Claudio,Elettricista,,0831 730026,"Via Generale A. Falcone, 21",Mesagne,,,,,,,,,,,
TERMOCOB SOC. COOP. A.R.L.,Idraulico,,333 734 4907,"Via Epitaffio, 90",Oria,,,,,,,,,,,
Prezzook,Negozio di elettronica,,389 563 5658,"Via Martiri della Libertà, 146",Latiano,,,,,,,,,,,
Tecno Allarm,Negozio di allarmi e sistemi di sicurezza,http://www.tecnoallarm.it/,0831 811452,"Via Semeraro, 29",Francavilla Fontana,,,http,ASP.NET,No,Aruba S.p.A,62,73,91.00,Sì,No
S.T.I.M. SRL,Elettricista,http://www.stimsrl.com/,0831 721293,"Via Thaon de Revel, 30",Latiano,,stim.info@tiscalinet.it,http,ASP.NET,No,Aruba S.p.A. Network,99,99,83.00,Sì,No
DE.COST. - GRUPPO DESTRADIS,Impresa di costruzioni,,0831 369190,"Via Mario Pagano, 56",Oria,,,,,,,,,,,
Elettromac di Antimo Delle Grottaglie,Laboratorio per la riparazione di articoli elettronici,,0831 215160,"Via Visciglio, 10A",Oria,,,,,,,,,,,
M.G. Di Summa Oronzo,Negozio di forniture elettriche,,0831 848438,"Via Fontana del Principe, 10",Oria,,,,,,,,,,,
Elettro Center Di Viapiana Gianluca,Negozio di telefoni cellulari,,0831 849154,"Via Giacinto D'Oria, 63",Oria,,,,,,,,,,,
Control S. r. l. - Verifica periodiche impianti ed attrezzature - Mesagne - Brindisi,Servizi per le imprese,http://www.controlcertificazione.it/,0831 777380,Via Antonio Montagna Z.I.,Mesagne,,info@controlcertificazione.it,http,React,Sì,Aruba S.p.A.,57,75,92.00,Sì,No
RDV srl - Impianti e tecnologie Avanzate,Servizio di installazione elettrica,http://www.rdvsas.it/,0831 773795,Via Bandello,Mesagne,,,http,Angular,No,Aruba S.p.A. Network,26,37,92.00,Sì,No
ELIOTECH,Fornitore di attrezzature per l'energia solare,http://www.eliotech.eu/,320 897 9631,Contrada San Cosimo N°21,Oria,,,http,WordPress,Sì,Keliweb S.R.L,0,0,92.00,Sì,Sì
Ferrettitermotecnica Oria (BR),Fornitore di impianti di riscaldamento,,0831 170 6478,"Via Francavilla, 54",Oria,,,,,,,,,,,
S.G. Domotic & Building,Impresa edile,https://shop.sgdomotic.com/,380 770 7166,"Via Martiri di Belfiore, 4",Oria,,,https,Shopify,No,"Cloudflare, Inc.",78,100,92.00,Sì,No
Soc. Adriatica Elettrica Snc,Elettricista,,0831 305561,"Via Ravenna, 20",Ostuni,,,,,,,,,,,
Impianti Elettrici Zizza snc,Elettricista,,331 618 3956,Zona Artigianale,Ostuni,,,,,,,,,,,
Tes Service Srl,Elettricista,,0831 304651,"27, Via Della Siderurgia, Ostuni, BR 72017",Zona Sisri,,,,,,,,,,,
Com.El .Srl L'elettrico,Negozio di elettronica,,0831 337071,"Via Verona, 53",Ostuni,,,,,,,,,,,
GE Impiantistica di Epifani Giuseppe,Idraulico,,338 881 6267,"Via Ferrara, 3",Ostuni,,,,,,,,,,,
Calamo Vito,Elettricista,,0831 338351,"Via Ugo Foscolo, 2",Ostuni,,,,,,,,,,,
Roma Francesco,Elettricista,,0831 335536,Via Foggia,Ostuni,,,,,,,,,,,
Sud Elettronic S.R.L.,Negozio di elettronica,https://www.sudelettronic.com/infocontatti/,0831 847143,"Piazza Ippocrate, 18",Oria,,info@sudelettronic.com,https,WordPress,No,Aruba S.p.A.,54,82,92.00,Sì,No
Puglia Energia - Impianti fotovoltaici - impianti solari termici,Consulente per impianti di produzione di energia,,392 397 1561,"Via Caduti di Via Fani, 35",San Michele Salentino,,,,,,,,,,,
COMP.SERVICE di Giacovelli F.,Negozio di elettronica,,0831 341099,"Via Dottor Angelo Tanzarella, 20",Ostuni,,,,,,,,,,,
Calamo Impianti,Elettricista,http://www.calamoimpianti.it/,348 129 0328,Via Bari,Ostuni,,calamo.maurizio@gmail.com,http,Shopify,No,Aruba S.p.A. Network,69,99,83.00,Sì,Sì
Perrone Antonio,Ditta specializzata in impianti di riscaldamento,,347 176 7454,"Via Galileo Galilei, 4",San Donaci,,,,,,,,,,,
Pugliese Girolamo,Negozio di elettrodomestici,,0831 667075,"Via Giovanni Bovio, 25/27",San Pancrazio Salentino,,,,,,,,,,,
Tecno Mar Impianti S.R.L.,Appaltatore,,0831 664039,"72026, Via dei Girasoli",San Pancrazio Salentino,,,,,,,,,,,
Ing. Ripa Giovanni,Servizio di installazione elettrica,,349 139 0719,"Via C. Miccoli, 15",San Pancrazio Salentino,,,,,,,,,,,
HM Tecnologie,Elettricista,,347 530 7720,"Via Madonna del Pane, 6F",Novoli,,,,,,,,,,,
Orsini Impianti Srl,Idraulico,,0831 667137,"Via Vittorio Emanuele III, 80",San Pancrazio Salentino,,,,,,,,,,,
Sicuralarm Di Tasco Pompilio,Elettricista,,339 821 4095,"Via Tripoli, 71",San Donaci,,,,,,,,,,,
Lg Elettroingrosso Di Giovanni Lavolta E C. S.a.s.,Negozio di forniture elettriche,,0831 302806,"Via Francesco Calamo, 85",Ostuni,,,,,,,,,,,
GUERRIERIMPIANTI,Fornitore di attrezzature per l'energia solare,http://www.guerrierimpianti.com/,0831 634527,"SP75, 54",San Donaci,,info@freehtml5.co,http,ASP.NET,No,Armada WAN,64,95,100.00,Sì,Sì
Tecnosistemi Di Malerba Giuseppe,Elettricista,,0831 635794,"Via Bari, 49",San Donaci,,,,,,,,,,,
Clima Multi System - idraulico/elettricista,Idraulico,https://www.climamultisystem.it/,0831 303464,"Via dei Calzolai, 65",Ostuni,,info@climamultisystem.it,https,WordPress,No,Aruba S.p.A. Network,63,97,85.00,Sì,Sì
Impianti elettrici di Renna Andrea,Elettricista,,347 762 2031,"Via S. Giuseppe, 111/A",Trepuzzi,,,,,,,,,,,
Elettro Impianti Solar Di Toraldo Antonio,Elettricista,,348 828 9400,"Via ARNO, 25",Squinzano,,,,,,,,,,,
Lanzilli Impianti Elettrici srls,Elettricista,,349 398 4736,"Via Randi, 91",Surbo,,,,,,,,,,,
Ri.Pa. Quadri,Elettricista,,0831 671431,Via Basilicata,San Pietro Vernotico,,,,,,,,,,,
Enersistemi s.a.s.,Impianto solare fotovoltaico,https://www.enersistemi.com/,328 918 9396,"Via del Commercio, 56",Ostuni,,enersistemi@libero.it,https,Angular,No,Server Plan S.r.l.,35,49,77.00,Sì,Sì
Nuova Elettro Luminarie,Servizio di noleggio di attrezzature per feste,https://www.luminariefabrizio-shoponline.it/,346 426 0610,"Via Cesare Battisti, 42",San Donaci,,info@nuovaelettroluminarie.it,https,Shopify,Sì,Aruba S.p.A. Network,48,57,92.00,Sì,No
3S Impianti s.r.l.s.,Elettricista,,338 247 0995,"Via Del Cervone, 8",Masseria Solicara-gelsi,,,,,,,,,,,
Gargano Pierangelo,Idraulico,,335 743 5015,"Via Spallanzani, 18",San Pietro Vernotico,,,,,,,,,,,
Elettrica Fagip Di Serinelli Francesco,Ferramenta,,0831 012120,"Via Brindisi, 62",Torchiarolo,,,,,,,,,,,
Idelgas - Paiano Piero,Impianto di raffreddamento,http://www.idelgas.it/,0831 606160,"Via Lo Marchese, 42",Torchiarolo,,info@idelgas.it,http,Angular,No,Aruba S.p.A,69,56,69.00,Sì,Sì
Golia Pietro,Negozio di forniture elettriche,,0831 620767,"Via Giacomo Leopardi, 74",Torchiarolo,,,,,,,,,,,
Tecno Impianti Di Caputo Enzo,Idraulico,,0831 162 2203,"Via E. Battisti, 31",San Pietro Vernotico,,,,,,,,,,,
Chiechi Elettrauto,Officina autoriparazioni,,340 706 0389,"Via Antonio Gramsci, 3",San Pietro Vernotico,,,,,,,,,,,
Studio Tecnico Ing. Ilio Assenzio - Progettazione e Manutenzione Impianti Fotovoltaici ed Eolici,Ingegnere elettrico,,346 031 0656,"Largo Generale Ellena, 1",San Pietro Vernotico,,,,,,,,,,,
Fobra Di Fontana Amleto,Idraulico,,0831 653400,"Via S. Pietro, 80",San Pietro Vernotico,,,,,,,,,,,
Mc Tecnotermica Di Manfreda G. & C. S.A.S.,Impianto di raffreddamento,,0831 654209,"Via Mare, 151",San Pietro Vernotico,,,,,,,,,,,
Energialternativa Di Bardi Giovanni,Idraulico,,0831 655329,"Via S. Pietro, 28",San Pietro Vernotico,,,,,,,,,,,
GM Group,Negozio di forniture elettriche,,347 675 9380,"Via 25 Luglio, 37",San Vito dei Normanni,,,,,,,,,,,
Idrotermoelettrica di Schiavone Angelo-Termoidraulica e materiale elettrico,Negozio di forniture idrauliche,,333 241 2198,"Via Bellini angolo, Via Petrarca",San Michele Salentino,,,,,,,,,,,
Punto Luce Di Ingrosso Antonio,Negozio di forniture elettriche,,0831 368003,"Via Galileo Galilei, 32",San Pietro Vernotico,,,,,,,,,,,
Elettrosecurity S.r.l.,Ufficio aziendale,https://www.elettrosecuritysrl.cloud/,320 931 6914,"Via Lussemburgo, 19",San Pietro Vernotico,,elettrosecurity.srl@libero.it,https,Shopify,No,Aruba S.p.A.,48,65,92.00,Sì,Sì
I.C. Smart Solutions,Negozio di articoli per l'illuminazione,,389 687 7488,"Via Angelo Raffaele Morfeo, 8",Torre Santa Susanna,,,,,,,,,,,
NEW ELECTRIC SYSTEM di De Punzio Mario Pompeo,Negozio di elettronica,,380 791 1484,"Via S. Pancrazio, 30",Torre Santa Susanna,,,,,,,,,,,
Diviggiano Daniele,Negozio di forniture elettriche,,0831 746339,"Via Latiano, 21",Torre Santa Susanna,,,,,,,,,,,
Epifani Impianti Termoidraulici,Idraulico,,360 830 923,"Via Pirandello, 7",San Vito dei Normanni,,,,,,,,,,,
GENERALE ELETTRICA SRL,Negozio di forniture elettriche,https://generale-elettrica.com/,349 346 6031,"Via Germania, 6",San Donaci,,,https,WordPress,No,HOSTINGER FR,55,74,92.00,Sì,No
Tecnoimpianti Carlucci Cosimo,Idraulico,http://www.tecnoimpianti-br.it/,0831 981496,"Via Franklin Nardelli, 8",San Vito dei Normanni,,,http,React,No,Aruba S.p.A.,37,62,92.00,Sì,Sì
SOGIM IMPIANTI | COSTRUZIONI| RISTRUTTRAZIONI,Elettricista,,345 606 4320,Via Capitano Congedi,Ugento,,,,,,,,,,,
ALtech Impianti di Alberto Martina,Elettricista,,320 607 2463,Via Gioberti 13 - Felline 73040,Felline,,,,,,,,,,,
EdoMatt Installazioni Elettriche,Servizio di installazione elettrica,http://edomattinstallazionielettriche.it/,328 538 6180,"Via Taormina, 78",Racale,,,http,Webnode,No,Amazon Technologies Inc.,88,99,50.00,No - Pagina Non Trovata (404),No
AS elettroimpianti,Elettricista,,349 720 9246,"Via Giorgio la Pira, 8",Parabita,,,,,,,,,,,
PuntoLED 2.2,Negozio di forniture elettriche,,348 337 0386,"Via Roma, 239",Alezio,,,,,,,,,,,
Elettrocasa,Negozio di forniture elettriche,,0833 281871,"Via Umberto I, 66",Alezio,,,,,,,,,,,
Falco Pasquale,Elettricista,,349 266 1179,"Via XI Febbraio, 18",Tuglie,,,,,,,,,,,
F.P. Elettroimpianti S.N.C. Di Perrone Marcello E Luigi,Elettricista,,0833 262125,"Via R. D'Angiò, 7",Gallipoli,,,,,,,,,,,
SDE Smart di Antonio Franco,Elettricista,,393 600 8602,"Via Francesco Rubichi, 28",Nardò,,,,,,,,,,,
Impiantistica Ria Enrico,Elettricista,,338 545 2366,"Via Risorgimento, 33",Collepasso,,,,,,,,,,,
Impiantistica di Pantaleo De Giorgi,Elettricista,,328 875 1500,Via Vanze,Acquarica di Lecce,,,,,,,,,,,
Trani Rocco Antonio - Impianti Elettrici-Automazioni-Antifurto-Tv-Videosorveglianza.,Elettricista,,347 133 6496,"Via Caduti Sul Lavoro, 14",Presicce-Acquarica,,,,,,,,,,,
Torsello Giacinto Antonio,Elettricista,,0833 730002,"Corso Dante Alighieri, 79",Presicce-Acquarica,,,,,,,,,,,
