Nome Attività,Categoria,Sito Web,Telefono,Indirizzo,Comune,Provincia,Email,Protocollo,Tecnologia,Cookie Banner,Hosting Provider,Mobile Performance,Desktop Performance,Punteggio SEO,Disponibilità Sito,Stato Manutenzione
Bovino Ing. Angelo Raffaele,Ingegnere,,080 426 5687,"Via XXIV Maggio, 1",Polignano a Mare,,,,,,,,,,,
Sistemi Globali Sas Di Marinaccio Raffaele,Elettricista,,0881 981117,"Via Caporale Antonio Bonito, 47",Accadia,,,,,,,,,,,
LFA Impianti di Laganella Francesco Antonio,Elettricista,,0881 178 2697,"Piazza Scaramella, 18",Foggia,,,,,,,,,,,
Impiantistica Grassano,Elettricista,,338 122 8000,"Via Bartolo Longo, 9",San Severo,,,,,,,,,,,
Elettricista antennista TEKNOIMPIANTI,Elettricista,,320 853 3102,"Frazione Cerasito, 4",Frosolone,,,,,,,,,,,
TEKNOIMPIANTI di Matteo Erminio,Elettricista,,350 571 3841,"C.da Acqua Fredda, 2",Jelsi,,,,,,,,,,,
Soluzioni Elettriche,Elettricista,,340 370 3754,"Via Defensa, 5",Serracapriola,,,,,,,,,,,
Albano Impianti,Fornitore di impianti di riscaldamento,,328 119 3251,Via Padre Lorenzo,Volturino,,,,,,,,,,,
ELIS S.r.l Elettronica-Informatica-Sistemi Elettrici,Azienda informatica,http://www.elissrl.net/,0881 961478,"Via Florestano Rossomandi, 6",Bovino,,info@alissrl.net,http,React,No,Aruba S.p.A.,63,91,83.00,Sì,No
LPN IMPIANTI,Elettricista,,320 533 0833,"Via Marchese de Rosa, 9",Foggia,,,,,,,,,,,
Dnsystem,Elettricista,,333 202 4246,"Corso Giacomo Matteotti, 76",Torremaggiore,,,,,,,,,,,
Elettrica 2000 Di Salcone Raffaele & Vezzano Michele S.N.C.,Elettricista,,0882 331580,"Via Benevento, 8",San Severo,,,,,,,,,,,
Beta 2002 Srl,Elettricista,,0882 393379,"Via Michele Fuiano, 17",Torremaggiore,,,,,,,,,,,
ELETTROIMPIANTI di LUIGI MURGANO,Servizio di installazione elettrica,http://www.elettroimpiantimurgano.it/,328 908 9509,Corso Vittorio Emanuele,Lesina,,elettroimpiantimurgano@gmail.com,http,Joomla,No,Netsons s.r.l.,64,94,83.00,Sì,Sì
Impianti Elettrici Sergio Romano,Elettricista,http://www.sergioromanoimpianti.it/,0882 332819,"Via Brindisi, 248",San Severo,,,http,ASP.NET,No,Aruba S.p.A. Network,100,100,82.00,Sì,Sì
IMESD IMPIANTI ELETTRICI SALTARELLO DAVIDE,Elettricista,,340 164 7060,"Via Fuori Porta Annunziata, 87",Biccari,,,,,,,,,,,
D'Antuoni Impianti Di D'Antuoni Gianpietro,Elettricista,,328 007 5125,"Via Monsignor Giuseppe Stoico, 7",San Severo,,,,,,,,,,,
CEDDIAL S.R.L.,Elettricista,http://www.ceddial.com/,0882 334442,"Via S. Tempesta, Z.I",San Severo,,info@ceddial.com,http,Shopify,No,Aruba S.p.A.,50,54,85.00,Sì,No
A.M. impianti elettrici di Maiorino Alfonso,Elettricista,,329 611 5339,"Viale Checchia Rispoli, 159",San Severo,,,,,,,,,,,
Pepe Impianti,Elettricista,,0824 967886,"SP90, 13",San Bartolomeo In Galdo,,,,,,,,,,,
S.D.F. Impianti di Simone De Felice,Elettricista,,329 291 4990,"Via Cantiere, 23",Lesina,,,,,,,,,,,
Elettro2g impianti elettrici ed elettronici,Elettricista,,347 882 6660,"Via Alessandro Manzoni, 25",Biccari,,,,,,,,,,,
Angelillis Claudio,Negozio di forniture elettriche,,0882 646092,"Via Luigi Galasso, 42",Apricena,,,,,,,,,,,
Elettro Security,Elettricista,http://www.elettrosecurityimpianti.it/,329 075 3804,"Via Taranto, 201",San Severo,,info@elettrosecurityimpianti.it,http,WordPress,Sì,Aruba S.p.A.,62,49,85.00,Sì,Sì
Colacchio Antonio,Elettricista,https://colacchio-antonio.webnode.it/,329 495 1072,"Via Villafranca, 26",Torremaggiore,,contatto@esempio.it,https,Sitefinity,No,Amazon Technologies Inc.,65,97,100.00,Sì,Sì
Electric di Riccardo del Campo,Negozio di elettronica,,0884 88013,"Via A. Moro, 7/C",Cagnano Varano,,,,,,,,,,,
Ecoelectra Soc. Coop.,Elettricista,http://www.ecoelectra.it/,327 684 2290,"Via Michele Maitilasso, 2",Troia,,info@ecoelectra.it,http,WordPress,Sì,Aruba S.p.A.,39,47,85.00,Sì,No
Impiantistica Lamedica Srl,Elettricista,http://www.impiantisticalamedica.it/,0882 381442,"Corso Giacomo Matteotti, 214",Torremaggiore,,,http,React,No,Aruba S.p.A.,42,88,92.00,Sì,Sì
Elettronica Center di Columpsi Michele,Negozio di articoli per l'illuminazione,,335 525 4161,"Via Pescara, 10",Cagnano Varano,,,,,,,,,,,
Novatek Impiantistica,Servizio di installazione elettrica,,348 034 5365,"Via Michelangelo Manicone, 12",Vico del Gargano,,,,,,,,,,,
Intini Impianti,Elettricista,,371 330 9113,Via Giacomo Matteotti,Bari,,,,,,,,,,,
NB Elettrica,Servizio di installazione elettrica,,347 753 0494,"Via Archita, 3",Bari,,,,,,,,,,,
Electronic Cars,Officina per macchine,,327 193 0633,"Via G. Marconi, 64",Cagnano Varano,,,,,,,,,,,
Elettroimpianti Snc Di Novelli Pietro & C.,Elettricista,,0882 820034,"Contrada Monte Sacro, 4",Rignano Garganico,,,,,,,,,,,
POWER SOLUTION di Ritoli Michele,Elettricista,,370 150 9192,"Via Normandia, 16",San Nicandro Garganico,,,,,,,,,,,
Tecnobema S.r.l.,Elettricista,,347 752 1558,"Via Giovanni Battista Nenna, 14",Bari,,,,,,,,,,,
GF IMPIANTI di Gurgoglione Filippo,Elettricista,,392 670 1168,Via Giuseppe Impastato,San Giovanni Rotondo,,,,,,,,,,,
Unica s.n.c di Audrito e Candela,Elettricista,https://unicasnc.it/,339 630 5085,"Via Chambéry, 91",Torino,,,https,WordPress,No,Netsons s.r.l.,84,98,83.00,Sì,No
BOCCONE NICOLA IMPIANTI ELETTRICI ED ELETTRONICI,Elettricista,,080 321 8020,"Via Monte Nevoso, 17",Bari,,,,,,,,,,,
IMP IMPIANTI di Impagnatiello Pietro,Elettricista,,347 160 4866,"Viale Beccarini, 78",Manfredonia,,,,,,,,,,,
Tecnoimpianti Martella Francesco,Impresa di costruzioni,,348 397 9733,"Via Paolo Borsellino, 10",Vico del Gargano,,,,,,,,,,,
T.R.I.impianti,Elettricista,,338 954 2518,"m, Via Matteo Fraccacreta",Manfredonia,,,,,,,,,,,
Notarangelo Angelo,Elettricista,,0884 565179,"Via Manfredi, 40",Monte Sant'Angelo,,,,,,,,,,,
Ieva M Impianti s.r.l.,Idraulico,,339 448 1406,"Via Vittime Civili, 4",Carapelle,,,,,,,,,,,
Giambattista Francesco,Ferramenta,,0884 997432,"Via Roma, 171",Carpino,,,,,,,,,,,
Teknoelectri System srl,Elettricista,,0885 981155,"Largo Risorgimento, 25",Orta Nova,,,,,,,,,,,
Gravina Antonio,Elettricista,,0882 474525,"Via Cicerone, 114",San Nicandro Garganico,,,,,,,,,,,
Elettroimpiantistica di Boccasile Natale,Elettricista,https://www.elettroimpiantistica.it/,346 784 9606,"Via Caposele, 44",Trani,,,https,Basekit,No,Aruba S.p.A.,39,67,100.00,Sì,No
Elettroservice S.n.c.,Elettricista,https://www.elettroservicesnc.net/,0884 583060,"Via Torre de Angelis, 48/50",Manfredonia,,giovanni@elettroservicesnc.net,https,React,No,Aruba S.p.A.,56,61,73.00,Sì,Sì
Rovea Impianti,Elettricista,https://impiantirovea.it/,380 444 0022,"Via S. Giovanni Battista, 9",San Giovanni Rotondo,,saveriorovea@gmail.com,https,WordPress,Sì,Signet B.V.,53,81,85.00,Sì,Sì
De.Bi. Impianti Elettrici Di De Martino Luigi Foggia,Elettricista,,389 343 6903,"Via G. Galilei, 5",Carapelle,,,,,,,,,,,
Elettrica Armenise S.r.l.,Elettricista,https://armeniseimpianti.it/,080 964 3310,Traversa Al 8 di Via Modugno,Modugno,,info@armeniseimpianti.it,https,React,Sì,Google LLC,57,79,100.00,Sì,Sì
Dimensione System Services Srl,Automazione e robotica,http://dimensionesys.it/,351 017 4374,"Via Marconi, 2",Carapelle,,gravina.dimensione@gmail.com,http,WordPress,No,SEEWEB s.r.l.,76,98,83.00,Sì,No
LT Impianti Di Luca Trotta,Elettricista,,331 123 0522,"Viale Giuseppe di Vittorio, 38",Manfredonia,,,,,,,,,,,
Monaco Antonio,Elettricista,,0824 964041,"00 Contrada Sette Luci, San Bartolomeo In Galdo, BN 82028",San Bartolomeo in Galdo,,,,,,,,,,,
Due P Impianti,Elettricista,,0881 204669,"Via Pasquale Tarantino, 18",Foggia,,,,,,,,,,,
Sit Impianti,Elettricista,,345 721 8899,"Via Monte S. Michele, 30",Lucera,,,,,,,,,,,
FG IMPIANTI S.R.L.,Elettricista,http://www.fgimpianti.it/,0881 707564,"Via di Tressanti, 1",Foggia,,,http,ASP.NET,No,Aruba S.p.A. Network,74,99,91.00,Sì,No
Elettrica Service Citro srl,Elettricista,,0881 331100,"UFFICIO, Via Sandro Pertini, 3",Foggia,,,,,,,,,,,
Saem Impianti Srl,Fornitore di impianti industriali,http://www.saemimpianti.com/,0884 543381,Viale Antonio Meucci,Manfredonia,,info@saemimpianti.com,http,WordPress,Sì,OVH SAS,55,0,92.00,Sì,Sì
Della Santa Giovanni,Elettricista,,0881 972292,"Via Santa Maria, 58",Castelluccio Valmaggiore,,,,,,,,,,,
Elettro Store Service Di Savino Zanni,Elettricista,,0885 782039,"Via Foria, 43",Orta Nova,,,,,,,,,,,
Nuova Elettrica Snc Di Vassallo Antonio Remo Gagliardi Antonio E Sav,Elettricista,,0824 987331,"Via IV Novembre, 183",Pago Veiano,,,,,,,,,,,
Marotta SmartTechnology,Automazione e robotica,http://www.marottadomenico.it/,080 561 5919,"V.le del Concilio Vaticano II, 124/a",Bari,,info@marottadomenico.it,http,WordPress,Sì,Aruba S.p.A.,17,28,85.00,Sì,Sì
MASTRANDREA IMPIANTI,Elettricista,,339 111 5312,"Via Cesare Battisti, 1",Gravina in Puglia,,,,,,,,,,,
D.P. ELETTROIMPIANTI di Di Paola Giuseppe,Elettricista,,392 180 1988,Via Martiri,Ariano Irpino,,,,,,,,,,,
Ga Impianti Di Gervasio Antonio,Elettricista,,0885 792975,"Via Spagna, 9",Orta Nova,,,,,,,,,,,
Electric System di Racanelli Fedele,Elettricista,,333 484 9053,"Via Scesciola, 20",Sannicandro di Bari,,,,,,,,,,,
Nuova Impiantistica Di Minervini & C. S.D.F.,Elettricista,,0883 629960,"Via Giulio Pastore, 47",San Ferdinando di Puglia,,,,,,,,,,,
LAM Srl Impianti Tecnologici | Elettricista | Gravina in Puglia BA,Elettricista,http://www.lamimpianti.it/,338 993 9875,"Via Vincenzo Simone, 16",Gravina in Puglia,,info@lamimpianti.it,http,React,No,Aruba S.p.A.,57,72,100.00,Sì,Sì
Illumìnati Impianti Elettrici by A. Gatti,Elettricista,,339 465 6612,Via Guido Rossa,Santeramo In Colle,,,,,,,,,,,
GRUPPO CAMASTA,Elettricista,http://gruppocamasta.it/,335 704 7383,"SS96, km 115+703",Modugno,,info@gruppocamasta.it,http,WordPress,Sì,Aruba S.p.A.,56,75,92.00,Sì,Sì
Iacubino Angelo Mario,Negozio di elettronica,http://www.euronics.it/,0882 644192,"Via Principessa Maria Josè, 13",Apricena,,,http,React,No,"Cloudflare, Inc.",40,12,85.00,Sì,No
Edilelettrica di Pepe sante,Elettricista,,347 373 1176,"Via Papini Giovanni, 26c",Bitetto,,,,,,,,,,,
Elettrauto bernaudo antonio,Officina autoriparazioni,,0881 559688,"Via Aldo Moro, 76",Castelnuovo della Daunia,,,,,,,,,,,
Fomas Srl,Ferramenta,,0881 554182,"Via Giardino, 2A",Celenza Valfortore,,,,,,,,,,,
D.A. Elettronica Di Deidone' Andrea,Elettricista,https://www.daelettronica.it/,045 755 2868,"Via S. Lorenzo, 53",Castelnuovo del Garda,,,https,WordPress,No,SEEWEB s.r.l.,56,72,100.00,Sì,No
Geom. Panaggio Antonio,Geometra,,320 574 8937,"Via Cairoli, 118",Celenza Valfortore,,,,,,,,,,,
F.L. IMPIANTISTICA DI LUCIANO FUCCI,Elettricista,,349 066 5874,Piazza del Popolo,Squillani,,,,,,,,,,,
I.G. Impianti,Elettricista,,0824 967731,"Traversa I Sannio, 62",San Bartolomeo In Galdo,,,,,,,,,,,
General System S.R.L.,Elettricista,,0885 442837,"Vico VI Assunta, 11",Cerignola,,,,,,,,,,,
Carducci Pasquale,Elettricista,,0885 424841,"Via Napoli, 39",Cerignola,,,,,,,,,,,
SicurElectrika di Ladogana Ruggiero,Elettricista,,0885 415747,"Via Mulini Tonti, 30",Cerignola,,,,,,,,,,,
Elektra,Negozio di elettronica,,0885 420045,"Vicolo III Melfi, 6A",Cerignola,,,,,,,,,,,
Mastino Impianti Elettrici,Elettricista,,346 309 7689,"Via dei Tigli, 3",Cerignola,,,,,,,,,,,
Elettricità da Bellonio Anna,Negozio di forniture elettriche,,0885 427437,"Viale XXIV Maggio, 40",Cerignola,,,,,,,,,,,
ELETTROSOLVING SRL,Elettricista,http://www.elettrosolvingsrl.com/,080 321 0757,"BA, Via de Deo Emanuele, 12",Ruvo di Puglia,,amministrazione@elettrosolvingsrl.it,http,Shopify,Sì,Aruba S.p.A. Network,57,68,92.00,Sì,Sì
Electric Service,Negozio di forniture elettriche,,0885 414838,"Via Vittorio Veneto, 43",Cerignola,,,,,,,,,,,
Cm Impianti Di Mauro Chieti,Idraulico,,0885 421166,"Via D. Cirillo, 13",Cerignola,,,,,,,,,,,
Societa' Melchionda Srl,Negozio di articoli per l'illuminazione,,0885 426552,"Via Catania, 5",Cerignola,,,,,,,,,,,
Basile Domenico,Servizio componenti elettrici per auto,,0885 416579,"Via Pantanella, 34",Cerignola,,,,,,,,,,,
LADOGANA GROUP,Negozio di forniture elettriche,http://www.ladoganagroup.it/,0885 417878,Via Raffaele Tamma Z.I.,Cerignola,,,http,Joomla,No,Aruba S.p.A. Network,92,100,83.00,Sì,No
Massimiliano Gallicchio Elettromeccanica,Officina per la riparazione di utensili,,0885 422869,"Viale Luogosanto, 1",Cerignola,,,,,,,,,,,
Dr Cell di Esposito Giuseppe,Negozio di elettronica,,327 566 9038,"Via Fontana Nuova, 24",Deliceto,,,,,,,,,,,
Turchiarelli Luigi Impiantistica,Idraulico,,0881 963867,"Via S. Cristoforo, 19",Deliceto,,,,,,,,,,,
Imbrice,Idraulico,,0885 423513,"Viale di Ponente, 20",Cerignola,,,,,,,,,,,
Golden System Elettronica di P.I. Petito Alfredo,Impianto solare fotovoltaico,,0881 776430,"Via Gabriele Pepe, 23",Foggia,,,,,,,,,,,
Societa' El.C.I. Impianti - S.R.L.,Elettricista,,0881 682282,"Corso del Mezzogiorno, 21",Foggia,,,,,,,,,,,
Il Giglio Snc di Lamatrice e Del Tito Maria,Caseificio,,0881 963090,"Via Borgo, Via Gavitelle, 20",Deliceto,,,,,,,,,,,
Di. Gi. System,Negozio di allarmi e sistemi di sicurezza,,0885 414761,"Via Maddaloni, 37",Cerignola,,,,,,,,,,,
Fsc Electric Italy,Elettricista,,388 344 5430,Via Luigi Obertj,Foggia,,,,,,,,,,,
PRONTORAPIDO,Ditta specializzata in impianti di riscaldamento,http://www.prontorapido.it/,800 114 424,"Corso Scuola Agraria, 51C",Cerignola,,info@prontorapido.it,http,Basekit,No,Aruba S.p.A.,40,68,100.00,Sì,Sì
Tekno Impianti Srl Foggia,Appaltatore,,393 004 8296,"Via di Cave, 3",Foggia,,,,,,,,,,,
Elettro Co.An. S.R.L.S,Elettricista,,0881 203349,"Via delle Casermette, 40",Foggia,,,,,,,,,,,
Mecie S.r.l.,Elettricista,http://www.mecie.it/,0881 774746,"Via di S. Giuliano, 53",Foggia,,,http,ASP.NET,No,Aruba S.p.A. Network,75,96,91.00,Sì,No
"Giuseppe Piserchia ""Materiale Elettrico""",Negozio di forniture elettriche,,0881 741400,"Via Francesco Crispi, 56",Foggia,,,,,,,,,,,
Elettrotecnica Antonio Occulto,Elettricista,,0881 686001,"Via Giuseppe Rosati, 161",Foggia,,,,,,,,,,,
Costeldati Srl,Elettricista,,0881 757526,"Via Manfredonia, 33",Foggia,,,,,,,,,,,
Solenergy 2M,Impianto solare fotovoltaico,https://www.solenergy2m.it/,0885 413065,VIA MOSE' CONTE LOTTO 134/O,Cerignola,,info@solenergy2m.it,https,WordPress,Sì,Aruba S.p.A.,53,76,77.00,Sì,No
Nembrotte,Elettricista,http://www.nembrotte.it/,0881 615286,"Via Francesco Marinaccio, 24",Foggia,,nembrotte@nembrotte.it,http,Shopify,Sì,Aruba S.p.A.,51,67,100.00,Sì,No
PRONTO INTERVENTO FOGGIA,Elettricista,,0881 189 6375,"Via Marchese de Rosa, 9",Foggia,,,,,,,,,,,
ELETTROTECNICA IMPIANTI di Guido Tanzi,Elettricista,,328 088 4078,"Via Suor Maria Celeste Crostarosa, 13",Foggia,,,,,,,,,,,
Pappalardo Claudio,Negozio di forniture elettriche,,0881 688370,"Via dei Carbonari Dauni, 26",Foggia,,,,,,,,,,,
Ditta Pistillo Severo,Elettricista,,328 715 2781,"Via Trani, 113",San Severo,,,,,,,,,,,
Cagno S.r.l. di Cagno Silvio,Officina per la riparazione di motori elettrici,http://www.cagnosrl.it/,0881 746589,"Via di Salsola, 99 - 137-139",Foggia,,,http,Angular,No,Aruba S.p.A. Network,23,39,92.00,Sì,No
Teknoallarm di Pertosa Matteo,Elettricista,,330 436 160,"Via Giuseppe Zanardelli, 2",San Nicandro Garganico,,,,,,,,,,,
Elettra Srl,Negozio di forniture elettriche,https://elettrafoggia.com/,0881 723656,"Via delle Casermette, 1A",Foggia,,,https,WordPress,Sì,Aruba S.p.A.,69,94,100.00,Sì,No
Elektro home,Elettricista,,320 764 2838,"Via Pasquale Follieri, 52",Lucera,,,,,,,,,,,
Ferramenta Luigiotto Sas,Ferramenta,,0884 595559,"Via Alcide de Gasperi, 15",Mattinata,,,,,,,,,,,
MULTIMPIANTI,Elettricista,https://www.multimpianti.com/,333 502 4705,"Via Washington, 97",Lucera,,info@multimpianti.com,https,WordPress,No,Aruba S.p.A,67,92,92.00,Sì,No
Uria Elettromeccanica,Negozio di motori elettrici,,0884 482183,C.da parco della Chiesa,Ischitella,,,,,,,,,,,
Tekno Elettrodomest. Di Tricarico P,Negozio di elettrodomestici,,199 580 480,"via Giacomo Matteotti, 3",Ischitella,,,,,,,,,,,
Di Lella Girolamo,Servizio di riparazione di elettrodomestici,,0884 995505,"via alle Croci, 11",Ischitella,,,,,,,,,,,
Videocenter di Gentile Berardino,Servizio di riparazione di televisioni,http://www.videocentermattinata.it/,0884 559518,"Via Alcide de Gasperi, 47",Mattinata,,videocenter.gentile@virgilio.it,http,WordPress,No,SEEWEB s.r.l.,90,98,75.00,Sì,Sì
Berthoud Sas Ischitella • Edilizia & Riscaldamento,Fornitore di attrezzature per l'edilizia,,0884 195 0834,"via Giacomo Matteotti, snc",Ischitella,,,,,,,,,,,
Avel S.r.l.,Negozio di motori elettrici,http://www.avelsrl.it/,0884 995406,Contrada Pozzo Romondato,Ischitella,,info@avelsrl.it,http,ASP.NET,No,Aruba S.p.A. Network,67,92,83.00,Sì,No
Lepore Impianti Srl,Elettricista,http://www.leporeimpianti.it/,0875 726056,"Via dei Lecci, 22",Termoli,,info@leporeimpianti.it,http,Hugo,No,Amazon Technologies Inc.,69,0,100.00,Sì,Sì
Trotta Impianti,Elettricista,,347 837 0684,"Via Palmiro Togliatti, 33",Manfredonia,,,,,,,,,,,
GS - Materiale elettrico e illuminotecnica di Giuseppe Salvemini,Servizio di installazione elettrica,,0884 661551,"Viale Beccarini, 70",Manfredonia,,,,,,,,,,,
GBC Electronic Store Manfredonia,Negozio di elettronica,,0884 513296,"Viale Giuseppe di Vittorio, 35",Manfredonia,,,,,,,,,,,
Tecnoimpianti Di Rinaldi Leonardo,Idraulico,,0884 536672,"Via Tribuna, 88",Manfredonia,,,,,,,,,,,
Cistarill - Tomaiuolo Matteo,Negozio di forniture elettriche,,0884 581807,"Via Zara, 63",Manfredonia,,,,,,,,,,,
Mangano Impianti,Idraulico,http://manganoimpianti.it/,340 761 9990,"Vicolo Gorizia, 9",Manfredonia,,benedettomangano@gmail.com,http,WordPress,No,Netsons s.r.l.,64,73,83.00,Sì,Sì
Valerio Termo Service,Idraulico,,389 997 8615,"Via Cozzolete, 9",Manfredonia,,,,,,,,,,,
New Calor di Gelsomino Annalisa,Installatore di impianti di condizionamento,,366 387 4271,"Via Scaloria, 23/A",Manfredonia,,,,,,,,,,,
Ristrutturiamo Insieme,Impresa di costruzioni,,329 964 2049,"Viale Giuseppe di Vittorio, 38",Manfredonia,,,,,,,,,,,
Per.Ind.Bartolomeo Ortuso - Impianti Elettrici Civili Ed Industriali D,Elettricista,,0884 585836,"4 Viale dell' Industria, Manfredonia, FG 71043",Manfredonia,,,,,,,,,,,
PAGLIONE IMPIANTI Srl,Elettricista,http://www.paglioneimpianti.it/,0884 588667,Via S. Rocco,Manfredonia,,info@paglioneimpianti.it,http,WordPress,No,Aruba S.p.A. Network,67,90,92.00,Sì,No
Megad srl,Negozio di forniture elettriche,,0884 512063,"Via Bartolomeo D'Onofrio, 66",Manfredonia,,,,,,,,,,,
Riparazione elettrodomestici Ischitella | Assistenza elettrodomestici Fuori Garanzia SulSicuro,Servizio di riparazione di elettrodomestici,https://www.sulsicuro.it/riparazioni/foggia/,06 90244,"via Giacomo Matteotti, 3",Ischitella,,data_protection_emea@whirlpool.com,https,WordPress,No,Keliweb S.R.L,62,79,85.00,Sì,No
Diem - Impianti elettrici industriali e domestici,Elettricista,,348 392 5805,"Via Andrea Angiulli, 61",Bari,,,,,,,,,,,
Re.Mi. Impianti Di Renzullo M.,Elettricista,,0884 535026,"Via Martin Luther King, 12",Manfredonia,,,,,,,,,,,
Ferramenta E Materiali Edili Carmelo Volpe,Ferramenta,,0881 983246,"Via Mancini, 119",Monteleone di Puglia,,,,,,,,,,,
Granatiero Impianti,Azienda fornitrice di energia elettrica,https://www.granatieroimpianti.it/,347 988 4619,"Via Gargano, 224",Manfredonia,,granatieroimpianti@gmail.com,https,WordPress,Sì,Aruba S.p.A. Network,9,14,100.00,Sì,Sì
Dipergola Francesco Paolo,Elettricista,,0885 787062,"Via Quiriti, 3",Orta Nova,,,,,,,,,,,
Con Energia Monte Sant'Angelo,Azienda fornitrice di energia elettrica,http://www.conenergia.net/,800 333 822,"Piazza Mario di Leo, 2A",Monte Sant'Angelo,,inviobollettahera@doxee.com,http,React,Sì,"Amazon.com, Inc.",31,40,62.00,Sì,Sì
Pronto Elettricista Bari,Elettricista,,379 110 5220,Via Enrico Nannei,Bari,,,,,,,,,,,
Ma.Cri srl CR,Impresa di costruzioni,https://macrisrlcr.it/,331 492 9855,"Via Piscina Nuova, 1",Adelfia,,silvano.chiulli@libero.it,https,WordPress,No,Hostinger International Limited,73,93,92.00,Sì,No
A.N. Impianti Elettrici,Elettricista,,340 645 3669,Contrada Medichicchio,Poggiorsini,,,,,,,,,,,
Electroassist,Negozio per la riparazione dei cellulari,,348 799 6822,"Via Solferino, 3",Peschici,,,,,,,,,,,
Elettrotecnica Marrone & C. Snc,Elettricista,,080 530 3757,"Via Macchie, 11",Bari,,,,,,,,,,,
I.e.c.i.cavone & C.snc,Elettricista,,080 530 4995,"Via Lepore, 20",Bari,,,,,,,,,,,
Electric Planet di Barone Vito,Elettricista,,080 533 3272,"Via Napoli, 147",Bari,,,,,,,,,,,
Di Pinto S.r.l.,Elettricista,,080 536 7426,"Km. 118 Strada Statale 96, Modugno, BA 70026",Modugno,,,,,,,,,,,
P.M.IMPIANTI,Elettricista,http://pmimpiantielettrici.it/,320 648 3893,"Via Michele Tupputi, 16",Barletta,,,http,WordPress,No,Hetzner Online GmbH,81,95,100.00,Sì,Sì
FAZI S.R.L.,Elettricista,http://www.hidrosystem.it/,0885 437017,Via Dei Cinque Reali Siti Zona Artigianale,Stornarella,,,http,Joomla,Sì,Aruba S.p.A.,55,62,92.00,Sì,No
Gronik Impianti,Elettricista,,366 328 6622,"Via Tommaso Fiore, 28",Trinitapoli,,,,,,,,,,,
El.Pe Di Pedroncelli Luca,Elettricista,,080 530 0453,"Via Capitaneo, 34",Bari,,,,,,,,,,,
Penta System S.R.L.,Elettricista,https://pentasystem.org/,080 535 4741,Largo degli Scalpellini 6 - Zona Artigianale,Modugno,,info@pentasystem.org,https,React,No,Interoute Telecommunications (UK) Ltd,56,48,77.00,Sì,Sì
Parisi Francesco,Elettricista,,338 323 2382,"Traversa Privata prima, Viale Europa, di",Bitonto,,,,,,,,,,,
Sicurezza Impianti Cognetti Giuseppe,Ditta specializzata in impianti di condizionamento,,338 959 5577,"Corso Trinità, 4",Trinitapoli,,,,,,,,,,,
Elettromeccanica 2P di Petrosino E Poliseno snc,Elettricista,http://www.elettromeccanica2p.it/contatti/,080 535 3525,"Strada Provinciale Bari, Km. 0.800",Modugno,,info@elettromeccanica2p.it,http,WordPress,No,Aruba S.p.A.,77,97,85.00,Sì,No
ELE.MAC. | Impianti Elettrici e Fotovoltaici,Elettricista,,338 497 3406,"Via Don Luigi Sturzo, 2",Trinitapoli,,,,,,,,,,,
E.S.I. Impianti srl,Elettricista,http://www.esiimpiantisrl.it/,0883 679294,"Corso Vittorio Emanuele, 79",Margherita di Savoia,,,http,WordPress,Sì,Aruba S.p.A.,97,97,83.00,Sì,No
Tesla electric impianti s.r.l,Elettricista,https://teslaelectricimpianti.it/,328 358 9991,"Via Fratelli Cervi, 14",Trinitapoli,,teslaelectricimpiantisrl@gmail.com,https,Shopify,Sì,Netsons s.r.l.,68,92,100.00,Sì,Sì
Dig.e.sol. srls,Impianto solare fotovoltaico,http://digesol.com/,327 197 3949,"Via Martiri di Via Fani, 68",Trinitapoli,,info@digesol.com,http,WordPress,Sì,Netsons s.r.l.,67,87,92.00,Sì,Sì
Vi.Mar Elettrik Di Marino Ventura,Elettricista,,368 577 262,"Largo Labirinto, 25",Bisceglie,,,,,,,,,,,
Electronic System Car Di Giovanni Vitobello,Servizio componenti elettrici per auto,,0883 634503,"Via Don Luigi Sturzo, 10",Trinitapoli,,,,,,,,,,,
Imeltel,Produttore,https://www.imeltel.it/,0882 996147,"Via S. Severo, 36",Poggio Imperiale,,info@imeltel.it,https,Joomla,Sì,OVH SAS,56,65,92.00,Sì,No
Belcastro Impianti,Servizio di riparazioni idrauliche,,0884 965439,"via Palestro, 18",Rodi Garganico,,,,,,,,,,,
defelice elettrodomestici,Negozio di elettrodomestici,,347 658 5639,"Corso Madonna della Libera, 54",Rodi Garganico,,,,,,,,,,,
Italiangas Pietra Montecorvino,Fornitore di energia,http://www.italiangas.it/,0881 555089,"Via Roma, 61",Pietramontecorvino,,info@italiangas.it,http,ASP.NET,No,Aruba S.p.A.,59,78,85.00,Sì,No
De Felice,Servizio di riparazioni idrauliche,,0884 966360,"Via Pietro Nenni, 48",Rodi Garganico,,,,,,,,,,,
Murolo Impianti - Tecnologie Elettriche,Elettricista,http://www.muroloimpianti.it/,080 338 1696,"Via La Malfa, Parallela la Malfa Ugo, 1",Molfetta,,muroloimpiantionline@gmail.com,http,WordPress,No,Aruba S.p.A. Network,51,62,85.00,Sì,Sì
Martella Alfredo,Elettricista,,085 894 1173,"Via Albania, 1",Roseto degli Abruzzi,,,,,,,,,,,
E.s.a impianti snc di Soldani giulio,Elettricista,https://esaimpiantisnc.com/,080 392 1507,Via Sant'Andrea,Bisceglie,,,https,WordPress,Sì,Server Plan S.r.l.,54,70,85.00,Sì,No
Gruppo Elettrotecnica Di D'Alonzo Gabriele,Elettricista,,085 894 1217,"Via Mantegna, 60",Roseto degli Abruzzi,,,,,,,,,,,
elettrikpoint by LEVI s.r.l.s.,Elettricista,http://elettrikpoint.com/,0883 888537,Contrada Lamapaola AC (SP13 Andria-Bisceglie 3°Trav. Sx,Andria,,info@elettrikpoint.com,http,WordPress,Sì,IONOS SE,77,90,61.00,Sì,No
ELEKTRO IMPIANTI,Elettricista,,349 594 8471,"Via S. Donato, 26",San Giovanni Rotondo,,,,,,,,,,,
Speed Casa - Rodi Garganico,Servizi di ristrutturazione,http://www.speedcasa.com/le-nostre-sedi/foggia/rodi-garganico,0884 966629,"Corso Ruggero Bonghi, 14",Rodi Garganico,,segreteria@speedcasa.com,http,Vue,No,Planetel srl,57,70,92.00,Sì,Sì
D'ERRICO LEONARDO PIO,Negozio di elettronica,http://www.euronics.it/,0884 995208,"via Salvo d'Acquisto, 39",Ischitella,,,http,React,No,"Cloudflare, Inc.",35,14,85.00,Sì,No
Lo Sfizio Bazar,Ferramenta,,347 395 7472,"Corso Madonna della Libera, 4",Rodi Garganico,,,,,,,,,,,
Illuminazione S.B Multiservice Foggia,Negozio di articoli per l'illuminazione,,347 570 5561,"Via Piazza Vecchia, 10",Roseto Valfortore,,,,,,,,,,,
RO.MA. Assistenza di Rorro Mario - Servizio Assistenza Tecnica TV ed Elettrodomestici,Elettricista,,347 819 4754,"Via Alessandro Manzoni, 10",Monteverde,,,,,,,,,,,
Elettroinstallazioni Lungaro del PI Luciano Lungaro,Elettricista,,347 848 3459,"Via di Salsola, 151",Foggia,,,,,,,,,,,
Tecnoimpianti snc,Idraulico,,329 421 6356,Via Giovanni Amendola,San Marco in Lamis,,,,,,,,,,,
Di Silvestre Group srl,Servizio di installazione elettrica,https://www.disilvestregroup.com/,085 894 1769,"Via Macallè, 2/bis",Roseto degli Abruzzi,,info@disilvestregroup.com,https,React,Sì,Aruba S.p.A.,56,83,100.00,Sì,Sì
Tecno Impianti di Rotolo Pellegrino,Elettricista,,338 766 3424,"san, Via Calisi, 39A",San Marco dei Cavoti,,,,,,,,,,,
Spazio Enel Partner - San Marco in Lamis,Azienda fornitrice di energia elettrica,https://www.enel.it/spazio-enel/foggia/iti-service-srl/12493/,0882 405282,"Corso Giacomo Matteotti, 115",San Marco in Lamis,,,https,Hugo,Sì,Incapsula Inc,42,59,92.00,Sì,No
MW Impiantistica Generale s.r.l.,Elettricista,,347 852 8801,"Via della Vittoria, 79",San Marco in Lamis,,,,,,,,,,,
Assistenza H24 Roseto Capo Spulico,Idraulico,https://www.assistenzah24roseto.it/,340 095 6101,"Via Bari, 40",Borgata Marina,,assistenzaroh24roseto@gmail.com,https,React,No,Aruba S.p.A,64,90,92.00,Sì,No
