Nome Attività,Categoria,Sito Web,Telefono,Indirizzo,Comune,Provincia,Email,Protocollo,Tecnologia,Cookie Banner,Hosting Provider,Mobile Performance,Desktop Performance,Punteggio SEO,Disponibilità Sito,Stato Manutenzione
Angelillis Claudio,Negozio di forniture elettriche,,0882 646092,"Via Luigi Galasso, 42",Apricena,,,,,,,,,,,
Fomas Srl,Ferramenta,,0881 554182,"Via Giardino, 2A",Celenza Valfortore,,,,,,,,,,,
Geom. Panaggio Antonio,Geometra,,320 574 8937,"Via Cairoli, 118",Celenza Valfortore,,,,,,,,,,,
IMESD IMPIANTI ELETTRICI SALTARELLO DAVIDE,Elettricista,,340 164 7060,"Via Fuori Porta Annunziata, 87",Biccari,,,,,,,,,,,
Elettro2g impianti elettrici ed elettronici,Elettricista,,347 882 6660,"Via Alessandro Manzoni, 25",Biccari,,,,,,,,,,,
Elettrica 2000 Di Salcone Raffaele & Vezzano Michele S.N.C.,Elettricista,,0882 331580,"Via Benevento, 8",San Severo,,,,,,,,,,,
Monaco Antonio,Elettricista,,0824 964041,"00 Contrada Sette Luci, San Bartolomeo In Galdo, BN 82028",San Bartolomeo in Galdo,,,,,,,,,,,
Soluzioni Elettriche,Elettricista,,340 370 3754,"Via Defensa, 5",Serracapriola,,,,,,,,,,,
Pepe Impianti,Elettricista,,0824 967886,"SP90, 13",San Bartolomeo In Galdo,,,,,,,,,,,
TEKNOIMPIANTI di Matteo Erminio,Elettricista,,350 571 3841,"C.da Acqua Fredda, 2",Jelsi,,,,,,,,,,,
Nuova Elettrica Snc Di Vassallo Antonio Remo Gagliardi Antonio E Sav,Elettricista,,0824 987331,"Via IV Novembre, 183",Pago Veiano,,,,,,,,,,,
Impiantistica Grassano,Elettricista,,338 122 8000,"Via Bartolo Longo, 9",San Severo,,,,,,,,,,,
LFA Impianti di Laganella Francesco Antonio,Elettricista,,0881 178 2697,"Piazza Scaramella, 18",Foggia,,,,,,,,,,,
Albano Impianti,Fornitore di impianti di riscaldamento,,328 119 3251,Via Padre Lorenzo,Volturino,,,,,,,,,,,
LPN IMPIANTI,Elettricista,,320 533 0833,"Via Marchese de Rosa, 9",Foggia,,,,,,,,,,,
Due P Impianti,Elettricista,,0881 204669,"Via Pasquale Tarantino, 18",Foggia,,,,,,,,,,,
Elettro Co.An. S.R.L.S,Elettricista,,0881 203349,"Via delle Casermette, 40",Foggia,,,,,,,,,,,
I.G. Impianti,Elettricista,,0824 967731,"Traversa I Sannio, 62",San Bartolomeo In Galdo,,,,,,,,,,,
Elettrica Service Citro srl,Elettricista,,0881 331100,"UFFICIO, Via Sandro Pertini, 3",Foggia,,,,,,,,,,,
MEP di Pasquale Melezio TERMOIDRAULICA,Ferramenta,,333 546 9696,Piazza Giovanni Paolo II Papa,Ascoli Satriano,,,,,,,,,,,
Elettro Security,Elettricista,http://www.elettrosecurityimpianti.it/,329 075 3804,"Via Taranto, 201",San Severo,,info@elettrosecurityimpianti.it,http,WordPress,Sì,Aruba S.p.A.,62,50,85.00,Sì,Sì
F.L. IMPIANTISTICA DI LUCIANO FUCCI,Elettricista,,349 066 5874,Piazza del Popolo,Squillani,,,,,,,,,,,
Ecoelectra Soc. Coop.,Elettricista,http://www.ecoelectra.it/,327 684 2290,"Via Michele Maitilasso, 2",Troia,,info@ecoelectra.it,http,Joomla,Sì,Aruba S.p.A.,57,49,85.00,Sì,No
FG IMPIANTI S.R.L.,Elettricista,http://www.fgimpianti.it/,0881 707564,"Via di Tressanti, 1",Foggia,,,http,ASP.NET,No,Aruba S.p.A. Network,79,99,91.00,Sì,No
D.P. ELETTROIMPIANTI di Di Paola Giuseppe,Elettricista,,392 180 1988,Via Martiri,Ariano Irpino,,,,,,,,,,,
Sistemi Globali Sas Di Marinaccio Raffaele,Elettricista,,0881 981117,"Via Caporale Antonio Bonito, 47",Accadia,,,,,,,,,,,
Teknoelectri System srl,Elettricista,,0885 981155,"Largo Risorgimento, 25",Orta Nova,,,,,,,,,,,
"La Vecchia Service, srl a socio unico.",Elettricista,,0825 422263,"Contrada Beatrice 87, Bonito, AV 83032",Bonito,,,,,,,,,,,
Punto Edison Apricena (FG) - ENERLUCE - Business Partner,Azienda fornitrice di energia elettrica,https://www.edisonenergia.it/edison/assistenza/edison-store,0882 641721,"Via Avola, 18",Apricena,,assicurativiedisonenergia@pec.edison.it,https,Shopify,Sì,"Amazon.com, Inc.",36,39,85.00,Sì,Sì
Idrotermica di Ruggiero Giuseppe,Ditta specializzata in impianti di condizionamento,http://idrotermicaruggierogiuseppe.myadj.it/v/idrotermicaruggierogiuseppe,347 062 2112,Via San Nazario Zona Artigianale Lotto 46,Apricena,,,http,React,No,"Cloudflare, Inc.",78,97,92.00,Sì,Sì
GASCONTROL S.r.l.,Ditta specializzata in impianti di riscaldamento,https://www.gas-control.it/,0883 566703,"Corso Umberto I, 47",Ascoli Satriano,,,https,WordPress,No,"Cloudflare, Inc.",64,88,83.00,Sì,Sì
Elettric Systems di Angelo Ciccone,Elettricista,http://www.elettricsystems.com/,340 664 0675,"Via pianelle, 1",Teora,,,http,ASP.NET,No,Aruba S.p.A. Network,81,99,91.00,Sì,No
CEDDIAL S.R.L.,Elettricista,http://www.ceddial.com/,0882 334442,"Via S. Tempesta, Z.I",San Severo,,info@ceddial.com,http,WordPress,No,Aruba S.p.A.,40,52,85.00,Sì,No
D'Antuoni Impianti Di D'Antuoni Gianpietro,Elettricista,,328 007 5125,"Via Monsignor Giuseppe Stoico, 7",San Severo,,,,,,,,,,,
Elettroimpianti Snc Di Novelli Pietro & C.,Elettricista,,0882 820034,"Contrada Monte Sacro, 4",Rignano Garganico,,,,,,,,,,,
Beta 2002 Srl,Elettricista,,0882 393379,"Via Michele Fuiano, 17",Torremaggiore,,,,,,,,,,,
Dnsystem,Elettricista,,333 202 4246,"Corso Giacomo Matteotti, 76",Torremaggiore,,,,,,,,,,,
Della Santa Giovanni,Elettricista,,0881 972292,"Via Santa Maria, 58",Castelluccio Valmaggiore,,,,,,,,,,,
Elektro home,Elettricista,,320 764 2838,"Via Pasquale Follieri, 52",Lucera,,,,,,,,,,,
S.I.Tec s.r.l.,Elettricista,http://www.sitec.av.it/,0825 437143,Via Taverna di Annibale,Frigento,,info@sitec.av.it,http,Joomla,No,Aruba S.p.A.,65,81,92.00,Sì,Sì
Iacubino Angelo Mario,Negozio di elettronica,http://www.euronics.it/,0882 644192,"Via Principessa Maria Josè, 13",Apricena,,,http,React,No,"Cloudflare, Inc.",15,15,85.00,Sì,No
A.S.I. GLOBAL,Negozio di elettronica,https://www.asiglobal.it/,0825 801311,"Contrada Stratola, 1/C",Ariano Irpino,,,https,WordPress,No,Aruba S.p.A.,60,88,83.00,Sì,Sì
D.A. Elettronica Di Deidone' Andrea,Elettricista,https://www.daelettronica.it/,045 755 2868,"Via S. Lorenzo, 53",Castelnuovo del Garda,,,https,WordPress,No,SEEWEB s.r.l.,56,79,100.00,Sì,No
D&D IMPIANTI SOC.COOP.,Elettricista,,377 316 4442,"Via 8 Settembre, 71",San Vito dei Normanni,,,,,,,,,,,
Elettro Store Service Di Savino Zanni,Elettricista,,0885 782039,"Via Foria, 43",Orta Nova,,,,,,,,,,,
Impianti Elettrici Rigoli Snc,Elettricista,,0434 80107,"Via Carbona, 31",San Vito al Tagliamento,,,,,,,,,,,
System Impianti S R L,Elettricista,,0831 985407,"Via Giuseppe di Vagno, 59",San Vito dei Normanni,,,,,,,,,,,
Comune di Celle di San Vito,Municipio,,0881 972031,"Via Roma, 74",Celle di San Vito,,,,,,,,,,,
Berthoud Sas Ischitella • Edilizia & Riscaldamento,Fornitore di attrezzature per l'edilizia,,0884 195 0834,"via Giacomo Matteotti, snc",Ischitella,,,,,,,,,,,
Tekno Elettrodomest. Di Tricarico P,Negozio di elettrodomestici,,199 580 480,"via Giacomo Matteotti, 3",Ischitella,,,,,,,,,,,
Di.mer. S.r.l.,Elettricista,,0831 982771,"Via Regina Margherita, 19",San Vito dei Normanni,,,,,,,,,,,
DE NETTO FRANCESCO,Elettricista,,320 875 8117,"Via Dentice, 26",San Vito dei Normanni,,,,,,,,,,,
Elettrosanvitese S.r.l.,Elettricista,http://www.elettrosanvitese.it/,0434 81666,"Via Belvedere, 25/10",San Vito al Tagliamento,,info@elettrosanvitese.it,http,WordPress,No,OVH ISP,47,72,85.00,Sì,No
Electro Tech di Veneziano Salvatore,Elettricista,https://electrotech.altervista.org/,349 052 3051,"Via Fratelli Cervi, 38",Campomarino,,electro-tech@libero.it,https,WordPress,Sì,Hetzner Online GmbH,53,81,85.00,Sì,Sì
Punto Luce SRL,Elettricista,,0831 985582,"Via Carovigno, 22",San Vito dei Normanni,,,,,,,,,,,
Uria Elettromeccanica,Negozio di motori elettrici,,0884 482183,C.da parco della Chiesa,Ischitella,,,,,,,,,,,
Novatek Impiantistica,Servizio di installazione elettrica,,348 034 5365,"Via Michelangelo Manicone, 12",Vico del Gargano,,,,,,,,,,,
Elettrauto bernaudo antonio,Officina autoriparazioni,,0881 559688,"Via Aldo Moro, 76",Castelnuovo della Daunia,,,,,,,,,,,
Gaetani Impianti Elettrici,Elettricista,,347 655 5838,"Via Generale Galliano, 79",San Vito dei Normanni,,,,,,,,,,,
Di Lella Girolamo,Servizio di riparazione di elettrodomestici,,0884 995505,"via alle Croci, 11",Ischitella,,,,,,,,,,,
Impianti Elettrici SEI,Elettricista,http://www.impiantielettricisei.it/,0434 875605,"Viale S. Giovanni, 50",San Vito al Tagliamento,,info@impiantielettricisei.it,http,WordPress,No,OVH SAS,61,73,77.00,Sì,No
S.D.F. Impianti di Simone De Felice,Elettricista,,329 291 4990,"Via Cantiere, 23",Lesina,,,,,,,,,,,
L.P.G. Impianti s.a.s.,Elettricista,,333 324 5159,"Via Raffaele Mezzalingua, 25",San Martino in Pensilis,,,,,,,,,,,
POWER SOLUTION di Ritoli Michele,Elettricista,,370 150 9192,"Via Normandia, 16",San Nicandro Garganico,,,,,,,,,,,
Avel S.r.l.,Negozio di motori elettrici,http://www.avelsrl.it/,0884 995406,Contrada Pozzo Romondato,Ischitella,,info@avelsrl.it,http,ASP.NET,No,Aruba S.p.A. Network,67,96,83.00,Sì,No
ELETTROIMPIANTI di LUIGI MURGANO,Servizio di installazione elettrica,http://www.elettroimpiantimurgano.it/,328 908 9509,Corso Vittorio Emanuele,Lesina,,elettroimpiantimurgano@gmail.com,http,Joomla,No,Netsons s.r.l.,62,84,83.00,Sì,Sì
Elettrotecnica F.Lli Di Lello Luigi & C. Snc,Elettricista,,0875 67503,"Contrada Saracena, Petacciato, CB 86038",Petacciato,,,,,,,,,,,
Riparazione elettrodomestici Ischitella | Assistenza elettrodomestici Fuori Garanzia SulSicuro,Servizio di riparazione di elettrodomestici,https://www.sulsicuro.it/riparazioni/foggia/,06 90244,"via Giacomo Matteotti, 3",Ischitella,,data_protection_emea@whirlpool.com,https,WordPress,No,Keliweb S.R.L,62,80,92.00,Sì,No
Costeldati Srl,Elettricista,,0881 757526,"Via Manfredonia, 33",Foggia,,,,,,,,,,,
BIESSE,Servizio di installazione elettrica,,349 182 5434,"Via Michele Papa, 15",Foggia,,,,,,,,,,,
Esa System S.N.C. Di Franco Verrillo E Carlo Di Domenico,Elettricista,,0875 530461,"Via della Stazione, 23",Campomarino,,,,,,,,,,,
"Giuseppe Piserchia ""Materiale Elettrico""",Negozio di forniture elettriche,,0881 741400,"Via Francesco Crispi, 56",Foggia,,,,,,,,,,,
Elettrotecnica Antonio Occulto,Elettricista,,0881 686001,"Via Giuseppe Rosati, 161",Foggia,,,,,,,,,,,
ELETTROTECNICA IMPIANTI di Guido Tanzi,Elettricista,,328 088 4078,"Via Suor Maria Celeste Crostarosa, 13",Foggia,,,,,,,,,,,
C.E. Impianti Elettrici Industriali di Cauto Eligio,Elettricista,http://www.ceimpianti.com/,085 446 4059,"Via Caravaggio, 10/C",San Giovanni Teatino,,,http,Joomla,Sì,Server Plan S.r.l.,65,94,100.00,Sì,Sì
Societa' El.C.I. Impianti - S.R.L.,Elettricista,,0881 682282,"Corso del Mezzogiorno, 21",Foggia,,,,,,,,,,,
Mecie S.r.l.,Elettricista,http://www.mecie.it/,0881 774746,"Via di S. Giuliano, 53",Foggia,,,http,ASP.NET,No,Aruba S.p.A. Network,75,96,91.00,Sì,No
CORUZZI ELETTROSERVICE,Elettricista,,389 555 4708,"Via Benedetto Biagi, 9",Foggia,,,,,,,,,,,
Golden System Elettronica di P.I. Petito Alfredo,Impianto solare fotovoltaico,,0881 776430,"Via Gabriele Pepe, 23",Foggia,,,,,,,,,,,
Dr Cell di Esposito Giuseppe,Negozio di elettronica,,327 566 9038,"Via Fontana Nuova, 24",Deliceto,,,,,,,,,,,
Elettricista: Elettronica Impianti di Troia Cesario,Elettricista,,330 786 774,"Via Scevola Muzio, 28",Andria,,,,,,,,,,,
S.M.R.A. Frutteria Del 2000 Di Spano Massimo,Minimarket,,0881 969118,"Via Varco, 2",Deliceto,,,,,,,,,,,
Turchiarelli Luigi Impiantistica,Idraulico,,0881 963867,"Via S. Cristoforo, 19",Deliceto,,,,,,,,,,,
Il Giglio Snc di Lamatrice e Del Tito Maria,Caseificio,,0881 963090,"Via Borgo, Via Gavitelle, 20",Deliceto,,,,,,,,,,,
Nembrotte,Elettricista,http://www.nembrotte.it/,0881 615286,"Via Francesco Marinaccio, 24",Foggia,,nembrotte@nembrotte.it,http,Joomla,Sì,Aruba S.p.A.,43,72,100.00,Sì,Sì
Lepore Impianti Srl,Elettricista,http://www.leporeimpianti.it/,0875 726056,"Via dei Lecci, 22",Termoli,,info@leporeimpianti.it,http,Shopify,No,Amazon Technologies Inc.,77,90,100.00,Sì,Sì
SicurElectrika di Ladogana Ruggiero,Elettricista,,0885 415747,"Via Mulini Tonti, 30",Cerignola,,,,,,,,,,,
Carducci Pasquale,Elettricista,,0885 424841,"Via Napoli, 39",Cerignola,,,,,,,,,,,
Elettricità da Bellonio Anna,Negozio di forniture elettriche,,0885 427437,"Viale XXIV Maggio, 40",Cerignola,,,,,,,,,,,
Electric Service,Negozio di forniture elettriche,,0885 414838,"Via Vittorio Veneto, 43",Cerignola,,,,,,,,,,,
Mastino Impianti Elettrici,Elettricista,,346 309 7689,"Via dei Tigli, 3",Cerignola,,,,,,,,,,,
Di. Gi. System,Negozio di allarmi e sistemi di sicurezza,,0885 414761,"Via Maddaloni, 37",Cerignola,,,,,,,,,,,
PRONTO INTERVENTO FOGGIA,Elettricista,,0881 189 6375,"Via Marchese de Rosa, 9",Foggia,,,,,,,,,,,
Cagno S.r.l. di Cagno Silvio,Officina per la riparazione di motori elettrici,http://www.cagnosrl.it/,0881 746589,"Via di Salsola, 99 - 137-139",Foggia,,,http,Angular,No,Aruba S.p.A. Network,25,40,92.00,Sì,No
P & B FERRAMENTA,Ferramenta,,0881 963649,Contrada Tremoleto s.n.,Deliceto,,,,,,,,,,,
Lapige Srl,Negozio di forniture elettriche,,0885 428060,Via degli Acquaioli,Cerignola,,,,,,,,,,,
Elettronica Bisceglia Di Tommaso Bisceglia,Negozio di allarmi e sistemi di sicurezza,,0885 423030,"Via Corsica, 2",Cerignola,,,,,,,,,,,
Massimiliano Gallicchio Elettromeccanica,Officina per la riparazione di utensili,,0885 422869,"Viale Luogosanto, 1",Cerignola,,,,,,,,,,,
ELIS S.r.l Elettronica-Informatica-Sistemi Elettrici,Azienda informatica,http://www.elissrl.net/,0881 961478,"Via Florestano Rossomandi, 6",Bovino,,info@alissrl.net,http,React,No,Aruba S.p.A.,68,89,83.00,Sì,No
Elektra,Negozio di elettronica,,0885 420045,"Vicolo III Melfi, 6A",Cerignola,,,,,,,,,,,
General System S.R.L.,Elettricista,,0885 442837,"Vico VI Assunta, 11",Cerignola,,,,,,,,,,,
LADOGANA GROUP,Negozio di forniture elettriche,http://www.ladoganagroup.it/,0885 417878,Via Raffaele Tamma Z.I.,Cerignola,,,http,Joomla,No,Aruba S.p.A. Network,98,97,83.00,Sì,No
Imbrice,Idraulico,,0885 423513,"Viale di Ponente, 20",Cerignola,,,,,,,,,,,
Gravina Antonio,Elettricista,,0882 474525,"Via Cicerone, 114",San Nicandro Garganico,,,,,,,,,,,
Er.Al.Systems Srl,Elettricista,,0875 755280,"Via Corsica, 194",Termoli,,,,,,,,,,,
Comune di Isole Tremiti,Municipio,,0882 463063,"Piazza del Castello, 4",San Nicola di Tremiti,,,,,,,,,,,
Nuova Impiantistica Di Minervini & C. S.D.F.,Elettricista,,0883 629960,"Via Giulio Pastore, 47",San Ferdinando di Puglia,,,,,,,,,,,
PRONTORAPIDO,Ditta specializzata in impianti di riscaldamento,http://www.prontorapido.it/,800 114 424,"Corso Scuola Agraria, 51C",Cerignola,,info@prontorapido.it,http,Basekit,No,Aruba S.p.A.,44,70,100.00,Sì,Sì
Societa' Melchionda Srl,Negozio di articoli per l'illuminazione,,0885 426552,"Via Catania, 5",Cerignola,,,,,,,,,,,
Solenergy 2M,Impianto solare fotovoltaico,https://www.solenergy2m.it/,0885 413065,VIA MOSE' CONTE LOTTO 134/O,Cerignola,,info@solenergy2m.it,https,WordPress,Sì,Aruba S.p.A.,54,77,83.00,Sì,No
Ditta Pistillo Severo,Elettricista,,328 715 2781,"Via Trani, 113",San Severo,,,,,,,,,,,
D'ERRICO LEONARDO PIO,Negozio di elettronica,http://www.euronics.it/,0884 995208,"via Salvo d'Acquisto, 39",Ischitella,,,http,React,No,"Cloudflare, Inc.",39,11,85.00,Sì,No
De.Bi. Impianti Elettrici Di De Martino Luigi Foggia,Elettricista,,389 343 6903,"Via G. Galilei, 5",Carapelle,,,,,,,,,,,
A.M. impianti elettrici di Maiorino Alfonso,Elettricista,,329 611 5339,"Viale Checchia Rispoli, 159",San Severo,,,,,,,,,,,
Elettricista antennista TEKNOIMPIANTI,Elettricista,,320 853 3102,"Frazione Cerasito, 4",Frosolone,,,,,,,,,,,
Riserva naturale marina Isole Tremiti,Attrazione turistica,https://www.riservamarinaisoletremiti.it/,0884 568911,"Isole Tremiti, Puglia",Monte Sant'Angelo,,info@riservamarinaisoletremiti.it,https,Joomla,No,Aruba S.p.A.,43,35,85.00,Sì,Sì
Ieva M Impianti s.r.l.,Idraulico,,339 448 1406,"Via Vittime Civili, 4",Carapelle,,,,,,,,,,,
Carlà Lab Srl,Impianto solare fotovoltaico,http://www.carlalab.it/,0832 177 8264,"Via Olanda, 6",Zona Industriale,,info@carlalab.it,http,Basekit,No,Aruba S.p.A.,78,76,92.00,Sì,Sì
Maintenance Electrique Candela,Elettricista,,+33 6 38 76 97 20,14 Rue de la Source,Clapiers,,,,,,,,,,,
Da Elio Fish Bar&Restaurant,Locale specializzato in cocktail,,338 778 0187,"Via Giacomo Matteotti, Via 4 marzo, 1943",Villaggio San Domino,,,,,,,,,,,
Elettronica Center di Columpsi Michele,Negozio di articoli per l'illuminazione,,335 525 4161,"Via Pescara, 10",Cagnano Varano,,,,,,,,,,,
T.R.I.impianti,Elettricista,,338 954 2518,"m, Via Matteo Fraccacreta",Manfredonia,,,,,,,,,,,
Electronic Cars,Officina per macchine,,327 193 0633,"Via G. Marconi, 64",Cagnano Varano,,,,,,,,,,,
Giambattista Francesco,Ferramenta,,0884 997432,"Via Roma, 171",Carpino,,,,,,,,,,,
Unica s.n.c di Audrito e Candela,Elettricista,https://unicasnc.it/,339 630 5085,"Via Chambéry, 91",Torino,,,https,WordPress,No,Netsons s.r.l.,84,98,83.00,Sì,No
IMP IMPIANTI di Impagnatiello Pietro,Elettricista,,347 160 4866,"Viale Beccarini, 78",Manfredonia,,,,,,,,,,,
Marlintremiti,Negozio di attrezzature per immersioni,https://www.marlintremiti.com/,336 829 746,"Viale Amerigo Vespucci, snc",Isole Tremiti,,info@marlintremiti.com,https,Wix,Sì,Google LLC,20,67,100.00,Sì,No
Electric di Riccardo del Campo,Negozio di elettronica,,0884 88013,"Via A. Moro, 7/C",Cagnano Varano,,,,,,,,,,,
Per.Ind.Bartolomeo Ortuso - Impianti Elettrici Civili Ed Industriali D,Elettricista,,0884 585836,"4 Viale dell' Industria, Manfredonia, FG 71043",Manfredonia,,,,,,,,,,,
GF IMPIANTI di Gurgoglione Filippo,Elettricista,,392 670 1168,Via Giuseppe Impastato,San Giovanni Rotondo,,,,,,,,,,,
STE.PA TERMOTECNICA S.n.c.,Idraulico,,349 131 7707,"Via Inverse, 21",Castelluccio dei Sauri,,,,,,,,,,,
Rm Impianti,Appaltatore,,336 609 232,"Via Ammiraglio Vincenzo, Via Basilio Leone, 24",Castelluccio dei Sauri,,,,,,,,,,,
Elettroservice S.n.c.,Elettricista,https://www.elettroservicesnc.net/,0884 583060,"Via Torre de Angelis, 48/50",Manfredonia,,giovanni@elettroservicesnc.net,https,React,No,Aruba S.p.A.,56,62,73.00,Sì,Sì
LABOTEC & design - Geom. Antonio Di Maria - Arch. Nicola Orsogna,Geometra,,0881 515055,"Piazza Municipio, 19",Casalnuovo Monterotaro,,,,,,,,,,,
Materiali Elettrici E Tecnologie Avanzate,Elettricista,,081 1917 8231,"Via Nazionale delle Puglie, 110",Casalnuovo di Napoli,,,,,,,,,,,
Gronik Impianti,Elettricista,,366 328 6622,"Via Tommaso Fiore, 28",Trinitapoli,,,,,,,,,,,
ELE.MAC. | Impianti Elettrici e Fotovoltaici,Elettricista,,338 497 3406,"Via Don Luigi Sturzo, 2",Trinitapoli,,,,,,,,,,,
Electronic System Car Di Giovanni Vitobello,Servizio componenti elettrici per auto,,0883 634503,"Via Don Luigi Sturzo, 10",Trinitapoli,,,,,,,,,,,
Impiantistica Lamedica Srl,Elettricista,http://www.impiantisticalamedica.it/,0882 381442,"Corso Giacomo Matteotti, 214",Torremaggiore,,,http,WordPress,No,Aruba S.p.A.,47,96,92.00,Sì,Sì
Sicurezza Impianti Cognetti Giuseppe,Ditta specializzata in impianti di condizionamento,,338 959 5577,"Corso Trinità, 4",Trinitapoli,,,,,,,,,,,
Dig.e.sol. srls,Impianto solare fotovoltaico,http://digesol.com/,327 197 3949,"Via Martiri di Via Fani, 68",Trinitapoli,,info@digesol.com,http,WordPress,Sì,Netsons s.r.l.,68,84,92.00,Sì,Sì
Bonytech,Negozio di elettrodomestici,,389 987 3810,"Via Benevento, 30",Casalnuovo di Napoli,,,,,,,,,,,
M.C. Energytech,Impianto solare fotovoltaico,https://www.mcenergytech.com/,351 722 0604,"Via Circonvallazione, 27",Castelluccio dei Sauri,,info@mcenergytechsrls.com,https,Wix,No,Google LLC,0,0,0.00,Sì,Sì
Tecnoimpianti Martella Francesco,Impresa di costruzioni,,348 397 9733,"Via Paolo Borsellino, 10",Vico del Gargano,,,,,,,,,,,
Staffieri Elettronica Di Staffieri Fabio,Negozio,,0884 991784,"Via Palmiro Togliatti, 10",Vico del Gargano,,,,,,,,,,,
Del. Ve Impianti di Della Vella Leonardo | Idraulico Vico del Gargano,Idraulico,,349 076 6076,"Via Alcide de Gasperi, 17",Vico del Gargano,,,,,,,,,,,
Ferrante Elettrodomestici,Negozio di elettronica,,0884 993621,"Via G. di Vagno, 9",Vico del Gargano,,,,,,,,,,,
Tesla electric impianti s.r.l,Elettricista,https://teslaelectricimpianti.it/,328 358 9991,"Via Fratelli Cervi, 14",Trinitapoli,,teslaelectricimpiantisrl@gmail.com,https,Shopify,Sì,Netsons s.r.l.,69,92,100.00,Sì,Sì
Biccari G.,Elettricista,,360 826 153,"Via Garibaldi, 89",Margherita di Savoia,,,,,,,,,,,
E.S.I. Impianti srl,Elettricista,http://www.esiimpiantisrl.it/,0883 679294,"Corso Vittorio Emanuele, 79",Margherita di Savoia,,,http,WordPress,Sì,Aruba S.p.A.,93,94,83.00,Sì,No
Autofficina riparazione camper Di Carlo,Officina di riparazione camper,,347 188 5847,"SS89, 7",Vieste,,,,,,,,,,,
Autofficina di Dicarlo Matteo & Michele,Officina autoriparazioni,,0884 272449,"Contrada Coppitella, 7/c",Vieste,,,,,,,,,,,
Notarangelo Angelo,Elettricista,,0884 565179,"Via Manfredi, 40",Monte Sant'Angelo,,,,,,,,,,,
Fsc Electric Italy,Elettricista,,388 344 5430,Via Luigi Obertj,Foggia,,,,,,,,,,,
Vi.Mar Elettrik Di Marino Ventura,Elettricista,,368 577 262,"Largo Labirinto, 25",Bisceglie,,,,,,,,,,,
Auto Latino,Centro per la revisione tecnica delle auto,http://www.autolatino.it/,0884 708312,"Via Sottotenente Girolamo de Maria, 5",Vieste,,autolatino@tiscali.it,http,WordPress,No,Server Plan S.r.l.,60,82,100.00,Sì,Sì
FAZI S.R.L.,Elettricista,http://www.hidrosystem.it/,0885 437017,Via Dei Cinque Reali Siti Zona Artigianale,Stornarella,,,http,WordPress,Sì,Aruba S.p.A.,55,67,92.00,Sì,No
LT Impianti Di Luca Trotta,Elettricista,,331 123 0522,"Viale Giuseppe di Vittorio, 38",Manfredonia,,,,,,,,,,,
P.M.IMPIANTI,Elettricista,http://pmimpiantielettrici.it/,320 648 3893,"Via Michele Tupputi, 16",Barletta,,,http,React,No,Hetzner Online GmbH,82,95,100.00,Sì,Sì
Elettroimpiantistica di Boccasile Natale,Elettricista,https://www.elettroimpiantistica.it/,346 784 9606,"Via Caposele, 44",Trani,,,https,Basekit,No,Aruba S.p.A.,62,69,100.00,Sì,No
Borgia Giovanni,Elettricista,,0833 873532,"Via Regina Elena, 24",Nardò,,,,,,,,,,,
Saem Impianti Srl,Fornitore di impianti industriali,http://www.saemimpianti.com/,0884 543381,Viale Antonio Meucci,Manfredonia,,info@saemimpianti.com,http,React,Sì,OVH SAS,55,63,92.00,Sì,Sì
STUDIO TECNICO ing. Frattulino,Ingegnere,http://www.frattulino.it/,329 777 7061,"Viale Giovanni Gentile, 85",Foggia,,,http,ASP.NET,No,Aruba S.p.A. Network,84,99,100.00,Sì,No
Comune di Ordona,Municipio,,0885 796221,Piazza Aldo Moro,Ordona,,,,,,,,,,,
Impianti elettrici Bari - Piepoli Impianti Elettrici - Elettricista Bari,Elettricista,,338 532 7891,"Via Marraffa, 16",Alberobello,,,,,,,,,,,
"Studio Ispe. Certificati Verifiche Impianti Elettrici D.P.R.462/01,S.T.P./Perizie Attività Professionale",Perito misuratore,,379 184 260,Via Mendel,Alberobello,,,,,,,,,,,
DI.MA. Impianti & Costruzioni,Elettricista,,080 459 3084,"Via Vittorio Veneto, 92",Adelfia,,,,,,,,,,,
A E I Impianti Elettrici Alberobello Srl,Elettricista,,080 432 2896,"Via Domenico Aversa, 13",Alberobello,,,,,,,,,,,
Iurilli Impianti,Elettricista,,080 459 1826,"Via Vittorio Veneto, 82",Adelfia,,,,,,,,,,,
Pronto Elettricista Bari,Elettricista,,379 110 5220,Via Enrico Nannei,Bari,,,,,,,,,,,
F.lli Cassano S.r.l.,Elettricista,,347 777 0649,"Via Conella, 27",Adelfia,,,,,,,,,,,
Tekno Impianti Srl Foggia,Appaltatore,,393 004 8296,"Via di Cave, 3",Foggia,,,,,,,,,,,
BOCCONE NICOLA IMPIANTI ELETTRICI ED ELETTRONICI,Elettricista,,080 321 8020,"Via Monte Nevoso, 17",Bari,,,,,,,,,,,
Biscardi Tommaso,Elettricista,,080 504 3655,"Via Grimoaldo degli Alfaraniti, 22",Bari,,,,,,,,,,,
Elettroimpianti Di Ricco Luigi,Elettricista,,080 553 3167,"Via dei Mille, 48",Bari,,,,,,,,,,,
El.Pe Di Pedroncelli Luca,Elettricista,,080 530 0453,"Via Capitaneo, 34",Bari,,,,,,,,,,,
Tecnobema S.r.l.,Elettricista,,347 752 1558,"Via Giovanni Battista Nenna, 14",Bari,,,,,,,,,,,
Lopedote,Elettricista,,080 524 7481,"Via Nicola de Giosa, 105-105/A",Bari,,,,,,,,,,,
Ma.Cri srl CR,Impresa di costruzioni,https://macrisrlcr.it/,331 492 9855,"Via Piscina Nuova, 1",Adelfia,,silvano.chiulli@libero.it,https,React,No,Hostinger International Limited,66,96,92.00,Sì,No
Eletrikimpianti Di Giovanni Greco Srl,Elettricista,,080 553 4001,"Via delle Medaglie d`Oro, 2",Bari,,,,,,,,,,,
Center Elettric Professional,Elettricista,,080 553 9438,"Via Enrico Nannei, 10",Bari,,,,,,,,,,,
Elettr.Di Giovinazzo Rocco Via Vitt.Veneto 168 Adelfia,Elettricista,,080 459 4498,"Via Vittorio Veneto, 168",Adelfia,,,,,,,,,,,
Uemme Impianti Elettrici,Elettricista,https://uemmeimpianti.com/,377 555 9743,"V.le Antonio Meucci, 12",Bari,,info@uemmeimpianti.it,https,Shopify,Sì,Aruba S.p.A.,69,89,85.00,Sì,Sì
Elettrotecnica Italiana Smart,Elettricista,https://elettrotecnicasmart.it/,392 987 1327,"Via Gino Strada, 16",Bari,,eismart@pec.it,https,Joomla,Sì,Interoute Telecommunications (UK) Ltd,56,87,85.00,Sì,Sì
Tommaso La Bottega Dell’Elettricista,Elettricista,,320 644 4435,"Via Municipio, 37",Bari,,,,,,,,,,,
Phoenix Elettronica s.a.s. di De Leonardis Emilio,Elettricista,http://www.phoenixelettronica.net/,335 634 9428,"Via Papa Innocenzo XII, 19",Bari,,info@phoenixelettronica.net,http,ASP.NET,No,Seeweb s.r.l,87,100,100.00,Sì,Sì
Elettricità Lamacchia,Elettricista,http://elettricitalamacchia.wix.com/elettricitalamacchia,080 523 2188,"Via Quintino Sella, 15",Bari,,,http,Wix,No,Google LLC,78,98,36.00,No - Pagina Non Trovata (404),No
I.E.M. Di Cozzoli Simone,Elettricista,,080 310 6818,"Via Ricovero di Mendicita', 93",Altamura,,,,,,,,,,,
Elettrica Murgia di Terranova Michele,Elettricista,,389 115 0345,"Via Termoli, 84",Altamura,,,,,,,,,,,
Euro Assistance Elettromeccanica,Elettricista,,080 314 9602,"Via della Roverella, 46",Altamura,,,,,,,,,,,
Intini Impianti,Elettricista,,371 330 9113,Via Giacomo Matteotti,Bari,,,,,,,,,,,
Elettrica Leader S.R.L.,Elettricista,,080 314 1377,"Contrada, Via Bersaglio",Altamura,,,,,,,,,,,
Impianti Elettrici di Chironna Tommaso,Elettricista,,360 371 884,"Via Tommaso Grossi, 45",Altamura,,,,,,,,,,,
Gallo Michele Michele,Elettricista,,338 197 6109,"Via Helsinki, 8",Altamura,,,,,,,,,,,
Elettrica Cicirelli Srl,Elettricista,http://www.elettricacicirelli.it/,080 310 5812,"Via dell’Ortica, 10",Altamura,,info@elettricacicirelli.it,http,WordPress,No,IT.Gate S.p.A.,74,83,92.00,Sì,Sì
bp Elettrica,Elettricista,https://www.bpelettrica.com/,080 432 2878,"Viale Luigi Einaudi, 53",Alberobello,,,https,React,Sì,Aruba S.p.A.,55,74,92.00,Sì,Sì
