Nome Attività,Categoria,Sito Web,Telefono,Indirizzo,Comune,Provincia,Email,Protocollo,Tecnologia,Cookie Banner,Hosting Provider,Mobile Performance,Desktop Performance,Punteggio SEO,Disponibilità Sito,Stato Manutenzione
Paladini Raffaele,Idraulico,,0832 606216,"Via Veglie, 19",Carmiano,,,,,,,,,,,
TC IMPIANTI di Toma Cosimo,Idraulico,,347 736 9209,Via C.da Varna,Ruffano,,,,,,,,,,,
Idrotech srls,Fornitore di attrezzature per l'energia solare,https://www.idrotechonline.it/,0833 583905,"Via Roma, 66",Racale,,,https,Joomla,Sì,Host SpA,49,77,92.00,Sì,No
Rci Climasistemi srl,Ditta specializzata in impianti di condizionamento,,0833 583316,"Via Enrico Mattei, 19",Racale,,,,,,,,,,,
Hydrotherm Di Emanuele Giudice,Idraulico,,0833 690046,"Via Luigi Cadorna, 23",Ruffano,,,,,,,,,,,
Calema | Pompe di Calore Fotovoltaico Infissi,Idraulico,http://www.calemacasa.it/,0832 181 6081,"Via Giovanni Boccaccio, 2",Arnesano,,info@calemacasa.it,http,React,No,Server Plan S.r.l.,52,90,100.00,Sì,No
DR TERMOLUX,Idraulico,,327 701 9433,Via della Vela,Tricase,,,,,,,,,,,
Puce Impianti Di Sandro Puce,Idraulico,,338 758 7703,"Via XXI Aprile, 51",Maglie,,,,,,,,,,,
Sergimpianti. Di sergi Rocco,Installatore di impianti a gas,,328 822 5777,"Via Vecchia per Tricase, 13",Andrano,,,,,,,,,,,
Euro Impianti Di De Bene Andrea,Idraulico,,0836 818620,"Via Vittorio Emanuele II, 48",Minervino di Lecce,,,,,,,,,,,
GP Idraservice,Idraulico,,338 769 5385,"Contrada Barba d'Angelo, 100/1B",Andria,,,,,,,,,,,
Caputo Rocco Impianti Idrotermici,Fornitore di impianti di riscaldamento,,0833 587627,"Via Felline, 130",Melissano,,,,,,,,,,,
Blanco Rocco,Idraulico,,0833 282065,"Via Solferino, 67",Alezio,,,,,,,,,,,
Botrugno,Idraulico,,0836 483718,"Via G. Mangionello, 49",Maglie,,,,,,,,,,,
Letizia Maurizio,Idraulico,,0832 823222,"Via Luciano Manara, 10",Caprarica di Lecce,,,,,,,,,,,
Idrotermica Di Calo' Concetto,Idraulico,,329 819 7759,"23, Via Antonio, Via A. Pellegrino",Zollino,,,,,,,,,,,
Guglielmo Costruzioni (S.R.L.),Impresa di costruzioni,,0836 318023,"Via Antonio Gramsci, 4",Cannole,,,,,,,,,,,
Urso Cosimo Damiano,Idraulico,,0836 901898,"Viale Giovanni Capreoli, 220",Poggiardo,,,,,,,,,,,
Bray Fabio e Marco Assistenza Caldaie,Idraulico,,0832 801101,"Via Cesare Battisti, 12",Martignano,,,,,,,,,,,
Scanderebech Ferramenta Edilizia Colorificio Idraulica,Ferramenta,https://scandecasa.it/,348 895 2892,"Via Melissano, n 43",Felline,,,https,React,Sì,Infomaniak Network Management,56,48,100.00,Sì,Sì
Aquaman Impianti di Cirillo Sacha,Idraulico,,347 768 6116,"Piazzetta Arturo Toscanini, 5",Lecce,,,,,,,,,,,
Calo' Fernando,Idraulico,,0832 654071,"Via Camillo Benso Conte di Cavour, 68",Lizzanello,,,,,,,,,,,
Idrotermica Conte Srl,Idraulico,,0832 612867,"Via Caprarica, 119",Cavallino,,,,,,,,,,,
"Todaro Group SRL impianti , ristrutturazioni",Elettricista,http://www.ediltodaro.it/,320 151 1583,"Via Fratelli Bandiera, 16",Alezio,,info@todarogroup.it,http,React,Sì,Aruba S.p.A.,56,69,100.00,Sì,Sì
C.A. Impianti Tecnologici Srl,Elettricista,,0836 318978,"Via Alcide De Gasperi, 51",Cannole,,,,,,,,,,,
HYDROTECH IMPIANTI IDRAULICI,Idraulico,,329 291 7228,"Via Gioacchino Toma, 44",Galatina,,,,,,,,,,,
Franco Mauro Termoidraulica,Idraulico,,389 998 0226,"Via Puglia, 2",Cavallino,,,,,,,,,,,
TERMOTECNICA TRAZZA,Idraulico,,347 690 4140,"Via S. Francesco D'Assisi, 60",Muro Leccese,,,,,,,,,,,
CGMIMPIANTI,Idraulico,,351 621 9918,"Via Bari, 9",Sternatia,,,,,,,,,,,
Carrozzo Impianti Di Marco Carrozzo,Idraulico,,328 765 6804,"Via S. Nicola, 32",Melendugno,,,,,,,,,,,
MP IDROTERMO di Muscatello Pasquale,Idraulico,,320 752 5398,"Via Giovan Battista Vico, 32",Soleto,,,,,,,,,,,
Calò Giuseppe Luigi,Idraulico,https://calogiuseppeluigi.altervista.org/,333 528 7332,"Via Pasubio, 11",Carpignano Salentino,,calogimpianti@gmail.com,https,WordPress,Sì,Hetzner Online GmbH,82,96,100.00,Sì,Sì
SPIRITO CLIMA SERVICE- GIOVANNI SPIRITO,Ditta specializzata in impianti di riscaldamento,,0836 428221,"Via Cesare Battisti, 49",Maglie,,,,,,,,,,,
Marrocco My Service,Idraulico,,339 175 5333,"Via Giuseppe Mazzini, 36",Maglie,,,,,,,,,,,
Termoimpianti,Ditta specializzata in impianti di riscaldamento,,333 401 1361,Piazza SS. Medici,Maglie,,,,,,,,,,,
Idraulico Elettricista,Consulente ingegneristico,http://idraulicoelettricista.com/,338 100 3568,"Via Japigia, 45",Corigliano d'Otranto,,,http,ASP.NET,No,Aruba S.p.A. Network,85,99,82.00,Sì,No
IDROTERMICA di Maggiulli Francesco,Idraulico,,329 545 0922,"Via Cimarosa Domenico, 13",Lecce,,,,,,,,,,,
Ceramiche Magurano,Negozio di ceramiche,,0836 318128,"Via A. Gramsci, 2",Bagnolo del Salento,,,,,,,,,,,
SA Impianti,Installatore di impianti a gas,,349 537 4978,"Corso XX Settembre, 54",Casarano,,,,,,,,,,,
CAR Termoidraulica,Idraulico,,340 516 6414,"Via Luigi Settembrini, 1",Casarano,,,,,,,,,,,
Paolo Ingrosso - Assistenza Caldaie Beretta,Idraulico,https://www.paoloingrossosrl.it/,0832 348801,"Via Giosuè Carducci, 2",Cavallino,,info@paoloingrossosrl.it,https,WordPress,No,Aruba S.p.A.,60,64,85.00,Sì,Sì
Mar Impianti S.r.l.,Idraulico,http://www.marimpianti.it/,0833 502617,"Via Bellini, 115",Casarano,,info@marimpianti.it,http,ASP.NET,No,Aruba S.p.A. Network,96,100,83.00,Sì,No
L'idraulica di Scorrano Luigi,Idraulico,,339 684 5788,"Via Adda, 7",Casarano,,,,,,,,,,,
Perrone Rocco,Fornitore di materiali da costruzione,,0833 505745,"Via Circonvallazione Est, Casarano, Le 73042",Casarano,,,,,,,,,,,
Climazon,Fornitore di impianti di riscaldamento,https://climatizzazionecapannoni.it/,0833 169 4005,"Via Zara, 12",Casarano,,info@tecsaving.com,https,ASP.NET,Sì,Google LLC,51,81,100.00,Sì,No
Mazzeo Impianti Di Andrea Mazzeo,Idraulico,,0833 504250,"Via Agnesi Cda Pigna, 5",Casarano,,,,,,,,,,,
Pagliara Impianti,Elettricista,http://www.pagliaraimpianti.it/,334 976 0233,Via E. de Filippo,Campi Salentina,,info@pagliaraimpianti.it,http,WordPress,No,Aruba S.p.A.,35,70,92.00,Sì,Sì
Tecnomat,Negozio di materiali da costruzione,,02 8390 5463,"Via Vecchia S. Donato, snc",Cavallino,,,,,,,,,,,
As Protecdi Alessandro Serio,Idraulico,,328 615 8110,"Via Abruzzi, 3",Campi Salentina,,,,,,,,,,,
'Pulli Silvia' di Colonna Andrea,Fornitore di impianti di riscaldamento,http://www.pullisilvia.it/,0832 183 1343,"Via Pietragrossa, 2",Carmiano,,info@pullisilvia.it,http,Hugo,Sì,Host SpA,48,86,83.00,Sì,No
Memmi Rocco,Idraulico,,0833 599610,"Viale Stazione, 31",Casarano,,,,,,,,,,,
Pezzuto - Idro Termo Clima - Filiale Casarano,Negozio di forniture idrauliche,https://www.pezzuto.it/,0832 240041,"Viale Cavaliere del lavoro Antonio Filograna, Lotto 9",Casarano,,,https,React,Sì,Passepartout s.a.,69,66,73.00,Sì,No
Doria Vito,Idraulico,,0832 826587,"Piazza Municipio, 6",Castri di Lecce,,,,,,,,,,,
Hp service-impianti,Elettricista,,328 419 9905,"Via Vincenzo Bellini, 106",Castri di Lecce,,,,,,,,,,,
Rigliaco Gianni,Idraulico,,0833 346064,"Via Consiglia Pesce, 66",Collepasso,,,,,,,,,,,
Idropoint Morciano,Fornitore di impianti di riscaldamento,,0833 744029,"Via F.lli Bandiera, 4",Morciano di Leuca,,,,,,,,,,,
Bortoluzzi Giuliano,Idraulico,,041 530 1941,"Via Fines, 5",Cavallino-Treporti,,,,,,,,,,,
De Iacob Vincenzo,Idraulico,,0836 589257,"Via Vittorio Emanuele, 38",Castrignano De' Greci,,,,,,,,,,,
"Assistenza caldaie, Sanitrit e climatizattori a Napoli - Tecnoservice",Ditta specializzata in impianti di riscaldamento,https://www.caldaieecondizionatori.com/,328 767 8096,"Via Bernardo Cavallino, 61/D",Napoli,,info@tecnoservicenapoli.it,https,Duda,No,Aruba S.p.A.,67,76,100.00,Sì,Sì
Rosato Alfredo,Idraulico,,0832 823408,"Viale Risorgimento, 13",Castri di Lecce,,,,,,,,,,,
Castrí Impianti Di Castrí Claudio,Idraulico,https://www.castriimpianti.it/,320 687 5711,"Via Edmondo de Amicis, 5",Matino,,info@castriimpianti.it,https,WordPress,No,Hetzner Online GmbH,79,99,100.00,Sì,Sì
Impiantistica Ria Enrico,Elettricista,,338 545 2366,"Via Risorgimento, 33",Collepasso,,,,,,,,,,,
Simoservice Società Cooperativa Sociale,Idraulico,,376 157 2591,"Via Casaranello, 8",Casarano,,,,,,,,,,,
Clark,Negozio di forniture idrauliche,http://www.clarksrl.it/,0833 593059,"Lotto, Via dei Commercianti, 22/23, 16/17, Snc",Zona P.i.p.,,info@clarksrl.it,http,WordPress,No,Host SpA,55,50,85.00,Sì,No
Pettenò Impianti,Ditta specializzata in impianti di riscaldamento,http://www.pettenoimpianti.it/,041 966935,"Via Cividale, 17",Cavallino-Treporti,,info@pettenoimpianti.it,http,WordPress,No,Aruba S.p.A.,56,79,77.00,Sì,Sì
Pelle' Massimo,Idraulico,,328 908 3639,"Via Giuseppe Mazzini, 53",Castri di Lecce,,,,,,,,,,,
Ferramenta F.lli Vantaggiato s.n.c,Ferramenta,https://ferramentavantaggiato.com/,0833 345595,"Via Principe di Piemonte, 196",Collepasso,,info@ferramentavantaggiato.com,https,WordPress,No,Netsons s.r.l.,51,30,100.00,Sì,No
Maar Impianti Di Serafino Mario,Idraulico,,349 422 0571,"Via A. Manzoni, 63 B",Tiggiano,,,,,,,,,,,
La termoidraulica snc di Costantini G. e Battagliarin M.,Idraulico,https://www.daikin.it/it_it/punti-vendita/la-termoidraulica-snc-di-costantini.html,041 530 1266,"Via Vienna, 15",Ca' Savio,,latermoidraulica66@gmail.com,https,Hugo,No,"Fastly, Inc.",36,35,92.00,Sì,No
Luce E Calore-Piccola Soc. Cop. A Rl,Idraulico,,0836 427496,"Via A. De Ferraris, 48",Maglie,,,,,,,,,,,
Idrotermica Calabra S.r.l. - Lupinacci Gennaro,Idraulico,,351 804 2179,"Via Metaponto, 69",Corigliano Scalo,,,,,,,,,,,
Luchena Impianti Professionali,Consulente,https://www.luchenaimpianti.it/,339 737 2945,"Via Enrico de Nicola, 49",CORIGLIANO D'OTRANO,,info@luchenaimpianti.it,https,WordPress,Sì,Aruba S.p.A. Network,62,79,85.00,Sì,No
Euroimpianti Di Basso Fabio,Idraulico,,347 655 5720,"Via Po, 47",Copertino,,,,,,,,,,,
Ditta Mellone Sebastiano,Idraulico,,0832 931178,"Via degli Ulivi, 6",Copertino,,,,,,,,,,,
N.p Thermo Di Pischedda NoÈ,Idraulico,,333 361 7482,"Via Antonio de Curtis(Toto), 22",Copertino,,,,,,,,,,,
Termotec s.r.l.s.,Idraulico,,338 5215 3317,"Via Don Rosario Trono, 16",Copertino,,,,,,,,,,,
Ca Impiantistica,Elettricista,https://www.caimpiantistica.it/,0832 169 3392,"Via Alessandro Volta, 36",Cavallino,,info@caimpiantistica.it,https,WordPress,Sì,Aruba S.p.A. Network,59,93,100.00,Sì,Sì
TS Tecnologia & Servizi s.r.l.,Ditta specializzata in impianti di condizionamento,,334 919 4672,"Via Don Rosario Trono, 6",Copertino,,,,,,,,,,,
A.B.S. Di Antonazzo Biagio,Idraulico,,0833 531657,"Via Alessandro Manzoni, 16",Corsano,,,,,,,,,,,
Idro Elettro Impianti Sas Di Greco Paolo,Elettricista,,380 520 3159,"Via Maggiore Toselli, 27",Copertino,,,,,,,,,,,
M.R. Service - Elettronica Auto - GPL e Metano,Officina autoriparazioni,http://www.mrcarservice.it/,0836 306629,"Via Arno, 51",Cursi,,info@mrcarservice.it,http,Shopify,No,Aruba S.p.A. Network,57,82,100.00,Sì,Sì
Procomfort Di Russo Antonio Fernando,Idraulico,,0836 543335,"Via Cutrofiano, 65",Sogliano Cavour,,,,,,,,,,,
Termoidraulica Mengoli,Arredo bagno,,0836 234293,"Via Carlo Alberto dalla Chiesa, 20",Cutrofiano,,,,,,,,,,,
Nuzzo Giacomo Filippo,Idraulico,,0836 920376,"Via Filippo Bottazzi, 54",Diso,,,,,,,,,,,
Termomeccanica di Spano Sergio,Installatore di impianti di condizionamento,,389 969 8838,"Via Castel del Monte, 67",Galatina,,,,,,,,,,,
Idrotermica Tundo,Negozio di forniture idrauliche,,0836 563127,"Via Val d'Aosta, 37",Galatina,,,,,,,,,,,
Sticchi Luigi,Officina autoriparazioni,,0836 331295,"Via Tevere, 75",Cursi,,,,,,,,,,,
D'Errico Impianti di Giuseppe D'Errico,Idraulico,,349 008 6140,"Via S. Stefano, 6",Galatina,,,,,,,,,,,
Gruppo Vincenti SRL,Fornitore di attrezzature per l'energia solare,http://www.gruppovincenti.it/,0836 543257,"Via dei Cavamonti, 10",Cutrofiano,,,http,React,No,Aruba S.p.A.,72,90,85.00,Sì,No
Piscopo Egidio,Idraulico,,0836 452426,"Via Vittorio Emanuele III, 47",Cutrofiano,,,,,,,,,,,
Idro Term Clima Di Alemanni Enrico,Idraulico,,338 754 4016,"Via Chiusa, 115 A",Cutrofiano,,,,,,,,,,,
Forte Impianti,Ditta specializzata in impianti di riscaldamento,http://www.impiantiforte.it/,0836 512726,"Via Gaetano Salvemini, 16/A",Cutrofiano,,support@mikado-themes.com,http,React,No,Aruba S.p.A.,34,53,85.00,Sì,No
Maiorano Impianti,Idraulico,,333 799 8852,"Via Cesira Pozzolini, 70",Galatina,,,,,,,,,,,
T & C Sas Di Coroneo Salvatore E C.,Idraulico,,338 841 7341,"Via Arezzo, 7",Galatina,,,,,,,,,,,
S.E.Edilizia e Termoidraulica S.r.l.,Impresa edile,http://seediliziaetermoidraulica.it/,320 534 9074,"Contrada Macchia, snc",Cutrofiano,,santoroemanuele443@gmail.com,http,WordPress,Sì,TransIP BV,51,87,92.00,Sì,Sì
Tiemme Impianti Srl-Impianti Termoidraulici a Galatina | in Provincia di Lecce,Idraulico,,0836 567679,"Viale Jonio, 45",Galatina,,,,,,,,,,,
Ser Clima S.r.l.,Appaltatore,,0836 561603,"Via di Gallipoli, 226",Galatina,,,,,,,,,,,
Francesco Perrone Impianti,Ditta specializzata in impianti di riscaldamento,,360 832 520,"Via S. Lazzaro, 28",Gallipoli,,,,,,,,,,,
Vantaggiato Antonio,Idraulico,,0836 568567,"Via Giuseppe Parini, 42",Galatina,,,,,,,,,,,
Caprioli Giulio,Idraulico,,0836 569604,"Via Giuseppe Parini, 54",Galatina,,,,,,,,,,,
Ciccarese Gdf Snc,Idraulico,,0832 948770,Via Sciarpo,Copertino,,,,,,,,,,,
Idraulica Spagna Sergio,Negozio di forniture idrauliche,,327 216 6642,"Via Trento, 16",Gallipoli,,,,,,,,,,,
Sergimpianti Di Sergi Angelo,Ditta specializzata in impianti di riscaldamento,,0833 261769,"Via Bonaventura Tricarico, 67",Gallipoli,,,,,,,,,,,
De Pascalis Impianti Srl,Idraulico,http://www.depascalisimpianti.com/,0836 563141,"Via Metauro, 101",Galatina,,info@depascalisimpianti.it,http,ASP.NET,No,Aruba S.p.A. Network,97,89,82.00,Sì,No
ZUCCALA GIACOMO S.R.L.,Impresa edile,https://www.zuccalagiacomo.com/web/,339 701 8052,"Via Fra Silvestro Calia, 6",Copertino,,info@zuccalagiacomo.com,https,React,No,Aruba S.p.A.,56,41,75.00,Sì,No
Termo Erre Bierre Di Basile Salvatore,Idraulico,,0836 561413,"Viale Santa Caterina Novella, 65",Galatina,,,,,,,,,,,
Termoclima - ecoenergie di Gubello Giuseppe,Negozio di forniture idrauliche,,0832 932871,"Via Raffaello Sanzio, 12",Copertino,,,,,,,,,,,
Salento Idraulica Di Milelli Sebastiano,Idraulico,,339 448 1696,"Via Francesco Crispi, 10",Galatone,,,,,,,,,,,
Filoni Donato,Idraulico,,0833 867291,"Via XX Settembre, 110",Galatone,,,,,,,,,,,
TOP CLIMA,Negozio di forniture idrauliche,,0833 293069,"Via Lecce, n° 115",Gallipoli,,,,,,,,,,,
Impianti di GUIDO Danilo,Idraulico,,339 292 6469,"Via Monte S. Michele, 62",Galatone,,,,,,,,,,,
Francesco Resta Impianti,Fornitore di impianti di riscaldamento,,328 725 6900,Via Martin Luther King,Galatone,,,,,,,,,,,
Impianti Papa Di Papa Francesco,Idraulico,,328 652 3960,Contrada Orelle,Galatone,,,,,,,,,,,
Persano Luigi,Idraulico,,0836 958389,"Via Giuseppe Verdi, 35",Vitigliano,,,,,,,,,,,
Termoidraulica Rolli,Ditta specializzata in impianti di riscaldamento,https://bit.ly/3QmFVUL,339 730 7717,"Via Achille palma, 9",Galatone,,info@rollisrl.com,https,React,No,Google LLC,73,96,92.00,Sì,No
SITEC Impianti srl,Idraulico,http://www.sitec-impianti.it/,0832 947930,"Via Regina Isabella, zona Gelsi, 33",Copertino,,,http,WordPress,No,Kualo Limited,100,100,36.00,,No
Ufficio Impianti Erroi Cosimo,Idraulico,,348 220 6615,"a73043, Via Ada Negri, 32",Copertino,,,,,,,,,,,
Felline Energie di Sergio Felline & C. snc,Elettricista,,0836 315688,"Via Menhir, 36",Giurdignano,,,,,,,,,,,
Essedi Impianti S.N.C. Di De Cicco Giuseppe E Siciliano Roberto,Elettricista,,0836 813499,"Via Roma, 117",Giurdignano,,,,,,,,,,,
Autospurgo Rubrichi,Servizio di smaltimento delle acque reflue,http://www.autospurgorubrichi.com/,338 708 0158,VIA CASE SPARSE,Casamassella,,rubrichiautospurgo@gmail.com,http,WordPress,No,Aruba S.p.A.,54,56,85.00,Sì,No
F-TeC Tecnologie Elettriche Connesse di Felline Danilo Fiore,Elettricista,http://f-tec.it/,329 665 2403,Via Giuseppe Mazzini,Giurdignano,,felline.tec@gmail.com,http,WordPress,No,Aruba S.p.A. Network,60,88,92.00,Sì,No
Idroclima di Marco Ricchiuto,Idraulico,,329 495 0074,"Via Adriatica, 36",Lecce,,,,,,,,,,,
Leone Impianti,Idraulico,,324 627 1124,"Via Saverio Mercadante, 1",Lecce,,,,,,,,,,,
S.I.T. Sistemi Innovativi Tecnologici Srl,Idraulico,,0832 169 0523,"Via Basilicata, 19",Lecce,,,,,,,,,,,
Montefusco Andrea,Idraulico,,0832 300525,"Viale Giovanni Paolo II, 38/B",Lecce,,,,,,,,,,,
ELLE ESSE IMPIANTI,Idraulico,,0832 631617,"Via G. Parini, 10",Lequile,,,,,,,,,,,
Impiantistica termoidraulica Spini Giuseppe,Idraulico,,327 573 1419,"Via L. da Vinci, 39",Lequile,,,,,,,,,,,
Ditta Climatech Di Capone Marcello,Idraulico,,0832 634574,"13 Vicinale Tramacere Dragoni, Lequile, Le 73010",Lequile,,,,,,,,,,,
Energyca Termoforniture,Negozio di forniture idrauliche,,0832 263090,"Via S. Cesario, 90",Lequile,,,,,,,,,,,
Servizi Idrotermici Di Campilongo Luca,Idraulico,,338 201 0791,"Via Dante Alighieri, 213",San Cesario di Lecce,,,,,,,,,,,
Giuseppe Tornese - impianti idrici termici gas antincendio,Idraulico,,0832 631000,"Piazzale Croce Rossa, 9",Lequile,,,,,,,,,,,
R.F. IMPIANTI DI RIZZO FEDERICO,Fornitore di impianti di riscaldamento,,380 382 9166,"Via Calabria, 32",Lequile,,,,,,,,,,,
Sorge Impianti srl,Ditta specializzata in impianti di riscaldamento,,0832 634037,"Via Guglielmo Marconi, nr. 92",Lequile,,,,,,,,,,,
Palmiro Brocca Impianti,Idraulico,,0832 493505,"10 vc. Sandalo, Lecce, Le 73100",Lecce,,,,,,,,,,,
Luperto Giuliano Termoidraulica,Idraulico,,347 658 2171,"VIa Lazio, 40",San Cesario di Lecce,,,,,,,,,,,
Global FCM,Negozio di forniture idrauliche,,328 975 7624,"Via gramsci, Via Giacomo Puccini, 6",Lizzanello,,,,,,,,,,,
Ditta Martina Massimiliano,Idraulico,,0832 726779,"Viale Aldo Moro, 41",Lecce,,,,,,,,,,,
T.I.M. Impianti Idraulici,Idraulico,https://www.timimpiantilecce.com/,347 242 8229,"Via Panaro, 9",Lecce,,tim.impianti_latino@libero.it,https,React,No,Netsons s.r.l.,54,83,92.00,Sì,Sì
La Nuova Idrotermotech,Idraulico,,349 125 2422,"Via Cavalieri di Vittorio Veneto, 12",Salice Salentino,,,,,,,,,,,
I.t.i.s.,Idraulico,,0832 922836,"Via Lazio, 16",Leverano,,,,,,,,,,,
Tecknoimpianti di Grandioso Gianluca,Ditta specializzata in impianti di riscaldamento,,339 261 4574,"Via G.Giusti, 29",Leverano,,,,,,,,,,,
D.S.I. Impianti Srl,Elettricista,,0836 571536,"Via Persia, 74",Martano,,,,,,,,,,,
Basso S.A.S. Di Morganti Dario & C.,Ditta specializzata in impianti di riscaldamento,,0836 484108,"Via Vittorio Emanuele, 143",Maglie,,,,,,,,,,,
Idrosanitaria - Termoidraulica Di Ruffo Vito,Arredo bagno,,0836 571489,"Via Castrignano, 118",Martano,,,,,,,,,,,
Vitali Antonio,Idraulico,,0833 503286,"Via Garibaldi, 215",Matino,,,,,,,,,,,
Cr Termoidraulica Di Carichino Giovanni Roberto,Idraulico,,345 350 8202,"Via Savoia, 12",Matino,,,,,,,,,,,
Innocenti Luca,Idraulico,,0461 820976,"Via del Forte, 12",Martignano,,,,,,,,,,,
WB Assistenza - Assistenza Vaillant,Ditta specializzata in impianti di riscaldamento,,0832 801012,"Via Cristoforo Colombo, 6",Martignano,,,,,,,,,,,
Neon Toma Termoidraulica,Negozio di forniture idrauliche,http://www.neontoma.it/,0836 194 6462,"Via Nicola Ferramosca, 96",Maglie,,info@neontoma.it,http,WordPress,Sì,Aruba S.p.A.,72,86,85.00,Sì,No
R.L.D. di Romano Daniele,Idraulico,,0833 503862,"Via Padova, 6",Matino,,,,,,,,,,,
Leveghi Srl,Idraulico,http://www.leveghi.it/,0461 820573,"Via don Leone Serafini, 3",Trento,,info@leveghi.it,http,Joomla,No,Hetzner Online GmbH,56,69,83.00,Sì,Sì
Comfort Clima' Di Pascali Gianfranco,Elettricista,,0832 874060,"Via Foggia, 4",Melendugno,,,,,,,,,,,
GEP di Elia Emanuele,Idraulico,,335 183 8116,"Largo Sant'Antonio, 22",Melendugno,,,,,,,,,,,
PDD | Sistemi Idrotermici e Arredo Bagno,Negozio di forniture idrauliche,http://www.arredobagnopdd.com/,0836 427846,"Via Lecce, 56",Maglie,,info@pddmaglie.it,http,React,Sì,IP VDF,42,77,92.00,Sì,No
Clima Service Srl,Idraulico,,348 400 3601,"Via Ettore Pasanisi, 24",Ruffano,,,,,,,,,,,
C.M. Forniture Srl - Forniture Termoidrauliche,Negozio di radiatori,,0836 818392,"Via Podgora, 19/21",Minervino di Lecce,,,,,,,,,,,
Lassa Fazzu Ieu,Elettricista,,324 667 3995,"Via giuseppe di vittorio, 2",Miggiano,,,,,,,,,,,
GEG Srl,Ditta specializzata in impianti di riscaldamento,http://www.gegenergia.com/,0833 692883,"Strada Provinciale 362, 330-356",Ruffano,,,http,Joomla,No,SEEWEB s.r.l.,84,80,100.00,Sì,No
Itic di Damiano trotta,Idraulico,,392 646 1445,"Via Trentino, 23",Nardò,,,,,,,,,,,
TA IMPIANTI,Fornitore di attrezzatura idraulica,,338 291 6226,"Largo Conciliazione, 14",Melpignano,,,,,,,,,,,
Tecno Impianti MG di Gerardo Manca,Idraulico,,360 741 467,"Via Conte di Torino, 5",Nardò,,,,,,,,,,,
Tecnoimpianti S.n.c.,Fornitore di impianti di riscaldamento,,0833 564508,"Via S. Francesco D'Assisi, 8",Nardò,,,,,,,,,,,
GINO BALDUCCI,Servizio di riparazione di guasti idraulici,,337 233 252,"Via Gallipoli, 16",Nardò,,,,,,,,,,,
Idrotermoimpianti Rizzo Michele,Idraulico,,349 499 0887,"Via Pantalei Tagliate, 19",Nardò,,,,,,,,,,,
F.d.b. Impianti Srl,Idraulico,http://www.fdbimpianti.it/,0833 873086,Via Malpighi,Nardò,,info@fdbimpianti.it,http,ASP.NET,No,Aruba S.p.A. Network,100,100,82.00,Sì,No
Gt Impianti Idrotermici,Idraulico,,329 546 3361,"Via Arturo Graf, 1",Nardò,,,,,,,,,,,
De Marco Luigi,Idraulico,,347 629 0693,"Via Masserei, 18",Nardò,,,,,,,,,,,
Sud Comfort Srl,Arredo bagno,,0833 572606,"Via Incoronata, 15",Nardò,,,,,,,,,,,
Autospurgo Mauro,Servizio per fosse biologiche,,388 790 5676,"Via Generale Vincenzo Bellomo, 86",Neviano,,,,,,,,,,,
L'Idraulica Srl,Fornitore di materiali da costruzione,,0833 873317,"Viale Medaglie d'Oro, 22",Nardò,,,,,,,,,,,
Santoro Termoidraulica,Fornitore di attrezzatura idraulica,,0832 654088,"Via Milano, 6",Lizzanello,,,,,,,,,,,
IDROTERM di Mingiano Stefano (idrotermstore),Negozio di forniture idrauliche,https://www.idrotermstore.it/,0832 654056,"Via Caserta, 8",Lizzanello,,info@idrotermstore.it,https,React,Sì,Hetzner Online GmbH,51,59,85.00,Sì,No
IdroClima Global Service di Ivano Calabrese,Servizio di riparazioni idrauliche,https://www.idroclima-global-service.it/,320 230 7047,"Strada Tagliate, 82",Nardò,,idroclima.service.coop@gmail.com,https,React,No,Google LLC,49,78,100.00,Sì,Sì
MyHome Impiantistica e Tecnologia,Elettricista,,335 821 3394,"Via Vincenzo Gioberti, 30",Neviano,,,,,,,,,,,
Branca Srl - Termoidraulica e Irrigazione,Negozio di forniture idrauliche,https://brancatermoidraulica.it/,0833 762024,"Via Giuseppe Pisanelli, 16",Montesano Salentino,,info@brancatermoidraulica.it,https,Shopify,No,Server Plan S.r.l.,57,84,85.00,Sì,No
Balducci Roberto & C.Sas,Idraulico,http://www.balducciservice.it/,0833 561444,"Via Gallipoli, 56",Nardò,,,http,Wix,No,Aruba S.p.A. Network,74,96,36.00,Sì,No
Cotec One srl,Elettricista,http://www.cotec.srl/,0836 212091,"Via Corsica, 133",Muro Leccese,,info@cotec.srl,http,WordPress,Sì,Google LLC,62,72,92.00,Sì,Sì
Hidro Green Service,Ditta specializzata in piscine,https://www.hidrogreen.it/,377 351 3375,Via Beata Madre Teresa di Calcutta,Seclì,,info@hidrogreen.it,https,Shopify,Sì,Aruba S.p.A.,57,80,92.00,Sì,Sì
BRAMATO - Soluzioni per il comfort abitativo,Negozio di forniture idrauliche,https://www.bramato.energy/,393 550 1312,"Via Giuseppe Pisanelli, 61",Montesano Salentino,,bramatosrl@pec.it,https,WordPress,Sì,Aruba S.p.A. Network,56,75,92.00,Sì,No
Idrotecnica Di Grieco Antonio,Elettricista,,348 652 3638,"Via Gorizia, 30",Nociglia,,,,,,,,,,,
Elettricista Lecce,Elettricista,,373 523 3972,"Via G. Matteotti, 9",Palmariggi,,,,,,,,,,,
Legittimo Srl,Negozio di piastrelle ceramiche,http://www.legittimosrl.it/,0833 631174,"Via Nociglia, 34",Supersano,,info@legittimosrl.it,http,React,No,Seeweb srl,67,99,100.00,Sì,No
Mangia Impianti Di Mangia Salvatore,Idraulico,https://www.mangiaimpianti.it/,347 642 4795,"Via Tagliamento, 6",Nardò,,mangiaimpianti@libero.it,https,Joomla,Sì,Aruba S.p.A.,65,72,83.00,Sì,Sì
Idro Bar,Gelateria,,0836 802962,"Via Vittorio Emanuele, II, 4",Otranto,,,,,,,,,,,
Edilclima Impianti Di Ferro Andrea,Idraulico,,0833 186 2217,"Via Addis Abeba, 4",Taurisano,,,,,,,,,,,
Toma Antonio,Idraulico,,0833 595698,"Via Milano, 36",Parabita,,,,,,,,,,,
Euroimpianti Srl,Idraulico,,0833 509925,Zona Industriale - Lotto 39,Parabita,,,,,,,,,,,
Conte Impianti Srl,Idraulico,,0833 594283,"Via Provinciale Matino, 31",Parabita,,,,,,,,,,,
Pellico Luigi Impianti Di Condizionamento E Riscaldamento,Idraulico,,348 081 5538,"Via Grazia Deledda, 5",Parabita,,,,,,,,,,,
Impianti Elettrici E Termoidraulici Di Casciaro Luigi,Ditta specializzata in impianti di riscaldamento,,328 655 8865,"Via Risorgimento, 24",Vignacastrisi,,,,,,,,,,,
Officina Daniele Guida,Officina autoriparazioni,,328 335 8348,"Zona Pip, Lotto, 19",Ortelle,,,,,,,,,,,
I Due Mori,Stabilimento balneare,https://www.iduemori.it/,335 228 394,"Spiaggia di Alimini, Alimini serra 2",Otranto,,,https,Joomla,No,SEEWEB s.r.l.,63,95,77.00,Sì,No
Ducta Srl Showroom,Negozio di forniture idrauliche,https://www.ducta.it/,0832 520975,"Viale Otranto, 24",Lecce,,info@ducta.it,https,Joomla,Sì,Aruba S.p.A. Network,54,88,85.00,Sì,No
Atlantis,Stabilimento balneare,http://www.atlantisbeach.it/,0836 804401,Via Porto Craulo,Otranto,,,http,WordPress,,Netsons s.r.l.,56,77,92.00,Sì,No
Fuorirotta,Stabilimento balneare,http://www.fuorirottabeach.com/,338 535 3226,"Via Antonio Sforza, 7",Otranto,,info@fuorirottabeach.com,http,WordPress,No,Seeweb srl,61,86,85.00,Sì,No
R.g. Termoimpianti Di Russo Antonio,Idraulico,,0833 593123,"Via Impero, 71",Parabita,,,,,,,,,,,
Termo Teknick Di Giorgio Portone,Idraulico,,339 321 5577,"Via Ignazio Silone, 1",Ruffano,,,,,,,,,,,
SOGIM IMPIANTI | COSTRUZIONI| RISTRUTTRAZIONI,Elettricista,,345 606 4320,Via Capitano Congedi,Ugento,,,,,,,,,,,
Salentosole,Idraulico,,340 470 8630,"Via Armando Diaz, 24",Salve,,,,,,,,,,,
DITTA ANTONIO LEOPIZZI TERMOIDRAULICO,Idraulico,,349 385 4453,"Via Ferrara, 43/A",Parabita,,,,,,,,,,,
C.s. Tecnoservice Soc. Coop.,Idraulico,,380 474 4441,"Via Umberto I, 14",Salice Salentino,,,,,,,,,,,
Energy Clima,Fornitore di attrezzatura idraulica,,389 207 8080,"Via Senatore De Castris, 102",Salice Salentino,,,,,,,,,,,
Ferredil,Negozio di forniture elettriche,,0832 733273,"Via Stazione, 14",Salice Salentino,,,,,,,,,,,
