Nome Attività,Categoria,Sito Web,Telefono,Indirizzo,Comune,Provincia,Email,Protocollo,Tecnologia,Cookie Banner,Hosting Provider,Mobile Performance,Desktop Performance,Punteggio SEO,Disponibilità Sito,Stato Manutenzione
Mondotermica,Idraulico,,328 963 3378,"Corso Matteotti, 74",Carapelle,,,,,,,,,,,
Idrotermo Di Forte Eugenio,Idraulico,,0881 555089,"Via Papa Giovanni XXIII, 1",Pietramontecorvino,,,,,,,,,,,
Giambattista Francesco,Ferramenta,,0884 997432,"Via Roma, 171",Carpino,,,,,,,,,,,
Giancarlo Laronga,Idraulico,,328 134 9405,"Via Enrico de Nicola, 107",Torremaggiore,,,,,,,,,,,
Agricola 2000 Di Mitrione Nicola - Prodotti per l'edilizia,Fornitore di fertilizzante,,0884 997500,"Via Europa, 58",Carpino,,,,,,,,,,,
Maddalena Michele,Idraulico,,0881 523591,"Via Famiglia d'Auria, 49",Lucera,,,,,,,,,,,
TERMOIDRAULICA SIMONETTI ANTONIO DEI F.LLI SIMONETTI NICOLA & GIUSEPPE S.n.c.,Idraulico,,329 874 5628,Via Papa Giovanni XXIII,Lucera,,,,,,,,,,,
2C S.r.l.,Idraulico,,0824 963627,Via var,San Bartolomeo in Galdo,,,,,,,,,,,
Termotec Impianti di Rollo Paolo,Idraulico,,340 679 1642,"Via Marchese de Rosa, 5",Foggia,,,,,,,,,,,
Vellonio Aldo,Idraulico,,0881 525048,"Via Enrico Toti, 14",Lucera,,,,,,,,,,,
Termoidraulica D'Ariano Srl,Idraulico,,0881 665518,"Viale Francia, 40",Foggia,,,,,,,,,,,
IDROCALOR di Caccavelli Leonardo - Idraulico - Termoidraulico - Foggia - Termoli,Idraulico,,333 732 0619,"Via Brescia, 56",San Severo,,,,,,,,,,,
Termosud Service Di Lucio Bosco,Idraulico,,348 660 1152,"Via Cesare Battisti, 4",Lucera,,,,,,,,,,,
termoidraulica De Maso Angelo,Idraulico,,380 467 2126,"Via Alberico Marrone, 125",Lucera,,,,,,,,,,,
Kalor Klima Di Vellonio A.E Del Grosso L.Snc,Idraulico,,0881 530421,"Via Napoleone Battaglia, 40",Lucera,,,,,,,,,,,
Termo System,Idraulico,,393 083 3046,"Via Francesco Ferrucci, 37",Apricena,,,,,,,,,,,
Tartaglia Pietro,Idraulico,,0882 646105,"Via Pier delle Vigne, 35",Apricena,,,,,,,,,,,
Ieva M Impianti s.r.l.,Idraulico,,339 448 1406,"Via Vittime Civili, 4",Carapelle,,,,,,,,,,,
Lombardi Vincenzo,Idraulico,,0882 646450,"Via A. de Gasperi, 1",Apricena,,,,,,,,,,,
Lattonerie Cassano Di Cassano Andrea Leonardo,Idraulico,,348 523 8665,"Via S. Nazario, 17",Apricena,,,,,,,,,,,
Idraulica Service srl - Concessionaria Ufficiale Assistenza Caldaie Unical,Ditta specializzata in impianti di riscaldamento,http://concessionari.unicalag.it/foggia/idraulica-service-srl-di-marino-martella,339 404 4260,"Largo Podgora, 11",Pietramontecorvino,,,http,React,No,Server Plan S.r.l.,61,98,82.00,Sì,Sì
Termoidraulica La Cava,Idraulico,http://www.termoidraulicalacava.it/,349 857 8625,"Via Alberico Marrone, 125",Lucera,,info@termoidraulicalacava.it,http,React,No,Aruba S.p.A. Network,47,74,75.00,Sì,Sì
Termoidraulica Antonio Graziano,Negozio di forniture idrauliche,,0881 545327,"Viale Avv. Vincenzo Scarano, 43",Lucera,,,,,,,,,,,
STE.PA TERMOTECNICA S.n.c.,Idraulico,,349 131 7707,"Via Inverse, 21",Castelluccio dei Sauri,,,,,,,,,,,
Barletta Juan Carlos,Idraulico,,347 620 4196,"Viale Kennedy, 53",Troia,,,,,,,,,,,
Idroferramenta Di Michele Rocco Srl,Ferramenta,http://www.idroferramenta.it/,081 521 0170,"Via Nazionale delle Puglie, 20",Casalnuovo di Napoli,,commerciale@idroferramenta.it,http,WordPress,No,Aruba S.p.A. Network,42,86,85.00,Sì,No
IDROSERVICE Andrea Creta,Idraulico,,329 109 0544,"Via Raffaele de Peppo, 21",Lucera,,,,,,,,,,,
Turchiarelli Luigi Impiantistica,Idraulico,,0881 963867,"Via S. Cristoforo, 19",Deliceto,,,,,,,,,,,
D.R.L. snc di D'Avena Michele & C.,Installatore di impianti di condizionamento,https://drl-davena.webnode.it/,0882 644170,"Viale Aldo Moro, 133",Apricena,,,https,Webnode,No,Amazon Technologies Inc.,78,98,92.00,Sì,Sì
Rubino Giulio,Idraulico,,0882 644395,"Via Milano, 83",Apricena,,,,,,,,,,,
Idrotermica di Ruggiero Giuseppe,Ditta specializzata in impianti di condizionamento,http://idrotermicaruggierogiuseppe.myadj.it/v/idrotermicaruggierogiuseppe,347 062 2112,Via San Nazario Zona Artigianale Lotto 46,Apricena,,,http,React,No,"Cloudflare, Inc.",79,92,92.00,Sì,Sì
Termoidraulica Sud Di Leone Biagio,Idraulico,,333 956 3537,"Via Camillo Cavour, 12",Ascoli Satriano,,,,,,,,,,,
STEFANINI CARLO TERMOIDRAULICA,Idraulico,,340 297 5024,"Via Zelano, 36",Accadia,,,,,,,,,,,
Impianti Idrici Termici Condizionamenti Gas di Donato della Santa,Idraulico,,340 779 3613,"Via Porta del Pozzo, 81",Castelluccio Valmaggiore,,,,,,,,,,,
Porcelli Angela Maria Rosaria,Idraulico,,0885 782100,"Via Giuseppe Ungaretti, 32",Orta Nova,,,,,,,,,,,
La Termoidraulica Di Iacobellis Franco,Idraulico,,346 951 8901,"Via Montrone, 44",Valenzano,,,,,,,,,,,
Minchillo Srl,Impresa di costruzioni,,0881 558201,"Via Rossetti, 18",Casalnuovo Monterotaro,,,,,,,,,,,
"Ferramenta, colori e idraulica di Anna Carpino",Ferramenta,http://www.carpinoanna.it/,340 277 7159,"Via Stazione, 18/C",Santo Stefano di Rogliano,,,http,React,No,Aruba S.p.A.,68,51,100.00,Sì,No
MEP di Pasquale Melezio TERMOIDRAULICA,Ferramenta,,333 546 9696,Piazza Giovanni Paolo II Papa,Ascoli Satriano,,,,,,,,,,,
Building Energy Group s.r.l.,Impresa di costruzioni,http://www.buildingenergygroup.com/,0881 964962,"Via Cesare Battisti, 29",Orsara di Puglia,,info@buildingenergygroup.it,http,WordPress,No,Hetzner Online GmbH,67,96,85.00,Sì,Sì
Teknoclima System Srl,Idraulico,,0882 335355,"Viale due Giugno, 44",San Severo,,,,,,,,,,,
IdroRM Termoidraulica di Saverio MARZULLI,Idraulico,,338 914 1797,"Via Cosenza, 22",Modugno,,,,,,,,,,,
Idrotermica PC dí Pugliese Carmine,Idraulico,,329 425 8494,"Via Mattine, 28",Frigento,,,,,,,,,,,
Tcr Di Carlo Troilo,Idraulico,,0882 374506,"Corso Giuseppe Di Vittorio, 6",San Severo,,,,,,,,,,,
Idrotermica Salnitro,Fornitore di materiali da costruzione,http://www.idrotermicasalnitro2003.com/,0881 778985,"Via di Salsola, 42",Foggia,,info@idrotermicasalnitro2003.com,http,WordPress,No,Aruba S.p.A. Network,38,66,85.00,Sì,No
Idrothermogas Di Caccavelli Leonardo & Mastrangelo Riccardo N. Snc,Idraulico,,0882 240898,"Via Brescia, 56",San Severo,,,,,,,,,,,
La Termoimpianti Srl,Ditta specializzata in impianti di riscaldamento,,0825 828623,Contrada Accoli,Ariano Irpino,,,,,,,,,,,
CSI - Centro Sud Idrotermico s.r.l,Idraulico,,0825 872024,"Via Bosco, Ariano Irpino, AV 83031",Frolice,,,,,,,,,,,
Termosud Impianti S.r.l.,Idraulico,,0825 891052,"Via Angelica Fontana, 1",Ariano Irpino,,,,,,,,,,,
Tecnici Del Caldo E Freddo Di Buono Nicola,Idraulico,,329 413 2624,"Via Pietro Ravanas, 190",Bari,,,,,,,,,,,
Anelli Impianti,Idraulico,https://www.anelliimpianti.com/,339 700 3564,"Via Carlo Alberto, 134",Canosa di Puglia,,,https,React,Sì,Server Plan S.r.l.,93,99,92.00,Sì,Sì
Castelnuovo Impianto Termoidraulici Sas Di Alessandra Comini,Idraulico,,0341 735176,"Via Statale, 95",Mandello del Lario,,,,,,,,,,,
CIR impianti di Nicola Cocca,Idraulico,https://www.cirimpianti.com/,334 924 0654,Vico III M. Passeri,Ariano Irpino,,cirimpianti.info@gmail.com,https,WordPress,Sì,TransIP BV,72,96,92.00,Sì,Sì
ID Impianti di Ippedico Domenico,Idraulico,,360 810 687,"Via Nino Bixio, 18",Gravina in Puglia,,,,,,,,,,,
Dlp impianti di Delli Carri Domenico,Idraulico,,331 473 3627,"Via Pio La Torre, 8",Foggia,,,,,,,,,,,
FERRARI IMPIANTI SRL,Ditta specializzata in impianti di riscaldamento,http://www.ferrari-impianti.com/,031 445 1519,"Via A. Diaz, 16B",Anzano del Parco,,info@ferrari-impianti.com,http,WordPress,Sì,Aruba S.p.A,64,74,85.00,Sì,Sì
D'Auria & Talia Idraulica,Idraulico,,0875 689175,"Via Goito, 88",Guglionesi,,,,,,,,,,,
Volpe Stefano Costruzioni,Fabbro,,368 786 7711,"Contrada Cupazzo, 71020",Monteleone di Puglia,,,,,,,,,,,
Termoidraulica Di Disposto Vito,Idraulico,,080 553 4012,"Via Valona, 59",Bari,,,,,,,,,,,
M.G. Impianti di Mongiello Giuseppe,Idraulico,https://mgimpiantibitonto.it/,080 321 4935,"Via Borgo San Francesco, 57",Bitonto,,mgimpiantibitonto@libero.it,https,WordPress,No,OVH SAS,69,85,100.00,Sì,Sì
Termoimpianti di Altamura Gianfranco,Idraulico,,339 751 0463,"Via Vito Giuseppe Millico, 22",Terlizzi,,,,,,,,,,,
Termoidraulico Attorre Gianvito,Idraulico,,349 500 3232,"Via Massimo D'Azeglio, 30",San Vito dei Normanni,,,,,,,,,,,
Lazazzera Giacomo Vito,Idraulico,,080 303 2221,"Via Salvatore Cognetti, 6",Santeramo In Colle,,,,,,,,,,,
Santosuosso Srl,Arredo bagno,http://www.santosuossosrl.it/,0825 891291,"Via Foresta, 49/a",Ariano Irpino,,santosuosso-logo-w@2x.png,http,React,No,Hetzner Online GmbH,56,71,100.00,Sì,No
Ruggiero Giovanni,Fornitore di materiali da costruzione,,0881 554184,"Via Cairoli, 211",Celenza Valfortore,,,,,,,,,,,
Candela Massimiliano Termoidraulica,Idraulico,,333 995 1564,"Via Giudicato di Torres, 6",Budoni,,,,,,,,,,,
D'Agostino F.lli Claudio & Davide s.n.c.,Fornitore di materiali da costruzione,,0881 554584,"Sp.1, Contrada Fornaci",Celenza Valfortore,,,,,,,,,,,
Vaccaro Impianti La Magia del Calore,Idraulico,https://www.vaccaroimpianti.it/,335 762 6076,"Largo Don Pasquale Uva, 3/A",Potenza,,vaccaroimpiantisrls@hotmail.com,https,Joomla,No,Host SpA,53,68,92.00,Sì,No
Co.Ma.Co,Fornitore di materiali da costruzione,,0881 554255,"Contrada Fornaci, Snc",Celenza Valfortore,,,,,,,,,,,
Thermotech Di D'Anzeo Maurizio,Idraulico,https://www.danzeoservizi.it/,0882 337339,"Via Soccorso, 266",San Severo,,info@danzeoservizi.it,https,Shopify,Sì,Aruba S.p.A.,54,84,92.00,Sì,Sì
Fomas Srl,Ferramenta,,0881 554182,"Via Giardino, 2A",Celenza Valfortore,,,,,,,,,,,
Cinalli Vincenzo,Idraulico,,0875 539806,"Via Don L. Sturzo, 55",Campomarino Lido,,,,,,,,,,,
Macelleria Fascia,Macelleria,,393 995 7990,"Via Cairoli, 1",Celenza Valfortore,,,,,,,,,,,
Ziccardi Termoidraulica,Idraulico,,346 827 3753,"Via Aldo Moro, 28",Larino,,,,,,,,,,,
Cellamare Vito Impianti Idraulici,Idraulico,,080 527 7060,"Corso Giuseppe Mazzini, 166",Bari,,,,,,,,,,,
Ziccardi Francesco,Idraulico,,0874 822733,"Via Aldo Moro, 28",Larino,,,,,,,,,,,
Lannutti Antonio,Idraulico,,0875 538240,"Via G. Di Vittorio, 24",Campomarino,,,,,,,,,,,
ML IMPIANTI DI MANUEL LONGO,Idraulico,,347 989 1132,"Via Vigne Nuove, 44/A",Campomarino,,,,,,,,,,,
Pillae Riscaldamento Di Pilla Bruno,Idraulico,,0874 823855,"Via S. Michele, 84",Larino,,,,,,,,,,,
Termoclima Di Romano Roberto,Idraulico,,0875 539657,"Corso Skanderberg, 12",Campomarino,,,,,,,,,,,
Croce Pasqualre Impianti Termosud,Appaltatore,,0881 740399,"Via Pasquale Fuiani, 22",Foggia,,,,,,,,,,,
VL IMPIANTI,Idraulico,,320 901 0792,"Via dei Castagni, 118",Termoli,,,,,,,,,,,
L'Equilibrio Climatico - Porzio Giovanni,Idraulico,,0881 707517,"Via S. Antonio, 84",Foggia,,,,,,,,,,,
Fusillo Raffaella,Idraulico,,0885 427882,"Via Don Minzoni, 70",Cerignola,,,,,,,,,,,
Imbrice,Idraulico,,0885 423513,"Viale di Ponente, 20",Cerignola,,,,,,,,,,,
Cm Impianti Di Mauro Chieti,Idraulico,,0885 421166,"Via D. Cirillo, 13",Cerignola,,,,,,,,,,,
"ColucciCalorClima Assistenza caldaie Vaillant,Lamborghini,Ferroli,Chaffoteaux,Italtherm,Sime,Intergas VenditaRicambi",Ditta specializzata in impianti di riscaldamento,,0885 415919,"Via Assisi, 6B",Cerignola,,,,,,,,,,,
Sciusco Giuliano & C.,Negozio di forniture idrauliche,,0885 424523,"Via Sestriere, 40",Cerignola,,,,,,,,,,,
E.co.tec. srl,Idraulico,,0885 411755,"132 Via Pedone Antonio, Cerignola, FG 71042",Cerignola,,,,,,,,,,,
IDROTECH IMPIANTI E MANUTENZIONI,Ufficio aziendale,,348 408 9770,"Via Tivoli, 2",Cerignola,,,,,,,,,,,
Assistec,Idraulico,,059 340287,"Str. Panni, 25",Modena,,,,,,,,,,,
Climatek 2000 di Sergio D'Alessandro,Idraulico,https://climatek2000.it/,328 376 9516,"Contrada Feudo, 42",Campobasso,,,https,Joomla,No,Hetzner Online GmbH,43,87,92.00,Sì,Sì
Del. Ve Impianti di Della Vella Leonardo | Idraulico Vico del Gargano,Idraulico,,349 076 6076,"Via Alcide de Gasperi, 17",Vico del Gargano,,,,,,,,,,,
Lenoci,Idraulico,,0884 994279,"Via G. di Vagno, 22",Vico del Gargano,,,,,,,,,,,
Lattoniere Vico Di Dattoli Alberto,Lavorazione metalli,,0884 272862,"Via dei Caduti, 24",Vico del Gargano,,,,,,,,,,,
Lo Drago Termoclima Di Franco Lo Drago,Idraulico,,0885 783032,"Corso Umberto I, 28",Orta Nova,,,,,,,,,,,
Novatek Impiantistica,Servizio di installazione elettrica,,348 034 5365,"Via Michelangelo Manicone, 12",Vico del Gargano,,,,,,,,,,,
Speed Casa - Rodi Garganico,Servizi di ristrutturazione,,0884 966629,"Corso Ruggero Bonghi, 14",Rodi Garganico,,,,,,,,,,,
PRONTORAPIDO,Ditta specializzata in impianti di riscaldamento,http://www.prontorapido.it/,800 114 424,"Corso Scuola Agraria, 51C",Cerignola,,info@prontorapido.it,http,Basekit,No,Aruba S.p.A.,46,72,100.00,Sì,Sì
Tutto Gas Di Menduno Mario,Servizio di riparazione di climatizzatori,,339 184 1143,"Corso Bixio, 37",Orta Nova,,,,,,,,,,,
Idrotermosol Di Solitro Antonio,Idraulico,,0884 706208,"Via Giuseppe Verdi, 25",Vieste,,,,,,,,,,,
Valerio Termo Service,Idraulico,,389 997 8615,"Via Cozzolete, 9",Manfredonia,,,,,,,,,,,
Termoidraulica DE5 - di De Cinque Giorgio,Idraulico,https://termoidraulicade5.weebly.com/,347 844 5095,Via Udine,Termoli,,,https,Weebly,No,"Weebly, Inc.",40,79,83.00,Sì,Sì
Belcastro Impianti,Servizio di riparazioni idrauliche,,0884 965439,"via Palestro, 18",Rodi Garganico,,,,,,,,,,,
Pagano Carlo S.r.l.,Idraulico,,0884 708700,"Via Venezia, 12",Vieste,,,,,,,,,,,
Termoidraulica Cota,Idraulico,,388 956 0768,"Viale dell'Emigrante, 2",Mattinata,,,,,,,,,,,
Idroservice di Di Iasio Adriano,Idraulico,,0884 593752,"Via Pulsano, 66",Manfredonia,,,,,,,,,,,
Rs Technology,Negozio di articoli per l'illuminazione,,080 322 1252,"Via Gianberardino Panni, 4",Gravina in Puglia,,,,,,,,,,,
Tecnotherm Impianti • Gargano,Idraulico,,350 073 5493,Via Europa,Vico del Gargano,,,,,,,,,,,
Tekind Tecnologie Industriali s.r.l.,Ditta specializzata in impianti di riscaldamento,http://www.tekindsrl.com/,06 8901 8124,Vicolo di Porta Furba,Roma,,info@tekindsrl.com ,http,WordPress,No,Seeweb srl,63,84,92.00,Sì,Sì
Iafelice Sandro Pasquale,Idraulico,,338 759 9541,"Via Uranio, 12",San Severo,,,,,,,,,,,
Idroelettra,Negozio di forniture idrauliche,,0885 792021,"Viale Ferrovia, Snc",Orta Nova,,,,,,,,,,,
"De Bonis Group | Vendita, Consulenza e Manutenzione Caldaie, Pompe di Calore e Impianti Fotovoltaici",Ditta specializzata in impianti di riscaldamento,http://www.debonisgroup.it/,0882 452510,Via Pasquale Turbacci,San Giovanni Rotondo,,,http,ASP.NET,No,Aruba S.p.A. Network,100,100,73.00,Sì,No
Bricomax di Corbo Giovanni,Ferramenta,,347 652 2470,"Largo Visconti Modrone, 21",Rocchetta Sant'Antonio,,,,,,,,,,,
D'Errico Impianti,Idraulico,,388 616 8275,"cappella 4, Contrada Campo",Bisaccia,,,,,,,,,,,
DUEF di Ferragonio Giuseppe | Vendita Assistenza Caldaie Climatizzatori | Termoidraulica Ceramica Rubinetteria | Orta Nova FG,Ditta specializzata in impianti di riscaldamento,,333 850 1591,"Via F. Turati, 13",Orta Nova,,,,,,,,,,,
Ferramenta Veneziani | Pitture e Termo Idraulica / Nautica,Ferramenta,,0884 965328,"Via de Grazia, 28",Rodi Garganico,,,,,,,,,,,
Gentile Termoidraulica,Ditta specializzata in impianti di condizionamento,http://www.dittagentile.net/,328 651 5866,"Via Pietro Giannone, 25",San Giovanni Rotondo,,info@dittagentile.net,http,WordPress,No,Aruba S.p.A.,68,81,77.00,Sì,No
N.T. Idraulica Riscaldamento Di Novelli Angela,Negozio di forniture idrauliche,https://www.idroclimasolution.com/,0885 784213,Via Giovanni Amendola,Orta Nova,,570@desktop.jpg,https,WordPress,Sì,IONOS SE,37,42,100.00,Sì,No
Simeone S.p.a.,Pianta di depurazione acque reflue,http://www.simeonespa.com/,0882 996260,"Piazza Principe Imperiale, 25",Poggio Imperiale,,logo-dark@2x.png,http,React,No,Aruba S.p.A. Network,56,73,100.00,Sì,Sì
Time Termoidraulica,Negozio di forniture idrauliche,,334 845 7676,"Via Orno, 27",Trinitapoli,,,,,,,,,,,
Termoidraulica Rio,Impianto di raffreddamento,,333 955 2421,"Via Difesa, 14",Oliveto Citra,,,,,,,,,,,
Antonacci Termoidraulica Srl,Idraulico,http://www.antonaccisrl.it/,0881 707522,"Via S. Severo, Km. 2",Foggia,,,http,WordPress,No,Aruba S.p.A. Network,100,0,0.00,Sì,No
Mi.fra,Arredo bagno,https://www.mifrasrl.com/,080 841 1693,"Via Giuseppe Bottalico, 78/80",Bari,,info@termoway.com,https,Shopify,No,Aruba S.p.A.,56,62,77.00,Sì,No
Pietro Caserta,Idraulico,,333 871 9505,"Via E. Fermi, 15",Trinitapoli,,,,,,,,,,,
De Benedittis Nunzia Srl Termoidraulica-Ceramiche-Arredo bagno,Negozio di materiali da costruzione,http://www.dbnsrl.com/,0883 633538,"Via Barletta, 63",Trinitapoli,,info@dbnsrl.com,http,React,No,Keliweb S.R.L,56,87,83.00,Sì,No
P.F.T. Di Palladino Fabrizio,Idraulico,http://www.pfttecnologie.it/,0882 459593,"Via Adua, 108",San Giovanni Rotondo,,info@pfttermoidraulica.it,http,Basekit,No,Aruba S.p.A.,65,72,92.00,Sì,Sì
LATIANO IMPIANTI di flavio latiano,Idraulico,,339 215 0235,"Via Foggia, 182",San Giovanni Rotondo,,,,,,,,,,,
De Bonis Arredo Bagno,Arredo bagno,,0882 453997,Via Antonio Canova,San Giovanni Rotondo,,,,,,,,,,,
Rovea Giorgio,Idraulico,,368 337 8686,"Via S. Giovanni Battista, 9",San Giovanni Rotondo,,,,,,,,,,,
Indipedente - San Marco la Catola,Benzinaio,,368 352 7260,Via Aldo Moro,San Marco La Catola,,,,,,,,,,,
IDRO CENTER,Negozio di forniture idrauliche,,0882 452157,"Via Foggia, 191",San Giovanni Rotondo,,,,,,,,,,,
Colagrossi Giovanni,Officina autoriparazioni,,0881 556221,"Viale Aldo Moro, 3",San Marco La Catola,,,,,,,,,,,
Palladino Giuseppe,Idraulico,,0882 451424,"Via Arc. Pasquale Cirpoli, 15",San Giovanni Rotondo,,,,,,,,,,,
Termoidraulica Sibilia,Idraulico,https://www.termoidraulicasibilia.it/,339 350 6825,Zona Artigianale,Rionero In Vulture,,,https,React,Sì,Google LLC,68,94,83.00,Sì,No
tecnogas autoparts,Negozio di ricambi per auto,,0882 553053,"Via Cesare Battisti, 39",San Paolo di Civitate,,,,,,,,,,,
F.lli Massa Centro Ceramiche,Arredo bagno,http://www.massafratelli.com/,0882 453552,"Via Tratturo, Via Piano del Marchese Strada 3",San Giovanni Rotondo,,info@massafratelli.com,http,WordPress,Sì,Aruba S.p.A.,61,73,92.00,Sì,Sì
ARVEL srl,Fornitore di ricambi per elettrodomestici,,0882 552600,"Via Dante Alighieri, 38",San Paolo di Civitate,,,,,,,,,,,
Idraulica Patete,Idraulico,,0882 331257,"Via Torquato Tasso, 13",San Severo,,,,,,,,,,,
PrimoClima di Fiano Antonio Assistenza Caldaie Beretta,Idraulico,,0882 422563,"Via Teano Appulo, 41",San Severo,,,,,,,,,,,
I.r.e. S.r.l.,Idraulico,http://www.irecirocco.it/,0824 994205,Contrada Decina,Molinara,,info@irecirocco.it,http,Hugo,No,Servereasy Srl,37,60,92.00,Sì,No
Sergio Antonelli,Idraulico,,334 818 8579,"Via Calabria, 3",San Severo,,,,,,,,,,,
Assistenza Tecnica Elettrodomestici Altieri Giancarlo,Negozio di elettrodomestici,,0882 552772,"Via Dante Alighieri, 38",San Paolo di Civitate,,,,,,,,,,,
De Matteis Casa srl - Materiali Per L'Edilizia,Fornitore di materiali da costruzione,https://www.dematteiscasa.it/,0882 552525,"Via Giovanni Gentile, 50",San Paolo di Civitate,,info@dematteiscasa.it,https,WordPress,No,Netsons Network,73,88,92.00,Sì,No
Termotec di D'Angelo Giovanni,Negozio di forniture idrauliche,,0882 475612,"Viale Vittorio Veneto, 151",San Nicandro Garganico,,,,,,,,,,,
Eurotermica Di Camillo Antonio & C. Snc,Idraulico,,0882 331793,"Via Caserta, 4",San Severo,,,,,,,,,,,
Termico 89 di Milione Amedeo,Idraulico,,389 092 7576,"Via Carlo Pisacane, 29",San Severo,,,,,,,,,,,
Giuliano Santagata & C. s.a.s.,Fornitore di attrezzature per l'irrigazione,http://www.giulianosantagatasas.com/,0882 552183,"via San Severo ss, 16 km 48+540",San Paolo di Civitate,,,http,Shopify,No,"Cloudflare, Inc.",55,76,100.00,Sì,No
Idrotermica S.O.T. di Di Giacinto Severino & C. Snc,Idraulico,,085 809 0033,"Via Colle Patito, 3",Roseto degli Abruzzi,,,,,,,,,,,
Pistillo Salvatore Rino,Idraulico,,360 513 317,"Via dei Mille, 114",San Severo,,,,,,,,,,,
Idroclima,Arredo bagno,http://www.idroclimasrl.it/,0882 382955,"Via San Giuseppe Moscati, 17",Torremaggiore,,idroclimatorremaggiore@virgilio.it,http,Hugo,No,OVH SAS,55,66,92.00,Sì,No
Spadone Impianti,Ditta specializzata in impianti di condizionamento,https://www.spadoneimpianti.it/,0882 224771,"Corso Giustino Fortunato, n°24",San Severo,,,https,WordPress,Sì,Aruba S.p.A.,55,73,92.00,Sì,Sì
Thermo Solar Tech di Princigallo Antonio,Idraulico,,0882 218354,"Via Petrarca, 5",San Severo,,,,,,,,,,,
Frores S.N.C. Di Fregola Alfredo & C.,Arredo bagno,,0882 334915,"Via Altamura, 107",San Severo,,,,,,,,,,,
MEIS del Geom. Luigi Maddaloni,Idraulico,,339 683 9776,"Via Ottaviano Augusto, 97",Nola,,,,,,,,,,,
Buonsanto Giuseppe,Idraulico,,0881 618656,"Via de Viti de Marco, 51",Foggia,,,,,,,,,,,
Termoidraulica Mecca Antonio,Idraulico,,340 285 6095,Via Alessandro Manzoni,San Fele,,,,,,,,,,,
Assistenza H24 Roseto Capo Spulico,Idraulico,https://www.assistenzah24roseto.it/,340 095 6101,"Via Bari, 40",Borgata Marina,,assistenzaroh24roseto@gmail.com,https,React,No,Aruba S.p.A,64,87,92.00,Sì,No
Idrotermica Edilceramica Irpina Di Sabatelli E Figli Snc,Idraulico,,0825 981461,"Km. 005.500 Via Ofantina, Parolise, AV 83050",Castelvetere sul Calore,,,,,,,,,,,
Tecnocalor Srl,Idraulico,,0884 582466,Località Conte di Troia,Manfredonia,,,,,,,,,,,
Climatizzazione ed Idraulica - ClimaIn S.r.l.,Negozio di climatizzatori,https://www.climashopping.it/,335 779 9974,Contrada Piana,Sant'Agata di Militello,,,https,WordPress,No,HOSTINGER DE,93,93,83.00,Sì,No
STUDIO DI INGEGNERIA GEOSTRUTTURALE E IDRAULICA,Ingegnere,,0882 391773,"Via Marsala, 60",Torremaggiore,,,,,,,,,,,
Impiantistica Lamedica Srl,Elettricista,http://www.impiantisticalamedica.it/,0882 381442,"Corso Giacomo Matteotti, 214",Torremaggiore,,,http,React,No,Aruba S.p.A.,48,92,92.00,Sì,Sì
Mangiacavallo Impianti,Fornitore di impianti industriali,http://www.mangiacavalloimpianti.it/,338 401 3413,"Via Palmiro Togliatti, 18",Torremaggiore,,contatto@esempio.it,http,Sitefinity,No,Amazon Technologies Inc.,78,94,100.00,Sì,No
Impresa Edile Foggia Sicuro Costruzioni Srl,Impresa di costruzioni,,333 135 8948,"Via Milazzo, 3",Torremaggiore,,,,,,,,,,,
Di Gaetano Franco,Idraulico,,0885 431766,"Via Scipione, 47",Stornara,,,,,,,,,,,
Edil Costruzioni Srl,Impresa di costruzioni,,0885 438107,"Viale delle Attività Produttive, sn 71048",Stornarella,,,,,,,,,,,
Di Siro Francesco | Officina Meccanica,Officina autoriparazioni,,0882 680022,"Contrada Colle Castrato, Serracapriola, FG 71010",Serracapriola,,,,,,,,,,,
Linea Verde Di Pelullo F. & C. Sas,Ditta specializzata nella realizzazione di sistemi di irrigazione per prato,,0885 432399,"Via Stornara, 86",Stornarella,,,,,,,,,,,
Ditta Siani Antonio,Fornitore di trattori e macchine agricole,https://www.dittasiani.com/,380 255 9283,"Viale Aldo Moro, 19",Serracapriola,,,https,React,No,Aruba S.p.A.,43,74,85.00,Sì,No
F.Lli Misceo Di Misceo G. & C. Snc,Idraulico,,080 521 2425,"Via Dante Alighieri, 322",Bari,,,,,,,,,,,
Un Raggio di Sole,Bed & Breakfast,,339 455 1488,"Corso Giuseppe Garibaldi, 96",Serracapriola,,,,,,,,,,,
Frigogen Condizionamento Refrigerazione Di Gennarino Antonio,Idraulico,,0881 522625,"Via Pasquale Follieri, 61",Lucera,,,,,,,,,,,
FAZI S.R.L.,Elettricista,http://www.hidrosystem.it/,0885 437017,Via Dei Cinque Reali Siti Zona Artigianale,Stornarella,,,http,Shopify,Sì,Aruba S.p.A.,56,67,92.00,Sì,No
F.C. Service,Idraulico,http://www.fcserv.it/,080 530 3811,"Stradella Privata Palumbo, 4",Zona Industriale,,info@fcserv.it,http,WordPress,Sì,Netsons Network,60,69,92.00,Sì,No
La Termoidraulica,Idraulico,,080 645 5687,"Via Vincenzo Rella, 6",Grumo Appula,,,,,,,,,,,
Albano Impianti,Fornitore di impianti di riscaldamento,,328 119 3251,Via Padre Lorenzo,Volturino,,,,,,,,,,,
Euro Klima Service S.N.C. Di Maselli Giovanni & Tassielli Donato,Idraulico,,080 762330,"Via Mele, 20",Acquaviva delle Fonti,,,,,,,,,,,
Idraulico Antonio Magrone,Idraulico,,335 653 9617,"Via Francesco Lattanzio, 46/A",Bari,,,,,,,,,,,
Climaimpianti Di Abrusci E.,Idraulico,,080 758431,"Via A. Volta, 36",Acquaviva delle Fonti,,,,,,,,,,,
Signorile Clima Service di Signorile Antonio,Idraulico,,328 544 0826,"Via Giuseppe de Nittis, 8",Acquaviva delle Fonti,,,,,,,,,,,
Gruppo Nettis & Posa Impianti S.R.L.,Idraulico,,080 761918,"Estramurale Giovanni Battista Molignani, n. 35",Acquaviva delle Fonti,,,,,,,,,,,
TERMICA DEMAR CENTRO ASSISTENZA AUTORIZZATO VAILLANT & THERMOROSSI,Fornitore di attrezzature per l'energia solare,http://www.termicademar.it/,335 126 2597,Contrada Piano Dei Masi,Foiano di Val Fortore,,info@termicademar.it,http,ASP.NET,No,Aruba S.p.A. Network,100,100,73.00,Sì,No
Euroclima Di Maselli & Tasselli S.N.C.,Idraulico,,080 769109,"Via per Sammichele, 44D",Acquaviva delle Fonti,,,,,,,,,,,
C.R. IMPIANTI DI CANNONE RAFFAELE,Idraulico,,324 586 0896,"Corso Vittorio Emanuele, 126",Margherita di Savoia,,,,,,,,,,,
Edil Valentino Costruzioni Ristrutturazioni Srls,Impresa edile,,391 366 5845,"Via Parco Padre Pio, 27",Zapponeta,,,,,,,,,,,
Tecnoimpianti Di Rinaldi Leonardo,Idraulico,,0884 536672,"Via Tribuna, 88",Manfredonia,,,,,,,,,,,
Di Conzo Ceramiche,Negozio di materiale da pavimentazione,,349 076 1810,"SP 141, KM. 19+500",Zapponeta,,,,,,,,,,,
Idroclima Di Michele De Cristofaro,Idraulico,,0884 273552,"Via Cimarrusti, 23",Manfredonia,,,,,,,,,,,
Tecnocalor-Sud' Di Russo Antonio,Idraulico,,0883 655657,"Via Ugo Foscolo, 19",Margherita di Savoia,,,,,,,,,,,
Idraulica Trotta Di Trotta Giuseppe,Idraulico,,0884 532788,"Via Giacomo Leopardi, 6",Manfredonia,,,,,,,,,,,
Hidrotermica di Andriani Luigi,Idraulico,,333 269 9293,"VIa Africa Orientale, 10",Margherita di Savoia,,,,,,,,,,,
FERRAMENTA DE FINIS RAFFAELE,Ferramenta,https://ferramentadefinis.it/,0885 433193,"n, Via Alessandro Manzoni, 18",Stornarella,,ferr.definis@gmail.com,https,Hugo,No,OVH SAS,36,55,83.00,Sì,No
Gastermoidro,Servizio di installazione gas,,080 924 3035,"Via S. Lioce, 2",Bari,,,,,,,,,,,
Ordona Ricambi,Fornitore di trattori e macchine agricole,,0885 796086,"Via Neviera, 29",Ordona,,,,,,,,,,,
P.A.M.M. Srl Materiali Termo-Idrici-Sanitari,Idraulico,,0884 538851,"Via Gaetano Palatella, 94 - 94/A",Manfredonia,,,,,,,,,,,
DL SERVICE SRL LUCA DI RUGGIERO,Elettricista,,338 308 3830,"Via Giancarlo Barbieri, 27",Acquaviva delle Fonti,,,,,,,,,,,
