Nome Attività,Categoria,Sito Web,Telefono,Indirizzo,Comune,Provincia,Email,Protocollo,Tecnologia,Cookie Banner,Hosting Provider,Mobile Performance,Desktop Performance,Punteggio SEO,Disponibilità Sito,Stato Manutenzione
Gargano assistenza srl,Centro di installazione di impianti a metano,http://garganoassistenza.it/,080 305 0556,"Via Vitantonio Tria, 19",Acquaviva delle Fonti,,amministrazione@garganoassistenza.it,http,WordPress,Sì,Netsons s.r.l.,62,87,92.00,Sì,No
F.lli Diaferia S.N.C Termoidraulica,Idraulico,http://www.termoidraulicadiaferia.it/,080 332 8637,"Via Alcide De Gasperi, 39-41",BA,,info@termoidraulicadiaferia.it,http,ASP.NET,No,Aruba S.p.A. Network,67,69,82.00,Sì,No
Clima Center di Vito Campobasso,Idraulico,,080 459 2463,"Via Ettore Carafa, 6/B",Adelfia,,,,,,,,,,,
Idrotermica Deg S.R.L.,Negozio di forniture idrauliche,,080 459 1076,"Via Piscina di Filippo, 37",Adelfia,,,,,,,,,,,
Servizio Assistenza Caldaie Cosmogas E Altre Marche Di Accettura Michele,Idraulico,,080 459 2108,"Via G. Marconi, 27",Adelfia,,,,,,,,,,,
Idraulico Di Bari Donato,Idraulico,,080 557 3316,"Via Montello, 7",Bari,,,,,,,,,,,
Antonio Gargano Impianti,Ditta specializzata in impianti di riscaldamento,,340 848 6927,"Corso Umberto I, 25",Adelfia,,,,,,,,,,,
Ficarella Idrotermica Sud Snc,Idraulico,,080 553 7236,"Via Francesco Lattanzio, 82",Bari,,,,,,,,,,,
IL TUO IDRAULICO DI MASSIMO MILONE,Idraulico,,347 445 3964,"Via Francesco Lattanzio, 107/e",Bari,,,,,,,,,,,
A.L. Impianti Tecnologici,Idraulico,,388 477 0618,"Via Carnia, 22",Bari,,,,,,,,,,,
Schirone Antonio - Idraulico - impianti e riparazioni,Idraulico,,347 691 8924,"Via Piave, 56",Bari,,,,,,,,,,,
Termoidrica,Idraulico,,080 556 1121,"Via Giovanni Laterza, 9",Bari,,,,,,,,,,,
La Termoidraulica Del Per. Ind. Lattanzi Francesco,Idraulico,,368 303 3336,"Via Padre Pio, 8",Bari,,,,,,,,,,,
Mangano Impianti,Idraulico,http://manganoimpianti.it/,340 761 9990,"Vicolo Gorizia, 9",Manfredonia,,benedettomangano@gmail.com,http,WordPress,No,Netsons s.r.l.,65,73,83.00,Sì,Sì
Mongelli Giuseppe,Idraulico,,338 814 4918,"Via Pietro Ravanas, 334",Bari,,,,,,,,,,,
L.p.impianti S.a.s,Idraulico,,080 542 9726,"Via Quarto, 37",Bari,,,,,,,,,,,
DUE N impianti,Fornitore di impianti industriali,http://www.duenimpianti.com/,080 558 1537,"Vico Privato Capurso, 16/B",Bari,,nardulliservizio@libero.it,http,WordPress,Sì,Aruba S.p.A. Network,53,59,85.00,Sì,Sì
A.i.s. srl,Fornitore di impianti di riscaldamento,,080 557 6878,"Via di Tullio Vito Nicola, 25",Bari,,,,,,,,,,,
Calor Klima Service srl,Ditta specializzata in impianti di riscaldamento,,080 432 1441,"Via A. Manzoni, 8",Alberobello,,,,,,,,,,,
Termoidraulica Cosimo Spinosa,Idraulico,,348 491 7064,"via provinciale per, Via Provinciale Locorotondo, 12",Alberobello,,,,,,,,,,,
Schiralli Giuseppe,Idraulico,,080 992 4713,"Via Gaetano Incovelli, 6",Bitetto,,,,,,,,,,,
L. & T. S.a.s.,Ditta specializzata in impianti di riscaldamento,http://lorussotrotta.it/,333 865 7381,Via della Concordia,Adelfia,,info@lorussotrotta.it,http,Joomla,No,Aruba S.p.A. Network,61,84,100.00,Sì,No
VI.MA.TER,Arredo bagno,http://vimater.it/,370 108 4145,"Via Don Giovanni Minzoni, 21",Adelfia,,vimatervm@gmail.com,http,WordPress,No,Hostinger International Limited,64,84,92.00,Sì,No
SATIC S.r.l.,Assistenza climatizzatori auto,http://saticsrl.it/,080 432 1577,"Viale Aldo Moro, 3/int.1",Alberobello,,,http,ASP.NET,No,Aruba S.p.A.,100,100,82.00,Sì,Sì
Ediltermoidraulica Di Cutrone Vito,Idraulico,,080 225 4142,"Via Piemonte, 8",Palo del Colle,,,,,,,,,,,
Termoidraulica Torelli Di Torelli Giuseppe,Negozio di forniture idrauliche,,080 623109,"Via Beato Giacomo da Bitetto, 4",Grumo Appula,,,,,,,,,,,
Tecnoservice2000 - Italiangas Point di Lacalamita,Idraulico,,080 625764,"Via Alcide De Gasperi, 25",Palo del Colle,,,,,,,,,,,
I L V I Impianti Di Alberto Ilenia,Elettricista,,080 968 4703,"Via Piscinelle, 34",Binetto,,,,,,,,,,,
Cutrone Giuseppe,Idraulico,,080 626620,"Viale Adriatico, 17",Palo del Colle,,,,,,,,,,,
Rimer Srl,Grossista,http://www.rimersrl.it/,080 432 3863,"Via Bligny, 35",Alberobello,,info@rimersrl.it,http,WordPress,No,Aruba S.p.A.,59,82,85.00,Sì,No
Colonna - Banco Termoidraulica | Showroom Arredo Bagno,Negozio di forniture idrauliche,http://www.colonnasaverio.com/,080 504 6562,"Via Generale Nicola Bellomo, 93ter",Bari,,tecnico@colonnasaverio.com,http,React,No,Telecom Italia S.p.A.,49,56,83.00,Sì,No
Nicola di Bari e Figli,Appaltatore,,080 574 0872,"Via Principe Amedeo, 402",Bari,,,,,,,,,,,
Idraulico,Idraulico,http://www.idraulicobari.net/,080 987 7480,"Via Gaetano Salvemini, 91",Bari,,info@idraulicobari.net,http,WordPress,No,Aruba S.p.A.,37,72,100.00,Sì,Sì
Latocom S.r.l.,Impresa edile,http://www.latocom.it/,349 831 6501,"Via Surdi Tenente Carlo, 61",Binetto,,info@your-domain.com,http,WordPress,No,Google LLC,57,92,92.00,Sì,Sì
"Clima Futura Di Inviti Angelo, Inviti Lorenzo E Scardicchio Raffaello Snc",Idraulico,,080 631054,"Via Alessandro Manzoni, 5",Bitritto,,,,,,,,,,,
Mg Impianti Giordano Michele,Idraulico,,347 502 2071,"Via Colella Giovanni, 4",Bitetto,,,,,,,,,,,
Termoidraulica Esposito Giuseppe,Idraulico,,338 274 9945,"Via Leonardo da Vinci, 2",Bitritto,,,,,,,,,,,
Azzilonna Domenico,Idraulico,,080 311 7034,"Via Pompei, 81",Altamura,,,,,,,,,,,
Edilimpianti srls,Impresa edile,,342 072 2033,Via Caporale Cosimo D'Armiento,Grumo Appula,,,,,,,,,,,
Idracol Service,Ditta specializzata in impianti di riscaldamento,https://idracol.com/,080 864 6056,"Via Crocifisso, 44",Bitonto,,segreteria@idracol.it,https,Angular,Sì,Seeweb srl,52,96,92.00,Sì,No
Idracol Srl,Fornitore di impianti di riscaldamento,http://www.idracol.it/,080 374 0793,"Strada Privata Luigi Perrini, Vico Modugno, snc",Bitonto,,,http,WordPress,Sì,OVH SAS,51,93,92.00,Sì,No
Borrelli Francesco,Idraulico,,080 236 9879,"Via Galileo Ferraris, 2",Casamassima,,,,,,,,,,,
Baritermo S.R.L.,Idraulico,https://www.baritermo.it/,080 697 7060,"Km. 17.500 Strada Statale 100, Casamassima, BA 70010",Centri Commerc. Baricentro-Auchan,,info@baritermo.it,https,WordPress,Sì,Sirianni Informatica S.r.l. in Sigla Sirinfo S.R.L.,66,88,100.00,Sì,No
Maiullari Impianti,Fornitore di impianti di riscaldamento,,327 023 3288,"Via Monte Rosa, 20",Altamura,,,,,,,,,,,
Fiorino Impianti Di Fiorino Francesco,Idraulico,,080 310 2593,"Via Istria, 9",Altamura,,,,,,,,,,,
Caldorosso,Negozio di forniture idrauliche,http://www.caldorosso.it/,080 246 5657,"Via Bari, 76/B",Casamassima,,info@caldorosso.it,http,WordPress,Sì,OVH SAS,76,92,67.00,Sì,No
Termoidraulica Curlo Michele,Idraulico,,080 634676,"Via Carlo Alberto, 35",Bitritto,,,,,,,,,,,
C.I.S. Centro Idro-Sanitario Di Pucci Angelo,Idraulico,,080 314 2120,"Via Fezzan, 7",Altamura,,,,,,,,,,,
Cappiello Michele Angelo E C. (S.A.S),Idraulico,http://cappiellosrl.it/,080 222 3303,"Via del Serpillo, 26",Altamura,,,http,WordPress,No,Aruba S.p.A.,77,97,92.00,Sì,Sì
I.F.I.R. Di Cutecchia A.& C. Snc,Idraulico,,080 311 8614,"Via Eugenio Montale, 10",Altamura,,,,,,,,,,,
Indrio Lorenzo Srl,Idraulico,,080 311 5456,"Via Ugo Bassi, 34",Altamura,,,,,,,,,,,
I Te Co Di Corradino Rocco,Idraulico,,080 310 1399,"Via Abbazia, 46",Altamura,,,,,,,,,,,
Domus Clima Tecnology,Idraulico,,080 385 4164,"Via john F. Kennedy, 25/c",Bitritto,,,,,,,,,,,
Si.Ti Impianti Snc,Idraulico,,080 314 8769,"Via S. Luigi, 18",Altamura,,,,,,,,,,,
De Santis Orazio,Idraulico,http://www.gruppodesantis.it/service/de-santis-orazio/,080 311 2049,Via Foresta Mercadante,Altamura,,info@gruppodesantis.it,http,WordPress,No,OVH SAS,87,97,92.00,Sì,No
Mondo Clima Di Scardicchio Raffaello,Ditta specializzata in impianti di riscaldamento,http://mondoclima.net/,327 735 1180,"Piazza Umberto, 44",Bitritto,,info@mondoclima.net,http,React,Sì,Google LLC,64,93,100.00,Sì,No
F.lli Loiudice,Idraulico,http://www.loiudiceimpianti.it/,080 311 2002,"Via Martin Luther King, 63",Altamura,,info@loiudiceimpianti.it,http,WordPress,No,"Amazon.com, Inc.",62,92,92.00,Sì,No
Forte Michele,Idraulico,,080 310 1143,"Via Niccolò Piccinni, 56",Altamura,,,,,,,,,,,
Climatermica Srl,Idraulico,,080 455 0531,"Via Casamassima, 58",Capurso,,,,,,,,,,,
Ferramenta da Pierino di De Benedictis Luigi,Ferramenta,,080 455 9176,"Via Francesco Lattanzio, 38",Capurso,,,,,,,,,,,
Gruppo Etis Tecnologie Srl,Idraulico,,080 371 7455,"Traversa IV Molfetta, Bitonto, BA 70032",Bitonto,,,,,,,,,,,
Monitillo Giovanni,Idraulico,,080 310 5024,"Via Ugo Foscolo, 41",Altamura,,,,,,,,,,,
Av Impianti Srl,Idraulico,https://www.avimpianti.net/,349 051 3512,"Piazza Umberto I, 8",Capurso,,,https,Angular,Sì,Aruba S.p.A. Network,62,96,100.00,Sì,Sì
Autospurgo Di Daniele Rizzi,Idraulico,,333 612 9969,Via Vitale Giordano,Bitonto,,,,,,,,,,,
G.E.T. Srls,Servizi di ristrutturazione,,392 140 5825,"Via Valenzano, 9",Capurso,,,,,,,,,,,
Tecnoimpianti Di Pacucci G. & C. Srl,Ditta specializzata in impianti di condizionamento,,080 455 9463,"Via Vicinale La Lenza, 23",Capurso,,,,,,,,,,,
RTF IMPIANTI S.R.L.,Idraulico,https://rtfimpianti.com/,080 314 1889,"Via del Tabacco, 13/15",Altamura,,info@rtfimpianti.com,https,React,Sì,Armada WAN,59,68,92.00,Sì,Sì
DITTA Lattanza Giuseppe Autospurgo Pozzi Neri Sturamenti Allagamenti Servizo Idraulico,Servizio per fosse biologiche,,368 366 8794,"Via Vito Siragusa, 23",Bitonto,,,,,,,,,,,
Termoidraulica Acqua e Fuoco di Giorgio Antonio,Idraulico,http://www.acquaefuocobitonto.it/,080 964 9072,"Via Giuseppe Mazzini, 116",Bitonto,,,http,WordPress,Sì,OVH SAS,57,68,85.00,Sì,No
IdrauliGò,Idraulico,http://www.idrauligo.it/,327 194 8409,"Via Crocifisso, 44",Bitonto,,info@idrauligo.it,http,React,Sì,"Cloudflare, Inc.",82,99,100.00,Sì,No
Bellomo Snc di Bellomo Vincenzo e Lidia,Idraulico,,080 371 7635,"Via Nicola Garofalo, 48",Bitonto,,,,,,,,,,,
IDROCLIMA ITALIANGAS DI CAFORIO Giuseppe,Idraulico,,393 590 1202,"Via Papa Pio XII, 17",Castellana Grotte,,,,,,,,,,,
Idropace di Giuseppe Pace,Idraulico,,329 854 2538,Via Giuseppe di Vagno,Castellana Grotte,,,,,,,,,,,
Termoidraulica Tutino impianti srl,Idraulico,,080 496 8640,"Via frà Luca Principino, 15",Castellana Grotte,,,,,,,,,,,
Termoidraulica LP di Leonardo Polignano,Ditta specializzata in impianti di riscaldamento,,339 690 8370,"Via Michelangelo Buonarroti, 54",Castellana Grotte,,,,,,,,,,,
Sabato Giambattista,Idraulico,,080 496 3333,"Via Giotto, 9",Castellana Grotte,,,,,,,,,,,
Clima Assistance - Installazione Assistenza Caldaie Riello - Assistenza idraulica - Installazione e assistenza Condizionatori,Fornitore di impianti di riscaldamento,https://www.climaassistance.it/,333 167 0485,"Via Aspromonte, 55",Palombaio,,info@climaassistance.it,https,WordPress,No,Aruba S.p.A.,57,93,100.00,Sì,Sì
G.D.F.Service di De Felice Gianni,Idraulico,,333 504 8435,"Strada com, Str. Vicinale Scamardella, 133",Castellana Grotte,,,,,,,,,,,
Climacalor S.r.l.,Ditta specializzata in impianti di condizionamento,http://www.climacalorbitonto.it/,080 373 9009,"Via Tenente Domenico Modugno, 36",Bitonto,,info@climacalorbitonto.it,http,WordPress,Sì,Aruba S.p.A.,63,81,92.00,Sì,No
Edilmemi S.R.L.,Fornitore di attrezzature per l'edilizia,https://www.edilmemi.it/,080 626171,"Bitonto, SP119",Palo del Colle,,,https,Shopify,No,Google LLC,56,65,92.00,Sì,No
Fc Impianti Srl,Servizio di installazione elettrica,http://www.fc-impianti.it/,080 914 4926,"Piazza Aldo Moro, 22",Cellamare,,info@fc-impianti.it,http,React,Sì,Aruba S.p.A. Network,62,89,85.00,Sì,No
Calella & Q Service Srl,Idraulico,,080 495 2026,"Via Fratelli Rosselli, 21",Conversano,,,,,,,,,,,
MLG Multiservice,Idraulico,,333 135 2751,"Contrada Turi, 30",Conversano,,,,,,,,,,,
Gungolo Felice Giuseppe,Idraulico,,080 495 7214,"Via Ligabue, 9",Conversano,,,,,,,,,,,
Lapertosa Pietro,Installatore di impianti a gas,,080 495 3121,"Via Principe Umberto, 26",Conversano,,,,,,,,,,,
Centro Impianti Ignomeriello Cosma Damiano,Idraulico,,080 374 4563,"Via Giuseppe Comez, 91",Bitonto,,,,,,,,,,,
Euroimpianti S.R.L.,Appaltatore,http://www.euroimpianti.info/,080 859 4916,"Via Polignano, 46/48",Castellana Grotte,,info@euroimpiantisrl.info,http,React,Sì,Google LLC,55,63,92.00,Sì,Sì
La Martina Tecnologie Srl,Idraulico,,080 495 2656,"Provinciale Turi, 10/a",Conversano,,,,,,,,,,,
Amodio Pietro,Idraulico,,080 495 0240,"Via Alessandro Volta, 38",Conversano,,,,,,,,,,,
"Ac Impianti Di Coletta Andrea ""Cosmogas""",Fornitore di impianti di riscaldamento,,333 386 5619,"Via Soldato Di Leo, 8",Conversano,,,,,,,,,,,
TecnoImpianti,Appaltatore diretto,,080 765353,Via G.Bovio 9/B Cassano delle Murge,Bari,,,,,,,,,,,
Idrotek forniture termoidrauliche,Negozio di forniture idrauliche,,349 236 4085,"Via Carmelo Colamonico, 2/4",Cassano delle Murge,,,,,,,,,,,
Spinellimpianti Tecnologie Del Geom. Antonio Spinelli,Idraulico,,080 763449,"Via Umberto Giordano, 24",Cassano delle Murge,,,,,,,,,,,
Thermoedilizia srl,Fornitore di attrezzature per l'edilizia,https://thermoedilizia.it/,080 352 7152,"Via Vecchia Putignano, 1",Castellana Grotte,,thermoediliziasrl@gmail.com,https,React,No,Aziende Italia S.r.l,64,68,92.00,Sì,No
Tecno Clima Snc Di Capogna Francesco E Vangi Michele,Idraulico,,080 872 7078,"Via Umberto I', 48",Corato,,,,,,,,,,,
D'Alessandro Salvatore,Idraulico,,080 403 0250,"Via Giovanni Pascoli, 14",Conversano,,,,,,,,,,,
Elettro Idrotermica Innamorato Lino,Idraulico,,328 122 7475,"Via Polignano, 7",Conversano,,,,,,,,,,,
Assistenza Ferroli Climatic Di Nicola Di Masi,Idraulico,http://www.ferroli-assistenza.it/,080 496 3384,"Via Nizza, 53",Castellana Grotte,,,http,ASP.NET,No,Aruba S.p.A. Network,61,95,100.00,Sì,Sì
N.S. Impianti Di Nicola & Vito Sportelli S.R.L.,Idraulico,http://www.nsimpianti.it/,080 495 5675,"Strada Vicinale, Vic.Calcarolo Antico Mestiere, 8",Conversano,,info@nsimpianti.it,http,ASP.NET,No,Aruba S.p.A. Network,73,90,100.00,Sì,No
Mitola Impianti Termoidraulici,Idraulico,http://www.mitolaimpianti.it/,347 543 5656,"Via Umberto Giordano, 12",Cellamare,,mitolaimpianti@libero.it,http,React,Sì,OVH SAS,54,75,100.00,Sì,Sì
Luigi Perrone Srl - Impianti Tecnologici,Fornitore di impianti industriali,,080 872 4159,"V.le Luigi Cadorna, 1",Corato,,,,,,,,,,,
Perservice di Ferrante Domenico- Assistenza caldaie Ariston,Ditta specializzata in impianti di riscaldamento,,080 358 8065,"Via G. Leopardi, 48",Corato,,,,,,,,,,,
Fluidotecnica Srl,Elettricista,http://fluidotecnicasrl.it/,080 763784,"VIA GRUMO, Via Della Scaletta Lotto n. 3 Z. I. , Cassano Delle Murge, BA, 70020",Cassano delle Murge,,,http,WordPress,No,Aruba S.p.A. Network,63,64,91.00,Sì,No
Termoidraulica S.I.C.E.L. Sas,Idraulico,,080 776603,"Via L. Da Vinci, 39",Cassano delle Murge,,,,,,,,,,,
Di Bisceglie Antonio,Idraulico,,080 872 3611,"Via Duca di Genova, 32",Corato,,,,,,,,,,,
"Naturii - Piscine, termoidraulica e giardinaggio",Negozio,,080 872 8332,"SP231, KM 30/800",Corato,,,,,,,,,,,
IDROTERMICA LG DI LINZALONE G. E RONCO D. S.A.S.,Idraulico,,080 343 1223,"Via delle Fosse Ardeatine, 23",Gioia del Colle,,,,,,,,,,,
Iannone Giuseppe,Idraulico,,080 872 7418,"Via Virgilio, 12",Corato,,,,,,,,,,,
HYDROTECH di Diaferia Mauro,Servizio di riparazioni idrauliche,,393 618 3571,"Via Guerrazzi, 40",Corato,,,,,,,,,,,
Perrone Living Design,Arredo bagno,,080 898 5902,"Via Catalano, 45",Corato,,,,,,,,,,,
Fusaro Vincenzo,Idraulico,,080 872 4510,"Via Don David Albertario, 52",Corato,,,,,,,,,,,
AUTOSPURGO CORATO ECOPUGLIA,Servizio per fosse biologiche,http://www.ecopuglia.it/,368 648 331,"km 35,500, SP231",Corato,,ecopuglia@ecopuglia.it,http,Joomla,Sì,Netsons s.r.l.,36,64,75.00,Sì,No
Focus Center Srl,Idraulico,,080 349 1073,"Via Dante Alighieri, 80",Gioia del Colle,,,,,,,,,,,
Adriatica Impianti Di Cannillo E C.,Idraulico,,080 898 7047,"Via Veronica Gambara, 16",Corato,,,,,,,,,,,
Termas Assistenza Caldaie,Ditta specializzata in impianti di riscaldamento,,080 403 4316,"Via Di Vittorio Giuseppe, 57",Gioia del Colle,,,,,,,,,,,
CAT SERVICE S.R.L.,Ditta specializzata in impianti di riscaldamento,,080 343 3076,"Via delle Fosse Ardeatine, 18",Gioia del Colle,,,,,,,,,,,
Sit srl,Idraulico,,080 898 4514,"Via Luigi Tarantini, 11",Corato,,,,,,,,,,,
Capodiferro Angelo,Idraulico,,080 343 3556,"Arco Cimone, 14",Gioia del Colle,,,,,,,,,,,
Alt Clima,Ditta specializzata in impianti di riscaldamento,,348 323 1492,"Via Bari, 116-118",Giovinazzo,,,,,,,,,,,
Zumpano Luigi,Idraulico,,080 394 7952,"Via Tenente Devenuto, 73",Giovinazzo,,,,,,,,,,,
Idrotecnica,Idraulico,https://www.nuovaidrotecnica.it/,080 344 1357,"Via dei Peuceti, 64",Gioia del Colle,,,https,Joomla,No,Seeweb srl,68,96,92.00,Sì,No
Ditta Marzella - Termoidraulica e Opere Edili,Idraulico,,080 394 7256,"V. Annantonia Lasorsa, 20",Giovinazzo,,,,,,,,,,,
Idrotermica Meridionale di Luigi Mastandrea,Idraulico,,080 394 1313,"Via delle Filatrici, 15",Giovinazzo,,,,,,,,,,,
Termo Idraulica Tarantini,Idraulico,http://www.termoidraulicatarantini.com/,080 898 4300,"Via Belvedere, 41",Corato,,termoidraulicatarantini@hotmail.it,http,Wix,No,Google LLC,77,90,61.00,Sì,No
Climacenter S.n.c.,Idraulico,http://www.clima-center.com/,080 344 1368,"Via dei Peuceti, 43",Gioia del Colle,,,http,WordPress,No,Aruba S.p.A.,61,84,58.00,Sì,Sì
Klimatika,Ditta specializzata in impianti di condizionamento,,080 394 5449,Via Guglielmo Marconi,Giovinazzo,,,,,,,,,,,
Colasante S.R.L.,Idraulico,,080 394 4372,"24/F Via Eustacchio Da Giovinazzo, Giovinazzo, BA 70054",Giovinazzo,,,,,,,,,,,
Termoidraulica di Diaferia Giuseppe,Ditta specializzata in impianti di condizionamento,https://www.diaferiatermoidraulica.it/,080 898 5251,"Viale V. Veneto, 79",Corato,,termoidraulicadiaferia@gmail.com,https,WordPress,Sì,Server Plan S.r.l.,66,78,85.00,Sì,Sì
Polidrotermica Pugliese Srl,Negozio di forniture idrauliche,,080 783 5858,"Via D'Ecclesis Giovanni, 22",Grumo Appula,,,,,,,,,,,
Perrone Global Service Srl,Fornitore di impianti di riscaldamento,http://www.perroneglobalservice.it/,080 872 8950,"V.le Luigi Cadorna, 11",Corato,,webadvains@gmail.com,http,WordPress,Sì,Google LLC,57,86,92.00,Sì,Sì
Mirgaldi Vitantonio,Idraulico,,080 638241,"Via Immacolata, 3",Grumo Appula,,,,,,,,,,,
Clima Di A. Deperte,Ditta specializzata in impianti di riscaldamento,,080 473 3529,"Via Giuseppe Garibaldi, 94",Mola di Bari,,,,,,,,,,,
Tedeschi Srl,Idraulico,,080 473 2358,"Viale Giacomo Matteotti, 52",Mola di Bari,,,,,,,,,,,
Ro.Mo.Va. S.A.S. Di Rondanini Gennaro,Idraulico,,080 214 6372,"Via Eugenio Montale, 16",Mola di Bari,,,,,,,,,,,
TMC Termoclimatica,Negozio di climatizzatori,,333 773 4746,"Via dei Sartori, 4",Locorotondo,,,,,,,,,,,
Schiavone Francesco,Idraulico,,080 431 1475,"Via Madonna della Catena, 52",Locorotondo,,,,,,,,,,,
Tuttimpianti Di Bufano Domenico,Idraulico,,349 296 6489,"Str. Prima Badessa, 351",Martina Franca,,,,,,,,,,,
Iti Sud Srl,Arredo bagno,,080 898 2564,"Via Teano, 8",Corato,,,,,,,,,,,
Impiantistica Di Calella Tommaso,Elettricista,,080 431 6113,"Contrada Cinquenoci, 4",Locorotondo,,,,,,,,,,,
Palmisano Donato,Idraulico,,080 440 0397,"465 Via Foggia Di Barnaba, Martina Franca, TA 74015",Martina Franca,,,,,,,,,,,
Rella SRL,Ditta specializzata in impianti di condizionamento,http://www.rellasrl.it/,080 783 5503,"Via Donat Cattin, 54",Grumo Appula,,info@rellasrl.it,http,Joomla,Sì,Host SpA,63,93,92.00,Sì,Sì
Hydra Complementi Bagno Srl,Negozio di forniture idrauliche,https://www.hydracom.it/,080 358 8517,"Via Giacometti, 40",Corato,,info@hydracom.it,https,Hugo,Sì,Host SpA,72,90,83.00,Sì,No
Idro Sistem Societa Srl Semplificata,Idraulico,,080 532 3496,"Piazza Giuseppe Garibaldi, 9",Modugno,,,,,,,,,,,
Centro Impianti Tecnologici Srl,Idraulico,,080 537 5511,"Via delle Ortensie, 10",Modugno,,,,,,,,,,,
Edil Co. N. Idraulica,Negozio di forniture idrauliche,,080 532 0572,"Via Giuseppe Monaco, 13",Modugno,,,,,,,,,,,
Termoidraulica 3D & C. s.r.l.,Idraulico,,080 536 7020,"Viale dell'Artigianato II Traversa, 4",Modugno,,,,,,,,,,,
Main Tech Srl,Idraulico,,080 531 5358,"Via delle Ortensie, 10",Modugno,,,,,,,,,,,
Carelli Tecno Solutions di Carelli Pasquale,Idraulico,,080 535 2447,"Via Kennedy, 17",Modugno,,,,,,,,,,,
I.e.s S.r.l,Idraulico,,080 536 7416,"Piazza Capitaneo, 24",Modugno,,,,,,,,,,,
Termoidraulica 3d & C. S.R.L.,Idraulico,,080 532 4555,"Via Alexander Fleming, 16",Modugno,,,,,,,,,,,
Ditta Mulas Aldo & Figli Snc Impianti Ind. Aspirazione,Idraulico,,080 220 5901,"Via Santa Lucia, 9",Modugno,,,,,,,,,,,
Tekno Term,Ditta specializzata in impianti di riscaldamento,,080 743934,"Via Pio XII, 11-13-15-17",Monopoli,,,,,,,,,,,
Idraulico Alò Giovanni,Idraulico,,080 410 7109,"Via PP. Passionisti, 1",Monopoli,,,,,,,,,,,
Climasystem di Albanese Cosimo & C. sas,Ditta specializzata in impianti di riscaldamento,,080 777707,"Via Leonardo Cirullo, 7/9",Monopoli,,,,,,,,,,,
AM Clima,Idraulico,,080 427 4610,"Via Vincenzo Cuoco, 10",Monopoli,,,,,,,,,,,
Satalino Vito,Idraulico,,080 698 5599,"Viale Aldo Moro, 9",Monopoli,,,,,,,,,,,
Moretti Clima,Idraulico,,080 410 7721,"Via Vittorio Veneto, 97",Monopoli,,,,,,,,,,,
Futura & Impianti Di Alo' Ignazio & C. Sas,Idraulico,,080 237 9675,"Via B. Ricasoli, 87",Monopoli,,,,,,,,,,,
Danna Leopoldo & C. Snc,Idraulico,,080 937 2256,"Via G. Polignani, 8",Monopoli,,,,,,,,,,,
ITM Idrotermica,Negozio di forniture idrauliche,,080 338 7530,"Via Paolo Poli, 56",Molfetta,,,,,,,,,,,
Ma. Pi. Sistemi Energetici,Servizio di riparazioni idrauliche,,320 083 1317,"Via della Repubblica, 6",Molfetta,,,,,,,,,,,
Termomeccanica Pisani,Idraulico,https://www.termomeccanicapisani.it/,080 930 9937,"Contrada Ciminiera, 62, Strada Provinciale Monopoli-Alberobello Km. 11",Monopoli,,termomeccanica@gmail.com,https,React,No,Aruba S.p.A.,56,94,100.00,Sì,No
Idrotermogas Di Giovanni Bufi,Idraulico,,080 338 1735,"C.so Vito Fornari, 105",Molfetta,,,,,,,,,,,
S.I.Te Impianti Di De Ceglia Francesco & Mezzina D,Idraulico,,080 397 3522,"Via Tenente Mauro Marzocca, 43",Molfetta,,,,,,,,,,,
Termoidroclima Srl,Idraulico,https://termoidroclima.com/,080 343 3194,"Via Carlo Poerio, 38",Gioia del Colle,,,https,React,Sì,WIIT AG,80,93,85.00,Sì,Sì
Tecnokalor Group Srl,Idraulico,http://www.tecnokalorgroup.it/,080 485 7395,"Via Mulino S. Martino, 19",Martina Franca,,,http,WordPress,No,Aruba S.p.A. Network,33,43,85.00,Sì,Sì
Di Bari Giovanni,Idraulico,,080 537 4758,"Via Lombardia, 39",Modugno,,,,,,,,,,,
DEMshop,Negozio di forniture idrauliche,http://www.demshop.it/,080 504 4114,"Viale dei Sarti, 6",Modugno,,info@demshop.it,http,OpenCart,No,Aruba S.p.A.,38,47,83.00,Sì,No
Puglia Termica S.R.L,Negozio di forniture idrauliche,http://www.pugliatermica.it/,080 849 1097,"Strada Provinciale Modugno-Bari, 4/E",Modugno,,,http,Sitefinity,Sì,"Cloudflare, Inc.",26,52,85.00,Sì,No
Riello - Fratelli Carparelli,Ditta specializzata in impianti di riscaldamento,https://www.riello.it/assistenza/cerca-assistenza-riello/f-lli-carparelli-s-r-l--0000005821,080 808414,"Via Salvemini, 2/8",Monopoli,,,https,React,Sì,"Cloudflare, Inc.",42,75,92.00,Sì,Sì
Idrotermosanitaria Lacedonia S.r.l.,Arredo bagno,,080 338 1190,"Via S. Francesco D'Assisi, 20",Molfetta,,,,,,,,,,,
LA IDRICA - Impianti idrici e di riscaldamento - Molfetta,Ditta specializzata in impianti di condizionamento,http://www.laidrica.it/,080 334 0387,"Via Paolo Borsellino, 13",Molfetta,,info@laidrica.it,http,React,No,Netsons s.r.l.,67,79,0.00,Sì,Sì
Bruno Vito,Idraulico,,080 497 8336,"Zona G, 6/n. 10",Noci,,,,,,,,,,,
Termoidraulica MA.DEC.,Ditta specializzata in impianti di riscaldamento,https://www.madecsnc.it/,392 887 6829,"Via Magenta, 12/14",Molfetta,,ma.dec.snc@gmail.com,https,Joomla,Sì,OVH SAS,35,48,100.00,Sì,No
Tecnoterm,Fornitore di impianti di riscaldamento,,080 335 2600,"Piazza Aldo Moro, 4/5",Molfetta,,,,,,,,,,,
Losito impianti Idrici,Idraulico,,333 316 7641,Strada Provinciale Modugno-Bari,Modugno,,,,,,,,,,,
SC CAT IMPIANTI,Idraulico,http://www.sccatimpianti.it/,080 338 4055,"Via Corrado Salvemini Educatore, 32",Molfetta,,sc.impianti_cat@libero.it,http,ASP.NET,No,Aruba S.p.A. Network,66,72,100.00,Sì,No
Termoidraulica Spaspe di Altomare nicoló,Idraulico,,348 470 7882,"Vico 12° Madonna dei Martiri, 20",Molfetta,,,,,,,,,,,
Ditta Tinelli Domenico,Idraulico,,339 825 5385,"Via Cesare Battisti, 55",Noci,,,,,,,,,,,
T.I.C.A. Impianti sas di Dongiovanni G.&Co.,Ditta specializzata in impianti di riscaldamento,,351 629 8805,"Via Palmiro Togliatti, 35",Noci,,,,,,,,,,,
Mekagri Di Plantone Francesco E Losavio Vito S.n.c.,Meccanico,,080 497 9872,"Strada Statale Per Mottola Km.1, Zona F N, 30",Noci,,,,,,,,,,,
Moliterni Michele,Idraulico,,080 403 3086,Via Cartesio,Gravina in Puglia,,,,,,,,,,,
Desiante F.Lli (S.N.C.),Idraulico,,080 326 7723,"Via Federico Meninni, 105",Gravina in Puglia,,,,,,,,,,,
Galli Investments,Fornitore di attrezzature per l'energia solare,,800 660 562,"Via XX Settembre, 7",Noci,,,,,,,,,,,
GR Impianti,Idraulico,,393 375 2546,"Via Emilia, 11a",Gravina in Puglia,,,,,,,,,,,
Idraulica Idroterm,Idraulico,,393 921 1463,"Via Fornaci, 10",Gravina in Puglia,,,,,,,,,,,
Idraltermica Srl,Idraulico,,080 325 7134,"Via Amerigo Vespucci, 17",Gravina in Puglia,,,,,,,,,,,
Termo Idrica Service,Servizio di riparazione di guasti idraulici,,338 837 6325,"Via Federico Meninni, 296",Gravina in Puglia,,,,,,,,,,,
Mascellaro Nicola,Idraulico,,080 326 2242,"Via Vincenzo Ragni, 175",Gravina in Puglia,,,,,,,,,,,
So I M,Idraulico,,080 321 7024,"Via Francesco Baracca, 79",Gravina in Puglia,,,,,,,,,,,
CLIMATECH Snc - Assistenza Caldaie e Climatizzazione,Servizio di riparazione di climatizzatori,,080 326 8959,"Via Cesare Battisti, 40",Gravina in Puglia,,,,,,,,,,,
Assistenza Tecnica E Vendita Caldaie E Climatizzatori,Idraulico,,080 325 3558,"Via Massimo d'Azeglio, 33",Gravina in Puglia,,,,,,,,,,,
Ferrulli Francesco,Idraulico,,080 326 4493,"Via Emilio Guida, 43",Gravina in Puglia,,,,,,,,,,,
Tedeschi S.R.L.,Idraulico,,080 478 1909,"Via Carmine, 176",Noicattaro,,,,,,,,,,,
Quarato Giuseppe,Idraulico,,080 497 0564,"Via Don Emanuele Caronti, 2",Noci,,,,,,,,,,,
